{
  "actuaciones": [
    {
      "idRegActuacion": 1283273453,
      "llaveProceso": "11001400305020170135700",
      "consActuacion": 36,
      "fechaActuacion": "2022-10-24T05:00:00.000Z",
      "actuacion": "Archivo Definitivo",
      "anotacion": "CAJA 56 DE 2022",
      "fechaInicial": null,
      "fechaFinal": null,
      "fechaRegistro": "2022-10-24T05:00:00.000Z",
      "codRegla": "00                              ",
      "conDocumentos": false,
      "cant": 36,
      "idProceso": 11224353,
      "isUltimaAct": true,
      "carpetaNumero": 350,
      "createdAt": "2023-12-10T20:31:14.914Z"
    },
    {
      "idRegActuacion": 797225653,
      "llaveProceso": "11001400305020170135700",
      "consActuacion": 35,
      "fechaActuacion": "2019-10-17T05:00:00.000Z",
      "actuacion": "Archivo Definitivo",
      "anotacion": "ARCHIVO TERMINADO PAQUETE 355 DE 2019.",
      "fechaInicial": null,
      "fechaFinal": null,
      "fechaRegistro": "2019-10-17T05:00:00.000Z",
      "codRegla": "00                              ",
      "conDocumentos": false,
      "cant": 36,
      "idProceso": 11224353,
      "isUltimaAct": false,
      "carpetaNumero": 350,
      "createdAt": "2023-12-10T20:31:14.914Z"
    },
    {
      "idRegActuacion": 796270543,
      "llaveProceso": "11001400305020170135700",
      "consActuacion": 34,
      "fechaActuacion": "2019-09-17T05:00:00.000Z",
      "actuacion": "Elaboración de oficios",
      "anotacion": "OF",
      "fechaInicial": null,
      "fechaFinal": null,
      "fechaRegistro": "2019-09-17T05:00:00.000Z",
      "codRegla": "00                              ",
      "conDocumentos": false,
      "cant": 36,
      "idProceso": 11224353,
      "isUltimaAct": false,
      "carpetaNumero": 350,
      "createdAt": "2023-12-10T20:31:14.914Z"
    },
    {
      "idRegActuacion": 796270533,
      "llaveProceso": "11001400305020170135700",
      "consActuacion": 33,
      "fechaActuacion": "2019-09-02T05:00:00.000Z",
      "actuacion": "Fijacion estado",
      "anotacion": "Actuación registrada el 02/09/2019 a las 11:50:30.",
      "fechaInicial": "2019-09-03T05:00:00.000Z",
      "fechaFinal": "2019-09-03T05:00:00.000Z",
      "fechaRegistro": "2019-09-02T05:00:00.000Z",
      "codRegla": "00                              ",
      "conDocumentos": false,
      "cant": 36,
      "idProceso": 11224353,
      "isUltimaAct": false,
      "carpetaNumero": 350,
      "createdAt": "2023-12-10T20:31:14.914Z"
    },
    {
      "idRegActuacion": 796270523,
      "llaveProceso": "11001400305020170135700",
      "consActuacion": 32,
      "fechaActuacion": "2019-09-02T05:00:00.000Z",
      "actuacion": "Auto termina proceso por Pago",
      "anotacion": "TOTAL.",
      "fechaInicial": null,
      "fechaFinal": null,
      "fechaRegistro": "2019-09-02T05:00:00.000Z",
      "codRegla": "00                              ",
      "conDocumentos": false,
      "cant": 36,
      "idProceso": 11224353,
      "isUltimaAct": false,
      "carpetaNumero": 350,
      "createdAt": "2023-12-10T20:31:14.914Z"
    },
    {
      "idRegActuacion": 741349113,
      "llaveProceso": "11001400305020170135700",
      "consActuacion": 31,
      "fechaActuacion": "2019-07-02T05:00:00.000Z",
      "actuacion": "Al despacho",
      "anotacion": "SOLICITUD DECRETO DE TERMINACIÓN DE PROCESO",
      "fechaInicial": null,
      "fechaFinal": null,
      "fechaRegistro": "2019-07-02T05:00:00.000Z",
      "codRegla": "00                              ",
      "conDocumentos": false,
      "cant": 36,
      "idProceso": 11224353,
      "isUltimaAct": false,
      "carpetaNumero": 350,
      "createdAt": "2023-12-10T20:31:14.914Z"
    },
    {
      "idRegActuacion": 675293553,
      "llaveProceso": "11001400305020170135700",
      "consActuacion": 30,
      "fechaActuacion": "2019-06-12T05:00:00.000Z",
      "actuacion": "Fijacion estado",
      "anotacion": "Actuación registrada el 12/06/2019 a las 14:16:25.",
      "fechaInicial": "2019-06-13T05:00:00.000Z",
      "fechaFinal": "2019-06-13T05:00:00.000Z",
      "fechaRegistro": "2019-06-12T05:00:00.000Z",
      "codRegla": "00                              ",
      "conDocumentos": false,
      "cant": 36,
      "idProceso": 11224353,
      "isUltimaAct": false,
      "carpetaNumero": 350,
      "createdAt": "2023-12-10T20:31:14.914Z"
    },
    {
      "idRegActuacion": 675293543,
      "llaveProceso": "11001400305020170135700",
      "consActuacion": 29,
      "fechaActuacion": "2019-06-12T05:00:00.000Z",
      "actuacion": "Auto requiere",
      "anotacion": "A la parte actora, so pena de dar aplicación a lo dispuesto en el art 317 del Código General del Proceso.",
      "fechaInicial": null,
      "fechaFinal": null,
      "fechaRegistro": "2019-06-12T05:00:00.000Z",
      "codRegla": "00                              ",
      "conDocumentos": false,
      "cant": 36,
      "idProceso": 11224353,
      "isUltimaAct": false,
      "carpetaNumero": 350,
      "createdAt": "2023-12-10T20:31:14.914Z"
    },
    {
      "idRegActuacion": 655454823,
      "llaveProceso": "11001400305020170135700",
      "consActuacion": 28,
      "fechaActuacion": "2019-06-10T05:00:00.000Z",
      "actuacion": "Al despacho",
      "anotacion": "AUTO REQUIERE ART 317 CODIGO GENERAL DEL PROCESO.",
      "fechaInicial": null,
      "fechaFinal": null,
      "fechaRegistro": "2019-06-10T05:00:00.000Z",
      "codRegla": "00                              ",
      "conDocumentos": false,
      "cant": 36,
      "idProceso": 11224353,
      "isUltimaAct": false,
      "carpetaNumero": 350,
      "createdAt": "2023-12-10T20:31:14.914Z"
    },
    {
      "idRegActuacion": 522410793,
      "llaveProceso": "11001400305020170135700",
      "consActuacion": 27,
      "fechaActuacion": "2019-05-23T05:00:00.000Z",
      "actuacion": "Fijacion estado",
      "anotacion": "Actuación registrada el 23/05/2019 a las 14:21:26.",
      "fechaInicial": "2019-05-24T05:00:00.000Z",
      "fechaFinal": "2019-05-24T05:00:00.000Z",
      "fechaRegistro": "2019-05-23T05:00:00.000Z",
      "codRegla": "00                              ",
      "conDocumentos": false,
      "cant": 36,
      "idProceso": 11224353,
      "isUltimaAct": false,
      "carpetaNumero": 350,
      "createdAt": "2023-12-10T20:31:14.914Z"
    },
    {
      "idRegActuacion": 522410783,
      "llaveProceso": "11001400305020170135700",
      "consActuacion": 26,
      "fechaActuacion": "2019-05-23T05:00:00.000Z",
      "actuacion": "Auto pone en conocimiento",
      "anotacion": null,
      "fechaInicial": null,
      "fechaFinal": null,
      "fechaRegistro": "2019-05-23T05:00:00.000Z",
      "codRegla": "00                              ",
      "conDocumentos": false,
      "cant": 36,
      "idProceso": 11224353,
      "isUltimaAct": false,
      "carpetaNumero": 350,
      "createdAt": "2023-12-10T20:31:14.914Z"
    },
    {
      "idRegActuacion": 522410773,
      "llaveProceso": "11001400305020170135700",
      "consActuacion": 25,
      "fechaActuacion": "2019-05-13T05:00:00.000Z",
      "actuacion": "Al despacho",
      "anotacion": "SOLICITUD TERMINACIÓN DE PROCESO.",
      "fechaInicial": null,
      "fechaFinal": null,
      "fechaRegistro": "2019-05-13T05:00:00.000Z",
      "codRegla": "00                              ",
      "conDocumentos": false,
      "cant": 36,
      "idProceso": 11224353,
      "isUltimaAct": false,
      "carpetaNumero": 350,
      "createdAt": "2023-12-10T20:31:14.914Z"
    },
    {
      "idRegActuacion": 522410763,
      "llaveProceso": "11001400305020170135700",
      "consActuacion": 24,
      "fechaActuacion": "2019-05-03T05:00:00.000Z",
      "actuacion": "Elaboración de oficios",
      "anotacion": "OFI",
      "fechaInicial": null,
      "fechaFinal": null,
      "fechaRegistro": "2019-05-03T05:00:00.000Z",
      "codRegla": "00                              ",
      "conDocumentos": false,
      "cant": 36,
      "idProceso": 11224353,
      "isUltimaAct": false,
      "carpetaNumero": 350,
      "createdAt": "2023-12-10T20:31:14.914Z"
    },
    {
      "idRegActuacion": 522410753,
      "llaveProceso": "11001400305020170135700",
      "consActuacion": 23,
      "fechaActuacion": "2019-04-25T05:00:00.000Z",
      "actuacion": "Fijacion estado",
      "anotacion": "Actuación registrada el 25/04/2019 a las 16:26:05.",
      "fechaInicial": "2019-04-26T05:00:00.000Z",
      "fechaFinal": "2019-04-26T05:00:00.000Z",
      "fechaRegistro": "2019-04-25T05:00:00.000Z",
      "codRegla": "00                              ",
      "conDocumentos": false,
      "cant": 36,
      "idProceso": 11224353,
      "isUltimaAct": false,
      "carpetaNumero": 350,
      "createdAt": "2023-12-10T20:31:14.914Z"
    },
    {
      "idRegActuacion": 522410743,
      "llaveProceso": "11001400305020170135700",
      "consActuacion": 22,
      "fechaActuacion": "2019-04-25T05:00:00.000Z",
      "actuacion": "Auto decreta retención vehículos",
      "anotacion": null,
      "fechaInicial": null,
      "fechaFinal": null,
      "fechaRegistro": "2019-04-25T05:00:00.000Z",
      "codRegla": "00                              ",
      "conDocumentos": false,
      "cant": 36,
      "idProceso": 11224353,
      "isUltimaAct": false,
      "carpetaNumero": 350,
      "createdAt": "2023-12-10T20:31:14.914Z"
    },
    {
      "idRegActuacion": 522410733,
      "llaveProceso": "11001400305020170135700",
      "consActuacion": 21,
      "fechaActuacion": "2019-04-12T05:00:00.000Z",
      "actuacion": "Fijacion estado",
      "anotacion": "Actuación registrada el 12/04/2019 a las 13:48:49.",
      "fechaInicial": "2019-04-22T05:00:00.000Z",
      "fechaFinal": "2019-04-22T05:00:00.000Z",
      "fechaRegistro": "2019-04-12T05:00:00.000Z",
      "codRegla": "00                              ",
      "conDocumentos": false,
      "cant": 36,
      "idProceso": 11224353,
      "isUltimaAct": false,
      "carpetaNumero": 350,
      "createdAt": "2023-12-10T20:31:14.914Z"
    },
    {
      "idRegActuacion": 522410723,
      "llaveProceso": "11001400305020170135700",
      "consActuacion": 20,
      "fechaActuacion": "2019-04-12T05:00:00.000Z",
      "actuacion": "Auto fija fecha para audiencia de fallo",
      "anotacion": "REPROGRAMAR AUDIENCIA LAS 10:00 A.M. DEL 16 DE MAYO DE 2019.",
      "fechaInicial": null,
      "fechaFinal": null,
      "fechaRegistro": "2019-04-12T05:00:00.000Z",
      "codRegla": "00                              ",
      "conDocumentos": false,
      "cant": 36,
      "idProceso": 11224353,
      "isUltimaAct": false,
      "carpetaNumero": 350,
      "createdAt": "2023-12-10T20:31:14.914Z"
    },
    {
      "idRegActuacion": 522410713,
      "llaveProceso": "11001400305020170135700",
      "consActuacion": 19,
      "fechaActuacion": "2019-03-11T05:00:00.000Z",
      "actuacion": "Al despacho",
      "anotacion": "SOLICITUD CAPTURA DE VEHICULO.",
      "fechaInicial": null,
      "fechaFinal": null,
      "fechaRegistro": "2019-03-11T05:00:00.000Z",
      "codRegla": "00                              ",
      "conDocumentos": false,
      "cant": 36,
      "idProceso": 11224353,
      "isUltimaAct": false,
      "carpetaNumero": 350,
      "createdAt": "2023-12-10T20:31:14.914Z"
    },
    {
      "idRegActuacion": 522410703,
      "llaveProceso": "11001400305020170135700",
      "consActuacion": 18,
      "fechaActuacion": "2019-01-25T05:00:00.000Z",
      "actuacion": "Elaboración de oficios",
      "anotacion": "OFI 143",
      "fechaInicial": null,
      "fechaFinal": null,
      "fechaRegistro": "2019-01-25T05:00:00.000Z",
      "codRegla": "00                              ",
      "conDocumentos": false,
      "cant": 36,
      "idProceso": 11224353,
      "isUltimaAct": false,
      "carpetaNumero": 350,
      "createdAt": "2023-12-10T20:31:14.914Z"
    },
    {
      "idRegActuacion": 522410693,
      "llaveProceso": "11001400305020170135700",
      "consActuacion": 17,
      "fechaActuacion": "2018-11-13T05:00:00.000Z",
      "actuacion": "Fijacion estado",
      "anotacion": "Actuación registrada el 13/11/2018 a las 17:00:35.",
      "fechaInicial": "2018-12-18T05:00:00.000Z",
      "fechaFinal": "2018-12-18T05:00:00.000Z",
      "fechaRegistro": "2018-11-13T05:00:00.000Z",
      "codRegla": "00                              ",
      "conDocumentos": false,
      "cant": 36,
      "idProceso": 11224353,
      "isUltimaAct": false,
      "carpetaNumero": 350,
      "createdAt": "2023-12-10T20:31:14.914Z"
    },
    {
      "idRegActuacion": 522410683,
      "llaveProceso": "11001400305020170135700",
      "consActuacion": 16,
      "fechaActuacion": "2018-11-13T05:00:00.000Z",
      "actuacion": "Auto fija fecha audiencia y/o diligencia",
      "anotacion": null,
      "fechaInicial": null,
      "fechaFinal": null,
      "fechaRegistro": "2018-11-13T05:00:00.000Z",
      "codRegla": "00                              ",
      "conDocumentos": false,
      "cant": 36,
      "idProceso": 11224353,
      "isUltimaAct": false,
      "carpetaNumero": 350,
      "createdAt": "2023-12-10T20:31:14.914Z"
    },
    {
      "idRegActuacion": 140358223,
      "llaveProceso": "11001400305020170135700",
      "consActuacion": 15,
      "fechaActuacion": "2018-07-19T05:00:00.000Z",
      "actuacion": "Al despacho",
      "anotacion": "VENCIDO TRASLADO CON PRONUNCIAMIENTO EN TERMINO.",
      "fechaInicial": null,
      "fechaFinal": null,
      "fechaRegistro": "2018-07-19T05:00:00.000Z",
      "codRegla": "00                              ",
      "conDocumentos": false,
      "cant": 36,
      "idProceso": 11224353,
      "isUltimaAct": false,
      "carpetaNumero": 350,
      "createdAt": "2023-12-10T20:31:14.914Z"
    },
    {
      "idRegActuacion": 140358213,
      "llaveProceso": "11001400305020170135700",
      "consActuacion": 14,
      "fechaActuacion": "2018-07-03T05:00:00.000Z",
      "actuacion": "Fijacion estado",
      "anotacion": "Actuación registrada el 03/07/2018 a las 12:26:04.",
      "fechaInicial": "2018-07-04T05:00:00.000Z",
      "fechaFinal": "2018-07-04T05:00:00.000Z",
      "fechaRegistro": "2018-07-03T05:00:00.000Z",
      "codRegla": "00                              ",
      "conDocumentos": false,
      "cant": 36,
      "idProceso": 11224353,
      "isUltimaAct": false,
      "carpetaNumero": 350,
      "createdAt": "2023-12-10T20:31:14.914Z"
    },
    {
      "idRegActuacion": 140358203,
      "llaveProceso": "11001400305020170135700",
      "consActuacion": 13,
      "fechaActuacion": "2018-07-03T05:00:00.000Z",
      "actuacion": "Auto ordena correr traslado",
      "anotacion": null,
      "fechaInicial": null,
      "fechaFinal": null,
      "fechaRegistro": "2018-07-03T05:00:00.000Z",
      "codRegla": "00                              ",
      "conDocumentos": false,
      "cant": 36,
      "idProceso": 11224353,
      "isUltimaAct": false,
      "carpetaNumero": 350,
      "createdAt": "2023-12-10T20:31:14.914Z"
    },
    {
      "idRegActuacion": 140358193,
      "llaveProceso": "11001400305020170135700",
      "consActuacion": 12,
      "fechaActuacion": "2018-05-21T05:00:00.000Z",
      "actuacion": "Al despacho",
      "anotacion": "VENCIDO TERMINO DE NOTIFICACIÓN PERSONAL; CON CONTESTACIÓN DE DEMANDA.",
      "fechaInicial": null,
      "fechaFinal": null,
      "fechaRegistro": "2018-05-21T05:00:00.000Z",
      "codRegla": "00                              ",
      "conDocumentos": false,
      "cant": 36,
      "idProceso": 11224353,
      "isUltimaAct": false,
      "carpetaNumero": 350,
      "createdAt": "2023-12-10T20:31:14.914Z"
    },
    {
      "idRegActuacion": 140358183,
      "llaveProceso": "11001400305020170135700",
      "consActuacion": 11,
      "fechaActuacion": "2018-05-09T05:00:00.000Z",
      "actuacion": "Oficio Elaborado",
      "anotacion": "OFICIO 1052",
      "fechaInicial": null,
      "fechaFinal": null,
      "fechaRegistro": "2018-05-09T05:00:00.000Z",
      "codRegla": "00                              ",
      "conDocumentos": false,
      "cant": 36,
      "idProceso": 11224353,
      "isUltimaAct": false,
      "carpetaNumero": 350,
      "createdAt": "2023-12-10T20:31:14.914Z"
    },
    {
      "idRegActuacion": 140358173,
      "llaveProceso": "11001400305020170135700",
      "consActuacion": 10,
      "fechaActuacion": "2018-05-03T05:00:00.000Z",
      "actuacion": "Diligencia de notificación personal (acta)",
      "anotacion": "DIEGO FERNEY VERGARA VALDERRAMA",
      "fechaInicial": null,
      "fechaFinal": null,
      "fechaRegistro": "2018-05-03T05:00:00.000Z",
      "codRegla": "00                              ",
      "conDocumentos": false,
      "cant": 36,
      "idProceso": 11224353,
      "isUltimaAct": false,
      "carpetaNumero": 350,
      "createdAt": "2023-12-10T20:31:14.914Z"
    },
    {
      "idRegActuacion": 140358303,
      "llaveProceso": "11001400305020170135700",
      "consActuacion": 9,
      "fechaActuacion": "2018-04-16T05:00:00.000Z",
      "actuacion": "Fijacion estado",
      "anotacion": "Actuación registrada el 16/04/2018 a las 10:02:49.",
      "fechaInicial": "2018-04-17T05:00:00.000Z",
      "fechaFinal": "2018-04-17T05:00:00.000Z",
      "fechaRegistro": "2018-04-16T05:00:00.000Z",
      "codRegla": "00                              ",
      "conDocumentos": false,
      "cant": 36,
      "idProceso": 11224353,
      "isUltimaAct": false,
      "carpetaNumero": 350,
      "createdAt": "2023-12-10T20:31:14.914Z"
    },
    {
      "idRegActuacion": 140358293,
      "llaveProceso": "11001400305020170135700",
      "consActuacion": 8,
      "fechaActuacion": "2018-04-16T05:00:00.000Z",
      "actuacion": "Auto decreta medida cautelar",
      "anotacion": null,
      "fechaInicial": null,
      "fechaFinal": null,
      "fechaRegistro": "2018-04-16T05:00:00.000Z",
      "codRegla": "00                              ",
      "conDocumentos": false,
      "cant": 36,
      "idProceso": 11224353,
      "isUltimaAct": false,
      "carpetaNumero": 350,
      "createdAt": "2023-12-10T20:31:14.914Z"
    },
    {
      "idRegActuacion": 140358283,
      "llaveProceso": "11001400305020170135700",
      "consActuacion": 7,
      "fechaActuacion": "2018-04-16T05:00:00.000Z",
      "actuacion": "Fijacion estado",
      "anotacion": "Actuación registrada el 16/04/2018 a las 10:02:27.",
      "fechaInicial": "2018-04-17T05:00:00.000Z",
      "fechaFinal": "2018-04-17T05:00:00.000Z",
      "fechaRegistro": "2018-04-16T05:00:00.000Z",
      "codRegla": "00                              ",
      "conDocumentos": false,
      "cant": 36,
      "idProceso": 11224353,
      "isUltimaAct": false,
      "carpetaNumero": 350,
      "createdAt": "2023-12-10T20:31:14.914Z"
    },
    {
      "idRegActuacion": 140358273,
      "llaveProceso": "11001400305020170135700",
      "consActuacion": 6,
      "fechaActuacion": "2018-04-16T05:00:00.000Z",
      "actuacion": "Auto libra mandamiento ejecutivo",
      "anotacion": null,
      "fechaInicial": null,
      "fechaFinal": null,
      "fechaRegistro": "2018-04-16T05:00:00.000Z",
      "codRegla": "00                              ",
      "conDocumentos": false,
      "cant": 36,
      "idProceso": 11224353,
      "isUltimaAct": false,
      "carpetaNumero": 350,
      "createdAt": "2023-12-10T20:31:14.914Z"
    },
    {
      "idRegActuacion": 140358263,
      "llaveProceso": "11001400305020170135700",
      "consActuacion": 5,
      "fechaActuacion": "2018-02-21T05:00:00.000Z",
      "actuacion": "Al despacho",
      "anotacion": "CON SUBSANACIÓN DE DEMANDA EN TIEMPO.",
      "fechaInicial": null,
      "fechaFinal": null,
      "fechaRegistro": "2018-02-21T05:00:00.000Z",
      "codRegla": "00                              ",
      "conDocumentos": false,
      "cant": 36,
      "idProceso": 11224353,
      "isUltimaAct": false,
      "carpetaNumero": 350,
      "createdAt": "2023-12-10T20:31:14.914Z"
    },
    {
      "idRegActuacion": 140358253,
      "llaveProceso": "11001400305020170135700",
      "consActuacion": 4,
      "fechaActuacion": "2018-02-12T05:00:00.000Z",
      "actuacion": "Fijacion estado",
      "anotacion": "Actuación registrada el 12/02/2018 a las 14:32:01.",
      "fechaInicial": "2018-02-13T05:00:00.000Z",
      "fechaFinal": "2018-02-13T05:00:00.000Z",
      "fechaRegistro": "2018-02-12T05:00:00.000Z",
      "codRegla": "00                              ",
      "conDocumentos": false,
      "cant": 36,
      "idProceso": 11224353,
      "isUltimaAct": false,
      "carpetaNumero": 350,
      "createdAt": "2023-12-10T20:31:14.914Z"
    },
    {
      "idRegActuacion": 140358243,
      "llaveProceso": "11001400305020170135700",
      "consActuacion": 3,
      "fechaActuacion": "2018-02-12T05:00:00.000Z",
      "actuacion": "Auto inadmite demanda",
      "anotacion": null,
      "fechaInicial": null,
      "fechaFinal": null,
      "fechaRegistro": "2018-02-12T05:00:00.000Z",
      "codRegla": "00                              ",
      "conDocumentos": false,
      "cant": 36,
      "idProceso": 11224353,
      "isUltimaAct": false,
      "carpetaNumero": 350,
      "createdAt": "2023-12-10T20:31:14.914Z"
    },
    {
      "idRegActuacion": 140358233,
      "llaveProceso": "11001400305020170135700",
      "consActuacion": 2,
      "fechaActuacion": "2017-11-27T05:00:00.000Z",
      "actuacion": "Al despacho",
      "anotacion": null,
      "fechaInicial": null,
      "fechaFinal": null,
      "fechaRegistro": "2017-11-24T05:00:00.000Z",
      "codRegla": "00                              ",
      "conDocumentos": false,
      "cant": 36,
      "idProceso": 11224353,
      "isUltimaAct": false,
      "carpetaNumero": 350,
      "createdAt": "2023-12-10T20:31:14.914Z"
    },
    {
      "idRegActuacion": 140358163,
      "llaveProceso": "11001400305020170135700",
      "consActuacion": 1,
      "fechaActuacion": "2017-11-24T05:00:00.000Z",
      "actuacion": " Radicación de Proceso",
      "anotacion": "Actuación de  Radicación de Proceso  realizada el 24/11/2017 a las 11:58:58",
      "fechaInicial": "2017-11-24T05:00:00.000Z",
      "fechaFinal": "2017-11-24T05:00:00.000Z",
      "fechaRegistro": "2017-11-24T05:00:00.000Z",
      "codRegla": "00                              ",
      "conDocumentos": false,
      "cant": 36,
      "idProceso": 11224353,
      "isUltimaAct": false,
      "carpetaNumero": 350,
      "createdAt": "2023-12-10T20:31:14.914Z"
    }
  ],
  "juzgados": [
    {
      "id": 50,
      "tipo": "JUZGADO 050 CIVIL MUNICIPAL DE BOGOTÁ ",
      "url": "https://www.ramajudicial.gov.co/web/juzgado-50-civil-municipal-de-bogota"
    }
  ],
  "codeudor": null,
  "demanda": {
    "vencimientoPagare": "5/05/2020",
    "obligacion": {
      "A": "6740081982 / 451308007555923",
      "B": 5303717744146285
    },
    "capitalAdeudado": "24.965.682.98",
    "entregaGarantiasAbogado": "15/11/2017",
    "departamento": "CUNDINAMARCA",
    "municipio": "BOGOTA",
    "tipoProceso": "SINGULAR",
    "radicado": "2017 - 01357",
    "llaveProceso": "11001400305020170135700",
    "etapaProcesal": "NOTIFICACION",
    "fechaPresentacion": "23/11/2017",
    "mandamientoPago": "16/04/2018",
    "notificacion": {
      "tipo": "P/NAL",
      "autoNotificado": "03/05/2018"
    },
    "medidasCautelares": {
      "fechaOrdenaMedidas": "16/04/2018",
      "medidaSolicitada": "VEHICULO"
    }
  },
  "demandas": [
    {
      "idProceso": 11224353,
      "idConexion": 261,
      "llaveProceso": "11001400305020170135700",
      "fechaProceso": "2017-11-24T05:00:00.000Z",
      "fechaUltimaActuacion": "2022-10-24T05:00:00.000Z",
      "sujetosProcesales": "Demandante: BANCOLOMBIA S.A. | Demandado: DIEGO FERNEY VERGARA VALDERRAMA ",
      "esPrivado": false,
      "cantFilas": -1,
      "medidasCautelares": {
        "fechaOrdenaMedida": null,
        "medidaSolicitada": "VEHICULO"
      },
      "vencimientoPagare": ["2020-01-01T05:00:00.000Z"],
      "capitalAdeudado": 2496568298,
      "departamento": "CUNDINAMARCA",
      "entregaGarantiasAbogado": null,
      "tipoProceso": "SINGULAR",
      "mandamientoPago": null,
      "etapaProcesal": "NOTIFICACION",
      "fechaPresentacion": ["2017-11-23T05:00:00.000Z"],
      "municipio": "BOGOTA",
      "obligacion": ["6740081982 / 451308007555923", 5303717744146285],
      "radicado": "2017 - 01357"
    }
  ],
  "numero": 350,
  "llaveProceso": "11001400305020170135700",
  "fecha": "2022-10-24T05:00:00.000Z",
  "ultimaActuacion": {
    "idRegActuacion": 1283273453,
    "llaveProceso": "11001400305020170135700",
    "consActuacion": 36,
    "fechaActuacion": "2022-10-24T00:00:00",
    "actuacion": "Archivo Definitivo",
    "anotacion": "CAJA 56 DE 2022",
    "fechaInicial": null,
    "fechaFinal": null,
    "fechaRegistro": "2022-10-24T00:00:00",
    "codRegla": "00                              ",
    "conDocumentos": false,
    "cant": 36,
    "idProceso": 11224353,
    "isUltimaAct": true
  },
  "category": "Terminados",
  "revisado": true,
  "terminado": true,
  "tipoProceso": "SINGULAR",
  "deudor": {
    "tel": {
      "fijo": 4647087,
      "celular": 3112441540
    },
    "primerNombre": "DIEGO",
    "segundoNombre": "FERNEY",
    "primerApellido": "VERGARA",
    "segundoApellido": "VALDERRAMA",
    "cedula": 80111672,
    "direccion": "CALLE 51  SUR No  80 - 24",
    "email": "diegovergarav@hotmail.com"
  },
  "cc": 80111672,
  "procesos": [
    {
      "idProceso": 11224353,
      "idConexion": 261,
      "llaveProceso": "11001400305020170135700",
      "fechaProceso": "2017-11-24T05:00:00.000Z",
      "fechaUltimaActuacion": "2022-10-24T05:00:00.000Z",
      "despacho": "JUZGADO 050 CIVIL MUNICIPAL DE BOGOTÁ ",
      "departamento": "BOGOTÁ",
      "sujetosProcesales": "Demandante: BANCOLOMBIA S.A. | Demandado: DIEGO FERNEY VERGARA VALDERRAMA ",
      "esPrivado": false,
      "cantFilas": -1
    }
  ],
  "idProcesos": [11224353],
  "nombre": "DIEGO FERNEY VERGARA VALDERRAMA",
  "notificacion": {
    "notifiers": [],
    "certimail": null,
    "fisico": null,
    "autoNotificado": "03/05/2018"
  }
}
