{
  "actuaciones": [
    {
      "idRegActuacion": 1936452500,
      "llaveProceso": "11001400300320170088400",
      "consActuacion": 104,
      "fechaActuacion": "2023-11-21T05:00:00.000Z",
      "actuacion": "Recepción memorial",
      "anotacion": "RESPUESTA TRANSUNION ",
      "fechaInicial": null,
      "fechaFinal": null,
      "fechaRegistro": "2023-11-21T05:00:00.000Z",
      "codRegla": "00                              ",
      "conDocumentos": false,
      "cant": 104,
      "idProceso": 50468620,
      "isUltimaAct": true,
      "carpetaNumero": 16,
      "createdAt": "2023-12-10T20:30:22.951Z"
    },
    {
      "idRegActuacion": 1931638350,
      "llaveProceso": "11001400300320170088400",
      "consActuacion": 103,
      "fechaActuacion": "2023-11-08T05:00:00.000Z",
      "actuacion": "Envío Comunicaciones",
      "anotacion": "OFICIO CIFIN Y DATACREDITO TERMINO DE 5 DIAS ",
      "fechaInicial": null,
      "fechaFinal": null,
      "fechaRegistro": "2023-11-08T05:00:00.000Z",
      "codRegla": "00                              ",
      "conDocumentos": false,
      "cant": 104,
      "idProceso": 50468620,
      "isUltimaAct": false,
      "carpetaNumero": 16,
      "createdAt": "2023-12-10T20:30:22.951Z"
    },
    {
      "idRegActuacion": 1931638340,
      "llaveProceso": "11001400300320170088400",
      "consActuacion": 102,
      "fechaActuacion": "2023-11-07T05:00:00.000Z",
      "actuacion": "Oficio Elaborado",
      "anotacion": "OFICIO CIFIN Y DATACREDITO ",
      "fechaInicial": null,
      "fechaFinal": null,
      "fechaRegistro": "2023-11-07T05:00:00.000Z",
      "codRegla": "00                              ",
      "conDocumentos": false,
      "cant": 104,
      "idProceso": 50468620,
      "isUltimaAct": false,
      "carpetaNumero": 16,
      "createdAt": "2023-12-10T20:30:22.951Z"
    },
    {
      "idRegActuacion": 1908319300,
      "llaveProceso": "11001400300320170088400",
      "consActuacion": 101,
      "fechaActuacion": "2023-10-17T05:00:00.000Z",
      "actuacion": "Fijacion estado",
      "anotacion": "Actuación registrada el 17/10/2023 a las 08:18:23.",
      "fechaInicial": "2023-10-18T05:00:00.000Z",
      "fechaFinal": "2023-10-18T05:00:00.000Z",
      "fechaRegistro": "2023-10-17T05:00:00.000Z",
      "codRegla": "00                              ",
      "conDocumentos": false,
      "cant": 104,
      "idProceso": 50468620,
      "isUltimaAct": false,
      "carpetaNumero": 16,
      "createdAt": "2023-12-10T20:30:22.951Z"
    },
    {
      "idRegActuacion": 1908319290,
      "llaveProceso": "11001400300320170088400",
      "consActuacion": 100,
      "fechaActuacion": "2023-10-17T05:00:00.000Z",
      "actuacion": "Auto ordena oficiar",
      "anotacion": null,
      "fechaInicial": null,
      "fechaFinal": null,
      "fechaRegistro": "2023-10-17T05:00:00.000Z",
      "codRegla": "00                              ",
      "conDocumentos": false,
      "cant": 104,
      "idProceso": 50468620,
      "isUltimaAct": false,
      "carpetaNumero": 16,
      "createdAt": "2023-12-10T20:30:22.951Z"
    },
    {
      "idRegActuacion": 1814836590,
      "llaveProceso": "11001400300320170088400",
      "consActuacion": 99,
      "fechaActuacion": "2023-07-18T05:00:00.000Z",
      "actuacion": "Recepción memorial",
      "anotacion": "ALLEGAN DOCUMENTOS RECONSTRUCCION ",
      "fechaInicial": null,
      "fechaFinal": null,
      "fechaRegistro": "2023-07-18T05:00:00.000Z",
      "codRegla": "00                              ",
      "conDocumentos": false,
      "cant": 104,
      "idProceso": 50468620,
      "isUltimaAct": false,
      "carpetaNumero": 16,
      "createdAt": "2023-12-10T20:30:22.951Z"
    },
    {
      "idRegActuacion": 1792483340,
      "llaveProceso": "11001400300320170088400",
      "consActuacion": 98,
      "fechaActuacion": "2023-06-28T05:00:00.000Z",
      "actuacion": "Fijacion estado",
      "anotacion": "Actuación registrada el 28/06/2023 a las 16:17:33.",
      "fechaInicial": "2023-06-29T05:00:00.000Z",
      "fechaFinal": "2023-06-29T05:00:00.000Z",
      "fechaRegistro": "2023-06-28T05:00:00.000Z",
      "codRegla": "00                              ",
      "conDocumentos": false,
      "cant": 104,
      "idProceso": 50468620,
      "isUltimaAct": false,
      "carpetaNumero": 16,
      "createdAt": "2023-12-10T20:30:22.951Z"
    },
    {
      "idRegActuacion": 1792483330,
      "llaveProceso": "11001400300320170088400",
      "consActuacion": 97,
      "fechaActuacion": "2023-06-28T05:00:00.000Z",
      "actuacion": "Auto pone en conocimiento",
      "anotacion": null,
      "fechaInicial": null,
      "fechaFinal": null,
      "fechaRegistro": "2023-06-28T05:00:00.000Z",
      "codRegla": "00                              ",
      "conDocumentos": false,
      "cant": 104,
      "idProceso": 50468620,
      "isUltimaAct": false,
      "carpetaNumero": 16,
      "createdAt": "2023-12-10T20:30:22.951Z"
    },
    {
      "idRegActuacion": 1716788490,
      "llaveProceso": "11001400300320170088400",
      "consActuacion": 96,
      "fechaActuacion": "2023-04-17T05:00:00.000Z",
      "actuacion": "Al despacho",
      "anotacion": null,
      "fechaInicial": null,
      "fechaFinal": null,
      "fechaRegistro": "2023-04-20T05:00:00.000Z",
      "codRegla": "00                              ",
      "conDocumentos": false,
      "cant": 104,
      "idProceso": 50468620,
      "isUltimaAct": false,
      "carpetaNumero": 16,
      "createdAt": "2023-12-10T20:30:22.951Z"
    },
    {
      "idRegActuacion": 1614936780,
      "llaveProceso": "11001400300320170088400",
      "consActuacion": 95,
      "fechaActuacion": "2023-01-16T05:00:00.000Z",
      "actuacion": "Recepción memorial",
      "anotacion": "SE AGREGA MEMORIAL INFORME PARQUEADERO",
      "fechaInicial": null,
      "fechaFinal": null,
      "fechaRegistro": "2023-01-16T05:00:00.000Z",
      "codRegla": "00                              ",
      "conDocumentos": false,
      "cant": 104,
      "idProceso": 50468620,
      "isUltimaAct": false,
      "carpetaNumero": 16,
      "createdAt": "2023-12-10T20:30:22.951Z"
    },
    {
      "idRegActuacion": 1528286940,
      "llaveProceso": "11001400300320170088400",
      "consActuacion": 94,
      "fechaActuacion": "2022-11-21T05:00:00.000Z",
      "actuacion": "Recepción memorial",
      "anotacion": "SOLICITUD",
      "fechaInicial": null,
      "fechaFinal": null,
      "fechaRegistro": "2022-11-28T05:00:00.000Z",
      "codRegla": "00                              ",
      "conDocumentos": false,
      "cant": 104,
      "idProceso": 50468620,
      "isUltimaAct": false,
      "carpetaNumero": 16,
      "createdAt": "2023-12-10T20:30:22.951Z"
    },
    {
      "idRegActuacion": 1525354420,
      "llaveProceso": "11001400300320170088400",
      "consActuacion": 93,
      "fechaActuacion": "2022-11-24T05:00:00.000Z",
      "actuacion": "Fijacion estado",
      "anotacion": "Actuación registrada el 24/11/2022 a las 17:11:46.",
      "fechaInicial": "2022-11-25T05:00:00.000Z",
      "fechaFinal": "2022-11-25T05:00:00.000Z",
      "fechaRegistro": "2022-11-24T05:00:00.000Z",
      "codRegla": "00                              ",
      "conDocumentos": false,
      "cant": 104,
      "idProceso": 50468620,
      "isUltimaAct": false,
      "carpetaNumero": 16,
      "createdAt": "2023-12-10T20:30:22.951Z"
    },
    {
      "idRegActuacion": 1525354410,
      "llaveProceso": "11001400300320170088400",
      "consActuacion": 92,
      "fechaActuacion": "2022-11-24T05:00:00.000Z",
      "actuacion": "Auto resuelve solicitud",
      "anotacion": "Ordena busqueda de actuaciones - proceso extraviado",
      "fechaInicial": null,
      "fechaFinal": null,
      "fechaRegistro": "2022-11-24T05:00:00.000Z",
      "codRegla": "00                              ",
      "conDocumentos": false,
      "cant": 104,
      "idProceso": 50468620,
      "isUltimaAct": false,
      "carpetaNumero": 16,
      "createdAt": "2023-12-10T20:30:22.951Z"
    },
    {
      "idRegActuacion": 1519088590,
      "llaveProceso": "11001400300320170088400",
      "consActuacion": 91,
      "fechaActuacion": "2022-11-03T05:00:00.000Z",
      "actuacion": "Al despacho",
      "anotacion": null,
      "fechaInicial": null,
      "fechaFinal": null,
      "fechaRegistro": "2022-11-22T05:00:00.000Z",
      "codRegla": "00                              ",
      "conDocumentos": false,
      "cant": 104,
      "idProceso": 50468620,
      "isUltimaAct": false,
      "carpetaNumero": 16,
      "createdAt": "2023-12-10T20:30:22.951Z"
    },
    {
      "idRegActuacion": 1496870600,
      "llaveProceso": "11001400300320170088400",
      "consActuacion": 90,
      "fechaActuacion": "2022-11-08T05:00:00.000Z",
      "actuacion": "Fijacion estado",
      "anotacion": "Actuación registrada el 08/11/2022 a las 17:11:57.",
      "fechaInicial": "2022-11-09T05:00:00.000Z",
      "fechaFinal": "2022-11-09T05:00:00.000Z",
      "fechaRegistro": "2022-11-08T05:00:00.000Z",
      "codRegla": "00                              ",
      "conDocumentos": false,
      "cant": 104,
      "idProceso": 50468620,
      "isUltimaAct": false,
      "carpetaNumero": 16,
      "createdAt": "2023-12-10T20:30:22.951Z"
    },
    {
      "idRegActuacion": 1496870590,
      "llaveProceso": "11001400300320170088400",
      "consActuacion": 89,
      "fechaActuacion": "2022-11-08T05:00:00.000Z",
      "actuacion": "Auto nombra Auxiliar de la Justicia",
      "anotacion": "No accede petición",
      "fechaInicial": null,
      "fechaFinal": null,
      "fechaRegistro": "2022-11-08T05:00:00.000Z",
      "codRegla": "00                              ",
      "conDocumentos": false,
      "cant": 104,
      "idProceso": 50468620,
      "isUltimaAct": false,
      "carpetaNumero": 16,
      "createdAt": "2023-12-10T20:30:22.951Z"
    },
    {
      "idRegActuacion": 1477253420,
      "llaveProceso": "11001400300320170088400",
      "consActuacion": 88,
      "fechaActuacion": "2022-10-21T05:00:00.000Z",
      "actuacion": "Recepción memorial",
      "anotacion": "SOLICITUD DAR TRAMITE - PROCESO EN ÁREA DE DIGITALIZACIÓN.",
      "fechaInicial": null,
      "fechaFinal": null,
      "fechaRegistro": "2022-10-27T05:00:00.000Z",
      "codRegla": "00                              ",
      "conDocumentos": false,
      "cant": 104,
      "idProceso": 50468620,
      "isUltimaAct": false,
      "carpetaNumero": 16,
      "createdAt": "2023-12-10T20:30:22.951Z"
    },
    {
      "idRegActuacion": 1274477560,
      "llaveProceso": "11001400300320170088400",
      "consActuacion": 87,
      "fechaActuacion": "2022-04-19T05:00:00.000Z",
      "actuacion": "Al despacho",
      "anotacion": null,
      "fechaInicial": null,
      "fechaFinal": null,
      "fechaRegistro": "2022-04-19T05:00:00.000Z",
      "codRegla": "00                              ",
      "conDocumentos": false,
      "cant": 104,
      "idProceso": 50468620,
      "isUltimaAct": false,
      "carpetaNumero": 16,
      "createdAt": "2023-12-10T20:30:22.951Z"
    },
    {
      "idRegActuacion": 1266347270,
      "llaveProceso": "11001400300320170088400",
      "consActuacion": 86,
      "fechaActuacion": "2022-03-23T05:00:00.000Z",
      "actuacion": "Recepción memorial",
      "anotacion": "MANIFESTACIÓN",
      "fechaInicial": null,
      "fechaFinal": null,
      "fechaRegistro": "2022-03-24T05:00:00.000Z",
      "codRegla": "00                              ",
      "conDocumentos": false,
      "cant": 104,
      "idProceso": 50468620,
      "isUltimaAct": false,
      "carpetaNumero": 16,
      "createdAt": "2023-12-10T20:30:22.951Z"
    },
    {
      "idRegActuacion": 1264568120,
      "llaveProceso": "11001400300320170088400",
      "consActuacion": 85,
      "fechaActuacion": "2022-03-17T05:00:00.000Z",
      "actuacion": "Fijacion estado",
      "anotacion": "Actuación registrada el 17/03/2022 a las 14:51:19.",
      "fechaInicial": "2022-03-18T05:00:00.000Z",
      "fechaFinal": "2022-03-18T05:00:00.000Z",
      "fechaRegistro": "2022-03-17T05:00:00.000Z",
      "codRegla": "00                              ",
      "conDocumentos": false,
      "cant": 104,
      "idProceso": 50468620,
      "isUltimaAct": false,
      "carpetaNumero": 16,
      "createdAt": "2023-12-10T20:30:22.951Z"
    },
    {
      "idRegActuacion": 1264568110,
      "llaveProceso": "11001400300320170088400",
      "consActuacion": 84,
      "fechaActuacion": "2022-03-17T05:00:00.000Z",
      "actuacion": "Auto requiere",
      "anotacion": "A la parte actora",
      "fechaInicial": null,
      "fechaFinal": null,
      "fechaRegistro": "2022-03-17T05:00:00.000Z",
      "codRegla": "00                              ",
      "conDocumentos": false,
      "cant": 104,
      "idProceso": 50468620,
      "isUltimaAct": false,
      "carpetaNumero": 16,
      "createdAt": "2023-12-10T20:30:22.951Z"
    },
    {
      "idRegActuacion": 1263648650,
      "llaveProceso": "11001400300320170088400",
      "consActuacion": 83,
      "fechaActuacion": "2022-03-15T05:00:00.000Z",
      "actuacion": "Al despacho",
      "anotacion": null,
      "fechaInicial": null,
      "fechaFinal": null,
      "fechaRegistro": "2022-03-15T05:00:00.000Z",
      "codRegla": "00                              ",
      "conDocumentos": false,
      "cant": 104,
      "idProceso": 50468620,
      "isUltimaAct": false,
      "carpetaNumero": 16,
      "createdAt": "2023-12-10T20:30:22.951Z"
    },
    {
      "idRegActuacion": 1260781290,
      "llaveProceso": "11001400300320170088400",
      "consActuacion": 82,
      "fechaActuacion": "2022-03-02T05:00:00.000Z",
      "actuacion": "Recepción memorial",
      "anotacion": "APORTA NOTIFICACIÓN",
      "fechaInicial": null,
      "fechaFinal": null,
      "fechaRegistro": "2022-03-02T05:00:00.000Z",
      "codRegla": "00                              ",
      "conDocumentos": false,
      "cant": 104,
      "idProceso": 50468620,
      "isUltimaAct": false,
      "carpetaNumero": 16,
      "createdAt": "2023-12-10T20:30:22.951Z"
    },
    {
      "idRegActuacion": 1259391910,
      "llaveProceso": "11001400300320170088400",
      "consActuacion": 81,
      "fechaActuacion": "2022-02-24T05:00:00.000Z",
      "actuacion": "Fijacion estado",
      "anotacion": "Actuación registrada el 24/02/2022 a las 15:18:30.",
      "fechaInicial": "2022-02-25T05:00:00.000Z",
      "fechaFinal": "2022-02-25T05:00:00.000Z",
      "fechaRegistro": "2022-02-24T05:00:00.000Z",
      "codRegla": "00                              ",
      "conDocumentos": false,
      "cant": 104,
      "idProceso": 50468620,
      "isUltimaAct": false,
      "carpetaNumero": 16,
      "createdAt": "2023-12-10T20:30:22.951Z"
    },
    {
      "idRegActuacion": 1259391900,
      "llaveProceso": "11001400300320170088400",
      "consActuacion": 80,
      "fechaActuacion": "2022-02-24T05:00:00.000Z",
      "actuacion": "Auto requiere",
      "anotacion": "Hacer manifestaciones",
      "fechaInicial": null,
      "fechaFinal": null,
      "fechaRegistro": "2022-02-24T05:00:00.000Z",
      "codRegla": "00                              ",
      "conDocumentos": false,
      "cant": 104,
      "idProceso": 50468620,
      "isUltimaAct": false,
      "carpetaNumero": 16,
      "createdAt": "2023-12-10T20:30:22.951Z"
    },
    {
      "idRegActuacion": 1258734960,
      "llaveProceso": "11001400300320170088400",
      "consActuacion": 79,
      "fechaActuacion": "2022-02-22T05:00:00.000Z",
      "actuacion": "Al despacho",
      "anotacion": null,
      "fechaInicial": null,
      "fechaFinal": null,
      "fechaRegistro": "2022-02-22T05:00:00.000Z",
      "codRegla": "00                              ",
      "conDocumentos": false,
      "cant": 104,
      "idProceso": 50468620,
      "isUltimaAct": false,
      "carpetaNumero": 16,
      "createdAt": "2023-12-10T20:30:22.951Z"
    },
    {
      "idRegActuacion": 1258656190,
      "llaveProceso": "11001400300320170088400",
      "consActuacion": 78,
      "fechaActuacion": "2022-02-21T05:00:00.000Z",
      "actuacion": "Recepción memorial",
      "anotacion": "NUEVA DIRECCION ",
      "fechaInicial": null,
      "fechaFinal": null,
      "fechaRegistro": "2022-02-21T05:00:00.000Z",
      "codRegla": "00                              ",
      "conDocumentos": false,
      "cant": 104,
      "idProceso": 50468620,
      "isUltimaAct": false,
      "carpetaNumero": 16,
      "createdAt": "2023-12-10T20:30:22.951Z"
    },
    {
      "idRegActuacion": 1234389210,
      "llaveProceso": "11001400300320170088400",
      "consActuacion": 77,
      "fechaActuacion": "2021-11-18T05:00:00.000Z",
      "actuacion": "Fijacion estado",
      "anotacion": "Actuación registrada el 18/11/2021 a las 15:27:13.",
      "fechaInicial": "2021-11-19T05:00:00.000Z",
      "fechaFinal": "2021-11-19T05:00:00.000Z",
      "fechaRegistro": "2021-11-18T05:00:00.000Z",
      "codRegla": "00                              ",
      "conDocumentos": false,
      "cant": 104,
      "idProceso": 50468620,
      "isUltimaAct": false,
      "carpetaNumero": 16,
      "createdAt": "2023-12-10T20:30:22.951Z"
    },
    {
      "idRegActuacion": 1234389200,
      "llaveProceso": "11001400300320170088400",
      "consActuacion": 76,
      "fechaActuacion": "2021-11-18T05:00:00.000Z",
      "actuacion": "Auto pone en conocimiento",
      "anotacion": null,
      "fechaInicial": null,
      "fechaFinal": null,
      "fechaRegistro": "2021-11-18T05:00:00.000Z",
      "codRegla": "00                              ",
      "conDocumentos": false,
      "cant": 104,
      "idProceso": 50468620,
      "isUltimaAct": false,
      "carpetaNumero": 16,
      "createdAt": "2023-12-10T20:30:22.951Z"
    },
    {
      "idRegActuacion": 1233786160,
      "llaveProceso": "11001400300320170088400",
      "consActuacion": 75,
      "fechaActuacion": "2021-11-16T05:00:00.000Z",
      "actuacion": "Al despacho",
      "anotacion": null,
      "fechaInicial": null,
      "fechaFinal": null,
      "fechaRegistro": "2021-11-16T05:00:00.000Z",
      "codRegla": "00                              ",
      "conDocumentos": false,
      "cant": 104,
      "idProceso": 50468620,
      "isUltimaAct": false,
      "carpetaNumero": 16,
      "createdAt": "2023-12-10T20:30:22.951Z"
    },
    {
      "idRegActuacion": 1229254590,
      "llaveProceso": "11001400300320170088400",
      "consActuacion": 74,
      "fechaActuacion": "2021-10-19T05:00:00.000Z",
      "actuacion": "Fijacion estado",
      "anotacion": "Actuación registrada el 19/10/2021 a las 17:07:43.",
      "fechaInicial": "2021-10-20T05:00:00.000Z",
      "fechaFinal": "2021-10-20T05:00:00.000Z",
      "fechaRegistro": "2021-10-19T05:00:00.000Z",
      "codRegla": "00                              ",
      "conDocumentos": false,
      "cant": 104,
      "idProceso": 50468620,
      "isUltimaAct": false,
      "carpetaNumero": 16,
      "createdAt": "2023-12-10T20:30:22.951Z"
    },
    {
      "idRegActuacion": 1229254580,
      "llaveProceso": "11001400300320170088400",
      "consActuacion": 73,
      "fechaActuacion": "2021-10-19T05:00:00.000Z",
      "actuacion": "Auto pone en conocimiento",
      "anotacion": "DECLARA TERMINADO PODER",
      "fechaInicial": null,
      "fechaFinal": null,
      "fechaRegistro": "2021-10-19T05:00:00.000Z",
      "codRegla": "00                              ",
      "conDocumentos": false,
      "cant": 104,
      "idProceso": 50468620,
      "isUltimaAct": false,
      "carpetaNumero": 16,
      "createdAt": "2023-12-10T20:30:22.951Z"
    },
    {
      "idRegActuacion": 1228130520,
      "llaveProceso": "11001400300320170088400",
      "consActuacion": 72,
      "fechaActuacion": "2021-10-12T05:00:00.000Z",
      "actuacion": "Al despacho",
      "anotacion": null,
      "fechaInicial": null,
      "fechaFinal": null,
      "fechaRegistro": "2021-10-12T05:00:00.000Z",
      "codRegla": "00                              ",
      "conDocumentos": false,
      "cant": 104,
      "idProceso": 50468620,
      "isUltimaAct": false,
      "carpetaNumero": 16,
      "createdAt": "2023-12-10T20:30:22.951Z"
    },
    {
      "idRegActuacion": 1227964190,
      "llaveProceso": "11001400300320170088400",
      "consActuacion": 71,
      "fechaActuacion": "2021-10-08T05:00:00.000Z",
      "actuacion": "Recepción memorial",
      "anotacion": "REVOCA PODER",
      "fechaInicial": null,
      "fechaFinal": null,
      "fechaRegistro": "2021-10-11T05:00:00.000Z",
      "codRegla": "00                              ",
      "conDocumentos": false,
      "cant": 104,
      "idProceso": 50468620,
      "isUltimaAct": false,
      "carpetaNumero": 16,
      "createdAt": "2023-12-10T20:30:22.951Z"
    },
    {
      "idRegActuacion": 1222975360,
      "llaveProceso": "11001400300320170088400",
      "consActuacion": 70,
      "fechaActuacion": "2021-09-10T05:00:00.000Z",
      "actuacion": "Fijacion estado",
      "anotacion": "Actuación registrada el 10/09/2021 a las 06:54:05.",
      "fechaInicial": "2021-09-13T05:00:00.000Z",
      "fechaFinal": "2021-09-13T05:00:00.000Z",
      "fechaRegistro": "2021-09-10T05:00:00.000Z",
      "codRegla": "00                              ",
      "conDocumentos": false,
      "cant": 104,
      "idProceso": 50468620,
      "isUltimaAct": false,
      "carpetaNumero": 16,
      "createdAt": "2023-12-10T20:30:22.951Z"
    },
    {
      "idRegActuacion": 1222975350,
      "llaveProceso": "11001400300320170088400",
      "consActuacion": 69,
      "fechaActuacion": "2021-09-10T05:00:00.000Z",
      "actuacion": "Agreguese a autos",
      "anotacion": null,
      "fechaInicial": null,
      "fechaFinal": null,
      "fechaRegistro": "2021-09-10T05:00:00.000Z",
      "codRegla": "00                              ",
      "conDocumentos": false,
      "cant": 104,
      "idProceso": 50468620,
      "isUltimaAct": false,
      "carpetaNumero": 16,
      "createdAt": "2023-12-10T20:30:22.951Z"
    },
    {
      "idRegActuacion": 1221485190,
      "llaveProceso": "11001400300320170088400",
      "consActuacion": 68,
      "fechaActuacion": "2021-09-05T05:00:00.000Z",
      "actuacion": "Recepción memorial",
      "anotacion": "MANIFESTACION NO ACEPTACION CARGO",
      "fechaInicial": null,
      "fechaFinal": null,
      "fechaRegistro": "2021-09-05T05:00:00.000Z",
      "codRegla": "00                              ",
      "conDocumentos": false,
      "cant": 104,
      "idProceso": 50468620,
      "isUltimaAct": false,
      "carpetaNumero": 16,
      "createdAt": "2023-12-10T20:30:22.951Z"
    },
    {
      "idRegActuacion": 1221014340,
      "llaveProceso": "11001400300320170088400",
      "consActuacion": 67,
      "fechaActuacion": "2021-09-02T05:00:00.000Z",
      "actuacion": "Constancia secretarial",
      "anotacion": "SE REMITE COMUNICACION DE DESIGNACION AL AUXILIAR DE LA JUSTICIA",
      "fechaInicial": null,
      "fechaFinal": null,
      "fechaRegistro": "2021-09-02T05:00:00.000Z",
      "codRegla": "00                              ",
      "conDocumentos": false,
      "cant": 104,
      "idProceso": 50468620,
      "isUltimaAct": false,
      "carpetaNumero": 16,
      "createdAt": "2023-12-10T20:30:22.951Z"
    },
    {
      "idRegActuacion": 1220047450,
      "llaveProceso": "11001400300320170088400",
      "consActuacion": 66,
      "fechaActuacion": "2021-08-26T05:00:00.000Z",
      "actuacion": "Recepción memorial",
      "anotacion": "DEVUELVEN DESPACHO COMISORIO",
      "fechaInicial": null,
      "fechaFinal": null,
      "fechaRegistro": "2021-08-27T05:00:00.000Z",
      "codRegla": "00                              ",
      "conDocumentos": false,
      "cant": 104,
      "idProceso": 50468620,
      "isUltimaAct": false,
      "carpetaNumero": 16,
      "createdAt": "2023-12-10T20:30:22.951Z"
    },
    {
      "idRegActuacion": 1216622440,
      "llaveProceso": "11001400300320170088400",
      "consActuacion": 65,
      "fechaActuacion": "2021-08-05T05:00:00.000Z",
      "actuacion": "Fijacion estado",
      "anotacion": "Actuación registrada el 05/08/2021 a las 18:39:04.",
      "fechaInicial": "2021-08-06T05:00:00.000Z",
      "fechaFinal": "2021-08-06T05:00:00.000Z",
      "fechaRegistro": "2021-08-05T05:00:00.000Z",
      "codRegla": "00                              ",
      "conDocumentos": false,
      "cant": 104,
      "idProceso": 50468620,
      "isUltimaAct": false,
      "carpetaNumero": 16,
      "createdAt": "2023-12-10T20:30:22.951Z"
    }
  ],
  "juzgados": [
    {
      "id": 3,
      "tipo": "JUZGADO 003 CIVIL MUNICIPAL DE BOGOTÁ ",
      "url": "https://www.ramajudicial.gov.co/web/juzgado-03-civil-municipal-de-bogota"
    },
    {
      "id": 3,
      "tipo": "JUZGADO 003 CIVIL MUNICIPAL DE BOGOTÁ ",
      "url": "https://www.ramajudicial.gov.co/web/juzgado-03-civil-municipal-de-bogota"
    }
  ],
  "codeudor": null,
  "demanda": {
    "vencimientoPagare": "4/05/2020",
    "obligacion": {
      "A": 2530444
    },
    "capitalAdeudado": "$ 33.791.309",
    "entregaGarantiasAbogado": "11/05/2017",
    "departamento": "CUNDINAMARCA",
    "municipio": "BOGOTA",
    "tipoProceso": "PRENDARIO",
    "radicado": "2017 - 00884",
    "llaveProceso": "11001400300320170088400",
    "etapaProcesal": "EMPLAZAMIENTO",
    "fechaPresentacion": "24/05/2017",
    "mandamientoPago": "2/06/2017",
    "notificacion": {
      "291": {
        "fechaAporta": "11/07/2018"
      },
      "292": {
        "fechaAporta": "11/07/2018",
        "resultado": "31/03/1901"
      },
      "autoNotificado": "11/07/2018"
    },
    "medidasCautelares": {
      "medidaSolicitada": "VEHICULO"
    }
  },
  "demandas": [
    {
      "idProceso": 50468620,
      "idConexion": 259,
      "llaveProceso": "11001400300320170088400",
      "fechaProceso": "2017-05-26T05:00:00.000Z",
      "fechaUltimaActuacion": "2023-11-21T05:00:00.000Z",
      "sujetosProcesales": "Demandante: BANCOLOMBIA S.A. | Demandado: YESID ALBEIRO RAMOS ",
      "esPrivado": false,
      "cantFilas": -1,
      "medidasCautelares": {
        "fechaOrdenaMedida": null,
        "medidaSolicitada": "VEHICULO"
      },
      "vencimientoPagare": ["2020-01-01T05:00:00.000Z"],
      "capitalAdeudado": null,
      "departamento": "CUNDINAMARCA",
      "entregaGarantiasAbogado": "2017-11-05T05:00:00.000Z",
      "tipoProceso": "PRENDARIO",
      "mandamientoPago": "2017-02-06T05:00:00.000Z",
      "etapaProcesal": "EMPLAZAMIENTO",
      "fechaPresentacion": ["2017-05-24T05:00:00.000Z"],
      "municipio": "BOGOTA",
      "obligacion": [2530444],
      "radicado": "2017 - 00884"
    },
    {
      "idProceso": 113956611,
      "idConexion": 320,
      "llaveProceso": "11001400300320170088400",
      "fechaProceso": "2017-05-24T05:00:00.000Z",
      "fechaUltimaActuacion": null,
      "sujetosProcesales": "Demandante/accionante: BANCOLOMBIA SA | Demandado/indiciado/causante: YESID ALBEIRO RAMOS  (Emplazado) | Defensor Publico: MARIA HELENA SUAREZ GARCIA ",
      "esPrivado": false,
      "cantFilas": -1,
      "medidasCautelares": {
        "fechaOrdenaMedida": null,
        "medidaSolicitada": "VEHICULO"
      },
      "vencimientoPagare": ["2020-01-01T05:00:00.000Z"],
      "capitalAdeudado": null,
      "departamento": "CUNDINAMARCA",
      "entregaGarantiasAbogado": "2017-11-05T05:00:00.000Z",
      "tipoProceso": "PRENDARIO",
      "mandamientoPago": "2017-02-06T05:00:00.000Z",
      "etapaProcesal": "EMPLAZAMIENTO",
      "fechaPresentacion": ["2017-05-24T05:00:00.000Z"],
      "municipio": "BOGOTA",
      "obligacion": [2530444],
      "radicado": "2017 - 00884"
    }
  ],
  "numero": 16,
  "llaveProceso": "11001400300320170088400",
  "fecha": "2023-11-21T05:00:00.000Z",
  "ultimaActuacion": {
    "idRegActuacion": 1936452500,
    "llaveProceso": "11001400300320170088400",
    "consActuacion": 104,
    "fechaActuacion": "2023-11-21T00:00:00",
    "actuacion": "Recepción memorial",
    "anotacion": "RESPUESTA TRANSUNION ",
    "fechaInicial": null,
    "fechaFinal": null,
    "fechaRegistro": "2023-11-21T00:00:00",
    "codRegla": "00                              ",
    "conDocumentos": false,
    "cant": 104,
    "idProceso": 50468620,
    "isUltimaAct": true
  },
  "category": "Bancolombia",
  "revisado": false,
  "terminado": false,
  "tipoProceso": "PRENDARIO",
  "deudor": {
    "tel": {
      "fijo": null,
      "celular": 3212337597
    },
    "primerNombre": "YESID",
    "segundoNombre": "ALBEIRO",
    "primerApellido": "RAMOS",
    "segundoApellido": null,
    "cedula": 1077969975,
    "direccion": "CARRERA 77B No. 68B - 19 BARRIO SANTA HELENITA",
    "email": "yess_Id@hotmail.com"
  },
  "cc": 1077969975,
  "procesos": [
    {
      "idProceso": 50468620,
      "idConexion": 259,
      "llaveProceso": "11001400300320170088400",
      "fechaProceso": "2017-05-26T05:00:00.000Z",
      "fechaUltimaActuacion": "2023-11-21T05:00:00.000Z",
      "despacho": "JUZGADO 003 CIVIL MUNICIPAL DE BOGOTÁ ",
      "departamento": "BOGOTÁ",
      "sujetosProcesales": "Demandante: BANCOLOMBIA S.A. | Demandado: YESID ALBEIRO RAMOS ",
      "esPrivado": false,
      "cantFilas": -1
    },
    {
      "idProceso": 113956611,
      "idConexion": 320,
      "llaveProceso": "11001400300320170088400",
      "fechaProceso": "2017-05-24T05:00:00.000Z",
      "fechaUltimaActuacion": null,
      "despacho": "JUZGADO 003 CIVIL MUNICIPAL DE BOGOTÁ ",
      "departamento": "BOGOTÁ",
      "sujetosProcesales": "Demandante/accionante: BANCOLOMBIA SA | Demandado/indiciado/causante: YESID ALBEIRO RAMOS  (Emplazado) | Defensor Publico: MARIA HELENA SUAREZ GARCIA ",
      "esPrivado": false,
      "cantFilas": -1
    }
  ],
  "idProcesos": [50468620, 113956611],
  "nombre": "YESID ALBEIRO RAMOS",
  "notificacion": {
    "notifiers": [
      {
        "tipo": "291",
        "fechaRecibido": null,
        "fechaAporta": "2018-07-11T05:00:00.000Z",
        "resultado": null
      },
      {
        "tipo": "292",
        "fechaRecibido": null,
        "fechaAporta": "2018-07-11T05:00:00.000Z",
        "resultado": false
      }
    ],
    "certimail": null,
    "fisico": null,
    "autoNotificado": "11/07/2018"
  }
}
