const fechas = [
  '2024-03-30T05:00:16.000Z',
  '2018-01-16T05:00:16.000Z',
  '19/02/2018',
  '2026-11-28T05:00:16.000Z',
  '2017-05-11T05:00:16.000Z',
  42885,
  '22/0617',
  '22/0617',
  'LOTE',
  '307-63825',
  42978,
  'INMUEBLE',
  '2018-09-05T05:00:16.000Z',
  '2018-09-09T05:00:16.000Z',
  '2017-09-08T05:00:16.000Z',
  43035,
  43144,
  'SI',
  43503,
  43349,
  43354,
  43144,
  'INMUEBLE',
  '50C-1951690    50C-1951751',
  43145,
  '29/05/2018',
  'POSITIVO',
  43719,
  '2021-02-25T05:00:16.000Z',
  '2017-09-13T05:00:16.000Z',
  '2017-09-18T05:00:16.000Z',
  43371,
  43133,
  43133,
  'VEHCICULO',
  'ZXV022',
  '09/20/2018',
  '09/2018',
  '2019-04-04T05:00:16.000Z',
  '2022-11-15T05:00:16.000Z',
  '2017-05-11T05:00:16.000Z',
  42885,
  'CASA',
  '50C1543292',
  'CASA 255 CONJUNTO RESIDENCIAL SABANA GRANDE 2 LOTE 3 UBCADO EN LA CALLE 14 No. 108-48 ESCRITURA No. 5252 DEL 17 DE OCTUBRE DE 2012 NOTARÍA 37 DE BOGOTÁ',
  '24/11/17',
  '2018-02-02T05:00:16.000Z',
  '1934-02-14T05:00:16.000Z',
  '2017-05-11T05:00:16.000Z',
  42891,
  43013,
  43013,
  'LOTE',
  '160-40158',
  43382,
  '2019-01-31T05:00:16.000Z',
  '2008-09-05T05:00:16.000Z',
  '2017-05-11T05:00:16.000Z',
  42885,
  '2017-09-11T05:00:16.000Z',
  '2020-04-26T05:00:16.000Z',
  '2017-05-11T05:00:16.000Z',
  42879,
  '2017-09-11T05:00:16.000Z',
  '2020-04-20T05:00:16.000Z',
  '2017-05-11T05:00:16.000Z',
  42879,
  '2017-09-11T05:00:16.000Z',
  '18/02//2021',
  '2017-09-19T05:00:16.000Z',
  43003,
  43028,
  43118,
  43028,
  'VEHICULO',
  'IMT-138',
  43251,
  'POSITIVO',
  43251,
  'SERVICIOS INTEGRADOS AUTOMOTRIZ TEL: 3133936806',
  43150,
  'SE PRESENTA CORRECCION',
  3371000,
  43167,
  '2019-05-30T05:00:16.000Z',
  '2020-04-26T05:00:16.000Z',
  '2017-05-11T05:00:16.000Z',
  42879,
  'VEHICULO',
  'MPN-672',
  'AUTOMOVIL MARCA KIA MODELO 2013 COLOR PLATA SERVICIO PARTICULAR LINEA PICANTO EX',
  '30/05/18',
  '2018-06-18T05:00:16.000Z',
  '2017-08-28T05:00:16.000Z',
  '2017-06-07T05:00:16.000Z',
  '2018-09-05T05:00:16.000Z',
  '2026-07-05T05:00:16.000Z',
  '2017-05-11T05:00:16.000Z',
  42885,
  42996,
  'PERSONAL',
  42996,
  'APARTAMENTO',
  '156-98553',
  43003,
  'POSITIVO',
  '/',
  '22/08/2018 APELACION',
  '2019-11-19T05:00:16.000Z',
  '2018-07-03T05:00:16.000Z',
  '2017-05-11T05:00:16.000Z',
  42886,
  39235,
  'SIN GARANTIA',
  '25/19/2017',
  '2023-03-05T05:00:16.000Z',
  '2017-09-19T05:00:16.000Z',
  43005,
  '2017-11-08T05:00:16.000Z',
  '2017-05-11T05:00:16.000Z',
  42879,
  42887,
  42887,
  'VEHICULO',
  'HHP-982',
  43006,
  43195,
  '22/05/2018',
  '2019-11-28T05:00:16.000Z',
  '2020-05-04T05:00:16.000Z',
  '2017-05-11T05:00:16.000Z',
  '2017-05-24T05:00:16.000Z',
  '2017-06-02T05:00:16.000Z',
  '2018-07-11T05:00:16.000Z',
  '2018-07-11T05:00:16.000Z',
  '2018-07-11T05:00:16.000Z',
  'BOGOTA',
  '2017-09-28T05:00:16.000Z',
  '2018-05-31T05:00:16.000Z',
  ' ',
  '2010-03-20T05:00:16.000Z',
  43315,
  'PENDIENTE',
  '2025-09-07T05:00:16.000Z',
  '2017-05-11T05:00:16.000Z',
  42885,
  42969,
  42969,
  'CASA',
  '051-117941',
  '05/04/18',
  '2018-07-13T05:00:16.000Z',
  '2017-04-27T05:00:16.000Z',
  '2017-05-11T05:00:16.000Z',
  42885,
  42926,
  'PERSONAL',
  42926,
  'VEHICULO',
  'UBZ-580',
  43251,
  'POSITIVO',
  '   ',
  '3/12/18',
  '2019-01-17T05:00:16.000Z',
  '2022-12-06T05:00:16.000Z',
  '2017-09-19T05:00:16.000Z',
  '25/09/2017',
  '22/05/18',
  '26/06/18',
  '2018-09-15T05:00:16.000Z',
  '2020-04-25T05:00:16.000Z',
  '2017-05-11T05:00:16.000Z',
  42879,
  42895,
  42895,
  'VEHICULO',
  'IPR-993',
  'AUTOMOVIL MARCA KIA LINEA SERATO PROEX SERVICIO PARTICULAR MODELO 2017 COLOR PLATA MOTOR G4GGH611514',
  '2017-10-13T05:00:16.000Z',
  null,
  42941,
  42941,
  'BANCOS',
  42948,
  43250,
  43250,
  42941,
  'BANCOS',
  'FEB 2018',
  '2021-06-09T05:00:16.000Z',
  '2020-04-26T05:00:16.000Z',
  '2017-05-11T05:00:16.000Z',
  '2017-05-24T05:00:16.000Z',
  '2017-07-21T05:00:16.000Z',
  '2018-07-19T05:00:16.000Z',
  '2018-07-19T05:00:16.000Z',
  '2018-08-08T05:00:16.000Z',
  '2018-08-08T05:00:16.000Z',
  '2018-05-30T05:00:16.000Z',
  '2017-08-01T05:00:16.000Z',
  '2017-06-01T05:00:16.000Z',
  42898,
  '2017-08-01T05:00:16.000Z',
  '2017-04-26T05:00:16.000Z',
  '2017-05-19T05:00:16.000Z',
  42885,
  42942,
  42942,
  'VEHICULO',
  'GRH-581 GIRARDOT',
  42996,
  'SEP 2017',
  'POSITIVO',
  '24/11/2017',
  43146,
  43299,
  3000000,
  '2019-06-06T05:00:16.000Z',
  '20/10/2016 - 05/08/16',
  '2017-05-19T05:00:16.000Z',
  42921,
  42921,
  42921,
  'INMUEBLE ',
  '160-43922',
  '2018-02-08T05:00:16.000Z',
  '2020-05-10T05:00:16.000Z',
  '2017-05-19T05:00:16.000Z',
  '2017-05-30T05:00:16.000Z',
  '2017-08-14T05:00:16.000Z',
  '17/07/2018',
  '17/07/2018',
  '2019-08-21T05:00:16.000Z',
  '2017-08-14T05:00:16.000Z',
  '2017-08-22T05:00:16.000Z',
  '01/02/2018',
  '09/03/2018',
  '2024-03-03T05:00:16.000Z',
  '2017-05-19T05:00:16.000Z',
  42885,
  42927,
  42927,
  'APARTAMENTO',
  '50C1739005',
  '-',
  43271,
  '2018-11-29T05:00:16.000Z',
  '2017-04-11T05:00:16.000Z',
  '2017-05-19T05:00:16.000Z',
  'CENTRO DE CONCILIACION',
  '2017-05-31T05:00:16.000Z',
  '2017-07-19T05:00:16.000Z',
  'POSITIVO',
  '29/08/2017',
  'FINCA',
  'FINCA DENOMINADA VENECIA VEREDA ACUAPAL MUNICIPIO DE GUADUAS',
  '2017-08-10T05:00:16.000Z',
  '-',
  'POSITIVO',
  '2018-08-30T05:00:16.000Z',
  '06/07/2018',
  4830405,
  '4/02/2021 CANCELADA POR LA JUEZ DILIGENCIA DE REMATE- POSIBLE FRAUDE PROCESAL PUES EL DEUDOR ES COMERCIANTE CON ESTABLECIMIENTO DE COMERCIO RADICADO EN CAMARA DE COMERCIO DE FACATATIVA, RESIDE EN GUADUAS (CUNDINAMARCA) Y RELACIONA EN PROCESO DE INSOLVENCIA OBLIGACIÓN MENOR AL VALOR ADEUDADO A FINAGRO Y CON FALSEDADES DOCUMENTALES',
  '2021-06-02T05:00:16.000Z',
  '2025-09-03T05:00:16.000Z',
  '2017-05-30T05:00:16.000Z',
  42894,
  42914,
  42914,
  'APARTAMENTO',
  15731010,
  'APTO 301 EDIFICIO ADRIANA  FOLIIO MATR15731010',
  '2017-09-25T05:00:16.000Z',
  '2029-12-05T05:00:16.000Z',
  '2017-09-19T05:00:16.000Z',
  43004,
  '21/03/18',
  '2018-05-09T05:00:16.000Z',
  '2031-12-02T05:00:16.000Z',
  '2017-09-18T05:00:16.000Z',
  43018,
  43018,
  'INMUEBLE',
  '50N-20626041',
  43303,
  '27/10/2017',
  '15/08/2018',
  '10/09/2018',
  '17/01/2019',
  '1936-12-09T05:00:16.000Z',
  '2017-05-30T05:00:16.000Z',
  42895,
  43125,
  43125,
  '090',
  '50s 40665575',
  '051-168638',
  'APARTAMENTO 201 DE LA TORRE 3 CONJUNTO RESIDENCIA SAUCE ii UBICADO EN LA TRANSVERSAL 40 No. 14-11  SOACHA',
  '2018-05-09T05:00:16.000Z',
  '2028-08-01T05:00:16.000Z',
  '2018-05-30T05:00:16.000Z',
  '8/06/2017 // 12/04/2018',
  '2017-07-28T05:00:16.000Z',
  '2018-06-07T05:00:16.000Z',
  '2017-07-28T05:00:16.000Z',
  '2017-08-08T05:00:16.000Z',
  'MAYO 2018',
  'ALCALDIA',
  '2018-07-05T05:00:16.000Z',
  '2018-08-08T05:00:16.000Z',
  '2020-03-03T05:00:16.000Z',
  '2017-05-30T05:00:16.000Z',
  42895,
  42901,
  42901,
  '2/05/18',
  '2018-05-16T05:00:16.000Z',
  '2036-04-26T05:00:16.000Z',
  '2017-06-06T05:00:16.000Z',
  42894,
  42907,
  42907,
  '1292',
  '25/09/17',
  '2016-09-16T05:00:16.000Z',
  '2017-05-19T05:00:16.000Z',
  '2017-05-30T05:00:16.000Z',
  '2017-06-30T05:00:16.000Z',
  '19/12/2017',
  '2017-06-30T05:00:16.000Z',
  'SEP 2017',
  'BANCOS',
  '2018-02-09T05:00:16.000Z',
  '2018-06-08T05:00:16.000Z',
  '2018-06-27T05:00:16.000Z',
  '2017-09-15T05:00:16.000Z',
  '2017-06-06T05:00:16.000Z',
  42900,
  42914,
  42914,
  'CASA',
  '50S40387803',
  'CORRECCION OFICIOS',
  '2019-03-19T05:00:16.000Z',
  '2020-05-26T05:00:16.000Z',
  '2017-06-06T05:00:16.000Z',
  '09/06/2017//27/07/17',
  42958,
  42958,
  'VEHÍCULO',
  'VWE-94D',
  '19/04/2018',
  '29/05/2018',
  43209,
  '23/10/2018',
  '25/10/18',
  '2019-02-21T05:00:16.000Z',
  '2020-03-19T05:00:16.000Z',
  '2017-06-06T05:00:16.000Z',
  42901,
  '23/032018',
  '23/032018',
  '19/01/2018',
  43119,
  43278,
  0.03,
  '24/09/2018',
  '02/10/2018',
  '2019-02-06T05:00:16.000Z',
  '2017-06-07T05:00:16.000Z',
  42899,
  42927,
  42927,
  'BANCOS / ESTABLECIMIENTO',
  'CTA IBAGUE',
  'POSITIVO',
  43122,
  43256,
  '2021-03-09T05:00:16.000Z',
  '2021-07-22T05:00:16.000Z',
  '2017-06-07T05:00:16.000Z',
  42899,
  42950,
  42950,
  'BANCOS',
  'U',
  '17/10/2017',
  '20/10/2017',
  '2017-10-20T05:00:16.000Z',
  '2020-01-02T05:00:16.000Z',
  '2017-06-08T05:00:16.000Z',
  '11/08/147',
  42977,
  42977,
  'APARTAMENTO ',
  '50C-1929560',
  '06/05/18',
  '04/08/18',
  '2017-05-19T05:00:16.000Z',
  '2017-05-31T05:00:16.000Z',
  '2017-07-28T05:00:16.000Z',
  '2018-03-01T05:00:16.000Z',
  'FEB 2018',
  '2018-03-21T05:00:16.000Z',
  '2024-11-18T05:00:16.000Z',
  '2017-06-12T05:00:16.000Z',
  42909,
  42971,
  42971,
  'PARTAMENTO',
  '50C-1738919',
  '5/04/19',
  '13/04/19',
  '14/0572019',
  '2024-11-18T05:00:16.000Z',
  '2017-06-12T05:00:16.000Z',
  42958,
  43003,
  43324,
  43339,
  43003,
  'PARTAMENTO',
  '50C-1738919',
  43286,
  '30/07/2018',
  '17/01/19',
  '2019-07-23T05:00:16.000Z',
  '2020-02-02T05:00:16.000Z',
  '2017-06-12T05:00:16.000Z',
  42900,
  42922,
  42922,
  'BANCOS',
  '/',
  '10/07/2017',
  'SEP 2017',
  'NEGATIVAS',
  43039,
  43445,
  904346,
  43038,
  '2019-10-07T05:00:16.000Z',
  '18/04/20//04/05/20',
  '2017-05-19T05:00:16.000Z',
  '2017-05-30T05:00:16.000Z',
  '2017-06-21T05:00:16.000Z',
  '2019-07-18T05:00:16.000Z',
  '2019-07-29T05:00:16.000Z',
  '30/0772019',
  '2019-08-01T05:00:16.000Z',
  '2019-08-02T05:00:16.000Z',
  '2017-06-21T05:00:16.000Z',
  'BOGOTA',
  'OFICIOS PERDIDOS',
  '     ',
  '2019-09-22T05:00:16.000Z',
  '2017-06-12T05:00:16.000Z',
  '2017-06-20T05:00:16.000Z',
  '2017-07-12T05:00:16.000Z',
  '2018-04-18T05:00:16.000Z',
  '12/07/217',
  '2017-07-26T05:00:16.000Z',
  '26/07/2017',
  'SEP 2017 // 17/10',
  '2018-04-26T05:00:16.000Z',
  '2018-06-27T05:00:16.000Z',
  '2018-07-19T05:00:16.000Z',
  '2017-09-12T05:00:16.000Z',
  '2017-09-18T05:00:16.000Z',
  'TERMINO ERRADAMENTE POR PAGO TOTAL',
  43004,
  43025,
  'POSITIVO',
  43206,
  43244,
  '25/10/2017',
  'VEHICULO',
  'VEHICULO',
  '/',
  '22/01/2018',
  'POSITIVO',
  43231,
  43290,
  1250000,
  '06',
  '22/01/19',
  '12/12/18',
  '2021-04-13T05:00:16.000Z',
  '2027-03-02T05:00:16.000Z',
  '2017-06-12T05:00:16.000Z',
  42906,
  'APARTAMENTO',
  '50S-40582624',
  'CARRERA 77 No. 57-H39 SUR//CARRERA 11B No. 12-68 SUR BOGOTA// TRANSVERSAL 31 No. 28-31 Apto 103 bloque 7',
  '23/11/17',
  '2019-06-01T05:00:16.000Z',
  '2017-06-12T05:00:16.000Z',
  '16/06/2017 // 08/06/2018',
  43346,
  '3/10/18',
  '8/10/18',
  '2018-10-08T05:00:16.000Z',
  '2017-02-21T05:00:16.000Z',
  '2017-06-12T05:00:16.000Z',
  42909,
  '11/09/17',
  '2031-01-18T05:00:16.000Z',
  '2017-06-12T05:00:16.000Z',
  42908,
  42915,
  42915,
  '1086',
  'APARTAMENTO',
  '176-128883',
  'CARRERA 7 No. 25-51 BQ/ TO 9 APTO 104 PARQUE RESIDENCIAL VILLAZO ZIPAQUIRA',
  '2017-11-23T05:00:16.000Z',
  '2025-09-01T05:00:16.000Z',
  '2017-06-12T05:00:16.000Z',
  42907,
  42947,
  '31/07/2017',
  '4625',
  'APARTAMENTO',
  '50C-570040',
  'calle 64 no. 85-60 INTERIOR 1 LOTE 19 MANZANA 36 URBANIZACION LA ISABELA  ETAPA IIcalle 64 I No. 86-60 ',
  '18/05/18',
  '18/06/18',
  '2022-04-02T05:00:16.000Z',
  '2017-06-12T05:00:16.000Z',
  42907,
  42972,
  42972,
  '3396',
  'APARTAMENTO',
  '50S-40475831',
  'CARRERA 87D No. 48-03 SUR//DIAGONAL 49 No. 85-79 SUR TORRE 10 APARTAMENTO 2',
  '2018-04-27T05:00:16.000Z',
  '2018-03-06T05:00:16.000Z',
  '2017-06-12T05:00:16.000Z',
  42906,
  43075,
  43075,
  'BANCOS ',
  43341,
  506000,
  43353,
  '2019-01-31T05:00:16.000Z',
  '2022-10-19T05:00:16.000Z',
  '2017-06-12T05:00:16.000Z',
  'EJECUCIÓN',
  42908,
  43308,
  'CASA',
  'DIAGONAL 62 C No. 19-C-12 ACACIA SAN',
  'POSITIVO',
  '2021-06-08T05:00:16.000Z',
  '2017-06-12T05:00:16.000Z',
  42901,
  '2017-09-11T05:00:16.000Z',
  '2017-06-08T05:00:16.000Z',
  '2017-06-13T05:00:16.000Z',
  '2017-07-25T05:00:16.000Z',
  '30/05/2018',
  '30/05/2018',
  '2018-07-16T05:00:16.000Z',
  '2017-07-25T05:00:16.000Z',
  '2017-08-01T05:00:16.000Z',
  '01/08/2017',
  'SEP 2017',
  '2018-07-16T05:00:16.000Z',
  '2018-07-24T05:00:16.000Z',
  '2018-08-16T05:00:16.000Z',
  '2017-10-04T05:00:16.000Z',
  '2017-09-19T05:00:16.000Z',
  43004,
  '2017-10-14T05:00:16.000Z',
  '12438741',
  'CUNDINAMARCA',
  42996,
  '9/04/2018',
  'CERTIMAIL',
  'VEHICULO',
  'URU-159',
  'AUTOMOVIL PARTICULAR',
  '27/11/2017',
  'POSITIVO CORRIGE JUZGADO',
  43280,
  43294,
  '2019-09-27T05:00:16.000Z',
  '2017-11-04T05:00:16.000Z',
  '2017-06-12T05:00:16.000Z',
  42902,
  42935,
  42935,
  'VEHICULO',
  'UBV-649',
  '24/08/2017',
  '05/04/2018',
  '30/05/2018',
  '21/08/2018',
  '03/09/2018',
  '2019-02-07T05:00:16.000Z',
  '2022-01-31T05:00:16.000Z',
  '2017-06-12T05:00:16.000Z',
  42907,
  43180,
  '06/07/2018',
  '06/07/2018',
  43180,
  'APARTAMENTO',
  '50S-40463408',
  43196,
  '14/06/2018',
  'POSITIVO',
  '16/08/2018',
  43328,
  '2020-01-16T05:00:16.000Z',
  '2021-11-18T05:00:16.000Z',
  '2017-09-06T05:00:16.000Z',
  42997,
  43084,
  43084,
  'INMUEBLE',
  '50S-40582863',
  43115,
  '02/04/2018',
  '05/09/2018',
  43348,
  '27/09/2018',
  '2020-01-16T05:00:16.000Z',
  '2017-10-22T05:00:16.000Z',
  '2017-06-12T05:00:16.000Z',
  'PROCESO DE REESTRUCTURACION SUPER SOCIEDADES',
  '2017-06-15T05:00:16.000Z',
  '2017-06-30T05:00:16.000Z',
  '26/07/2018',
  'SUPER SOCIEDADES',
  '2017-07-17T05:00:16.000Z',
  'VEHICULO',
  'RENAULT,MODELO 2015',
  '24/08/2017',
  '2021-03-10T05:00:16.000Z',
  '2019-12-19T05:00:16.000Z',
  '2017-06-12T05:00:16.000Z',
  'EJECUCIÓN',
  42901,
  42961,
  'NO',
  'POSITIVO',
  '3/04/2018',
  42972,
  'VEHICULO',
  '28/09/2017',
  'POSITIVO',
  '27/07/20018',
  3014000,
  'PENDIENTE DE RETIRAR OFICIO DE MOVILIDAD FUSAGASDUGA ACLARA MEDIDA DE EMBARGO',
  '2020-10-06T05:00:16.000Z',
  '2018-10-08T05:00:16.000Z',
  '2017-06-12T05:00:16.000Z',
  42937,
  42943,
  42943,
  '1944',
  'VEHICULO',
  'RKR-221',
  '01/02/18',
  '15/02/18',
  '2018-06-23T05:00:16.000Z',
  '2017-06-12T05:00:16.000Z',
  'SENTENCIA',
  42906,
  42970,
  '05/03/2018',
  'OK',
  42991,
  'VEHICULO',
  'VEHICULO',
  '30/11/2017',
  '09/05/2018',
  'POSITIVO',
  6000000,
  43362,
  '2019-06-11T05:00:16.000Z',
  '2031-01-18T05:00:16.000Z',
  '2017-06-12T05:00:16.000Z',
  42908,
  42929,
  42929,
  'APARTAMENTO',
  '176-128883',
  'CARRERA 7 No. 25-51 BQ/ TO 9 APTO 104 PARQUE RESIDENCIAL VILLAZO ZIPAQUIRA',
  '2017-11-23T05:00:16.000Z',
  '2019-08-12T05:00:16.000Z',
  '2017-06-08T05:00:16.000Z',
  '13/06/2017//21/07/17',
  '2017-07-27T05:00:16.000Z',
  'OK',
  '2017-07-27T05:00:16.000Z',
  '2017-08-04T05:00:16.000Z',
  '28/09/2017',
  '2018-06-06T05:00:16.000Z',
  '2019-01-15T05:00:16.000Z',
  '2017-06-07T05:00:16.000Z',
  '2017-06-12T05:00:16.000Z',
  'SENTENCIA',
  42900,
  42964,
  'SI',
  'POSITIVO',
  43476,
  43483,
  'POSITIVO',
  43483,
  42993,
  'VEHICULO',
  'VEHICULO',
  '22/01*2018',
  '22/01/2018',
  'POSITIVO',
  '8/07/2021',
  '2017-06-07T05:00:16.000Z',
  '2017-06-12T05:00:16.000Z',
  'NOTIFICACION',
  42906,
  43069,
  '09/07/2018',
  '13/09/2018 SOL EPS',
  43081,
  'VEHICULO',
  'VEHICULO',
  '12/12/2017',
  '12/03/2018',
  'POSITIVO',
  '2019-05-15T05:00:16.000Z',
  '2017-06-07T05:00:16.000Z',
  '2017-09-12T05:00:16.000Z',
  42902,
  43083,
  43083,
  'VEHICULO',
  'UCP-316',
  43237,
  1100000,
  43251,
  'OK',
  'OK',
  '2018-08-30T05:00:16.000Z',
  '2018-08-27T05:00:16.000Z',
  '2017-06-12T05:00:16.000Z',
  'EJECUCIÓN',
  '2017-06-14T05:00:16.000Z',
  '2017-07-17T05:00:16.000Z',
  'NO',
  'POSITIVO',
  '2018-06-12T05:00:16.000Z',
  'POSITIVO',
  '2018-04-12T05:00:16.000Z',
  '2017-07-25T05:00:16.000Z',
  'VEHICULO',
  'VEHICULO',
  '24/08/2017',
  '11/05/2018',
  'POSITIVO',
  '2018-08-22T05:00:16.000Z',
  3900000,
  ' 25 NOV 2022 SE SOLICITA NUEVAMENTE ACTUALIZACION DE LIQUIDACION DE CREDITO // 9 DIC 2022 SE SENVIA MEMORIAL SOLICITUD DE APREHENSIÓN DEL VEHICULO PARA SIJIN // 10 DE ENERO 2023 SE ENVIA LIQUIDACION DE CREDITO APORTA POR REINTEGRA // LLEGA REPORTE DE PARQUEADERO VEHICULO APREHENDIDO, SE DEBE 23 MILLONES /// 18 ABRIL 2023 NIEGA LIQUIDACION CREDITO // 26 ABRIL 2023 APOIDERADA SONIA MAZUERA SE HACE PATE DEL PROCESO // 18 MAYO 2023 JUZGADO REQUIERE ACREDITE PODER ABOGADA DEMANDADA // SE ENVIA PAZ Y SALVO A COMPAÑIA Q LO COMPRO POR CONCEPTO DE HONORARIOS// 30 MAYO 2023 SE ENVIA RENUNCIA PODER Y COPIA PAZ Y SALVO A JUZGADO CORRESPONDIENTE // 8  JUNIO 2023 ACEPTA RENUNCIA CCR, RECONOCE PODER APODERADA SONIA MAZUERA',
  '2023-05-30T05:00:16.000Z',
  '2017-06-07T05:00:16.000Z',
  '2017-06-12T05:00:16.000Z',
  42901,
  42941,
  42941,
  'VEHICULO',
  'HBQ-043',
  '24/08/2017',
  '08/2017',
  'POSITIVO',
  '2020-02-10T05:00:16.000Z',
  'CALLE 8 C No. 92-72 casa 20 conjunto residencial ciudad tital ph',
  42907,
  '06/07/2017//13/07/17',
  'CASA',
  'CALLE 8 C No. 92-72 casa 20 conjunto residencial ciudad tital ph',
  43379,
  43294,
  43300,
  '2019-04-04T05:00:16.000Z',
  '2019-07-21T05:00:16.000Z',
  '2017-06-12T05:00:16.000Z',
  'EJECUCIÓN',
  42907,
  42933,
  42963,
  42912,
  'PREDIO RURAL',
  'RETENCION DINEROS',
  '06/2017',
  '08/2017',
  'EN OFICIO',
  43299,
  1000000,
  'RETIRAR OFICIO PARA RADICAR EMBARGO DE INMUEBLE DE ADELMO ABRIL FORERO',
  '2021-04-29T05:00:16.000Z',
  '2027-10-24T05:00:16.000Z',
  '2017-06-12T05:00:16.000Z',
  'EJECUCIÓN',
  42958,
  43007,
  43378,
  43014,
  'INMUEBLE',
  'CARREA 2  No. 15-90 SUR APARTAMENTO 202 TORRE 22 AGRUPACION DE VIVIENDA BARICHARA',
  '2021-11-12T05:00:16.000Z',
  '05/07/2016 // 16/04/16',
  '2017-06-12T05:00:16.000Z',
  42906,
  '16/12/17',
  '2020-08-04T05:00:16.000Z',
  '2017-06-12T05:00:16.000Z',
  'EJECUCIÓN',
  42902,
  42956,
  'SI',
  'POSITIVO',
  43027,
  43017,
  'BANCOS',
  'RESPUESTA CUENTA EN DAVIVIENDA // NUEVOS OFIOS RADICADOS EN EXPERIAN',
  '03086',
  '22/11/2017',
  'NEGATIVAS',
  43264,
  1275000,
  'SOLICITAR AL JUEZ DATOS DEL EMPLEADOR PARA EMBARGO DE SALARIOS',
  '2021-11-26T05:00:16.000Z',
  '2019-09-01T05:00:16.000Z',
  '2017-06-12T05:00:16.000Z',
  'EJECUCIÓN',
  42908,
  42915,
  'SI',
  'POSITIVO',
  '18/01/2018',
  'POSITIVO',
  43119,
  42927,
  'BANCOS INMUEBLE ',
  'EMBARGO DE REMANTES',
  43265,
  'SOLICITUD EMBARGO SALARIOS COMO ALCALDE DE TOCANCIPA PENDIENTE PODER DE REINTEGRA S.A.S.',
  '2021-01-21T05:00:16.000Z',
  '2018-10-26T05:00:16.000Z',
  '12/062017',
  'EJECUCIÓN',
  42907,
  42907,
  'SI',
  'POSITIVO',
  43357,
  'POSITIVO',
  43293,
  42949,
  'INMUEBLE',
  'BANCOS',
  '02/08/2017',
  '14/09/2017',
  'POSITIVO',
  'ESTADO DEL DESPACHO COMISORIO PARA ESTA ACTUACIÓN /// ENVIO DE COPIA A LA DEUDORA',
  '2021-08-24T05:00:16.000Z',
  '2018-08-27T05:00:16.000Z',
  '2017-06-12T05:00:16.000Z',
  42906,
  '25/09/17',
  '2017-09-20T05:00:16.000Z',
  ' 22/09/2017',
  'EL 4 DE ABRIL DE 2019 SE DEVOLVIERON GARANTIAS A AECSA S.A. // EL 27/03/2019 SE RADICO EN EL SIM OFICIO DE LEVANTAMIENTO DE MEDIDA CAUTELAR DE EMBARGO SOBRE VEHICULO // EL 26 DE ABRIL DE 2019 SE ARCHIVO EL PROCESO EN LA CAJA 631 EL 19 DE MARZO 2019',
  '2019-02-22T05:00:16.000Z',
  '2019-11-05T05:00:16.000Z',
  '2017-06-12T05:00:16.000Z',
  '2017-06-14T05:00:16.000Z',
  '2017-06-22T05:00:16.000Z',
  '2017-06-22T05:00:16.000Z',
  '2017-06-22T05:00:16.000Z',
  '2017-08-03T05:00:16.000Z',
  '-',
  '-',
  '31/102017',
  '2018-06-08T05:00:16.000Z',
  '2018-06-26T05:00:16.000Z',
  '2020-04-10T05:00:16.000Z',
  '2017-06-12T05:00:16.000Z',
  42906,
  42926,
  42926,
  '11/01/2019',
  '10/5/19',
  '2019-05-10T05:00:16.000Z',
  '2018-11-11T05:00:16.000Z',
  '2017-06-12T05:00:16.000Z',
  '2017-06-14T05:00:16.000Z',
  '2017-09-06T05:00:16.000Z',
  'OK',
  '2017-09-06T05:00:16.000Z',
  '2017-09-14T05:00:16.000Z',
  'FEB 2018',
  'BANCOS',
  '2018-04-30T05:00:16.000Z',
  '2018-06-26T05:00:16.000Z',
  '2018-08-15T05:00:16.000Z',
  '2018-04-20T05:00:16.000Z',
  '2017-06-12T05:00:16.000Z',
  42906,
  42943,
  42943,
  'BANCOS',
  'BACNOS',
  '24/08/2017',
  'SEP 2017',
  '12/07/2018',
  '13/07/2018',
  '03/08/2018',
  '2019-02-06T05:00:16.000Z',
  '2018-07-01T05:00:16.000Z',
  42906,
  42914,
  42914,
  '1369',
  'VEHICULO',
  'HZP-730',
  'AUTOMOVIL MARCA HYNDAI LINEA ACCENT GL MODELO 2016 COLOR BLANCO CRISTAL ',
  '23/11/17',
  '2017-06-09T05:00:16.000Z',
  '2017-06-12T05:00:16.000Z',
  '21/07/2017 // 18/09/2017',
  '2017-10-17T05:00:16.000Z',
  '2020-06-09T05:00:16.000Z',
  '2019-01-01T05:00:16.000Z',
  '2017-06-20T05:00:16.000Z',
  '2017-07-10T05:00:16.000Z',
  '2018-12-02T05:00:16.000Z',
  '2018-07-18T05:00:16.000Z',
  '2018-07-18T05:00:16.000Z',
  '2019-01-25T05:00:16.000Z',
  '2017-07-10T05:00:16.000Z',
  '2017-07-17T05:00:16.000Z',
  '2017-08-24T05:00:16.000Z',
  '2018-08-24T05:00:16.000Z',
  '2019-04-11T05:00:16.000Z',
  '2018-04-05T05:00:16.000Z',
  '11001400301420180040600',
  '2023-06-22T05:00:16.000Z',
  '9/06/2020',
  '2017-06-12T05:00:16.000Z',
  'EJECUCIÓN',
  42906,
  42916,
  'SI',
  'POSITIVO',
  43042,
  'POSITIVO',
  43013,
  42937,
  'VEHICULO',
  'VEHICULO',
  '24/08/2017',
  '08/2017',
  'POSITIVO',
  '1,5000,000',
  'REGISTRAR PODER DE REINTEGRA ASUME /// PENDIENTE PODER DE APODERADA MHSG',
  '2019-09-03T05:00:16.000Z',
  '2031-08-06T05:00:16.000Z',
  '2017-06-28T05:00:16.000Z',
  42906,
  43013,
  43013,
  'INMUEBLE',
  '176-128285',
  '11/07/2018',
  '21/08/2018',
  '17/10/2018',
  '2034-10-09T05:00:16.000Z',
  '2017-06-28T05:00:16.000Z',
  42915,
  ' ',
  42934,
  '1721',
  '16/12/17',
  '2017-06-13T05:00:16.000Z',
  '2017-06-28T05:00:16.000Z',
  42915,
  42926,
  42926,
  'VEHICULO',
  'MWY-129',
  '18/09/2018',
  '26/09/2018',
  '2019-02-07T05:00:16.000Z',
  '2033-01-30T05:00:16.000Z',
  '2017-06-28T05:00:16.000Z',
  42915,
  '2017-09-25T05:00:16.000Z',
  '2017-09-20T05:00:16.000Z',
  43112,
  43112,
  'INMUEBLE',
  '50S-32037',
  '23/05/2018',
  43248,
  '2019-02-18T05:00:16.000Z',
  '2030-01-25T05:00:16.000Z',
  '2017-06-28T05:00:16.000Z',
  42915,
  42986,
  42986,
  'INMUEBLE',
  '50N-20655101  50N 20654761',
  '13/04/18',
  '8/08/18',
  '11/05/2018',
  '2018-07-28T05:00:16.000Z',
  '13/062017',
  '2017-06-28T05:00:16.000Z',
  ' 08/08/17',
  43124,
  43124,
  'VEHICULO',
  'UCO-687',
  '15/05/18',
  '20/06/018',
  '24/08/18',
  '2017-06-13T05:00:16.000Z',
  '2017-06-28T05:00:16.000Z',
  42915,
  42941,
  42941,
  'J2017-673',
  'VEHICULO',
  'DGS-877',
  '07/02/18',
  '16/02/18',
  '16/03/18',
  '2017-06-13T05:00:16.000Z',
  '2017-06-28T05:00:16.000Z',
  42915,
  42950,
  42950,
  '2436',
  'VEHICULO',
  'HBY-767',
  '16/04/18',
  '04/05/18',
  '2018-06-01T05:00:16.000Z',
  '2019-07-05T05:00:16.000Z',
  '2017-06-12T05:00:16.000Z',
  '15/06/2017 // 29/08/2017',
  '2017-11-07T05:00:16.000Z',
  '2018-05-17T05:00:16.000Z',
  '2018-05-17T05:00:16.000Z',
  '2018-07-17T05:00:16.000Z',
  '2017-11-07T05:00:16.000Z',
  '2017-11-15T05:00:16.000Z',
  '2024-02-02T05:00:16.000Z',
  '2018-09-04T05:00:16.000Z',
  '2018-11-26T05:00:16.000Z',
  '2019-05-13T05:00:16.000Z',
  '2017-06-12T05:00:16.000Z',
  '2017-06-16T05:00:16.000Z',
  '2017-07-17T05:00:16.000Z',
  '2018-02-05T05:00:16.000Z',
  'SOLICITUD EPS',
  42933,
  '2017-07-27T05:00:16.000Z',
  '2015-08-28T05:00:16.000Z',
  '2017-07-19T05:00:16.000Z',
  42937,
  42943,
  42943,
  '1415/1416',
  'INMUEBLE Y BCOS',
  '50C-1756731',
  'P/NAL',
  200000,
  43055,
  'pago cuotas',
  '12/02/18',
  '2018-05-09T05:00:16.000Z',
  '2020-04-27T05:00:16.000Z',
  '2017-07-19T05:00:16.000Z',
  'ADMISION',
  42937,
  42961,
  42986,
  'BANCOS',
  '2018-04-20T05:00:16.000Z',
  '2018-08-28T05:00:16.000Z',
  '2017-06-12T05:00:16.000Z',
  '2017-06-16T05:00:16.000Z',
  '2017-07-19T05:00:16.000Z',
  '2017-08-12T05:00:16.000Z',
  '2017-08-12T05:00:16.000Z',
  '2017-08-28T05:00:16.000Z',
  '2018-02-14T05:00:16.000Z',
  '2018-05-15T05:00:16.000Z',
  '2017-07-19T05:00:16.000Z',
  '2017-08-03T05:00:16.000Z',
  '24/082017',
  '24/08/2017',
  '22/06/2018',
  'SIJIN',
  'A LA ESPERA',
  '2018-05-15T05:00:16.000Z',
  '2018-08-02T05:00:16.000Z',
  '2018-08-22T05:00:16.000Z',
  '2016-01-29T05:00:16.000Z',
  '2017-08-01T05:00:16.000Z',
  42955,
  42977,
  42977,
  'INMUEBLE',
  '50S-40272935',
  43346,
  43348,
  '2019-01-31T05:00:16.000Z',
  '2020-06-07T05:00:16.000Z',
  '2017-06-12T05:00:16.000Z',
  '2017-06-20T05:00:16.000Z',
  '2017-10-23T05:00:16.000Z',
  '11/05/2018',
  '11/05/2018',
  '11/05/2018',
  '2017-10-23T05:00:16.000Z',
  '2017-10-31T05:00:16.000Z',
  '27/11/2017',
  '21/05/2018',
  '06/04/2018',
  '2018-07-25T05:00:16.000Z',
  '2018-08-09T05:00:16.000Z',
  '2017-07-26T05:00:16.000Z',
  '2017-08-01T05:00:16.000Z',
  42955,
  43193,
  'CERTIMAIL',
  43193,
  'VEHICULO',
  'IFU-012',
  43346,
  '2019-10-24T05:00:16.000Z',
  '2019-07-18T05:00:16.000Z',
  '2017-06-12T05:00:16.000Z',
  'EJECUCIÓN',
  42906,
  42913,
  'NO',
  'POSITIVO',
  43082,
  'POSITIVO',
  43164,
  'INMUEBLE',
  'PENDIENTE',
  43259,
  839000,
  'VERIFICAR EN EL JUZGADO RESPUESTA DE EMBARGO INMUEBLE DE UN CODEUDOR',
  '2022-05-24T05:00:16.000Z',
  '2017-07-26T05:00:16.000Z',
  '2017-08-01T05:00:16.000Z',
  42955,
  '2017-11-23T05:00:16.000Z',
  '26/07/2020 // 3/07/2020',
  '2017-08-01T05:00:16.000Z',
  'EJECUCIÓN',
  42955,
  43041,
  'SI',
  'POSITIVO',
  43206,
  'POSITIVO',
  43320,
  43059,
  'VEHICULO',
  'VEHICULO',
  43069,
  43203,
  'POSITIVO',
  43339,
  'RADICAR MEMORIAL QUE REMITE COPIA SIMPLE DE LA ESCRITURA SOLICITADA Y CAMARA DE COMERCIO',
  '2021-05-07T05:00:16.000Z',
  '2021-05-16T05:00:16.000Z',
  '2017-08-01T05:00:16.000Z',
  'LIQUIDACION',
  '8/08/2017 // 29/11/2017',
  43073,
  43248,
  43326,
  43116,
  'INMUEBLE',
  'VEHICULO',
  43161,
  '27/04/2018/',
  'POSITIVO',
  43354,
  970000,
  43364,
  '2019-09-10T05:00:16.000Z',
  '2023-11-15T05:00:16.000Z',
  '2017-08-01T05:00:16.000Z',
  42958,
  42971,
  42971,
  '1087',
  '051-31508',
  '01/03/18',
  '23/03/18',
  '21/04/18',
  '2025-06-17T05:00:16.000Z',
  '2017-08-01T05:00:16.000Z',
  42955,
  43123,
  43123,
  'INMUEBLE',
  '051-116091',
  '16/08/20178',
  '04/09/2018',
  '2019-09-02T05:00:16.000Z',
  '2017-07-26T05:00:16.000Z',
  '2017-08-01T05:00:16.000Z',
  42955,
  42992,
  43294,
  43294,
  42992,
  'VEHICULO',
  'HIU-620',
  43006,
  '06/09/2018',
  43363,
  '2018-09-20T05:00:16.000Z',
  '2019-01-21T05:00:16.000Z',
  '2017-06-12T05:00:16.000Z',
  '2017-06-20T05:00:16.000Z',
  '2017-08-30T05:00:16.000Z',
  '2018-05-10T05:00:16.000Z',
  '25/06/2018',
  '25/06/2018',
  '25/06/2018',
  '2017-08-30T05:00:16.000Z',
  '2017-09-08T05:00:16.000Z',
  '08/09/2017',
  '02/2018',
  '2018-08-06T05:00:16.000Z',
  '2018-08-27T05:00:16.000Z',
  '2022-02-02T05:00:16.000Z',
  '2017-08-04T05:00:16.000Z',
  42958,
  '04/12/2017',
  '04/12/2017',
  'INMUEBLE',
  '50N-20308267',
  '600,000 CONDENADOS',
  '12/07/2018',
  '12/07/2018',
  '17/01/2019',
  '2019-05-13T05:00:16.000Z',
  '2017-08-04T05:00:16.000Z',
  42958,
  42997,
  42997,
  'VEHICULO',
  'COD-175',
  43242,
  '30/05/2018',
  '2018-08-03T05:00:16.000Z',
  '2021-04-12T05:00:16.000Z',
  '2017-08-04T05:00:16.000Z',
  '2017-08-11T05:00:16.000Z',
  '2017-09-08T05:00:16.000Z',
  '2017-12-12T05:00:16.000Z',
  '2017-12-12T05:00:16.000Z',
  '2017-12-12T05:00:16.000Z',
  '2018-02-09T05:00:16.000Z',
  '2017-09-08T05:00:16.000Z',
  '2017-09-15T05:00:16.000Z',
  '2018-09-15T05:00:16.000Z',
  '2018-06-01T05:00:16.000Z',
  '2018-02-09T05:00:16.000Z',
  '2018-06-20T05:00:16.000Z',
  '2018-08-01T05:00:16.000Z',
  '2029-12-26T05:00:16.000Z',
  '2017-08-04T05:00:16.000Z',
  42958,
  43236,
  43244,
  43236,
  'INMUEBLE',
  '50C-1744739',
  43243,
  '27/06/2018',
  'POSITIVA',
  43327,
  '14/11/2018',
  43420,
  '2019-02-08T05:00:16.000Z',
  '135435',
  'CUNDINAMARCA',
  42991,
  'ENVIADO 292  24/08',
  'POSITIVO',
  'INMUEBLE',
  '051-92706',
  '2019-10-01T05:00:16.000Z',
  '2419-10-07T05:00:16.000Z',
  'CUNDINAMARCA',
  43011,
  'FISICA',
  'INMUEBLE',
  '50N-2039500',
  '23/08/2018',
  '2020-05-22T05:00:16.000Z',
  '2017-08-09T05:00:16.000Z',
  42963,
  '2017-11-08T05:00:16.000Z',
  '2020-11-27T05:00:16.000Z',
  '2017-06-12T05:00:16.000Z',
  '20/06/2017 // 28/08/2017',
  '2017-09-14T05:00:16.000Z',
  '26/06/2018',
  '26/06/2018',
  '26/06/2018',
  'PENDIENTE',
  '2017-09-14T05:00:16.000Z',
  '2017-09-22T05:00:16.000Z',
  '2017-08-11T05:00:16.000Z',
  'LIQUIDACION',
  42963,
  42971,
  'OK',
  42978,
  'INMUEBLE',
  42978,
  '19/01/2018',
  'NEGATIVO NOTA DEVOLUTIVA',
  '2019-03-27T05:00:16.000Z',
  '26/05/2021 // 26/07/2017',
  '2017-08-01T05:00:16.000Z',
  43035,
  43042,
  43042,
  43054,
  43230,
  43248,
  43355,
  43367,
  '2018-09-24T05:00:16.000Z',
  '2018-05-11T05:00:16.000Z',
  '2017-08-15T05:00:16.000Z',
  42965,
  42972,
  42972,
  'VEHICULO',
  'ASH-805',
  43006,
  43335,
  612000,
  43350,
  '2020-03-30T05:00:16.000Z',
  '29/07/2019 // 29/11/2021',
  '2017-08-15T05:00:16.000Z',
  42965,
  42993,
  42993,
  'INMUEBLE',
  '50N-20640673',
  43054,
  '2018-09-09T05:00:16.000Z',
  '2017-08-15T05:00:16.000Z',
  42965,
  42976,
  43278,
  42976,
  'VEHICULO // BANCOS',
  'CPW-417',
  43006,
  '28/09/2017',
  'VEHICULO (-) BANCOS (+) BANCO OCIDENTE',
  43287,
  43341,
  '2020-02-25T05:00:16.000Z',
  '2192-12-15T05:00:16.000Z',
  'CUNDINAMARCA',
  42983,
  'FISICO',
  43404,
  'FISICO',
  'INMUEBLE',
  '051-105520',
  'INMUEBLE',
  '19/01/2018',
  'POSITIVO',
  '.',
  43318,
  '2019-09-19T05:00:16.000Z',
  '2017-08-11T05:00:16.000Z',
  42970,
  '28/09/2017             17/11/2017',
  43006,
  'INMUEBLE',
  '50N-20695043',
  43230,
  '22/05/18',
  '13/07/18',
  '2017-08-11T05:00:16.000Z',
  'LIQUIDACION',
  42969,
  42990,
  43194,
  43011,
  'iNMUEBLE',
  'CALLE 69B N° 116 C - 02 APTO 603 TORRE 9 CONJUNTO RES. FLORIDA DE ENGATIVA',
  43223,
  'DECRETADO 3/05/2018',
  1034700,
  43273,
  '2019-08-14T05:00:16.000Z',
  '2028-08-28T05:00:16.000Z',
  '2017-08-16T05:00:16.000Z',
  42971,
  '10/05/18',
  43256,
  '13/107/18',
  '2020-12-31T05:00:16.000Z',
  '2017-06-28T05:00:16.000Z',
  'EJECUCIÓN',
  42915,
  '14/08/2017   20/09/2017',
  'NO',
  'NEGATIVO',
  43088,
  'NEGATIVO',
  43548,
  '',
  '2020-11-13T05:00:16.000Z',
  '2025-10-04T05:00:16.000Z',
  '2017-08-16T05:00:16.000Z',
  42970,
  43425,
  43425,
  'INMUEBLE',
  '50S-868526',
  '19/07/2018',
  43328,
  '2020-09-17T05:00:16.000Z',
  '2023-10-31T05:00:16.000Z',
  '2017-08-15T05:00:16.000Z',
  42970,
  43070,
  43070,
  'INMUEBLE',
  '50N-20520873',
  '05/04/18',
  43224,
  '14/08/18',
  '2027-10-11T05:00:16.000Z',
  '15/08/25017',
  42969,
  42978,
  42978,
  'APTO',
  '50C-1836375',
  'POR CONCILIACION',
  43376,
  '17/01/2019',
  '2017-08-15T05:00:16.000Z',
  42970,
  43007,
  43007,
  '50S-114877',
  43245,
  '//',
  '2018-08-15T05:00:16.000Z',
  '2020-06-12T05:00:16.000Z',
  '2017-06-28T05:00:16.000Z',
  'EJECUCIÓN',
  42915,
  42948,
  'NO',
  'POSITIVO',
  43362,
  'POSITIVO',
  43259,
  42951,
  'VEHICULO',
  'AUTOMOVIL MARCA MAZDA 3,MODELO:2016,GRIS METEORO',
  '28/09/2017',
  '28/09/2017',
  'POSITIVO',
  'SE DESISTE DE CAUCIÓN SOBRE 30 MILLONES SE SOLICITA DESPACHO COMISORIO PARA SECUESTRO // TIENE COMPARENDO DE $ 3.600.000 POR CONDUCIR EMBRIAGADO // SERGIO PERDOMO DE REINTEGRA RADICO OFICIO AVERIGUAR ',
  '23/&04/2021',
  '2017-09-24T05:00:16.000Z',
  '2017-08-15T05:00:16.000Z',
  42969,
  '150/2/18',
  '2017-08-11T05:00:16.000Z',
  42970,
  43017,
  43257,
  43257,
  ' ',
  'INMUEBLE',
  '50C-1906708  50C-1906861',
  2069,
  '02/03/2018',
  'POSITIVA',
  43341,
  43355,
  '23/01/2019',
  '2020-10-29T05:00:16.000Z',
  '2017-06-30T05:00:16.000Z',
  '2017-08-17T05:00:16.000Z',
  42969,
  42992,
  42992,
  'VEHICULO',
  'JFN-987',
  43006,
  '2018-09-27T05:00:16.000Z',
  '2020-10-26T05:00:16.000Z',
  '2017-08-16T05:00:16.000Z',
  'LIQUIDACIÓN DEL CRÉDITO SOLICITADA',
  42969,
  42976,
  'NO',
  'NEGATIVO',
  43362,
  'NEGATIVO',
  43646,
  43780,
  '13/09/2017',
  'INMUEBLE CL 136A # 100A-05',
  'POSITIVO',
  'SE SOLICITA LIQUIDACIÓN DEL CRÉDITO A REINETGRA // SE DEBE RADICAR MEMORIAL SOLICITANDO SECUESTRO DE INMUEBLE // SE DEBE ACLARAR ABONO REALIZADO POR EL FNG',
  '2021-09-02T05:00:16.000Z',
  '2035-11-19T05:00:16.000Z',
  '2017-08-15T05:00:16.000Z',
  42969,
  43006,
  43006,
  'INMUEBLE',
  '50S-40693472',
  '2020-01-16T05:00:16.000Z',
  '2017-08-11T05:00:16.000Z',
  '2017-08-17T05:00:16.000Z',
  42969,
  43080,
  43080,
  'VEHICULO',
  'HJX-323',
  '08/05/18',
  43248,
  '2018-08-04T05:00:16.000Z',
  '2021-12-05T05:00:16.000Z',
  '2017-08-15T05:00:16.000Z',
  'EJECUCION',
  42969,
  42998,
  'NO',
  43145,
  43056,
  'VEHICULO BANCOS',
  'VEHICULO',
  '/',
  '/',
  'POSITIVO',
  '2017-08-10T05:00:16.000Z',
  '2017-08-16T05:00:16.000Z',
  42969,
  42969,
  42969,
  'VEHICULO',
  'HCU-056',
  '13/07/2018',
  '16/08/2018',
  '06/11/2018',
  '2042-08-29T05:00:16.000Z',
  '2017-08-18T05:00:16.000Z',
  42969,
  '2017-11-08T05:00:16.000Z',
  '2025-01-19T05:00:16.000Z',
  '2017-08-23T05:00:16.000Z',
  42975,
  42997,
  42997,
  '50S-40658041(antes) 051-165325(ahora)',
  '7/09/2018',
  '13/09/2018',
  '2018-11-16T05:00:16.000Z',
  '2017-08-22T05:00:16.000Z',
  42975,
  42989,
  42989,
  '3675',
  '50N-20587722',
  '06/04/18',
  '2035-02-05T05:00:16.000Z',
  '2017-08-23T05:00:16.000Z',
  'DESDE EL 25/03/2022 APARECE OFICIO CORREGIDO SIN TRAMITAR Y PASA A LA LETRA',
  43348,
  '2023-02-03T05:00:16.000Z',
  '2017-08-24T05:00:16.000Z',
  42975,
  43194,
  '626',
  43300,
  43341,
  '03/12/2018',
  '21/02/2018 // 26/10/20247',
  '2017-08-23T05:00:16.000Z',
  'EL 11/07/2018 EL JUZGADO DECRETA TERMINACION PROCESO POR PAGO CUOTAS EN MORA // EL 5/09/2018 SE DEVOLVIERON GARANTIAS A AECSA S.A. // 30/08/2022 NO SE HAN LEVANTADO MEDIDAS CAUTELARES// PAGAR DESARCHIVE Y TRAMITAR OFICIO RECIENTE // ARCHIVO DEFINITIVO 596-2018',
  '2018-09-05T05:00:16.000Z',
  '29/11/2028\r\n',
  '2017-08-04T05:00:16.000Z',
  42958,
  42982,
  42982,
  '50C-1881363',
  '09/04/18',
  43216,
  '2018-07-13T05:00:16.000Z',
  '2020-08-15T05:00:16.000Z',
  '2017-08-22T05:00:16.000Z',
  'EJECUCIÓN',
  42975,
  42997,
  'NO',
  'POSITIVO',
  43035,
  'POSITIVO',
  43039,
  43006,
  'VEHICULO',
  'POSITIVO',
  43271,
  'REVISAR RESPUESTA DEL LA STT SI LE ACLARO REGISTRO Y ENVIO AL JUZGADO /// PEDIR CERTIFICADO MOVILIDAD DE FUNZA PARA VERIFICAR ACLARACIÓN EMBAEGO PLACAS DGT - 770',
  '2020-11-05T05:00:16.000Z',
  42975,
  '15/01/2019',
  '18/01/19',
  '2018-01-18T05:00:16.000Z',
  '2034-03-26T05:00:16.000Z',
  '2017-08-17T05:00:16.000Z',
  'EJECUCIÓN',
  42976,
  42801,
  'NO',
  'POSITIVO',
  43243,
  'POSITIVO',
  '13/07/2018',
  '22/03/2018',
  'INMUEBLE',
  '  ',
  '22/05/2018',
  'POSITIVO',
  '2021-11-12T05:00:16.000Z',
  '2017-08-16T05:00:16.000Z',
  '2017-08-22T05:00:16.000Z',
  42975,
  '2017-11-08T05:00:16.000Z',
  '7/12/20149',
  '2017-08-22T05:00:16.000Z',
  42975,
  '31/08/2017',
  '31/08/2017',
  'INMUEBLE',
  '50S-620708',
  '29/05/2018',
  '26/06/2018',
  '2019-07-02T05:00:16.000Z',
  '2033-10-31T05:00:16.000Z',
  '2017-08-24T05:00:16.000Z',
  42978,
  '2018-02-02T05:00:16.000Z',
  'AVENIDA 68 # 4 - 40 BLOQUE 6 APTO 402',
  'SENTENCIA',
  42977,
  43041,
  43357,
  'MUEBLES Y ENSERES',
  '2022-12-12T05:00:16.000Z',
  '29/11/2028\r\n',
  '2017-08-04T05:00:16.000Z',
  42975,
  43014,
  43014,
  '50C-1882363',
  '09/04/18',
  '2018-07-13T05:00:16.000Z',
  '2019-09-30T05:00:16.000Z',
  '2017-07-19T05:00:16.000Z',
  '2017-07-21T05:00:16.000Z',
  '2017-09-01T05:00:16.000Z',
  '29/09/2017',
  '2018-02-15T05:00:16.000Z',
  '2018-01-25T05:00:16.000Z',
  '2018-02-28T05:00:16.000Z',
  '2017-09-01T05:00:16.000Z',
  '2017-09-14T05:00:16.000Z',
  '2018-02-28T05:00:16.000Z',
  '2018-06-06T05:00:16.000Z',
  '2018-06-13T05:00:16.000Z',
  '2019-08-18T05:00:16.000Z',
  '2017-07-19T05:00:16.000Z',
  '2017-07-21T05:00:16.000Z',
  '2017-08-03T05:00:16.000Z',
  '2018-06-06T05:00:16.000Z',
  '2018-06-06T05:00:16.000Z',
  '2018-06-06T05:00:16.000Z',
  '2018-06-06T05:00:16.000Z',
  '2017-08-03T05:00:16.000Z',
  '2017-08-14T05:00:16.000Z',
  '2018-03-06T05:00:16.000Z',
  '2019-10-12T05:00:16.000Z',
  '2019-01-11T05:00:16.000Z',
  '2020-08-16T05:00:16.000Z',
  '22/082017',
  'EJECUCIÓN',
  42967,
  43368,
  'NO',
  'POSITIVO',
  43125,
  'POSITIVO',
  43125,
  43022,
  'VEHICULO',
  'AUTOMOVIL PARTICULAR',
  43022,
  '19/12/2017',
  'POSITIVO',
  43276,
  1600000,
  'PENDIENTE DESPACHO COMISORIO PARA SECUESTRO DE VEHICULO CAPTURA EL 5/07/2018 ',
  '2021-02-02T05:00:16.000Z',
  '2031-10-07T05:00:16.000Z',
  '2017-08-22T05:00:16.000Z',
  'EJECUCIÓN',
  43075,
  43152,
  'NO',
  'POSITIVO',
  43271,
  'POSITIVO',
  43333,
  43159,
  'INMUEBLE',
  'INMUEBLE CARRERA  116 N° 77-65 APTO 401 INTERIOR 15 CONJUNTO RESIDENCIAL ANDALUCIA',
  43159,
  '29/05/2018',
  'POSITIVO',
  '23/\'6/2\'22',
  '2024-03-24T05:00:16.000Z',
  '2017-08-17T05:00:16.000Z',
  42975,
  43004,
  43004,
  'INMUEBLE',
  '50N-20564117',
  '12/06/18',
  '27/06/2018',
  '2018-07-13T05:00:16.000Z',
  '2020-03-15T05:00:16.000Z',
  '2017-08-01T05:00:16.000Z',
  '11001400300320170126400',
  '2017-08-18T05:00:16.000Z',
  42975,
  42977,
  42977,
  '3151-2017',
  'INMUEBLE',
  '2014-5846',
  '2018-02-23T05:00:16.000Z',
  '2017-08-14T05:00:16.000Z',
  '2017-08-24T05:00:16.000Z',
  42975,
  '2018-01-19T05:00:16.000Z',
  '2017-08-16T05:00:16.000Z',
  '2017-08-22T05:00:16.000Z',
  42975,
  '05/0/2017',
  '05/0/2017',
  'VEHICULO',
  'HBQ-576',
  '2019-07-04T05:00:16.000Z',
  '2028-08-09T05:00:16.000Z',
  '2017-08-24T05:00:16.000Z',
  'NOTIFICACION',
  42975,
  43004,
  43014,
  '2019-06-25T05:00:16.000Z',
  '2026-03-10T05:00:16.000Z',
  '2017-08-22T05:00:16.000Z',
  '2017-08-28T05:00:16.000Z',
  '2017-09-18T05:00:16.000Z',
  '2018-06-20T05:00:16.000Z',
  '2018-06-20T05:00:16.000Z',
  '2018-06-20T05:00:16.000Z',
  '2018-06-22T05:00:16.000Z',
  '2017-09-18T05:00:16.000Z',
  '2017-09-25T05:00:16.000Z',
  '2018-01-28T05:00:16.000Z',
  '2018-03-22T05:00:16.000Z',
  '2018-06-22T05:00:16.000Z',
  '11/01/2019',
  '2024-04-22T05:00:16.000Z',
  '2017-08-24T05:00:16.000Z',
  42978,
  'CASA N° 11 BLOQUE 21 CONJUNTO RES. LA ABOLEDA II ESTAPA III CALLE 36 N° 1-81 SOACHA ',
  43144,
  43341,
  '2018-08-29T05:00:16.000Z',
  '2023-11-27T05:00:16.000Z',
  '2017-08-16T05:00:16.000Z',
  42975,
  43006,
  43006,
  '3327',
  '50C-1694514',
  '2017-12-16T05:00:16.000Z',
  '2022-06-02T05:00:16.000Z',
  '2017-08-24T05:00:16.000Z',
  42975,
  42979,
  42979,
  'BANCOS',
  '03/09/2018',
  '12/09/2018',
  '2018-09-11T05:00:16.000Z',
  '2017-08-15T05:00:16.000Z',
  '2017-08-22T05:00:16.000Z',
  42975,
  42984,
  42984,
  'VEHICULO',
  'KIZ-348',
  '14/09/2017',
  43006,
  'VEHICULO',
  'BUENOS AIRES',
  '30/10/2018',
  '11/01/19',
  '2019-01-11T05:00:16.000Z',
  '2019-11-02T05:00:16.000Z',
  '2017-08-01T05:00:16.000Z',
  '2017-07-21T05:00:16.000Z',
  '2017-11-15T05:00:16.000Z',
  '2018-02-27T05:00:16.000Z',
  '2018-04-08T05:00:16.000Z',
  '2018-04-08T05:00:16.000Z',
  '2018-05-07T05:00:16.000Z',
  '2017-11-15T05:00:16.000Z',
  '2017-12-01T05:00:16.000Z',
  '2017-12-01T05:00:16.000Z',
  '19/02/2018',
  '2017-08-15T05:00:16.000Z',
  '2017-08-22T05:00:16.000Z',
  42976,
  42996,
  42996,
  'VEHICULO',
  'TGU-950',
  43066,
  '05/12/2018',
  '2018-12-10T05:00:16.000Z',
  '2017-08-16T05:00:16.000Z',
  '2017-08-22T05:00:16.000Z',
  42975,
  43013,
  43013,
  'VEHICULO',
  'IMP-035',
  42997,
  '28/09/2017',
  '12/08/2018',
  '18/9/2018',
  '2018-09-18T05:00:16.000Z',
  '2019-11-03T05:00:16.000Z',
  '2017-08-01T05:00:16.000Z',
  'EJECUCIÓN',
  42955,
  42983,
  'NO',
  'POSITIVO',
  43257,
  'POSITIVO',
  43273,
  42984,
  'BANCOS',
  'PEDIR EMBARGO Y SECUESTRO VEHICULO PROPIEDAD DEL DEUDOR',
  'NEGATIVO',
  43294,
  'SOLICITAR JUZGADO REQUERIR A SECRETARIA DE MOVILIDAD DE COTA LAS RAZONES POR LAS CUALES NO SE HA REGISTRADO MEDIDA CAUTELAR VEHICULO SLJ234 // RECONOCE PERSONERIA 31/01/22 // REVISAR URGENTE NUEVO APODERADO CISA // BANCOLOMBIA NO HA CEDIDO A REINTEGRA CREDITO // SEPT 9 RECONOCE PODER A CISA',
  'PROCESO VENDIDO A CISA S.A.',
  '2022-09-08T05:00:16.000Z',
  '2019-11-03T05:00:16.000Z',
  '2017-08-01T05:00:16.000Z',
  '2017-08-08T05:00:16.000Z',
  '2017-09-05T05:00:16.000Z',
  '2018-02-06T05:00:16.000Z',
  '2018-06-06T05:00:16.000Z',
  '2018-06-06T05:00:16.000Z',
  '2018-06-22T05:00:16.000Z',
  '2017-09-05T05:00:16.000Z',
  '2017-09-06T05:00:16.000Z',
  '2018-06-22T05:00:16.000Z',
  '2018-06-29T05:00:16.000Z',
  '2018-07-13T05:00:16.000Z',
  '2021-12-15T05:00:16.000Z',
  '2017-08-01T05:00:16.000Z',
  '2017-08-08T05:00:16.000Z',
  '2017-08-14T05:00:16.000Z',
  '2019-03-19T05:00:16.000Z',
  '2019-03-19T05:00:16.000Z',
  '2019-10-06T05:00:16.000Z',
  '2017-08-14T05:00:16.000Z',
  '2017-08-22T05:00:16.000Z',
  '2017-08-11T05:00:16.000Z',
  'NOTIFICACION',
  42975,
  43084,
  43271,
  43119,
  'INMUEBLE',
  'APARTAMENTO 604 TORRE 1 DEL CONJUNTO RESIDENCIAL AZALEAS PROPIEDAD HORIZONTAL CARRERA 4 ESTE N° 38-56 URB. SAN MATEO II ETAPA MANZANA H4 SOACHA',
  '19*/01/2018',
  '16/03/2018',
  '21/11/2018',
  'IMUEBLE ',
  '2020-12-16T05:00:16.000Z',
  '2021-01-29T05:00:16.000Z',
  '2017-08-11T05:00:16.000Z',
  '2017-08-15T05:00:16.000Z',
  '2017-09-19T05:00:16.000Z',
  '2018-07-08T05:00:16.000Z',
  '2018-08-30T05:00:16.000Z',
  '2018-08-20T05:00:16.000Z',
  '2017-09-19T05:00:16.000Z',
  '2017-09-26T05:00:16.000Z',
  '19/03/2020 //  15/10/2019 ',
  '2017-08-23T05:00:16.000Z',
  'EJECUCIÓN',
  42975,
  42978,
  'NO',
  'POSITIVO',
  43031,
  'POSITIVO',
  43031,
  '08/09/2017',
  'BANCOS',
  'RETENCION DE DINEROS // VEHICULO',
  42986,
  'FEBRERO 2018',
  43285,
  '$14.416.762',
  'ESTA REALIZANDO PAGOS EN COVINOC // SE ENVIA MEMORIAL PARA ACTUALIZACIÓN DE FECHA DE CAPTURA',
  '2021-11-19T05:00:16.000Z',
  '170638',
  'CUNDINAMARCA',
  43143,
  'FISICO',
  'INMUEBLE',
  '051-153172',
  'APARTAMENTO 502 INTERIOR 20 CARRERA 7 A N° 3 -35 SOACHA- CUNDINAMARCA',
  '18/05/2018',
  43249,
  43263,
  '2019-09-16T05:00:16.000Z',
  '09/06/2034',
  '2017-08-22T05:00:16.000Z',
  '29/08/2017',
  '31/08/2017',
  '31/08/2017',
  '2629',
  '176-108370',
  '04/05/18',
  '2018-05-09T05:00:16.000Z',
  '152366',
  'CUNDINAMARCA',
  43076,
  'FISICO',
  'INMUEBLE',
  '050C-1785620',
  'CASA 4 MANZANA D  CONJUNTO RES NUEVO MEXICO FUNZA',
  43250,
  43278,
  '2019-10-15T05:00:16.000Z',
  '2020-11-30T05:00:16.000Z',
  '2017-08-11T05:00:16.000Z',
  '2017-08-23T05:00:16.000Z',
  '2017-09-13T05:00:16.000Z',
  '2018-05-15T05:00:16.000Z',
  '2018-05-22T05:00:16.000Z',
  '2018-05-22T05:00:16.000Z',
  '2018-05-22T05:00:16.000Z',
  '2017-09-13T05:00:16.000Z',
  '2017-09-20T05:00:16.000Z',
  '2018-06-15T05:00:16.000Z',
  '22/02/2021 // 19/05/20258',
  '2017-08-17T05:00:16.000Z',
  '101/09/2017',
  '28/11/2017',
  '28/11/2017',
  'INMUEBLE',
  '50N-20480143',
  '5/10/2018',
  '22/05/2018',
  '20/06/2018',
  '11/01/2019',
  '18/01/19',
  '2019-01-18T05:00:16.000Z',
  '2020-08-09T05:00:16.000Z',
  '2017-08-16T05:00:16.000Z',
  '2017-08-23T05:00:16.000Z',
  '15/02/2018',
  '26/06/2018',
  '26/06/2018',
  '26/06/2018',
  '24/09/2018',
  '15/02/2018',
  '02/03/2018',
  '0465',
  '10/04/2018',
  '26/07/2018',
  '08/08/2018',
  '2018-09-24T05:00:16.000Z',
  '2017-08-23T05:00:16.000Z',
  '2017-08-28T05:00:16.000Z',
  42978,
  43003,
  43003,
  '3621',
  'VEHICULO',
  'IVZ-052',
  '2018-03-13T05:00:16.000Z',
  '2026-05-04T05:00:16.000Z',
  '2017-08-24T05:00:16.000Z',
  42977,
  42997,
  42997,
  'INMUEBLE',
  '50C-1791484',
  43017,
  '21/05/20181',
  'POSITIVO',
  '29/06/2018',
  '03/09/2018',
  '26/09/2018',
  '6/02/19',
  '25/02/19',
  '2019-10-15T05:00:16.000Z',
  '2037-03-15T05:00:16.000Z',
  '22/082017',
  'PAGO TOTAL',
  42977,
  43067,
  'NO',
  'POSITIVO',
  43327,
  'POSITIVO',
  43370,
  43133,
  'INMUEBLE',
  43133,
  '02/04/2018',
  'POSITIVO',
  '2022-12-14T05:00:16.000Z',
  '2017-08-23T05:00:16.000Z',
  '2017-08-28T05:00:16.000Z',
  42982,
  42999,
  42999,
  'VEHICULO',
  'MPX-465',
  43006,
  43054,
  43074,
  '2018-06-14T05:00:16.000Z',
  '2028-09-03T05:00:16.000Z',
  '2017-08-29T05:00:16.000Z',
  42982,
  '2017-11-08T05:00:16.000Z',
  '2020-08-16T05:00:16.000Z',
  '2017-08-22T05:00:16.000Z',
  '2017-08-31T05:00:16.000Z',
  '2017-09-19T05:00:16.000Z',
  '12/12/2017',
  '2017-12-13T05:00:16.000Z',
  '2017-12-12T05:00:16.000Z',
  '2017-12-13T05:00:16.000Z',
  '2017-09-19T05:00:16.000Z',
  '2017-09-29T05:00:16.000Z',
  '2018-12-13T05:00:16.000Z',
  '04/07/2018',
  '2028-10-10T05:00:16.000Z',
  '2017-08-28T05:00:16.000Z',
  'EJECUCIÓN',
  42982,
  43025,
  'NO',
  'POSITIVO',
  43266,
  'POSITIVO',
  43294,
  43053,
  'INMUEBLE',
  '31/01/2018',
  'POSITIVO',
  43334,
  2500000,
  43362,
  '2021-04-15T05:00:16.000Z',
  '16/11/2019 // 6/03/2020',
  '2017-08-23T05:00:16.000Z',
  'PROCESO DE INSOLVENCIA',
  '2017-09-04T05:00:16.000Z',
  '2017-10-04T05:00:16.000Z',
  '12/10/2017',
  'PENDIENTES DE RADICAR ACTUALIZACION DE FECHA',
  '2023-06-05T05:00:16.000Z',
  '2022-05-30T05:00:16.000Z',
  '2017-08-28T05:00:16.000Z',
  'EJECUCIÓN',
  42982,
  42990,
  'NO',
  'POSITIVO',
  43152,
  'POSITIVO',
  43299,
  42999,
  'INMUEBLE',
  42999,
  '27/03/2018',
  'POSITIVO',
  '2021-11-12T05:00:16.000Z',
  '2024-11-28T05:00:16.000Z',
  '29/082017',
  42982,
  42989,
  42989,
  'INMUEBLE',
  '50S-40129060',
  '31/01/2018',
  43166,
  43278,
  3165000,
  '05/10/2018',
  '16/10/18',
  '2019-06-27T05:00:16.000Z',
  '2020-08-23T05:00:16.000Z',
  '2017-08-28T05:00:16.000Z',
  '2017-08-30T05:00:16.000Z',
  '2017-09-12T05:00:16.000Z',
  '13/03/2020',
  '2020-03-13T05:00:16.000Z',
  '2020-03-13T05:00:16.000Z',
  '2020-03-13T05:00:16.000Z',
  '2017-09-12T05:00:16.000Z',
  '21/09/2017',
  '2017-09-28T05:00:16.000Z',
  43047,
  '01/12/2017',
  '2021-09-09T05:00:16.000Z',
  '2017-08-22T05:00:16.000Z',
  '2017-08-28T05:00:16.000Z',
  '2017-09-19T05:00:16.000Z',
  '2018-05-08T05:00:16.000Z',
  '2018-07-06T05:00:16.000Z',
  '2018-05-28T05:00:16.000Z',
  '2019-08-20T05:00:16.000Z',
  '2019-09-09T05:00:16.000Z',
  '2018-02-01T05:00:16.000Z',
  'FEB 2018',
  '2020-07-04T05:00:16.000Z',
  '16//11/2021',
  '2017-08-29T05:00:16.000Z',
  42983,
  '2017-12-16T05:00:16.000Z',
  '2017-02-28T05:00:16.000Z',
  '2017-08-17T05:00:16.000Z',
  42983,
  '18/10/2017                16/11/2017        07/02/2018',
  43357,
  43026,
  'INMUEBLE',
  '50N-20552554',
  43147,
  '22/05/2018',
  '-',
  '2020-10-22T05:00:16.000Z',
  '2020-08-15T05:00:16.000Z',
  '2017-08-22T05:00:16.000Z',
  '2017-08-28T05:00:16.000Z',
  '2017-09-12T05:00:16.000Z',
  '2018-08-28T05:00:16.000Z',
  '2018-08-28T05:00:16.000Z',
  '2018-09-07T05:00:16.000Z',
  '2018-09-07T05:00:16.000Z',
  '12/09/2017',
  '19/09/2017',
  '2017-09-28T05:00:16.000Z',
  '14/09/2018',
  '19/11/2018',
  '2020-08-31T05:00:16.000Z',
  '2017-08-22T05:00:16.000Z',
  '2017-08-28T05:00:16.000Z',
  '2017-09-06T05:00:16.000Z',
  '2017-10-31T05:00:16.000Z',
  '2017-10-31T05:00:16.000Z',
  '2017-10-31T05:00:16.000Z',
  '2017-09-06T05:00:16.000Z',
  '2017-09-18T05:00:16.000Z',
  '2017-09-18T05:00:16.000Z',
  'SEP 2017',
  '5/01/2020  5/01/2020',
  '22/082017',
  '2017-08-28T05:00:16.000Z',
  '2018-03-05T05:00:16.000Z',
  '2018-07-15T05:00:16.000Z',
  '3018-07-26T05:00:16.000Z',
  '3018-07-26T05:00:16.000Z',
  '2018-03-05T05:00:16.000Z',
  '13/03/2018',
  '2028-08-02T05:00:16.000Z',
  '2017-08-24T05:00:16.000Z',
  'NOTIFICACIÓN CERTIMAIL A MARIA NUBIA MARTINEZ CELY',
  42984,
  43245,
  'SI',
  'POSITIVO',
  '10/08/2018',
  'POSITIVO',
  '10/08/2018',
  43269,
  'INMUEBLE',
  'POSITIVO',
  '2021-11-11T05:00:16.000Z',
  '2017-05-09T05:00:16.000Z',
  '2017-08-29T05:00:16.000Z',
  42982,
  '2017-11-23T05:00:16.000Z',
  '2021-04-25T05:00:16.000Z',
  '2017-08-30T05:00:16.000Z',
  42982,
  43082,
  43082,
  '0049',
  'INMUEBLE',
  '50C-1633731',
  43161,
  'PAGO CUOTAS ',
  '2018-06-01T05:00:16.000Z',
  '2017-06-28T05:00:16.000Z',
  '2017-08-17T05:00:16.000Z',
  42982,
  '15/05/18',
  '1/07/18',
  '2018-08-18T05:00:16.000Z',
  '2017-03-30T05:00:16.000Z',
  '2017-08-23T05:00:16.000Z',
  42982,
  43042,
  43042,
  '3169',
  '50C-1633720',
  43063,
  '2018-03-13T05:00:16.000Z',
  '96859',
  'CUNDINAMARCA',
  43031,
  'OK',
  43370,
  'INMUEBLE',
  '50N-20497311',
  '2020-10-08T05:00:16.000Z',
  '2017-08-17T05:00:16.000Z',
  '2019-12-12T05:00:16.000Z',
  '2017-08-25T05:00:16.000Z',
  42989,
  43033,
  43033,
  '50N-20564266',
  43047,
  '22/05/18',
  43256,
  '2018-07-13T05:00:16.000Z',
  '2032-07-19T05:00:16.000Z',
  '2017-09-04T05:00:16.000Z',
  42989,
  42996,
  42996,
  'INMUEBLE',
  '50S-40395172',
  43018,
  '31/01/20148',
  '11/01/2019',
  43482,
  '2019-03-29T05:00:16.000Z',
  '2023-10-14T05:00:16.000Z',
  '2017-09-04T05:00:16.000Z',
  42989,
  43020,
  43020,
  '50S-40500825',
  '-',
  '31/01/2018',
  43245,
  '18/06/2018',
  435000,
  '19/06/2018',
  '18/01/2019',
  '19/02/19',
  '2020-08-19T05:00:16.000Z',
  '2022-04-19T05:00:16.000Z',
  '2017-08-18T05:00:16.000Z',
  'EJECUCIÓN',
  42982,
  42991,
  'NO',
  'POSITIVO',
  '25/07/2018',
  'POSITIVO',
  '25/07/2018',
  '28/09/2017                            20-06-2018',
  'INMUEBLE',
  'POSITIVO',
  '2021-11-11T05:00:16.000Z',
  '2022-05-03T05:00:16.000Z',
  '2017-08-30T05:00:16.000Z',
  42982,
  42990,
  42990,
  '2000',
  '50N-20208600',
  '2017-12-16T05:00:16.000Z',
  '18/04/2020  5/05/2020  15/12/2019',
  '2017-08-23T05:00:16.000Z',
  '2017-08-28T05:00:16.000Z',
  '2018-01-30T05:00:16.000Z',
  '2018-06-20T05:00:16.000Z',
  '2018-06-20T05:00:16.000Z',
  '2018-06-20T05:00:16.000Z',
  '2019-01-28T05:00:16.000Z',
  '2018-01-30T05:00:16.000Z',
  '2018-05-16T05:00:16.000Z',
  '2018-05-16T05:00:16.000Z',
  'JUNIO 2018',
  '2023-04-30T05:00:16.000Z',
  '2017-08-29T05:00:16.000Z',
  42986,
  '23/11/2017       23/01/2018',
  43062,
  'INMUEBLE',
  '166-96016',
  '23/10/2018',
  '2019-10-07T05:00:16.000Z',
  '2017-08-18T05:00:16.000Z',
  42982,
  '30/11/2017                  06/02/2018',
  43069,
  '3821-2017',
  'INMUEBLE',
  '50S-40566813',
  '2018-04-27T05:00:16.000Z',
  '2017-08-31T05:00:16.000Z',
  '2017-09-06T05:00:16.000Z',
  42991,
  43035,
  43035,
  'VEHICULO',
  'IMW-365',
  43139,
  '30/05/2018',
  '03/09/2018',
  43348,
  '06/11/2018',
  '2020-08-30T05:00:16.000Z',
  '2017-09-04T05:00:16.000Z',
  'EJECUCIÓN',
  42991,
  43033,
  'SI',
  'POSITIVO',
  43303,
  43242,
  'POSITIVO',
  43271,
  43040,
  'VEHICULO',
  'NO SE REGISTRA AL EXISTIR PRELACION DE MOVILIDAD // 05/09 SOLICITO EMBARGO REMANENTES',
  'NEGATIVO COBRO COACTIVO',
  'REVISAR EN EL JUZGADO RESPUESTA DE SECRETARIA DE MOVILIDAD EMBARGO DE REMANENTES EN COBRO COACTIVO',
  '2021-11-08T05:00:16.000Z',
  '2024-06-03T05:00:16.000Z',
  '2017-09-04T05:00:16.000Z',
  'EJECUCION',
  42991,
  43018,
  'SI',
  'POSITIVO',
  43259,
  43238,
  'POSITIVO',
  '8/07/2018',
  '24/10/2017',
  'IMBUEBLE',
  'CALLE 49 B SUR N° 9-89 APARTAMENTO 405 BLOQUE 2 AGRUPACION DE VIVIENDA MOLINOS DEL MILENIO P.H.',
  '31/01/2018',
  'POSITIVO',
  '21/08/2018',
  '2022-05-20T05:00:16.000Z',
  '2017-09-04T05:00:16.000Z',
  '1309/2017',
  '11/07/18',
  43297,
  '2018-09-05T05:00:16.000Z',
  '2018-07-23T05:00:16.000Z',
  '2017-08-22T05:00:16.000Z',
  'SUSPENDIDO CENTRO DE CONCILIACIÓN',
  42977,
  43147,
  43348,
  '06/03/2018',
  'VEHICULO',
  'VEHICULO',
  43165,
  '10/04/2018',
  'NEGATIVO// EMBARGO MOVILIDAD',
  'PROCESO EN CENTRO DE CONCILIACIÓN ASEMGAS SOLICITAR VIGENCIA EN SU CUMPLIMIENTO',
  '<',
  'CALLE 67 C SUR 1B ESTE  APARTAMENTO 404 TORRE 2 ',
  'NOTIFICACION',
  42997,
  43084,
  43115,
  'INMUEBLE',
  'APARTAMENTO 404 TORRE 2 CONJUNTO RESIDENCIAL QUINTAS DEL PORTAL ETAPA 4 CALLE 67 C SUR N° 1 B - 23 ESTE',
  43115,
  '02/04/2018',
  '05/09/2018',
  '27/09/2018',
  '2020-01-16T05:00:16.000Z',
  '2033-03-22T05:00:16.000Z',
  '2017-09-06T05:00:16.000Z',
  42996,
  43027,
  43027,
  '50S-754516',
  43216,
  '14/06/2018',
  '18/09/2018',
  '21/09/2018',
  '2019-09-12T05:00:16.000Z',
  '2020-08-24T05:00:16.000Z',
  '2017-08-29T05:00:16.000Z',
  '2017-09-01T05:00:16.000Z',
  '2017-10-19T05:00:16.000Z',
  '2018-01-26T05:00:16.000Z',
  '2018-04-18T05:00:16.000Z',
  '2018-04-18T05:00:16.000Z',
  '2019-03-04T05:00:16.000Z',
  '2018-05-16T05:00:16.000Z',
  '2018-04-30T05:00:16.000Z',
  '2017-10-19T05:00:16.000Z',
  '2017-11-10T05:00:16.000Z',
  '2017-11-27T05:00:16.000Z',
  '27/11/2017',
  '2018-06-18T05:00:16.000Z',
  '2018-07-09T05:00:16.000Z',
  '2018-07-13T05:00:16.000Z',
  '2018-08-16T05:00:16.000Z',
  '2017-09-06T05:00:16.000Z',
  42996,
  43032,
  43032,
  '50S-1142181',
  43060,
  '29/05/2018',
  '03/09/2018',
  '11/09/2018',
  '2018-09-11T05:00:16.000Z',
  '2017-02-14T05:00:16.000Z',
  '2017-09-06T05:00:16.000Z',
  '2017-09-18T05:00:16.000Z',
  '2017-09-21T05:00:16.000Z',
  '2018-02-06T05:00:16.000Z',
  '2018-02-06T05:00:16.000Z',
  '2018-02-06T05:00:16.000Z',
  '2018-05-07T05:00:16.000Z',
  '2017-09-21T05:00:16.000Z',
  '2017-10-04T05:00:16.000Z',
  '2017-10-04T05:00:16.000Z',
  '2018-05-15T05:00:16.000Z',
  '2018-07-16T05:00:16.000Z',
  '2018-07-24T05:00:16.000Z',
  '2019-01-11T05:00:16.000Z',
  '2032-12-21T05:00:16.000Z',
  '2017-09-06T05:00:16.000Z',
  42996,
  42999,
  42999,
  '4874/4875',
  '051-137449 - 051-137257',
  '2018-02-22T05:00:16.000Z',
  '2017-05-14T05:00:16.000Z',
  '2017-08-29T05:00:16.000Z',
  42997,
  '2017-11-23T05:00:16.000Z',
  '05/09/2017 //13/08/2030',
  '2017-09-11T05:00:16.000Z',
  42997,
  '2017-10-11T05:00:16.000Z',
  '2017-09-13T05:00:16.000Z',
  'SIN LEVANTAMIENTO DE MEDIDA CAUTELAR AL 18/01/2023 SE ENCUENTRA DESARCHIVE DESDE EL 14 DE DICI DE 2022',
  '2017-10-25T05:00:16.000Z',
  '2026-06-23T05:00:16.000Z',
  '120/09/2017',
  42997,
  '2018-04-21T05:00:16.000Z',
  '2018-07-27T05:00:16.000Z',
  '2017-09-11T05:00:16.000Z',
  42997,
  43034,
  'JAIME CASTILLO',
  '20/06/2018 JAIME',
  '20/06/2018 JAIME',
  43034,
  43070,
  'DIC 2017',
  '2019-10-08T05:00:16.000Z',
  '2023-04-20T05:00:16.000Z',
  '2017-09-11T05:00:16.000Z',
  42997,
  43014,
  43014,
  '1339',
  '051-177721 ANTES  50S-40683393',
  '2018-01-11T05:00:16.000Z',
  '2020-08-11T05:00:16.000Z',
  '2017-08-25T05:00:16.000Z',
  '2017-08-31T05:00:16.000Z',
  '2017-10-05T05:00:16.000Z',
  '2018-02-23T05:00:16.000Z',
  '2018-02-23T05:00:16.000Z',
  '2018-12-02T05:00:16.000Z',
  '2019-11-25T05:00:16.000Z',
  '2019-02-13T05:00:16.000Z',
  '2017-10-05T05:00:16.000Z',
  '2017-10-12T05:00:16.000Z',
  '2033-02-28T05:00:16.000Z',
  '2017-09-12T05:00:16.000Z',
  42997,
  43018,
  43018,
  '5603',
  'INMUEBLE',
  '50S-40606637',
  '2017-12-16T05:00:16.000Z',
  '2022-11-21T05:00:16.000Z',
  '2017-09-06T05:00:16.000Z',
  42997,
  '2017-11-08T05:00:16.000Z',
  '2023-11-21T05:00:16.000Z',
  '2017-09-13T05:00:16.000Z',
  42997,
  '2018-04-21T05:00:16.000Z',
  '2017-03-20T05:00:16.000Z',
  '2017-09-06T05:00:16.000Z',
  'SENTENCIA',
  42996,
  43032,
  43256,
  43049,
  'LOTE Y CONSTRUCCION CALLE 5 N° 0-19 ANAPOIMA',
  43160,
  '01/03//2018',
  'NEGATIVO',
  '2019-06-11T05:00:16.000Z',
  '2017-04-22T05:00:16.000Z',
  '2017-09-07T05:00:16.000Z',
  42992,
  43012,
  '04/10/2017',
  '4071',
  '50S-264186',
  '2017-11-23T05:00:16.000Z',
  '18/05/2020  // 5/05/2020 // 15/05/2019',
  '2017-08-23T05:00:16.000Z',
  '2017-09-04T05:00:16.000Z',
  '2017-09-11T05:00:16.000Z',
  '2018-06-28T05:00:16.000Z',
  '2018-06-28T05:00:16.000Z',
  '2018-06-28T05:00:16.000Z',
  '2018-09-05T05:00:16.000Z',
  '2017-09-11T05:00:16.000Z',
  '2017-09-18T05:00:16.000Z',
  '2018-09-05T05:00:16.000Z',
  '2018-09-27T05:00:16.000Z',
  '2017-08-29T05:00:16.000Z',
  '2017-09-04T05:00:16.000Z',
  42992,
  43055,
  '18/09 ENVIO CERTIMAIL',
  43055,
  '2019-06-27T05:00:16.000Z',
  '2017-08-22T05:00:16.000Z',
  '2020-04-25T05:00:16.000Z',
  '11001400301320170116200',
  'EJECUCIÓN',
  '2017-09-04T05:00:16.000Z',
  'SI',
  '2017-12-15T05:00:16.000Z',
  'POSITIVO',
  '2017-12-15T05:00:16.000Z',
  '2017-12-15T05:00:16.000Z',
  'POSITIVO',
  'CERTIMAIL',
  '3225-2017',
  '28/09/2017',
  'HCO-167',
  '28/09/20017',
  '22/01/2018',
  'HIBRIDO // 13 jJUNIO 2022 REINTEGRA RADICA CESION CREDITO //28 DE SEPTIEMBRE DE 2.022 SE REALIZA SECUESTRO DEL VEHICULO POR INSPECCIÓN DE MOSQUERA //P // EL 4 OCT 2022 SE APORTA ACTA A UZGADO // EL 22 DE NOVIEMBRE SE ENVIÒ AVALUO DEL VEHÍCULO AL JUZGADO // 29 NOV 2022 REGRESA DC, REQUIERE SECUESTRE  Y CORRE TRASLADO AVALUO  // 12 DIC 2022 TELEGRAMA AL SECUESTRE //16/02/2023 ENVIO CONSTANCIA DE NOTIFICACIÓN// 10 JULIO 2023 SE ENVIA MEMORIAL SOLICITANDO DAR ALCANCE A AVALUO. // 8 JUNIO 2023 ACEPTA CESION Y PODER A TERCERO. ',
  '2023-06-09T05:00:16.000Z',
  '2027-01-05T05:00:16.000Z',
  '2017-09-05T05:00:16.000Z',
  42992,
  43033,
  43033,
  '2253',
  '50S-40583034',
  '28/11/2017',
  43138,
  '2018-02-15T05:00:16.000Z',
  '2020-09-04T05:00:16.000Z',
  '2017-09-07T05:00:16.000Z',
  'EJECUCIÓN',
  42992,
  43007,
  'NO',
  'POSITIVO',
  43259,
  'POSITIVO',
  43259,
  43014,
  'VEHICULO',
  'VEHICULO/7 JUZGADO REQUIRIO DE OFICIO REGISTRAR LA MEDIDA',
  43066,
  '27/11/2018',
  'POSITIVO',
  43279,
  '2019-11-22T05:00:16.000Z',
  '2018-05-09T05:00:16.000Z',
  '2017-08-28T05:00:16.000Z',
  '2017-09-08T05:00:16.000Z',
  '22/10/018',
  '2018-11-01T05:00:16.000Z',
  '2018-11-01T05:00:16.000Z',
  '2018-11-22T05:00:16.000Z',
  '2017-11-03T05:00:16.000Z',
  '14/11/2017',
  '2017-11-14T05:00:16.000Z',
  '02/03/2018',
  '2/10/2019',
  '2019-07-19T05:00:16.000Z',
  '2017-09-01T05:00:16.000Z',
  'EJECUCION',
  42983,
  43011,
  'NO',
  'POSITIVO',
  'NEGATIVO',
  '14/11/2017',
  'VEHICULO CODEUDOR',
  'PEDIR EMBARGO Y SECUESTRO DEL VEHICULO DE PABLO ANDRES PEREZ ACEVEDO',
  43070,
  'DIC 2017',
  'NEGATIVO',
  ' CISA RADICO TERMINACION// AECSA RESPONDE 100% CISA // 29 SEPT SE ENVIA TERMINACION Y SOLICITUD SE LEVANTE MEDIDA',
  'REVISAR',
  '2022-07-28T05:00:16.000Z',
  '2019-09-02T05:00:16.000Z',
  '2017-09-18T05:00:16.000Z',
  42999,
  43012,
  43012,
  '3903',
  'INMUEBLE',
  '50C-1658091',
  '21/02/18',
  '04/04/18',
  '2018-05-23T05:00:16.000Z',
  '2017-04-25T05:00:16.000Z',
  '2017-09-13T05:00:16.000Z',
  42999,
  43026,
  43026,
  'INMUEBLE',
  '50C-1622056',
  '21/06/18',
  43300,
  '2018-09-05T05:00:16.000Z',
  '2018-01-26T05:00:16.000Z',
  '2017-09-01T05:00:16.000Z',
  '2017-09-06T05:00:16.000Z',
  '2017-09-13T05:00:16.000Z',
  '2018-02-14T05:00:16.000Z',
  '14/02/2018',
  '14/02/2018',
  '03/04/2018',
  '2017-09-13T05:00:16.000Z',
  '28/09/2017',
  '31/01/2018',
  '2018-04-03T05:00:16.000Z',
  '2018-04-03T05:00:16.000Z',
  '2018-06-25T05:00:16.000Z',
  '2017-04-23T05:00:16.000Z',
  '2017-09-13T05:00:16.000Z',
  42999,
  43040,
  43040,
  'INMUEBLE',
  '50S-775185',
  '21/06/18',
  43299,
  '2018-08-08T05:00:16.000Z',
  '2017-09-12T05:00:16.000Z',
  '2017-09-18T05:00:16.000Z',
  43005,
  43026,
  43026,
  'INMUEBLE',
  '157-8815',
  '28/11/2018',
  '07/12/2018',
  '2017-09-11T05:00:16.000Z',
  '2017-09-18T05:00:16.000Z',
  43005,
  43013,
  43013,
  '3481',
  'INMUEBLE',
  '50S-854957',
  '2018-02-22T05:00:16.000Z',
  '2018-08-01T05:00:16.000Z',
  '2017-09-12T05:00:16.000Z',
  43005,
  43013,
  43013,
  'INMUEBLE',
  '157-108378',
  '2019-10-01T05:00:16.000Z',
  '2017-09-20T05:00:16.000Z',
  '2017-09-22T05:00:16.000Z',
  43005,
  '2018-03-22T05:00:16.000Z',
  '2017-08-04T05:00:16.000Z',
  '2017-09-20T05:00:16.000Z',
  43006,
  43020,
  43020,
  '1066',
  '50N-20736591       50N-20402074',
  43193,
  '2018-04-21T05:00:16.000Z',
  '2020-05-04T05:00:16.000Z',
  '2017-09-21T05:00:16.000Z',
  'PROCESO DE INSOLVENCIA PASO A LIQUIDACION JUDICIAL',
  '2017-09-27T05:00:16.000Z',
  '2017-10-09T05:00:16.000Z',
  'SI',
  'POSITIVO',
  '2018-05-30T05:00:16.000Z',
  '2018-04-03T05:00:16.000Z',
  'POSITIVO',
  '2018-06-01T05:00:16.000Z',
  '20//11/2017',
  'INMUEBLE',
  'CASA 148 CONJUNTO RESIDNCIAL PRADOS DE CASTILLA V ETAPA PH CARRERA 90 C N° 6 A -31 ',
  '2017-11-20T05:00:16.000Z',
  '02/03/2018',
  'POSITIVO',
  '2018-02-18T05:00:16.000Z',
  '2018-06-01T05:00:16.000Z',
  43300,
  2064700,
  '2018-06-15T05:00:16.000Z',
  '2023-03-28T05:00:16.000Z',
  '2017-09-20T05:00:16.000Z',
  '2017-09-22T05:00:16.000Z',
  43005,
  43046,
  43046,
  'VEHICULO',
  'UUQ-363',
  '2019-06-15T05:00:16.000Z',
  '2020-09-20T05:00:16.000Z',
  '2017-09-22T05:00:16.000Z',
  'EJECUCIÓN',
  43005,
  43012,
  'NO',
  'POSITIVO',
  43299,
  'POSITIVO',
  '31/08/2018',
  43021,
  'VEHICULO',
  43021,
  '27/02/2018',
  'POSITIVO',
  '1,500,000',
  '2021-03-25T05:00:16.000Z',
  '21/09/2020',
  '25/09/2017',
  'EJECUCIÓN',
  '5/10/2017',
  '17/10/2017',
  'NO',
  'POSITIVO',
  43266,
  43340,
  'POSITIVO',
  '15/01/2019',
  '21/03/2019',
  'VEHICULO',
  '23/10/2017',
  'POSITIVO',
  'PENDIENTE RETIRAR DESPACHO COMISORIO DE JUZGADO DE EJECUCIÓN',
  '2020-10-22T05:00:16.000Z',
  '31/03/2025',
  '21/09/2017',
  'TERMINO POR PAGO TOTAL',
  '20/04/2018',
  '13/06/2018',
  '17/08/2018',
  '27/06/2018',
  'INMUEBLE',
  'INMUEBLE',
  '27/06/2018',
  '10/07/207',
  '2019-02-27T05:00:16.000Z',
  '21/09/2017',
  '25/09/2017',
  '05/10/2017',
  '07/05/018',
  '21/06/18',
  '2018-08-24T05:00:16.000Z',
  '12600924',
  'CUNDINAMARCA',
  '17/10/2017',
  'NIEGA CERTIMAIL',
  'VEHICULO',
  'NDV-894',
  '08/03/2018',
  '2019-08-28T05:00:16.000Z',
  '21/09/2017',
  '25/09/2017',
  '05/10/2017',
  '09/10/2017',
  '09/10/2017',
  '2064',
  'VEHICULO',
  'ZLY-790',
  '2017-12-16T05:00:16.000Z',
  '2022-10-05T05:00:16.000Z',
  '2017-09-25T05:00:16.000Z',
  'EJECUCIÓN',
  '05/10/2017',
  '31/08/2018',
  'NO',
  'POSITIVO',
  '2018-10-05T05:00:16.000Z',
  'POSITIVO',
  '24/09/2018',
  '11/09/2018',
  'CASA 35',
  'POSITIVO',
  '2021-09-10T05:00:16.000Z',
  '27/06/2017',
  '21/09/2017',
  '05/10/2017',
  '09/11/2017',
  '09/11/2017',
  '4374',
  'INMUEBLE',
  '50C-1432188',
  '21/02/18',
  '06/03/18',
  '2018-04-27T05:00:16.000Z',
  '09/12/2024',
  '27/09/2017',
  '05/10/2017',
  '28/08/2018',
  '13/09/2018',
  '03/12/2018',
  '05/02/2017',
  '21/09/2017',
  '05/10/2017',
  '2018-02-26T05:00:16.000Z',
  '2019-08-07T05:00:16.000Z',
  '2017-09-01T05:00:16.000Z',
  'EJECUCIÓN',
  42984,
  43033,
  'NO',
  'POSITIVO',
  43198,
  'POSITIVO',
  43200,
  '21/11/2017                   26/06/2018',
  'VEHICULO SALARIO ',
  'CAMIONETA CLASE PARTICULAR// REMANENTES',
  '27/04/2018',
  'PENDIENTE SOLICITAR MEDIDAS',
  'SE DA POR TERMINADO POR PAGO TOTAL 2 DE JUNIO .',
  '2022-06-21T05:00:16.000Z',
  '18/03/2019',
  '2017-09-28T05:00:16.000Z',
  '2017-10-10T05:00:16.000Z',
  '2018-01-16T05:00:16.000Z',
  '2018-04-30T05:00:16.000Z',
  '2018-09-14T05:00:16.000Z',
  '2018-05-15T05:00:16.000Z',
  '2018-06-08T05:00:16.000Z',
  '2018-09-03T05:00:16.000Z',
  '2020-12-07T05:00:16.000Z',
  '2017-08-25T05:00:16.000Z',
  '2017-09-04T05:00:16.000Z',
  '2017-09-13T05:00:16.000Z',
  '2018-07-06T05:00:16.000Z',
  '2018-07-06T05:00:16.000Z',
  '2018-07-06T05:00:16.000Z',
  '31/07/2018',
  '2017-09-13T05:00:16.000Z',
  '22/09/2017',
  '2018-07-31T05:00:16.000Z',
  '2018-08-10T05:00:16.000Z',
  '2019-01-11T05:00:16.000Z',
  '15/012021 ',
  '2017-09-11T05:00:16.000Z',
  '2017-09-19T05:00:16.000Z',
  '2017-12-12T05:00:16.000Z',
  '27/06/2018',
  '27/06/2018',
  '27/06/2018',
  '2017-12-12T05:00:16.000Z',
  '12/02/2018',
  '<',
  '20/03/2018',
  '2019-04-01T05:00:16.000Z',
  '21258',
  'CUNDINAMARCA',
  '13/04/2018',
  '10/09/2018',
  'INMUEBLE',
  '157-38399',
  'INMUEBLE',
  '04/07/2018',
  'POSITIVO',
  '23/08/2018',
  '2019-07-29T05:00:16.000Z',
  '5/05/2024',
  '2017-09-21T05:00:16.000Z',
  '2017-10-10T05:00:16.000Z',
  '08/11/2017    09/02/2018',
  '2018-02-14T05:00:16.000Z',
  '2018-06-08T05:00:16.000Z',
  '2018-02-23T05:00:16.000Z',
  '2018-06-08T05:00:16.000Z',
  '2018-02-23T05:00:16.000Z',
  '2017-11-08T05:00:16.000Z',
  '16/02/2018',
  '2018-02-16T05:00:16.000Z',
  '2018-03-12T05:00:16.000Z',
  '2017-07-20T05:00:16.000Z',
  '2017-09-26T05:00:16.000Z',
  'RT',
  42754,
  42754,
  'INMUEBLE',
  '50C-1518496',
  43133,
  '12/03/2018',
  'POSITIVO',
  43354,
  1034700,
  43343,
  '2019-07-04T05:00:16.000Z',
  '2017-09-27T05:00:16.000Z',
  43018,
  '2018-03-08T05:00:16.000Z',
  '2017-06-10T05:00:16.000Z',
  '2017-09-12T05:00:16.000Z',
  'EJECUCIÓN',
  42996,
  43047,
  'NO',
  'POSITIVO',
  43257,
  'POSITIVO',
  43231,
  '21/11/2017',
  'INMUEBLE',
  'NEGATIVO',
  '3/10/2022 INGRESO AL DESPACHO PARA TERMINACION PAGO TOTAL DE LA OBLIGACION // EL 18/11/2022 JUZGADO DECRETO TERMINACION PROCESO POR PAGO TOTAL DE LA OBLIGACION',
  '2022-11-18T05:00:16.000Z',
  '2020-09-06T05:00:16.000Z',
  '2017-09-11T05:00:16.000Z',
  '2017-09-19T05:00:16.000Z',
  '2017-10-12T05:00:16.000Z',
  '2017-10-12T05:00:16.000Z',
  '2017-10-31T05:00:16.000Z',
  '2017-11-30T05:00:16.000Z',
  '2020-09-29T05:00:16.000Z',
  '2017-10-04T05:00:16.000Z',
  'PROCESO DE INSOLVENCIA',
  '2017-10-06T05:00:16.000Z',
  '2018-11-27T05:00:16.000Z',
  '2017-12-12T05:00:16.000Z',
  'VEHICULO',
  'INSOLVENCIA',
  '2018-04-13T05:00:16.000Z',
  '2017-04-15T05:00:16.000Z',
  '2017-10-03T05:00:16.000Z',
  43014,
  '2017-12-16T05:00:16.000Z',
  '2020-03-22T05:00:16.000Z',
  '2017-09-11T05:00:16.000Z',
  '2017-09-14T05:00:16.000Z',
  '2017-09-26T05:00:16.000Z',
  '25/06/2018',
  '25/06/2018',
  '25/06/2018',
  '2017-09-26T05:00:16.000Z',
  '05/10/2017',
  '14/06/2018',
  '29/06/2018',
  '16/01/2020',
  '2020-12-13T05:00:16.000Z',
  '2017-09-27T05:00:16.000Z',
  43014,
  43025,
  43025,
  '50C-1629636',
  43019,
  '13/04/2018',
  'POSITIVO',
  '24/04/19 ',
  '2019-10-01T05:00:16.000Z',
  '2017-08-04T05:00:16.000Z',
  '2017-09-29T05:00:16.000Z',
  '06/102017',
  43028,
  '09/04/2018 CERTIMAIL',
  '09/04/2018 CERTIMAIL',
  43028,
  'INMUEBLE',
  '176-160476',
  2727,
  '16/03/2018',
  'POSITIVO',
  '//',
  '21/08/2018',
  '30/01/2019',
  43511,
  '2019-07-04T05:00:16.000Z',
  '2020-08-31T05:00:16.000Z',
  '2017-09-13T05:00:16.000Z',
  '2017-09-21T05:00:16.000Z',
  '2017-10-17T05:00:16.000Z',
  '2018-02-27T05:00:16.000Z',
  '2018-07-06T05:00:16.000Z',
  '06/07/018',
  '2018-03-06T05:00:16.000Z',
  '2017-10-17T05:00:16.000Z',
  '24/10/2017',
  '24/10/2017',
  'FEBRERO 2018',
  '2020-03-05T05:00:16.000Z',
  '2017-09-19T05:00:16.000Z',
  '2017-10-06T05:00:16.000Z',
  '2017-11-03T05:00:16.000Z',
  '2018-01-30T05:00:16.000Z',
  '2018-01-30T05:00:16.000Z',
  '2018-01-30T05:00:16.000Z',
  '2018-02-23T05:00:16.000Z',
  '2017-11-03T05:00:16.000Z',
  '2017-12-01T05:00:16.000Z',
  '2018-01-31T05:00:16.000Z',
  '2018-02-23T05:00:16.000Z',
  '2018-06-05T05:00:16.000Z',
  '2018-06-15T05:00:16.000Z',
  700000,
  '2020-09-13T05:00:16.000Z',
  '2017-09-18T05:00:16.000Z',
  '2017-09-21T05:00:16.000Z',
  '2017-09-25T05:00:16.000Z',
  '2018-06-21T05:00:16.000Z',
  43293,
  43293,
  '2018-07-12T05:00:16.000Z',
  43293,
  43003,
  '05/10/2017',
  '2017-10-05T05:00:16.000Z',
  '22/01/2018',
  '5/10/2017',
  '9/05/2019',
  '2018-09-06T05:00:16.000Z',
  '2020-09-12T05:00:16.000Z',
  '2017-09-18T05:00:16.000Z',
  '2017-09-21T05:00:16.000Z',
  '2017-10-02T05:00:16.000Z',
  '2018-03-26T05:00:16.000Z',
  '2018-03-01T05:00:16.000Z',
  '2018-04-03T05:00:16.000Z',
  '2018-04-18T05:00:16.000Z',
  '2018-06-14T05:00:16.000Z',
  '2017-10-02T05:00:16.000Z',
  '11/10/2017              31/05/2018',
  '2020-10-04T05:00:16.000Z',
  '2017-10-06T05:00:16.000Z',
  'EJECUCIÓN',
  43025,
  43112,
  'NO',
  'POSITIVO',
  '8/03/2018',
  'POSITIVO',
  43223,
  43140,
  'VEHICULO',
  'VEHICULO ',
  43140,
  '12/06/2018',
  'POSITIVO',
  '2022-03-01T05:00:16.000Z',
  '10/07/2019',
  '21/09/2017',
  '12/10/2017',
  '23/10/2017',
  '19/02/2018',
  '23/02/2018',
  '23/02/2018',
  '23/10/2017',
  '27/02/2018',
  '2018-03-20T05:00:16.000Z',
  '2017-04-04T05:00:16.000Z',
  '2017-10-13T05:00:16.000Z',
  43025,
  43028,
  43277,
  43277,
  43028,
  'INMUEBLE',
  '50S-597134',
  '31/01/2018',
  '18/09/2018',
  '03/10/2018',
  '17/01/2019',
  '2017-07-15T05:00:16.000Z',
  '2017-10-13T05:00:16.000Z',
  'NOTIFICACION',
  43025,
  43139,
  43403,
  'INMUEBLE',
  'APTO 201 INTERIOR 5 CONJUNTO RESIDENCIAL TERRAGRANDE IV ETAPA  1 PH CARERA 9E N° 36-59 SOACHA',
  '18/05/208',
  '2022-03-02T05:00:16.000Z',
  '2017-05-26T05:00:16.000Z',
  '2017-10-12T05:00:16.000Z',
  43026,
  '2019-01-31T05:00:16.000Z',
  null,
  'CUNDINAMARCA',
  '10/04/2018',
  '2019-11-29T05:00:16.000Z',
  '2032-12-24T05:00:16.000Z',
  '2017-10-12T05:00:16.000Z',
  43027,
  '22/03/18',
  '2020-07-14T05:00:16.000Z',
  '2017-09-16T05:00:16.000Z',
  'EJECUCIÓN',
  43020,
  43031,
  'NO',
  'POSITIVO',
  43248,
  '28/05/2018',
  'POSITIVO',
  '01/06/208',
  43047,
  'BANCOS',
  'RETENCION DE DINEROS',
  43047,
  'FEBRERO 2018',
  'NEGATIVO',
  43252,
  43290,
  600000,
  '2021-11-09T05:00:16.000Z',
  '2025-11-26T05:00:16.000Z',
  '2017-10-18T05:00:16.000Z',
  'SIN LEVANTAMIENTO DE MEDIDSA CAUTELAR  PAQUETE 269',
  '08/11/17',
  '2023-05-31T05:00:16.000Z',
  '2020-10-11T05:00:16.000Z',
  '2017-10-17T05:00:16.000Z',
  '2022-10-24T05:00:16.000Z',
  '10/810/2020',
  '2017-10-20T05:00:16.000Z',
  'EJECUCIÓN',
  43032,
  43048,
  'NO',
  'POSITIVO',
  43137,
  'POSITIVO',
  43209,
  43059,
  'VEHICULO',
  'VEHICULO, PARTICULAR',
  43066,
  '27/11/2017',
  'POSITIVO',
  43209,
  900000,
  43230,
  '2021-01-29T05:00:16.000Z',
  '2031-01-27T05:00:16.000Z',
  '2017-10-20T05:00:16.000Z',
  43032,
  43041,
  43041,
  '50S-40697186',
  43201,
  '22/05/2018',
  '07/09/2018',
  '13/09/2018',
  '2018-09-13T05:00:16.000Z',
  '2017-05-27T05:00:16.000Z',
  '2017-10-23T05:00:16.000Z',
  43032,
  43066,
  43066,
  '50S-40045929',
  '20/09/2018',
  '//',
  '2019-01-14T05:00:16.000Z',
  '2017-04-22T05:00:16.000Z',
  '2017-10-24T05:00:16.000Z',
  43039,
  43171,
  43171,
  'INMUEBLE ',
  '50C-1495315',
  43256,
  '09/10/2018',
  43425,
  '2018-11-21T05:00:16.000Z',
  '23/03/2020',
  '2017-10-04T05:00:16.000Z',
  '2017-10-10T05:00:16.000Z',
  '2017-11-30T05:00:16.000Z',
  '2018-04-25T05:00:16.000Z',
  '2018-07-06T05:00:16.000Z',
  '2019-05-27T05:00:16.000Z',
  '2019-05-27T05:00:16.000Z',
  '2019-06-17T05:00:16.000Z',
  '2017-11-30T05:00:16.000Z',
  '08/11/2017',
  '30-11-2017',
  '2017-11-30T05:00:16.000Z',
  '2017-07-20T05:00:16.000Z',
  '2017-10-24T05:00:16.000Z',
  43039,
  43041,
  '15/06/2018',
  '15/06/2018',
  43041,
  'INMUEBLE',
  '040-265529',
  '-',
  '21/03/2018',
  43312,
  '2019-08-12T05:00:16.000Z',
  '2017-06-08T05:00:16.000Z',
  '2017-10-26T05:00:16.000Z',
  43029,
  43069,
  43069,
  'INMUEBLE',
  '50S-40443064',
  '2020-01-16T05:00:16.000Z',
  '2017-06-22T05:00:16.000Z',
  '2017-10-25T05:00:16.000Z',
  'EJECUCIÓN',
  43039,
  43042,
  '8/06/2018',
  '06/07/2018',
  '20/11/2017',
  'BANCOS',
  'RETENCION DE DINEROS',
  '20/11/2017',
  'DICIEMBRE 2017',
  'POSITIVO (BANCAMIA)',
  '2019-12-19T05:00:16.000Z',
  '2033-03-06T05:00:16.000Z',
  '2017-10-31T05:00:16.000Z',
  43047,
  '06/07/2018',
  43123,
  43123,
  43123,
  '16/03/2018',
  '10/04/2018',
  '06/09/2018',
  '09/10/2018',
  '2019-04-04T05:00:16.000Z',
  '2033-12-05T05:00:16.000Z',
  '2017-10-28T05:00:16.000Z',
  43040,
  43144,
  43315,
  43315,
  43144,
  'I',
  43395,
  '24/01/19',
  43494,
  '2019-12-12T05:00:16.000Z',
  '2030-01-05T05:00:16.000Z',
  '2017-10-26T05:00:16.000Z',
  '2017-11-01T05:00:16.000Z',
  '2017-11-24T05:00:16.000Z',
  '2018-02-15T05:00:16.000Z',
  '2018-02-15T05:00:16.000Z',
  '2018-02-22T05:00:16.000Z',
  '2017-11-24T05:00:16.000Z',
  '2018-08-01T05:00:16.000Z',
  '2018-11-06T05:00:16.000Z',
  '2018-11-13T05:00:16.000Z',
  ' ',
  ' 21/10/2024',
  '2017-10-31T05:00:16.000Z',
  43046,
  43132,
  '16/07/2018',
  43346,
  'POSITIVO',
  '14/09/2018 WILSON',
  43132,
  'INMUEBLE',
  '50S-40530310',
  43143,
  '02/04/2018',
  '-',
  '27/09/2018',
  '2020-11-14T05:00:16.000Z',
  '121594',
  'PERSONAL',
  'INMUBELE',
  '50S-40500899',
  'APARTAMENTO 201 INTERIOR 7  CONJUNTO RESIDENCIAL PORVENIR RESWERVADO 3 RPH CALLE 52 SUR N° 97C-20',
  '15/05/2018',
  '2020-01-16T05:00:16.000Z',
  '2017-12-05T05:00:16.000Z',
  '2017-10-25T05:00:16.000Z',
  43047,
  43220,
  43220,
  43298,
  43406,
  893418,
  '2021-05-23T05:00:16.000Z',
  '2020-10-26T05:00:16.000Z',
  '2017-10-31T05:00:16.000Z',
  'EJECUCIÓN',
  43047,
  43123,
  'NO',
  'POSITIVO',
  '11/05/2018',
  '11/05/2018',
  'POSITIVO',
  '11/05/2018',
  '24/01/2018',
  'VEHICULO',
  'VEHICULO PARTICULAR',
  '-',
  '08/02/2018',
  'POSITIVA HURTADO',
  'PENDIENTE OFICIO AL JUZGADO INFORMANDO HURTO DEL VEHCICULO Y RECONOCIMIENTO DE SINIESTRO SE SOLICITO A AECSA ',
  '2022-08-30T05:00:16.000Z',
  '2018-09-21T05:00:16.000Z',
  '2017-11-02T05:00:16.000Z',
  '7/11/2017  13/12/17 2DA VEZ',
  '19/12/2017          22/032017 REFORMA',
  '19/12/2017          22/032017 REFORMA',
  'BANCOS',
  '22/01/2018',
  '-',
  '-',
  43223,
  745000,
  43230,
  '15/01/2019',
  '2019-02-07T05:00:16.000Z',
  '2027-09-11T05:00:16.000Z',
  '2017-10-25T05:00:16.000Z',
  43046,
  '2018-01-19T05:00:16.000Z',
  '2021-10-20T05:00:16.000Z',
  '2017-10-21T05:00:16.000Z',
  43041,
  43122,
  43122,
  'INMUEBLE',
  '50S-40460503',
  '07/05/18',
  '17/05/18',
  '2018-07-13T05:00:16.000Z',
  '2020-11-21T05:00:16.000Z',
  '2017-10-17T05:00:16.000Z',
  43040,
  43126,
  '20/06/2018',
  43126,
  'INMUEBLE',
  '50S-40536747 ahora 051-146590',
  '02/02/2018',
  '18/05/2018',
  43321,
  '18/09 CORRECCION',
  '2019-12-12T05:00:16.000Z',
  43041,
  '2019-02-06T05:00:16.000Z',
  '2022-11-26T05:00:16.000Z',
  '2017-10-27T05:00:16.000Z',
  43041,
  43073,
  43073,
  '2515',
  '08/03/18',
  '14/11/2017',
  43053,
  43151,
  '-',
  '20/03/2018',
  'INMUEBLE',
  'CARRERA 19 A N° 136 - 73 GARAJE 01 APTO 402 NIVEO 5 O CUARTO PISO EDIFICIO REBECA PH ',
  43179,
  '10/04/2018',
  'POSITIVO',
  '13/08/2018--(5/10/18 SE RADICO MEMORIAL IMPULSO)',
  '28/10/18/',
  '30/03/2019',
  '2017-05-06T05:00:16.000Z',
  '2017-11-01T05:00:16.000Z',
  '2017-12-18T05:00:16.000Z',
  '2020-02-11T05:00:16.000Z',
  '2017-11-01T05:00:16.000Z',
  'EJECUCIÓN',
  43048,
  43088,
  'SI',
  'POSITIVO',
  '4/04/2018',
  'POSITIVO',
  '23/07/2018',
  '17/01/2018',
  'INMUEBLE',
  'POSITIVA',
  '29/08/2018',
  '2020-11-13T05:00:16.000Z',
  '2042-10-09T05:00:16.000Z',
  '2017-10-31T05:00:16.000Z',
  43053,
  '13/07/18',
  '18/10/18',
  '2021-11-11T05:00:16.000Z',
  null,
  43116,
  43284,
  'CERTIMAIL',
  'BANCOS',
  'RETENCION DE DINEROS',
  'FEBRERO 2018',
  'NEGATIVO',
  43329,
  43402,
  '2019-09-25T05:00:16.000Z',
  '2017-06-05T05:00:16.000Z',
  '2017-11-08T05:00:16.000Z',
  '16/11/2017 // 15/03/2018',
  '07/09/2018 aclara 20/09',
  43398,
  '11/12/2018',
  '2017-11-08T05:00:16.000Z',
  '10/11/2017 2DA 18/12/2017',
  43115,
  43115,
  43115,
  '10/05/18',
  '18/05/18',
  '15/01/2020',
  '26/09/2017',
  '10/10/2017',
  '20/10/1017',
  '15/06/2018',
  '2018-06-26T05:00:16.000Z',
  '2018-06-26T05:00:16.000Z',
  '2018-06-26T05:00:16.000Z',
  '2018-06-26T05:00:16.000Z',
  '20/10/12017',
  '8/11/2017',
  '2020-11-30T05:00:16.000Z',
  '2017-11-10T05:00:16.000Z',
  '21/11/2017       6/02/2018',
  43157,
  43157,
  '2020-07-02T05:00:16.000Z',
  '24/05/82021',
  '2017-11-14T05:00:16.000Z',
  43059,
  43066,
  43066,
  '0041',
  'VEHICULO',
  'WLM-303',
  43193,
  '27/04/18',
  '2026-06-22T05:00:16.000Z',
  '2017-11-16T05:00:16.000Z',
  'PORCESO DE INSOLVENCUA',
  '2017-11-20T05:00:16.000Z',
  '2017-11-27T05:00:16.000Z',
  'NO',
  'ABIERTO',
  '6/02/2018',
  '2018-04-24T05:00:16.000Z',
  'POSITIVO',
  '2018-04-12T05:00:16.000Z',
  '2017-12-04T05:00:16.000Z',
  'CASA 1 ',
  'EDIFICIO CASA BIFAMILIAR MARLY PH TRANSVERSAL 17 N° 64F-04 SUR ',
  '2018-01-31T05:00:16.000Z',
  'POSITIVO',
  '2020-04-01T05:00:16.000Z',
  '2017-09-21T05:00:16.000Z',
  '2017-10-19T05:00:16.000Z',
  '2017-11-09T05:00:16.000Z',
  '19/02/2018',
  '6/03/2018',
  '2018-02-27T05:00:16.000Z',
  '2018-02-27T05:00:16.000Z',
  '2018-02-27T05:00:16.000Z',
  '2017-11-09T05:00:16.000Z',
  '2018-01-23T05:00:16.000Z',
  '2021-04-20T05:00:16.000Z',
  '2017-11-09T05:00:16.000Z',
  'SENTENCIA',
  43059,
  43074,
  43139,
  43074,
  'INMUEBLE',
  'INMUEBLE',
  43439,
  '02/803/2018',
  'POSITIVO',
  43269,
  '1,986,000',
  43193,
  '2019-06-18T05:00:16.000Z',
  '2018-09-25T05:00:16.000Z',
  '2017-10-04T05:00:16.000Z',
  'EJECUCIÓN',
  43018,
  43062,
  'NO',
  'POSITIVO',
  '18/06/2020',
  '18/06/2020',
  'POSITIVO',
  '21/06/2018',
  43081,
  'BANCOS',
  'RETENCION DE DINEROS',
  '-',
  'JUNIO 2018',
  'NEGATIVO',
  '11/09/2018',
  810000,
  'PENDIENTE RETIRAR DEL JUZGADO RESULTADO RESPUESTA DE FAMISANAR 3/01/2020',
  '2019-12-18T05:00:16.000Z',
  '2017-07-19T05:00:16.000Z',
  '2017-11-08T05:00:16.000Z',
  43054,
  43076,
  43076,
  '50N-20221967',
  '18/12/2018',
  '02/03/2018',
  'NEGATIVO',
  43179,
  43273,
  560000,
  '22/06/2018',
  '11/01/2019',
  '16/01/19',
  '2019-01-16T05:00:16.000Z',
  '4594250054867309',
  43082,
  'INMUEBLE',
  '50C-1606495',
  '2019-03-27T05:00:16.000Z',
  '2019-07-07T05:00:16.000Z',
  '2017-09-01T05:00:16.000Z',
  43056,
  43131,
  43131,
  'INMUEBLE',
  '50C-1914626',
  43140,
  '12/03/2018',
  'POSITIVO',
  '-',
  43230,
  840000,
  43265,
  '17/08/2018',
  43356,
  '2019-01-31T05:00:16.000Z',
  '9/12/2019       5/03/2020',
  '2017-09-29T05:00:16.000Z',
  '2017-10-06T05:00:16.000Z',
  '2017-10-17T05:00:16.000Z',
  '1/02/2018',
  '1/02/2018',
  '1/02/2018',
  '22/02/2018',
  '2017-10-17T05:00:16.000Z',
  '2017-10-18T05:00:16.000Z',
  '2019-06-05T05:00:16.000Z',
  '2017-11-15T05:00:16.000Z',
  'EJECUCIÓN',
  43061,
  43063,
  'NO',
  'ABIERTO',
  43115,
  43150,
  'POSITIVO',
  43157,
  '04/12/2017',
  'CASA',
  'INMUEBLE',
  43438,
  '02/03/2018',
  'POSITIVO',
  43259,
  '14741200,15',
  434700,
  43257,
  '2021-01-18T05:00:16.000Z',
  '2021-03-17T05:00:16.000Z',
  '2017-11-09T05:00:16.000Z',
  43061,
  43070,
  '5153',
  43235,
  43354,
  '2018-09-11T05:00:16.000Z',
  '2017-11-10T05:00:16.000Z',
  43060,
  43132,
  'OK',
  43236,
  43236,
  43132,
  'INMUEBLE',
  '051-83934',
  43140,
  '24/07/2018',
  43284,
  43322,
  720000,
  43368,
  '2019-03-04T05:00:16.000Z',
  '2/12/2021        3/09/2020',
  '2017-09-28T05:00:16.000Z',
  '2017-10-06T05:00:16.000Z',
  '2017-10-10T05:00:16.000Z',
  '14/09/2018',
  '2018-10-02T05:00:16.000Z',
  '2018-10-24T05:00:16.000Z',
  '2018-10-12T05:00:16.000Z',
  '24/1072018',
  '2017-10-10T05:00:16.000Z',
  '11/10/2017',
  '11/10/2017',
  '02/03/2018',
  '12/10/2017',
  '2016-07-18T05:00:16.000Z',
  '2017-11-14T05:00:16.000Z',
  43062,
  43073,
  43153,
  43187,
  'POSITIVO ',
  43073,
  '50N-20635992',
  43276,
  '2020-05-22T05:00:16.000Z',
  '2020-05-05T05:00:16.000Z',
  '2017-11-15T05:00:16.000Z',
  43062,
  43206,
  43206,
  'VEHICULO',
  'WNR-672',
  '2019-09-02T05:00:16.000Z',
  '2024-02-24T05:00:16.000Z',
  '2017-11-22T05:00:16.000Z',
  43066,
  '12/06/18',
  '26/06/018',
  '2018-08-24T05:00:16.000Z',
  '2019-05-20T05:00:16.000Z',
  '2017-09-29T05:00:16.000Z',
  '2017-10-17T05:00:16.000Z',
  '2017-10-25T05:00:16.000Z',
  '18/07/2018',
  '06/07/2018',
  '06/07/2018',
  '25/04/2019',
  '2017-10-25T05:00:16.000Z',
  '01/11/2017',
  '2018-10-01T05:00:16.000Z',
  '22/06/2018',
  '10/07/2018',
  '2017-05-15T05:00:16.000Z',
  '2017-11-16T05:00:16.000Z',
  'SENTENCIA',
  43066,
  43076,
  43158,
  '15-12-2017',
  'INMUEBLE',
  'INMUEBLE',
  '15/12/2017',
  '02/03/2018',
  'REVISAR',
  43277,
  '29993859',
  1209000,
  '13/04/2018',
  '2019-04-30T05:00:16.000Z',
  '2037-03-01T05:00:16.000Z',
  '2017-11-24T05:00:16.000Z',
  43068,
  43131,
  '22/05/18',
  43266,
  '2018-07-16T05:00:16.000Z',
  '2026-02-21T05:00:16.000Z',
  '  21/11/201',
  43066,
  43083,
  43271,
  43271,
  43083,
  'INMUEBLE',
  '50C-1800283',
  43115,
  '12/03/2018',
  'POSITIVO',
  43217,
  '2019-12-17T05:00:16.000Z',
  '2017-08-03T05:00:16.000Z',
  '2017-11-28T05:00:16.000Z',
  'EL 7 DE SEPTIEMBRE DE 2018 SE TERMINO PROCESO POR PAGO CUOTAS EN MORA // EL 17 DE ENERO DE 2019 SE DEVOLVIERON GARANTIAS A AECSA S.A. // EL 21/09/2018 SE HIZO LEVANTAMIENTO DE MEDIDAS CAUTELARES SEGÚN CERTIFICADO',
  '17/01/2019',
  '2018-09-21T05:00:16.000Z',
  '21/0/2017',
  '04/12/2017',
  '12/12/2017',
  '19-02-2018',
  '13/03/18',
  '2019-02-26T05:00:16.000Z',
  '2017-10-06T05:00:16.000Z',
  '2017-10-12T05:00:16.000Z',
  '2017-10-20T05:00:16.000Z',
  '23/05/2018',
  '01/06/2018',
  '01/06/2018',
  '14/06/2018',
  '2017-10-20T05:00:16.000Z',
  '27/10/2017',
  '27/10/2017',
  'FEBRERO 2018',
  '2018-07-03T05:00:16.000Z',
  '2018-07-13T05:00:16.000Z',
  '29/07/2018',
  '24/11/2017',
  '07/12/2017',
  '02/02/2018',
  '02/02/2018        25/05/2018',
  'INMUEBLE',
  '50C-1554114',
  '12/02/2018',
  '12/03/2018',
  'ESPERA',
  '28/01/19',
  '1/03/19',
  '2019-03-01T05:00:16.000Z',
  '02/03/2024',
  '04/12/2017',
  '12/12/2017',
  '22/03/18',
  '2021-03-26T05:00:16.000Z',
  '2017-09-26T05:00:16.000Z',
  '2017-10-17T05:00:16.000Z',
  '2017-11-23T05:00:16.000Z',
  '15/03/2018',
  '2018-04-27T05:00:16.000Z',
  '2018-04-27T05:00:16.000Z',
  '2018-04-27T05:00:16.000Z',
  '2018-06-05T05:00:16.000Z',
  '23/11/2017              05/06/2018',
  '4/12/2017                      22/06/2018',
  '2018-06-05T05:00:16.000Z',
  '2018-06-26T05:00:16.000Z',
  '2018-07-06T05:00:16.000Z',
  '03/07/2036',
  '05/12/2017',
  '12/12/2017',
  '08/03/2018',
  '21/05/2018',
  '8/03/2018',
  '15/03/2018',
  '15/03/2018',
  '18/05/2018',
  '19/07/2018',
  '28/06/2018',
  '12/07/2018',
  '31/10/2018',
  '06/11/2018',
  '11/12/2018',
  '2210088055/158705',
  'CUNDINAMARCA',
  '16/01/2018',
  'PERSONAL',
  'INMUEBLE',
  '051-135278',
  'CARRERA 4 ESTE N° 38-56 CASA INTERIO R 127 CONJUNTO RESIDECNIAL AZALEAS SOACHA',
  '15/03/2018',
  'POSITIVO',
  '19/06/2018',
  '21/06/2018',
  '12/07/2018',
  '2019-10-28T05:00:16.000Z',
  '26/10/82026',
  '06/12/2017',
  '14/12/2017',
  '18/01/2018',
  43248,
  '18/01/2018',
  'INMUEBLE',
  '50C-1802116      50C-1801617',
  '25/01/2018',
  '29/05/2018',
  'POSITIVO',
  '.',
  '11/01/2019 // 18/01/2019',
  '23/01/19',
  '2019-09-02T05:00:16.000Z',
  '10/03/2023',
  '07/12/2017',
  '14/12/2017',
  '16/05/2018',
  '16/05/2018',
  '24/04/2018',
  'INMUEBLE',
  '50C-1513892',
  '08/05/2018',
  '29/05/2018',
  '12/07/18(30/10/18 SE RADICO IMPULSO Y AUTORIZACION)',
  '20/03/19',
  '2019-09-12T05:00:16.000Z',
  '22/11/2025',
  '11/12/2017',
  'EJECUCIÓN',
  '15/12/2017',
  '30/01/2018',
  'NO',
  'ABIERTO',
  '6/03/2018',
  43197,
  'POSITIVO',
  '8/03/2018',
  '23/02/2018',
  'APARTAMENTO 602',
  'RECHAZO ERRADO',
  '2020-12-16T05:00:16.000Z',
  '10/10/2033',
  '01/12/2017',
  'EJECUCIÓN',
  '12/12/2017',
  '18/12/2017',
  'NO',
  'ABIERTO',
  43222,
  43229,
  'POSITIVO',
  '30/05/2018',
  '22/01/2018',
  'APARTAMENTO 202',
  'INMUEBLE',
  '02/05/2018',
  '19/06/2018',
  'POSITIVO',
  '2022-08-05T05:00:16.000Z',
  '02/05/2026',
  '11/12/2017',
  '18/12/2017     09/02/2018',
  '19/02/2018',
  '19/02/2018',
  '28/09/2018',
  '2019-06-27T05:00:16.000Z',
  '2018-10-08T05:00:16.000Z',
  '2017-10-17T05:00:16.000Z',
  '2017-10-31T05:00:16.000Z',
  '2017-11-29T05:00:16.000Z',
  '2018-05-03T05:00:16.000Z',
  43223,
  '-',
  '2017-11-29T05:00:16.000Z',
  '2017-12-06T05:00:16.000Z',
  '2017-12-06T05:00:16.000Z',
  'FEBRERO 2018',
  '06/02/2030',
  '11/12/2017',
  '14/12/2017',
  '12/02/2018',
  '20/06/2018',
  '20/06/2018',
  '12/02/2018',
  'INMUEBLE',
  '50C-1915620',
  '14/03/2018',
  '29/05/2018',
  '2019-12-17T05:00:16.000Z',
  '2024-07-31T05:00:16.000Z',
  '2018-01-11T05:00:16.000Z',
  '19/01/2018',
  '2018-04-21T05:00:16.000Z',
  '18/01/2018',
  '22/01/2018',
  '23/01/2018',
  '23/01/2018',
  'INMUEBLE',
  '166-45853',
  43130,
  '04/04/2018',
  43237,
  'PENDIENTE RADICAR MEMORIAL',
  '2019-05-22T05:00:16.000Z',
  '2024-08-26T05:00:16.000Z',
  '15/01/2018',
  '22/01/2018',
  '2018-06-01T05:00:16.000Z',
  '2034-08-24T05:00:16.000Z',
  '15/01/2018',
  '22/01/2018',
  43147,
  43257,
  43257,
  43147,
  'INMUEBLE',
  '50S-40043736',
  546,
  '15/05/2018',
  43346,
  43360,
  '2019-01-23T05:00:16.000Z',
  '2019-04-29T05:00:16.000Z',
  '2018-01-17T05:00:16.000Z',
  '2018-08-22T05:00:16.000Z',
  '2018-09-27T05:00:16.000Z',
  '17/01/2018',
  '24/01/2018',
  43129,
  '14/09/2018 GLADIS',
  43129,
  'BANCOS ',
  43136,
  'ABRIL 2018',
  43364,
  43370,
  '2018-09-27T05:00:16.000Z',
  '4594250463791785',
  'PEDIR DE DNP 348 , PEDIR HSQ367',
  'NEGATIVO',
  '2019-09-16T05:00:16.000Z',
  '2027-08-31T05:00:16.000Z',
  '11/01/2018',
  'EJECUCIÓN',
  '24/01/2018',
  43138,
  'NO',
  'ABIERTO',
  43223,
  43223,
  'POSITIVO',
  43245,
  '14/02/2018',
  'CASA VILLA DE LOS ALPES',
  'INMUEBLE',
  43145,
  '02/04/2018',
  'POSITIVO',
  43245,
  43272,
  4100000,
  43272,
  '2022-08-30T05:00:16.000Z',
  '2027-08-31T05:00:16.000Z',
  '11/01/2018',
  'EL 2/07/2021 EL JUZGADO DECRETA TERMINACION PROCESO POR PAGO CUOTAS EN MORA //EL 30/08/2022 SE DEVOLVIERON GARANTIAS Y DESGLOSE A AECSA // EL 4/05/2022 LA OFICIAN DE REGISTRO LEVANTO MEDIDA CAUTELAR DE EMBARGO',
  44685,
  '2022-05-04T05:00:16.000Z',
  '2027-09-06T05:00:16.000Z',
  '18/01/2017',
  '24/01/2018',
  '06/03/018',
  '2019-09-08T05:00:16.000Z',
  '11/01/2018',
  'NOTIFICACION',
  '25/01/2018',
  43153,
  'X',
  'OK',
  43172,
  'BANCOS',
  'RETENCION DE DINEROS',
  43172,
  'ABRIL 2018',
  '2020-09-17T05:00:16.000Z',
  '2024-03-16T05:00:16.000Z',
  '2018-01-18T05:00:16.000Z',
  '26/01/2018 //02/04/2018',
  43242,
  43242,
  '18/06/18',
  '2025-06-07T05:00:16.000Z',
  '2018-01-24T05:00:16.000Z',
  43130,
  43146,
  'X',
  43269,
  43269,
  43146,
  'INMUEBLE',
  '50C-1777698',
  '12/03/2018',
  'POSITIVO',
  43235,
  43272,
  1630535,
  43279,
  '2019-12-17T05:00:16.000Z',
  '2019-07-29T05:00:16.000Z',
  '2018-01-19T05:00:16.000Z',
  'NOTIFICACION',
  43130,
  43137,
  43150,
  'BANCOS ',
  'RETENCION DE DINEROS',
  43150,
  'ABRIL 2018',
  '2020-07-10T05:00:16.000Z',
  '2020-11-10T05:00:16.000Z',
  '2017-11-16T05:00:16.000Z',
  '2022-08-18T05:00:16.000Z',
  '2019-05-05T05:00:16.000Z',
  '2017-11-09T05:00:16.000Z',
  '2017-11-20T05:00:16.000Z',
  '2018-02-12T05:00:16.000Z',
  '28(\'8/2018',
  '2018-09-14T05:00:16.000Z',
  '2018-10-06T05:00:16.000Z',
  '2018-10-12T05:00:16.000Z',
  '2018-10-12T05:00:16.000Z',
  '2018-02-12T05:00:16.000Z',
  '2018-02-20T05:00:16.000Z',
  'NO ESTA',
  'NO ESTA',
  '26/11/2020',
  '29/01/2018',
  '05/02/2018',
  43153,
  43153,
  'INMUEBLE',
  '307-33624',
  '-',
  '11/04/2018',
  43361,
  43362,
  '2018-09-20T05:00:16.000Z',
  '18/07/2018-28/01/19',
  '8/02/19',
  '2019-02-08T05:00:16.000Z',
  '2020-07-21T05:00:16.000Z',
  '2017-11-16T05:00:16.000Z',
  '2017-11-20T05:00:16.000Z',
  '2018-01-17T05:00:16.000Z',
  '5/04/2020',
  '2018-04-09T05:00:16.000Z',
  '2020-05-11T05:00:16.000Z',
  '2018-06-08T05:00:16.000Z',
  '2020-04-09T05:00:16.000Z',
  '2018-01-17T05:00:16.000Z',
  '2018-01-24T05:00:16.000Z',
  '2018-01-24T05:00:16.000Z',
  '02/03/2018',
  '26/02/2033',
  '29/01/2018',
  'LIQUIDACION',
  '05/02/2018',
  '18/04/2018',
  '20/06/2018',
  '10/05/2018',
  'INMUEBLE',
  'INMUEBLE',
  '10/05/2018',
  '14/06/2018',
  '06/09/2018',
  '2020-08-19T05:00:16.000Z',
  '2020-08-22T05:00:16.000Z',
  '2017-11-09T05:00:16.000Z',
  '2017-11-20T05:00:16.000Z',
  '2018-04-12T05:00:16.000Z',
  '11/06/2019',
  '2019-07-31T05:00:16.000Z',
  '2019-07-03T05:00:16.000Z',
  '2019-07-31T05:00:16.000Z',
  '2019-12-12T05:00:16.000Z',
  '2018-04-12T05:00:16.000Z',
  '19/04/2018',
  '19/04/2018',
  '07/06/2018',
  '29/01/2018',
  '05/02/2018',
  '22/03/2018',
  '04/05/2018',
  '04/05/2018',
  '22/03/2018',
  'VEHICULO E INMUBELE',
  'HKN-819 IWK995 UCX535------50C-1943765',
  '05/04/2018',
  '30/05/2018//29/05/2018',
  '2019-02-20T05:00:16.000Z',
  '08/07/2033',
  '25/01/2018',
  '05/02/2018',
  '22/03/2018',
  '06/06/2018',
  '06/06/2018',
  '22/03/2018',
  'INMUEBLE',
  '50C-1790008',
  '05/04/2018',
  '29/05/2018',
  '18/01/2019',
  '24/01/19',
  '2019-03-27T05:00:16.000Z',
  '29/09/2018',
  '29/01/2018',
  '05/02/2018',
  '2019-08-23T05:00:16.000Z',
  '2019-06-08T05:00:16.000Z',
  '2017-11-15T05:00:16.000Z',
  '2017-11-21T05:00:16.000Z',
  '2017-09-06T05:00:16.000Z',
  '2018-05-13T05:00:16.000Z',
  '2018-05-30T05:00:16.000Z',
  '2018-05-18T05:00:16.000Z',
  '2018-05-30T05:00:16.000Z',
  '2018-06-07T05:00:16.000Z',
  '2017-09-06T05:00:16.000Z',
  '2017-09-18T05:00:16.000Z',
  '2018-01-31T05:00:16.000Z',
  'FEBRERO 2018',
  '2018-06-07T05:00:16.000Z',
  '2018-06-13T05:00:16.000Z',
  '2018-06-26T05:00:16.000Z',
  '31/05/2022',
  '19/01/2018',
  'CURADOR AD LITEM',
  '06/02/2018',
  '07/07/2018',
  'NO',
  'ABIERTO',
  43285,
  'NEGATIVO',
  'CURADOR AD LITEM',
  '21/07/2018',
  'PREDIO RURAL ALTO DE LOS MIRTOS LA MESA',
  'INMUEBLE UBICADO EN LA MESA',
  'X',
  'OCTUBRE 2018',
  'POSITIVO',
  'VERIFICAR EN EL JUZGADO EL NOMBRAMIENTO DE CURADOR AD LITEM Y RESPUESTA SI PROPONE EXEPCIONES',
  '29/01/2044',
  '24/01/2018',
  '07/02/2018',
  '10/04/2018',
  'PERSONAL',
  '10/04/2018',
  'INMUEBLE',
  '051-152724',
  '18/04/2018',
  '19/05/2018',
  'POSITIVO',
  'INMUEBLE',
  'MARIA XIMENA MEJIA',
  '12/07/2018',
  '26/07/2018',
  3061400,
  '28/08/2018',
  '26/07/2018',
  '02/10/2018',
  '2018-11-16T05:00:16.000Z',
  '12/02/2033',
  '25/01/2018',
  '08/02/2018',
  '26/04/2018',
  '20/06 ANGELICA FISICO',
  '20/06 ANGELICA FISICO',
  '26/04/2018',
  'INMUEBLE',
  '50S-40622189',
  '09/05/2018',
  '15/09/2018',
  '13/06/18',
  '16/07/2017',
  '15/09/18',
  '21/12/2020',
  '23/01/2018',
  ' 09/02/2018',
  '16/02/2018// ACLARACION',
  'PERSONAL',
  43147,
  'INMUEBLE',
  '307-1623',
  '26/02/2018',
  '111/04/2018',
  '11/09/2018',
  '2018-11-30T05:00:16.000Z',
  '15/10/2017',
  '15/02/2018',
  '20/02/2018',
  '01/06/18',
  '26/07/2022',
  '15/02/2018',
  '20/02/2018',
  '26/02/2018',
  '26/02/2018',
  '27/04/18',
  '3/8/2017',
  '15/02/2018',
  '20/02/2018',
  '2018-04-27T05:00:16.000Z',
  '28/08/2033',
  '15/02/2018',
  '21/02/2018',
  '14/03/2018',
  '10/06/2018',
  '10/06/2018',
  '14/03/2018',
  'INMUEBLE',
  '50S-40616980',
  '22/03/2018',
  '18/05/2018',
  '24/07/2018',
  900000,
  '14/12/2018',
  '22/01/19',
  '2020-01-14T05:00:16.000Z',
  '27/0/2021',
  '2018-02-15T05:00:16.000Z',
  '2018-02-22T05:00:16.000Z',
  '01/03/20108            2/03/2018',
  '2018-04-08T05:00:16.000Z',
  '2018-04-10T05:00:16.000Z',
  '2018-04-19T05:00:16.000Z',
  '2018-03-01T05:00:16.000Z',
  '09/03/2018',
  '2018-03-09T05:00:16.000Z',
  '2018-06-28T05:00:16.000Z',
  '27/08/2018',
  '25/096/2018',
  '02/08/2018',
  '27/08/2018',
  '11/07/2018',
  '15/10/2033',
  '15/02/2018',
  '23/02/2018',
  '01/03/2018',
  '18/07/2018',
  '18/07/2018',
  '01/03/2018',
  'INMUEBLE',
  '50S-40507368',
  '09/03/2018',
  '15/05/2018',
  '21/09/2018',
  '24/09/2018',
  '17/01/2019',
  '2024-01-26T05:00:16.000Z',
  '2017-11-16T05:00:16.000Z',
  '2017-11-27T05:00:16.000Z',
  '2018-12-01T05:00:16.000Z',
  '30/01/2018',
  '30/01/2018',
  '20/06/2018',
  '20/06/2018',
  '29/06/2018',
  '2018-12-01T05:00:16.000Z',
  '2017-12-13T05:00:16.000Z',
  '2017-12-13T05:00:16.000Z',
  '13/03/2018',
  '2018-07-11T05:00:16.000Z',
  '2018-07-24T05:00:16.000Z',
  '06/06/2018',
  '15/08/2018',
  '22/02/2018',
  '03/04/2018',
  '11/05/2018',
  '11/05/2018',
  '05/04/2018',
  'INMUEBLE',
  '50S-40569094',
  '17/04/2018',
  '15/05/2018',
  '15/01/2019',
  '11/02/19',
  '2019-08-24T05:00:16.000Z',
  '2018-06-20T05:00:16.000Z',
  '2018-02-15T05:00:16.000Z',
  '2018-02-28T05:00:16.000Z',
  '2018-03-22T05:00:16.000Z',
  '2018-05-18T05:00:16.000Z',
  '18/05/2018',
  '2018-05-18T05:00:16.000Z',
  '2018-05-18T05:00:16.000Z',
  '2018-03-22T05:00:16.000Z',
  '2018-04-02T05:00:16.000Z',
  '2018-06-07T05:00:16.000Z',
  '12/02/2018',
  '  22/04/2018',
  '03/04/2018',
  43227,
  43227,
  'INMUEBLE',
  '50S-40460026',
  '2019-04-30T05:00:16.000Z',
  '2034-06-24T05:00:16.000Z',
  '2018-04-16T05:00:16.000Z',
  43216,
  43238,
  43238,
  'INMUEBLE',
  '051-156155',
  43278,
  '2018-07-16T05:00:16.000Z',
  '2026-12-28T05:00:16.000Z',
  '2018-04-16T05:00:16.000Z',
  43216,
  43293,
  '2018-07-28T05:00:16.000Z',
  '2035-04-20T05:00:16.000Z',
  '2018-04-12T05:00:16.000Z',
  43216,
  43238,
  43238,
  'INMUEBLE',
  '051-177721',
  'POSITIVO',
  43483,
  43486,
  '2019-09-12T05:00:16.000Z',
  '17/07/2020 // 3/05/2020',
  '2018-04-12T05:00:16.000Z',
  'EJECUCIÓN',
  43215,
  43252,
  'NO',
  'ABIERTO',
  43265,
  'POSITIVO',
  43276,
  43286,
  'VEHICULO',
  'VEHICULO',
  43286,
  '13/08/2018',
  'POSITIVO',
  '2022-02-22T05:00:16.000Z',
  null,
  43264,
  'INMUEBLE',
  '50S-40709261',
  '2019-03-29T05:00:16.000Z',
  '2020-02-02T05:00:16.000Z',
  '2017-11-14T05:00:16.000Z',
  'EJECUCIÓN',
  43063,
  '19/02/2018                         12/04/2018',
  'SI',
  'POSITIVO',
  43300,
  43340,
  'POSITIVO',
  '14/09/2018',
  '16/05/2018',
  'BANCOS',
  'NEGATIVO',
  '20/01/2023 SOLICITAR OFICIO AL JUZGADO INFORMACION A SANITAS // 24 ENERO 2023 NEGO ABONO FNG QUE SE HACE ?? // 3 FEB 2023 ENVIAR DERECHO PETICION A FNG PARA CERTIFICAR VALOR . // 28 MARZO RTA DERECHO PETICION FNG // 20 ABRIL TERMINACION POR FNG /// OJO INTERPONER RECURSO ',
  '2/09/2021 / 3/01/2021',
  '19/11/2017',
  '06/12/2017',
  '20-02-2018',
  '7/05/2018',
  '2018-10-09T05:00:16.000Z',
  '2018-10-09T05:00:16.000Z',
  '2018-10-09T05:00:16.000Z',
  '20/0572019',
  '16/02/2018',
  '28/02/2018',
  '2018-04-12T05:00:16.000Z',
  '19//04/2018',
  43227,
  'INMUEBLE',
  '156-32918',
  43221,
  '24/05/2018',
  43425,
  43446,
  '2018-12-12T05:00:16.000Z',
  null,
  43231,
  'INMUEBLE',
  '50N-314128',
  '2018-07-05T05:00:16.000Z',
  '08/07/2020',
  '01/12/2017',
  '12/12/2017',
  '14/12/2017',
  '22/02/2018',
  '30/05/2018',
  '2018-03-26T05:00:16.000Z',
  '30/05/2018',
  '30/05/2018',
  '14/12/2017',
  '25/01/2018',
  '25/01/2018',
  'FEBRERO 2018',
  '19/12/2018',
  '07/11/2018',
  '2018-04-24T05:00:16.000Z',
  43217,
  43231,
  '18/09/2018 FINANZAUTO',
  43231,
  'VEHICULO',
  'JEO-395',
  43241,
  '12/06/2018',
  'POSITIVO',
  'PENDIENTE APOTAR CERTIFICADO',
  43308,
  43347,
  500000,
  43355,
  43476,
  43489,
  '2019-01-14T05:00:16.000Z',
  '03/0/82024',
  '2018-04-16T05:00:16.000Z',
  'EJECUCIÓN',
  43215,
  43269,
  'NO',
  'ABIERTO',
  43404,
  'POSITIVO',
  43404,
  43325,
  'APTO 403',
  'POSITIVO',
  '2022-03-02T05:00:16.000Z',
  '2024-12-30T05:00:16.000Z',
  '2018-04-16T05:00:16.000Z',
  43215,
  43229,
  43284,
  43284,
  43229,
  'INMUEBLE',
  '50S-40533250',
  43231,
  '14/06/2018',
  43357,
  43501,
  '2019-02-18T05:00:16.000Z',
  '18/02/82020',
  '2018-04-12T05:00:16.000Z',
  'EL 4/09/2019 SE DEVUELVE DESGLOSE CON GARANTIAS A AECSA // EL 18/03/2019 EL JUZGADO DA POR TERMINADO PROCESO POR PAGO CUOTAS EN MORA // EL 2/11/2022 SE PIDIO CERTIFICADO CON LEVANTAMIENTO DE MEDIDA CAUTELAR',
  43650,
  '2019-03-18T05:00:16.000Z',
  '2025-02-24T05:00:16.000Z',
  '2018-04-25T05:00:16.000Z',
  43228,
  43243,
  43476,
  43243,
  'INMUEBLE',
  '50C-781766',
  '2019-06-27T05:00:16.000Z',
  '2018-04-26T05:00:16.000Z',
  43198,
  43237,
  43237,
  43502,
  43537,
  '2019-03-13T05:00:16.000Z',
  '2021-01-16T05:00:16.000Z',
  '2018-01-19T05:00:16.000Z',
  '2018-02-01T05:00:16.000Z',
  '2018-02-26T05:00:16.000Z',
  '2018-05-08T05:00:16.000Z',
  '2018-05-08T05:00:16.000Z',
  '2018-07-16T05:00:16.000Z',
  '2018-05-03T05:00:16.000Z',
  '2019-05-05T05:00:16.000Z',
  '2019-09-11T05:00:16.000Z',
  '5/0572019',
  '2018-02-26T05:00:16.000Z',
  '2018-03-06T05:00:16.000Z',
  '2017-03-06T05:00:16.000Z',
  '10/04/2018',
  '2018-05-31T05:00:16.000Z',
  '2018-04-30T05:00:16.000Z',
  43228,
  43266,
  43266,
  'INMUEBLE',
  '156-137073',
  43476,
  43487,
  '2019-01-22T05:00:16.000Z',
  '2018-04-26T05:00:16.000Z',
  '08/05/20184',
  43238,
  43238,
  43248,
  43330,
  43346,
  '2019-04-23T05:00:16.000Z',
  '2028-04-10T05:00:16.000Z',
  '2018-04-27T05:00:16.000Z',
  43228,
  '2020-01-14T05:00:16.000Z',
  null,
  43258,
  'VEHICULO',
  'WNT-203',
  '2019-09-02T05:00:16.000Z',
  '2023-04-05T05:00:16.000Z',
  '2018-04-27T05:00:16.000Z',
  'NOTIFICACION',
  43229,
  43235,
  43266,
  43285,
  43243,
  'INMUEBLE',
  '      ',
  '2019-08-21T05:00:16.000Z',
  null,
  'NO TIENE EN CUENTA',
  'INMUEBLE',
  '156-14306',
  'INMUEBLE',
  '19/07/2018',
  'POSITIVO',
  43335,
  '2019-10-17T05:00:16.000Z',
  '2021-04-04T05:00:16.000Z',
  '2018-05-15T05:00:16.000Z',
  43242,
  '2019-12-17T05:00:16.000Z',
  '2025-08-18T05:00:16.000Z',
  '2018-05-16T05:00:16.000Z',
  43242,
  43378,
  43749,
  '2019-08-23T05:00:16.000Z',
  '2018-05-23T05:00:16.000Z',
  43251,
  43339,
  43361,
  '2019-01-31T05:00:16.000Z',
  '23/05/2021 // 15/11/2020',
  '2018-05-29T05:00:16.000Z',
  'EJECUCIÓN',
  43251,
  43271,
  'SI',
  'POSITIVO',
  43297,
  43293,
  'POSITIVO',
  43383,
  43367,
  'CASA EN FIRAVITOVA',
  'CUOTA PARTE',
  'POSITIVO',
  '2021-07-02T05:00:16.000Z',
  '2018-05-29T05:00:16.000Z',
  43251,
  43381,
  43383,
  '2018-10-10T05:00:16.000Z',
  '2028-06-26T05:00:16.000Z',
  '2018-05-15T05:00:16.000Z',
  43251,
  43293,
  '2018-08-18T05:00:16.000Z',
  '2018-05-29T05:00:16.000Z',
  43251,
  '2020-06-09T05:00:16.000Z',
  '2032-09-18T05:00:16.000Z',
  '2018-05-23T05:00:16.000Z',
  43251,
  43343,
  '2018-09-15T05:00:16.000Z',
  '3/01/2021 // 2/02/2021',
  '15/06/25018',
  'EJECUCIÓN',
  43270,
  43277,
  'NO',
  'ABIERTO',
  43314,
  'POSITIVO',
  43314,
  '13/0/2018',
  'VEHÍCULO',
  'POSITIVO',
  939000,
  'RADICAR MEMORIAL DESITIENDO DE LA CAUCIÓN, REITERAR LA CAPTURA O APREHENSIÓN DEL VEHÍCULO Y QUE EL MISMOS E HUBICADO EN UNO DE LOS PARQUEADEROS AUTORIZADOS INFORMADOS A SU DESPACHO',
  '2021-05-14T05:00:16.000Z',
  '2018-05-08T05:00:16.000Z',
  43270,
  43299,
  43299,
  'IJS-528',
  '2020-02-21T05:00:16.000Z',
  null,
  43277,
  'FISICO',
  'INMUEBLE',
  '50S-40549521',
  'INMUBELE',
  '15/08/2017',
  '2019-09-19T05:00:16.000Z',
  '2028-07-03T05:00:16.000Z',
  '2018-06-14T05:00:16.000Z',
  'EJECUCIÓN',
  43270,
  43299,
  'SI',
  'POSITIVO',
  43309,
  'POSITIVO',
  43495,
  43307,
  'APTO 301 PARQUE CAMPESTRE ETAPA 8 SOACHA',
  'POSITIVO',
  '21 OCTUBRE TERMINACION POR PAGO TOTAL . A LA ESPERA AUTO. / A AUTOS 4 DE3 NOV NO HA SALIDO TERMINACION.',
  '10//11/2022',
  null,
  '2019-09-19T05:00:16.000Z',
  '2027-10-27T05:00:16.000Z',
  '2018-06-21T05:00:16.000Z',
  '2018-07-13T05:00:16.000Z',
  '2021-01-15T05:00:16.000Z',
  '2018-06-21T05:00:16.000Z',
  'EJECUCIÓN',
  '26/0772018',
  43306,
  'NO',
  'ABIERTO',
  43333,
  'POSITIVO',
  43333,
  43334,
  'URBANIZACIÓN LA MARICHUELA 1 LOTE 14 MANZANA 55',
  'POSITIVO',
  '2022-07-13T05:00:16.000Z',
  '15/11/2020 // 17/11/2020',
  '2018-06-19T05:00:16.000Z',
  'EJECUCIÓN',
  43277,
  43399,
  'SI',
  'POSITIVO',
  43524,
  'POSITIVO',
  43599,
  43489,
  'INMUEBLE LOTU 83 A URBANIZACION PARIS',
  'POSITIVO',
  'REVISAR AL DESPACHO CESIÓN DEL CREDITO Y REVISAR EN ALCALDIA DE ENGATIVA FECHA DE DILIGENCIA',
  '2022-01-28T05:00:16.000Z',
  '2021-01-22T05:00:16.000Z',
  '2018-06-19T05:00:16.000Z',
  43277,
  '04/07/2018',
  '30/08/2018',
  '18/09/2018',
  '17/01/2019',
  '2018-06-28T05:00:16.000Z',
  'LIQUIDACION',
  43287,
  '11/09/2018',
  '2019-04-11T05:00:16.000Z',
  '07/03/2020',
  '29/01/2018',
  '05/02/2018',
  '2018-02-26T05:00:16.000Z',
  '2018-06-20T05:00:16.000Z',
  '2018-06-20T05:00:16.000Z',
  '2018-08-10T05:00:16.000Z',
  '13/08/2018',
  '2018-09-10T05:00:16.000Z',
  '2018-02-26T05:00:16.000Z',
  '2018-05-10T05:00:16.000Z',
  '2018-05-10T05:00:16.000Z',
  'JUNIO 2018',
  '2018-09-10T05:00:16.000Z',
  '2018-09-24T05:00:16.000Z',
  '2018-09-27T05:00:16.000Z',
  '2018-06-26T05:00:16.000Z',
  43284,
  43396,
  'CERTIMAIL',
  43417,
  '23/10/2018',
  '2021-06-02T05:00:16.000Z',
  '2021-02-04T05:00:16.000Z',
  '2018-06-26T05:00:16.000Z',
  'EJECUCIÓN',
  43280,
  43325,
  'NO',
  'ABIERTO',
  43371,
  'POSITIVO',
  '28/09/2018',
  '21/08/2018',
  'PREDIO RURAL SANTA HELENA EN ORTEGA - TOLIMA',
  'POSITIVO',
  '2022-01-31T05:00:16.000Z',
  '2018-06-29T05:00:16.000Z',
  43287,
  43314,
  'X',
  '11/01/2019',
  '4/02/19',
  '2019-02-04T05:00:16.000Z',
  '2021-01-29T05:00:16.000Z',
  '2018-06-29T05:00:16.000Z',
  'PENDIENTE CURADOR AD LITEM',
  43287,
  43356,
  'SI',
  'NEGATIVO',
  43382,
  'POSITIVO',
  '09/10/2018',
  '25/09/2018',
  'LOTE 12 MANZANA J URB. LOS ROBLES',
  'POSITIVO',
  '2021-04-21T05:00:16.000Z',
  '2019-01-26T05:00:16.000Z',
  '2018-07-09T05:00:16.000Z',
  43299,
  '15/09/18',
  '15/0/2020',
  '29/01/2018',
  '05/02/2018',
  '26/02/2018',
  '13/06/2018',
  '30/05/2018',
  '30/05/2018',
  '04/06/2018',
  '26/02/2018',
  '08/03/2018',
  '08/03/2018',
  '03/05/2018',
  '04/06/2018',
  '09/07/2018',
  '19/07/2018',
  '2018-09-21T05:00:16.000Z',
  '2024-06-30T05:00:16.000Z',
  '2018-07-16T05:00:16.000Z',
  43304,
  43335,
  '2019-09-04T05:00:16.000Z',
  null,
  '2019-04-23T05:00:16.000Z',
  '2021-03-17T05:00:16.000Z',
  '2018-07-10T05:00:16.000Z',
  'EJECUCIÓN',
  43299,
  43304,
  'NO',
  'ABIERTO',
  43524,
  'POSITIVO',
  43524,
  43312,
  'APTO 214',
  'INMUEBLE',
  '15/08/2018',
  'POSITIVO',
  '2020-10-29T05:00:16.000Z',
  '2043-07-04T05:00:16.000Z',
  '2018-07-06T05:00:16.000Z',
  'EJECUCIÓN',
  43293,
  43313,
  'NO',
  'ABIERTO',
  43524,
  'POSITIVO',
  43418,
  43321,
  'APTO 303',
  'POSITIVO',
  '2018-11-12T05:00:16.000Z',
  '4/02/2021 // 16/02/2021',
  '2018-07-05T05:00:16.000Z',
  '2018-07-12T05:00:16.000Z',
  '2019-05-07T05:00:16.000Z',
  '2019-09-28T05:00:16.000Z',
  '2019-09-28T05:00:16.000Z',
  '2020-01-29T05:00:16.000Z',
  '2019-05-14T05:00:16.000Z',
  '2019-05-14T05:00:16.000Z',
  null,
  '22/08/2018 EN CORRECCION',
  'FALLA',
  'X',
  '2019-09-12T05:00:16.000Z',
  '2027-03-02T05:00:16.000Z',
  '2018-07-29T05:00:16.000Z',
  43312,
  '12/09/2018',
  '18/09/18',
  '17/01/2019',
  '3/05/2020 // 17/04/2020',
  '29/01/2018',
  '05/02/2018',
  '29/05/2018',
  '6/08/2018',
  '2018-08-06T05:00:16.000Z',
  '2018-08-06T05:00:16.000Z',
  '2018-10-12T05:00:16.000Z',
  '2018-10-12T05:00:16.000Z',
  '29/05/2018',
  '06/06/2018',
  null,
  'CUNDINAMARCA',
  '27/09/2018 EN CORRECCION',
  '2019-12-11T05:00:16.000Z',
  '2020-06-08T05:00:16.000Z',
  '2018-08-03T05:00:16.000Z',
  'EJECUCIÓN',
  43321,
  43346,
  'NO',
  'ABIERTO',
  43410,
  'POSITIVO',
  '25/02/2019',
  '3/0972018',
  'PREDIO RURAL LOTE 6',
  'POSITIVO',
  '2020-10-20T05:00:16.000Z',
  '2022-11-15T05:00:16.000Z',
  '2018-08-01T05:00:16.000Z',
  43321,
  43364,
  '11/01/2019',
  '3/04/19',
  '2019-04-03T05:00:16.000Z',
  null,
  43350,
  'X',
  43381,
  '2019-10-01T05:00:16.000Z',
  '15/06/2022',
  '26 07/2018',
  '09/08/2018',
  43390,
  'CERTIMAIL',
  43412,
  '22/01/19',
  '289/01/19',
  '2019-01-14T05:00:16.000Z',
  '13/03/2022',
  '03/08/2018',
  '09/08/2018',
  43398,
  'CERTIMAIL',
  43417,
  '2020-03-03T05:00:16.000Z',
  'X',
  '08/10/2018',
  '2019-10-01T05:00:16.000Z',
  '04/01/2030',
  '15/08/208',
  '10/09/2018',
  '2019-07-23T05:00:16.000Z',
  '03/08//2019',
  '15/02/2018',
  '2018-02-22T05:00:16.000Z',
  '22/03/2018',
  '19/06/2018',
  '18/05/2018',
  '2018-06-19T05:00:16.000Z',
  '18/05/2018',
  '7/06/2018',
  '02/04/2018',
  '2/04/2018',
  '02/04/2018',
  'JUNIO 2018',
  '7/06/2018',
  '13/06/2018',
  '17/09/2018',
  '2018-10-02T05:00:16.000Z',
  '2019-08-26T05:00:16.000Z',
  '2020-08-15T05:00:16.000Z',
  '2018-04-21T05:00:16.000Z',
  '2018-04-25T05:00:16.000Z',
  '2018-05-08T05:00:16.000Z',
  '2018-06-13T05:00:16.000Z',
  '2018-06-13T05:00:16.000Z',
  '2018-06-13T05:00:16.000Z',
  '2018-06-12T05:00:16.000Z',
  '2018-05-08T05:00:16.000Z',
  '2018-05-28T05:00:16.000Z',
  '2018-07-05T05:00:16.000Z',
  '2018-07-12T05:00:16.000Z',
  '13/12/2019',
  '31/08/2018',
  '11/09/2018',
  '11/10/2018',
  '19/10/2018',
  '07/12/2018',
  '23/08/*2018',
  '6/09/2018',
  '22/10/2018',
  'CERTIMAIL',
  '13/11/2018',
  '22/10/2018',
  '2020-01-21T05:00:16.000Z',
  '15/04/2021 // 6/04/2021',
  '23/08/2018',
  '13/09/2018',
  '27/09/2018',
  '23/0772019',
  '23/0772019',
  '18/10/2018',
  '18/10/2018',
  '03/9/2018',
  '13/09/2018',
  '27/09/2018',
  '27/09/2018',
  '2019-12-05T05:00:16.000Z',
  '22/08/2018',
  '13/09/2018',
  '08/10/2018',
  'CERTIMAIL',
  '29/11/2018',
  '11/01/2019',
  '13/02/19',
  '2019-08-30T05:00:16.000Z',
  '21/21/2021',
  '3/09/2018',
  '13/09/2018',
  '2021-05-24T05:00:16.000Z',
  '21/11/2032',
  '6/09/2018',
  'NOTIFICACIÓN',
  '18/09/2018',
  '10/0572019',
  'SI',
  'NEGATIVO',
  '05/0972019',
  'POSITIVO',
  '17/05/2019',
  'APTO 602',
  'POSITIVO',
  '2021-10-28T05:00:16.000Z',
  '3/09/2018',
  '18/09/2018',
  '25/01/19',
  '07/02/19',
  '2020-09-17T05:00:16.000Z',
  '10/08/2018',
  '18/09/2018',
  '2019-06-27T05:00:16.000Z',
  null,
  'CUNDINAMARCA',
  '02/10/2018',
  'CERTIMAIL',
  '29/11/2018',
  '|',
  '2020-02-06T05:00:16.000Z',
  null,
  'CUNDINAMARCA',
  '2019-08-28T05:00:16.000Z',
  '19/02/2025',
  '13/09/2018',
  '20/09/2018',
  '2020-12-11T05:00:16.000Z',
  null,
  'CUNDINAMARCA',
  '02/11/2018',
  'CERTIMAIL',
  'INMUEBLE',
  '051-116202',
  'CONJUNTO RESIDENCIAL ALAMEDA DE SANTA ANA ',
  '2019-03-26T05:00:16.000Z',
  '15/05/2021 // 5/07/2021 // 5/07/2021',
  '3/09/2018',
  'EMBARGO DE REMANENTES JUZGADO 27 PROCESO 2019 - 00251',
  '20/09/2018',
  'NO',
  'POSITIVO',
  '02/11/2018',
  'POSITIVO',
  'CORREO',
  '1906-04-06T04:56:16.000Z',
  'REVOCADO POR OFICINA DE REGISTRO',
  '18/09/2018',
  '25/09/2018',
  '03/10/2018',
  'X',
  '02/11/2018',
  '2019-10-17T05:00:16.000Z',
  '6/09/2018',
  '29/09/2018',
  '18/01/19',
  '2020-01-14T05:00:16.000Z',
  '2026-01-14T05:00:16.000Z',
  '13/09/2018',
  '26/09/2018',
  '25/10/2018',
  'FALLA',
  '14/12/18',
  '15/02/19',
  '2019-10-01T05:00:16.000Z',
  '05/08/2021 // 07/05/2018',
  '18/09/2018',
  'EJECUCIÓN',
  '28/09/2018',
  '08/10/2018',
  'SI',
  'POSITIVO',
  '9/10/2019',
  'POSITIVO',
  '18/10/2019',
  '05/07/2019',
  'FINCA',
  'POSITIVO',
  '2020-08-26T05:00:16.000Z',
  '14/09/2021 // 07/05/2021',
  '2018-09-18T05:00:16.000Z',
  '2018-10-04T05:00:16.000Z',
  '2018-10-12T05:00:16.000Z',
  '2018-11-26T05:00:16.000Z',
  '2018-12-06T05:00:16.000Z',
  '2018-10-22T05:00:16.000Z',
  '11/02/2019',
  '2018-09-02T05:00:16.000Z',
  '26/09/2018',
  '3/10/2018',
  '25/10/2018',
  '25/10/2018',
  '27/10/2018',
  '2031-05-23T05:00:16.000Z',
  '18/09/2018',
  'PENDIENTE PAGAR ARANCEL $ 7000 Y DAR TRAMITE MARIA HELENA SUAREZ',
  '08/10/2018',
  '2019-11-19T05:00:16.000Z',
  '31/11/2024',
  '2018-10-08T05:00:16.000Z',
  '2018-10-12T05:00:16.000Z',
  '2019-07-31T05:00:16.000Z',
  '2020-02-18T05:00:16.000Z',
  '2020-02-18T05:00:16.000Z',
  '2020-02-13T05:00:16.000Z',
  '13/02/2020',
  '2020-05-27T05:00:16.000Z',
  '2018-04-16T05:00:16.000Z',
  '2018-04-27T05:00:16.000Z',
  '23/05/2018             13/06/2018',
  '2018-05-29T05:00:16.000Z',
  '2018-05-29T05:00:16.000Z',
  '2018-06-12T05:00:16.000Z',
  '2018-06-12T05:00:16.000Z',
  '2019-07-28T05:00:16.000Z',
  '2019-10-04T05:00:16.000Z',
  '2019-07-28T05:00:16.000Z',
  '2018-05-23T05:00:16.000Z',
  '2018-06-07T05:00:16.000Z',
  '01/06/2021//04/10/2021',
  '9/10/2018',
  'LIQUIDACIÓN',
  '17/10/2018',
  '11/09/2019',
  'SI',
  'POSITIVO',
  43888,
  'POSITIVO',
  'PENDIENTE RETIRAR OFICIOS BANCOS',
  'BANCOS',
  'NEGATIVO',
  '2020-07-14T05:00:16.000Z',
  '05/01/2021',
  '12/10/2018',
  '24/10/2018',
  '19/06/2019',
  '2019-12-12T05:00:16.000Z',
  '6/12/2019',
  '12/07/2019',
  '12/07/2019',
  'EMBARGO DE VEHICULO PLACAS JCZ 682',
  '10/10/2018',
  '25/10/2018',
  '07/11/2018',
  '2019-08-22T05:00:16.000Z',
  'CREDITO HIPOTCARIO',
  'CUNDINAMARCA',
  '2023-01-19T05:00:16.000Z',
  '04/06/2021 //04/06/2021',
  '27/10/2018',
  'LIQUIDACION DEL CRÉDITO',
  '30/10/2018',
  '11/02/2019',
  'NO',
  'POSITIVO',
  'POSITIVO',
  '18/02/2019',
  'CASA',
  'POSITIVO',
  '2020-09-18T05:00:16.000Z',
  '04/06/2021',
  '25/10/2018',
  'ADMITIENDO HIPOTECARIO',
  '30/11/2018',
  '24/07/2019',
  'NO',
  'POSITIVO',
  'POSITIVO',
  '24/07/2019',
  'CASA',
  'POSITIVO',
  '2022-05-03T05:00:16.000Z',
  null,
  'CUNDINAMARCA',
  'SIN LEVANTAMIENTO DE MEDIDA CAUTELAR',
  '31 ENERO 2023 SE ENVIO MEMORIAL AL JUZGADO CON CAMARA Y CERTIFICADO ',
  '2019-10-01T05:00:16.000Z',
  '01/03/2026 ',
  '2018-11-26T05:00:16.000Z',
  '2018-12-07T05:00:16.000Z',
  '2019-01-17T05:00:16.000Z',
  '2019-04-24T05:00:16.000Z',
  '2019-04-24T05:00:16.000Z',
  '2019-01-28T05:00:16.000Z',
  'w',
  '15/10/218',
  '30/11/2018',
  'ADMISION',
  '2021-10-18T05:00:16.000Z',
  '17/05/2033',
  '26/11/2018',
  'ADMISION',
  '2019-04-08T05:00:16.000Z',
  '12/04/2018',
  '21/11/2018',
  'ADMISION',
  '2019-03-06T05:00:16.000Z',
  null,
  'CUNDINAMARCA',
  '2019-08-28T05:00:16.000Z',
  null,
  'CUNDINAMARCA',
  '2019-09-25T05:00:16.000Z',
  '29/11/2019',
  '25/10/2018',
  'EJECUCION',
  '01/02/2019',
  '13/03/2019',
  'SI',
  'POSITIVO',
  43591,
  'POSITIVO',
  '14/06/2019',
  'APTO 501',
  'PENDIENTE',
  'VERIFICAR PROCESO 2005-1008 JUZGADO 40 CM ',
  '2021-10-07T05:00:16.000Z',
  '2022-03-10T05:00:16.000Z',
  '2018-11-30T05:00:16.000Z',
  'PROCESO SUSPENDIDO CENTRO DE CONCILIACION',
  '01/02/2019',
  '12/03/2019',
  'SI',
  'NEGATIVO',
  'NEGATIVO',
  '21/03/2019',
  'FINCA',
  'POSITIVO',
  '01/11/2018',
  '01/02/2019',
  '2019-07-09T05:00:16.000Z',
  null,
  'CUNDINAMARCA',
  '2019-09-12T05:00:16.000Z',
  '30/01/2019',
  '2019-07-03T05:00:16.000Z',
  '23/03/2027',
  '25/01/2019',
  'EL 3/12/2020 EL JUZGADO DECRETO TERMINACION PROCESO POR PAGO CUOTAS EN MORA // EL 12/05/2021 SE RETIRARON GARANTIAS DEL JUZGADO // EL 29/04/2021 SE ENVIO OFICIO A OFICINA DE REGISTRO // EL 22/09/2021 SUPERNOTARIADO LO DEVOLVIO POR NO PAGO // EL 11/11/2021 SE SOLICITO CERTIFICADO Y ESTA PENDIENTE LEVANTAMIENTO DE MEDIDA CAUTELAR //PAGAR DESGLOSE Y RETIRAR OFICIO PARA RADICAR LEVANTAMIENTO',
  '6/02/2019',
  '2022-04-05T05:00:16.000Z',
  '18/09/2023',
  '15/02/2019',
  '26/02/2019',
  '2020-03-02T05:00:16.000Z',
  '08/02/2019',
  '15/02/2019',
  '2019-09-18T05:00:16.000Z',
  '19/12/2026',
  '12/02/2019',
  '26/02/2019 // 4/06/19',
  '2019-08-09T05:00:16.000Z',
  '26/11/2018',
  '26/02/2019',
  '2019-10-24T05:00:16.000Z',
  '25/04/2026',
  '20/05/2019',
  '04/06/2019',
  '2020-05-20T05:00:16.000Z',
  '16/05/2032',
  '29/06/2019',
  '04/06/2019',
  '2019-11-14T05:00:16.000Z',
  '25/10/2024',
  '20/05/2019',
  '5/06/2019',
  '2020-05-22T05:00:16.000Z',
  '03/01/2022 //25/05/2022',
  '20/05/2019',
  'NOTIFICACION',
  '5/06/2019',
  '03/07/2019',
  'NO',
  'POSITIVO',
  '15/08/2019',
  'CASA',
  'POSITIVO',
  '2020-09-10T05:00:16.000Z',
  '25/08/2030',
  '20/08/2019',
  'EJECUCIÓN',
  '2/09/2019',
  '10/10/2019',
  'SI',
  'POSITIVO',
  43871,
  43861,
  'POSITIVO',
  '02/12/2019',
  'CASA 16',
  'EMBARGO CUOTA PARTE INMUEBLE PREDIO URBANO CALLE  23 No 12-50 CASA 16 INT 12 MANZANA 1 CONJUNTO QUINTAS DE ZARAGOZA DE BOGOTÁ',
  'POSITIVO',
  '20/05/2020',
  '24/01/2034',
  '14/11/2019',
  '2/03/2020',
  '2020-10-05T05:00:16.000Z',
  '2018-04-21T05:00:16.000Z',
  '2018-04-25T05:00:16.000Z',
  '2018-04-30T05:00:16.000Z',
  '2018-05-22T05:00:16.000Z',
  '2018-05-22T05:00:16.000Z',
  '2018-05-22T05:00:16.000Z',
  '2018-06-08T05:00:16.000Z',
  '2018-04-30T05:00:16.000Z',
  '2018-05-10T05:00:16.000Z',
  '2018-05-10T05:00:16.000Z',
  '22/05/2018',
  '2018-06-19T05:00:16.000Z',
  '2018-06-08T05:00:16.000Z',
  '2018-06-22T05:00:16.000Z',
  '2018-07-31T05:00:16.000Z',
  '2020-10-07T05:00:16.000Z',
  'EJECUCION',
  '2020-10-07T05:00:16.000Z',
  'SI',
  'POSITICVO',
  '2020-09-05T05:00:16.000Z',
  '15/11/2021',
  '2017-11-14T05:00:16.000Z',
  '2020-09-05T05:00:16.000Z',
  '01/23/2021',
  '2020-09-25T05:00:16.000Z',
  'NOTIFICACION',
  '2022-09-16T05:00:16.000Z',
  '2020-08-02T05:00:16.000Z',
  '2018-04-26T05:00:16.000Z',
  'EJECUCIÓN',
  43228,
  43265,
  'NO',
  'ABIERTO',
  43476,
  'POSITIVO',
  43476,
  43650,
  'LOTE 7 ENGATIVA',
  'POSITIVO',
  '10 ENERO 2023 SE ENVIA TERMINACION POR PAGO TOTAL.',
  '2022-02-02T05:00:16.000Z',
  '2018-06-28T05:00:16.000Z',
  '2018-07-06T05:00:16.000Z',
  '2018-07-24T05:00:16.000Z',
  '2019-01-11T05:00:16.000Z',
  '2019-01-11T05:00:16.000Z',
  '2019-01-11T05:00:16.000Z',
  '2019-01-11T05:00:16.000Z',
  '31/0/2018',
  '31/0/2018',
  '2020-09-24T05:00:16.000Z',
  '2018-05-17T05:00:16.000Z',
  'EJECUCIÓN',
  43242,
  43251,
  'NO',
  'ABIERTO',
  43287,
  'POSITIVO',
  43306,
  43264,
  'LOTE 13 SUBCONJUNTO FIGUEIRA RICAURTE',
  'INMUEBLE',
  'NA',
  '04/07/2018',
  'POSITIVO',
  1150000,
  'SE PRESENTO MEMORIAL TERMINACION POR PAGO TOTAL DE LA OBLIGACION // SE PRESENTO MEMORIAL PARA ENTREGA DE TITULO VALOR EN FAVOR DE BANCOLOMBIA S.A./ REINTEGRA S.A. // 6/12/2022 DIEGO SUAREZ RESPONDE QUE EL TEMA ESTA EN MANOS DE ABOGADO DE REINTEGRA /7 RELAX R & S ASESORIA JURIDICA S.A.S.',
  '2022-12-06T05:00:16.000Z',
  '2021-04-10T05:00:16.000Z',
  '2018-07-03T05:00:16.000Z',
  '2018-07-11T05:00:16.000Z',
  '2018-07-19T05:00:16.000Z',
  '2018-08-08T05:00:16.000Z',
  '2018-08-08T05:00:16.000Z',
  '2018-08-08T05:00:16.000Z',
  '2018-07-19T05:00:16.000Z',
  '2018-08-01T05:00:16.000Z',
  '2018-08-01T05:00:16.000Z',
  '31/08/2018',
  '24/09/2018',
  '27/09/2018',
  '10/05/2121 // 10/05/2021',
  '2018-07-26T05:00:16.000Z',
  '31/0772019',
  '9/0872018',
  '2018-08-11T05:00:16.000Z',
  '2018-08-11T05:00:16.000Z',
  '2018-10-04T05:00:16.000Z',
  '2018-10-12T05:00:16.000Z',
  '2018-10-12T05:00:16.000Z',
  '2018-08-17T05:00:16.000Z',
  '2018-08-17T05:00:16.000Z',
  '15/04/2021 // 6/05/2021',
  '31/08/2018',
  '10/09/2018',
  '17/09/2018',
  '25/10/2018',
  '25/10/2018',
  '04/11/2018',
  '25/02/2019',
  '25/02/2019',
  '17/09/2018',
  '17/09/2018',
  '6/04/2021 // 6/04/2021',
  '22/08/2018',
  '05/09/2018',
  '12/10/2018',
  '02/11/2018',
  '02/11/2018',
  '29/11/2018',
  '20/02/2019',
  '20/02/2019',
  '26/10/2018',
  '26/10/2018',
  '13/03/2022',
  '10/10/2018',
  '19/10/2018',
  '11/01/2019',
  '27/02/2019',
  '27/02/2019',
  '31/01/2019',
  '31/01/2019',
  '4/03/2019 //5/02/2026',
  '04/12/2019',
  'EJECUCIÓN',
  '16/12/2019',
  '20/01/2020',
  'SI',
  'POSITIVO',
  'POSITIVO',
  '31/01/2020',
  'CASA',
  'EMBARGO CUOTA PARTE INMUEBLE PREDIO URBANO DE LA KR 69 K 79 - 27 DE BOGOTÁ',
  'POSITIVO',
  'PENDIENTE LIQUIDACION DEL CREDITO PARA APORTAR AL JUZGADO PROCESO SE ENVIO A EJECUCIÓN',
  '2022-04-08T05:00:16.000Z',
  '11/11/22020',
  '2020-10-04T05:00:16.000Z',
  '2017-10-06T05:00:16.000Z',
  '2017-10-12T05:00:16.000Z',
  '2017-11-27T05:00:16.000Z',
  '22/05/2018',
  '2018-01-03T05:00:16.000Z',
  '2018-07-05T05:00:16.000Z',
  '2018-10-03T05:00:16.000Z',
  '2018-10-03T05:00:16.000Z',
  '2017-11-27T05:00:16.000Z',
  '04/12/2017',
  '2021-05-13T05:00:16.000Z',
  '2018-09-05T05:00:16.000Z',
  '2019-09-11T05:00:16.000Z',
  '2020-03-02T05:00:16.000Z',
  '2028-03-08T05:00:16.000Z',
  '2023-06-20T05:00:16.000Z',
  '10/02/2026 // 27/01/2026',
  '2023-06-20T05:00:16.000Z',
  '2025-02-25T05:00:16.000Z',
  '2023-06-20T05:00:16.000Z',
  '2023 - 01088',
  '11001400300320170088400',
  '22/02/2026 // 4/07/2026 // 6/03/2026',
  '2023-07-26T05:00:16.000Z',
  '2026-03-04T05:00:16.000Z',
  '2023-07-26T05:00:16.000Z',
  '9/03/2026 // 9/03/2026 // 9/04/2026',
  '2023-07-26T05:00:16.000Z',
  '18/07/2026 // 4/03/2026',
  '2023-07-26T05:00:16.000Z',
  '17/03/2026 // 4/03/2026',
  '2023-07-26T05:00:16.000Z',
  '2026-03-02T05:00:16.000Z',
  '2023-07-26T05:00:16.000Z',
  '6/03/2026 //4/07/2026',
  '2023-07-26T05:00:16.000Z',
  '2023 - 00735',
  '08001418901820230073500',
  '2/03/2026 // 20/03/2026',
  '2023-07-26T05:00:16.000Z',
  '10/05/2026 // 6/03/2026',
  '2023-07-26T05:00:16.000Z',
  '10/03/2026 // 25/06/2026 // 4/05/2025// 18/07/2026',
  '2023-07-26T05:00:16.000Z',
  '2026-03-08T05:00:16.000Z',
  '2023-07-26T05:00:16.000Z',
  '2026-03-09T05:00:16.000Z',
  '2023-07-26T05:00:16.000Z',
  '2026-02-28T05:00:16.000Z',
  '2023-07-26T05:00:16.000Z',
  '2027-08-02T05:00:16.000Z',
  '2023-07-26T05:00:16.000Z',
  '25/02/2028 // 17/06/2026',
  '2023-08-02T05:00:16.000Z',
  '2026-03-18T05:00:16.000Z',
  '2023-08-04T05:00:16.000Z',
  '2026-03-18T05:00:16.000Z',
  '2023-08-04T05:00:16.000Z',
  '2026-03-07T05:00:16.000Z',
  '2023-08-04T05:00:16.000Z',
  '17/03/2026 // 3/08/2026',
  '2023-08-04T05:00:16.000Z',
  '17/03/2023 // 4/08/2026',
  '2023-08-04T05:00:16.000Z',
  '2/04/2026 // 24/04/2026 // 7/04/2026 // 7/04/2026',
  '2023-08-17T05:00:16.000Z',
  '2026-04-02T05:00:16.000Z',
  '2023-08-17T05:00:16.000Z',
  '2/04/2026 //  23/04/2026',
  '2023-08-17T05:00:16.000Z',
  '2/04/2026 // 7/04/2026',
  '2021-08-18T05:00:16.000Z',
  '15/03/2026 // 17/08/2026',
  '2021-08-18T05:00:16.000Z',
  '21/03/2026 // 7/03/2026',
  '2021-08-18T05:00:16.000Z',
  '18/08/2026 // 4/04/2026 // 5/08/2026',
  '2023-08-24T05:00:16.000Z',
  '12/09/2034 // 30/03/2026',
  '2023-08-24T05:00:16.000Z',
  '2026-03-06T05:00:16.000Z',
  '2023-08-24T05:00:16.000Z',
  '15/04/2026 // 21/04/2026',
  '2023-09-05T05:00:16.000Z',
  '2026-05-07T05:00:16.000Z',
  '2023-09-26T05:00:16.000Z',
  '15/09/2026 // 22/05/2026 // 7/05/2026',
  '2023-09-26T05:00:16.000Z',
  '2052-12-07T05:00:16.000Z',
  '2023-10-02T05:00:16.000Z',
  '15/05/2026 // 5/06/2026',
  '2023-10-03T05:00:16.000Z',
  '15/08/2026 // 13/05/2026 // 4/09/2026 ',
  '2023-10-07T05:00:16.000Z',
  '2052-11-18T05:00:16.000Z',
  '2023-10-07T05:00:16.000Z',
  '13/12/2025  // 20/06/2026',
  '2023-10-09T05:00:16.000Z',
  '4/02/2026 // 17/05/2026 // 17/05/2026 // 2/02/2026 // 17/05/2026',
  '2023-10-13T05:00:16.000Z',
  '2052-02-21T05:00:16.000Z',
  '2023-10-13T05:00:16.000Z',
  '2052-02-21T05:00:16.000Z',
  '2023-10-13T05:00:16.000Z',
  '2026-06-04T05:00:16.000Z',
  '2023-10-20T05:00:16.000Z',
  '2026-06-04T05:00:16.000Z',
  '2023-10-20T05:00:16.000Z',
  '2023-1065',
  '11001400303420230106500',
  45239,
  '2026-05-15T05:00:16.000Z',
  '2023-10-20T05:00:16.000Z',
  '2049-02-07T05:00:16.000Z',
  '2023-11-14T05:00:16.000Z',
  '2023-1212',
  '11001400304220230121200',
  '1/07/2026 // 7/08/2026',
  '2023-11-14T05:00:16.000Z',
  '2026-03-09T05:00:16.000Z',
  '2023-11-14T05:00:16.000Z',
  '9/07/2026 // 8/07/2026',
  '2023-11-21T05:00:16.000Z',
  '4/07/2026 // 19/07/2026',
  '2023-11-21T05:00:16.000Z',
  '4/07/2026 // 18/08/2026',
  '2023-11-22T05:00:16.000Z',
  '3/07/2026 // 11/07/2026',
  '2023-11-22T05:00:16.000Z',
  '2034-10-10T05:00:16.000Z',
  '2023-11-23T05:00:16.000Z',
  '2026-07-07T05:00:16.000Z',
  '2023-11-23T05:00:16.000Z',
  '2026-08-06T05:00:16.000Z',
  '2023-11-24T05:00:16.000Z',
  '2026-07-07T05:00:16.000Z',
  '2023-11-24T05:00:16.000Z',
  '21/10/2041 // 4/07/2026',
  '2023-11-24T05:00:16.000Z',
  '23/03/2026 // 15/10/2026 // 3/07/2026',
  '2023-11-24T05:00:16.000Z',
  '15/08/2026 // 10/07/2023',
  '2023-11-27T05:00:16.000Z',
  '2023-11-27T05:00:16.000Z',
  '2023-11-27T05:00:16.000Z',
  '2023-11-27T05:00:16.000Z',
];

for ( const fecha of fechas ) {
  const matcher = String(
    fecha 
  )
    .matchAll(
      /(\d+)(-|\/)(\d+)(-|\/)(\d+)/gm 
    );

  for ( const matched of matcher ) {
    const [
      total,
      firstNumber,
      firstDivider,
      secondNumber,
      secondDivider,
      thirdNumber,
    ] = matched;
    let newYear, newDay;

    const newMonth = Number(
      secondNumber 
    ) - 1;

    if ( firstDivider === '-' ) {
      newYear = Number(
        firstNumber.padStart(
          4, '2015' 
        ) 
      );
      newDay = Number(
        thirdNumber.padStart(
          2, '00' 
        ) 
      );
    } else {
      newYear = Number(
        thirdNumber.padStart(
          4, '2015' 
        ) 
      );
      newDay = Number(
        firstNumber.padStart(
          2, '00' 
        ) 
      );
    }

    const outGoingDate = new Date(
      newYear, newMonth, newDay 
    );
    console.log(
      outGoingDate.toString() 
    );
  }
}
