{
  "id": 79357895,
  "actuaciones": [
    {
      "idRegActuacion": 944912050,
      "llaveProceso": "11001400306520170178600",
      "consActuacion": 40,
      "fechaActuacion": "2020-01-14T05:00:00.000Z",
      "actuacion": "Archivo Definitivo",
      "anotacion": "paquete 657",
      "fechaInicial": null,
      "fechaFinal": null,
      "fechaRegistro": "2020-01-14T05:00:00.000Z",
      "codRegla": "00                              ",
      "conDocumentos": false,
      "cant": 40,
      "idProceso": 18169790,
      "isUltimaAct": true,
      "createdAt": "2024-02-10T00:54:53.094Z"
    },
    {
      "idRegActuacion": 559124640,
      "llaveProceso": "11001400306520170178600",
      "consActuacion": 39,
      "fechaActuacion": "2019-08-12T05:00:00.000Z",
      "actuacion": "Envío Comunicaciones",
      "anotacion": "RADICADO   OFICIO 2467 AL JUZGADO 2 DE FAMILIA  DE EJECUCION  DE SENTENCIAS",
      "fechaInicial": null,
      "fechaFinal": null,
      "fechaRegistro": "2019-08-12T05:00:00.000Z",
      "codRegla": "00                              ",
      "conDocumentos": false,
      "cant": 40,
      "idProceso": 18169790,
      "isUltimaAct": false,
      "createdAt": "2024-02-10T00:54:53.094Z"
    },
    {
      "idRegActuacion": 559124690,
      "llaveProceso": "11001400306520170178600",
      "consActuacion": 38,
      "fechaActuacion": "2019-08-05T05:00:00.000Z",
      "actuacion": "Oficio Elaborado",
      "anotacion": "NO TIENE EN CUENTA REMANENTES",
      "fechaInicial": null,
      "fechaFinal": null,
      "fechaRegistro": "2019-08-05T05:00:00.000Z",
      "codRegla": "00                              ",
      "conDocumentos": false,
      "cant": 40,
      "idProceso": 18169790,
      "isUltimaAct": false,
      "createdAt": "2024-02-10T00:54:53.094Z"
    },
    {
      "idRegActuacion": 553899560,
      "llaveProceso": "11001400306520170178600",
      "consActuacion": 37,
      "fechaActuacion": "2019-07-11T05:00:00.000Z",
      "actuacion": "Fijacion estado",
      "anotacion": "Actuación registrada el 11/07/2019 a las 17:57:11.",
      "fechaInicial": "2019-07-12T05:00:00.000Z",
      "fechaFinal": "2019-07-12T05:00:00.000Z",
      "fechaRegistro": "2019-07-11T05:00:00.000Z",
      "codRegla": "00                              ",
      "conDocumentos": false,
      "cant": 40,
      "idProceso": 18169790,
      "isUltimaAct": false,
      "createdAt": "2024-02-10T00:54:53.094Z"
    },
    {
      "idRegActuacion": 553899550,
      "llaveProceso": "11001400306520170178600",
      "consActuacion": 36,
      "fechaActuacion": "2019-07-11T05:00:00.000Z",
      "actuacion": "Auto ordena oficiar",
      "anotacion": null,
      "fechaInicial": null,
      "fechaFinal": null,
      "fechaRegistro": "2019-07-11T05:00:00.000Z",
      "codRegla": "00                              ",
      "conDocumentos": false,
      "cant": 40,
      "idProceso": 18169790,
      "isUltimaAct": false,
      "createdAt": "2024-02-10T00:54:53.094Z"
    },
    {
      "idRegActuacion": 553143040,
      "llaveProceso": "11001400306520170178600",
      "consActuacion": 35,
      "fechaActuacion": "2019-07-08T05:00:00.000Z",
      "actuacion": "Al despacho",
      "anotacion": "Juzgado 14 de Familia embarga remanentes. Proceso ya terminado.",
      "fechaInicial": null,
      "fechaFinal": null,
      "fechaRegistro": "2019-07-08T05:00:00.000Z",
      "codRegla": "00                              ",
      "conDocumentos": false,
      "cant": 40,
      "idProceso": 18169790,
      "isUltimaAct": false,
      "createdAt": "2024-02-10T00:54:53.094Z"
    },
    {
      "idRegActuacion": 334966450,
      "llaveProceso": "11001400306520170178600",
      "consActuacion": 34,
      "fechaActuacion": "2019-06-05T05:00:00.000Z",
      "actuacion": "Entrega Desglose",
      "anotacion": "Desglose retirado por el señor demandado JOSE DAVID PEÑA SAAVEDRA. C.C. 79357895.PROCESO QUEDA PARA ARCHIVAR",
      "fechaInicial": null,
      "fechaFinal": null,
      "fechaRegistro": "2019-06-05T05:00:00.000Z",
      "codRegla": "00                              ",
      "conDocumentos": false,
      "cant": 40,
      "idProceso": 18169790,
      "isUltimaAct": false,
      "createdAt": "2024-02-10T00:54:53.094Z"
    },
    {
      "idRegActuacion": 266700190,
      "llaveProceso": "11001400306520170178600",
      "consActuacion": 33,
      "fechaActuacion": "2019-03-29T05:00:00.000Z",
      "actuacion": "Entrega Desglose",
      "anotacion": "Para entregar a la parte demandada.",
      "fechaInicial": null,
      "fechaFinal": null,
      "fechaRegistro": "2019-03-29T05:00:00.000Z",
      "codRegla": "00                              ",
      "conDocumentos": false,
      "cant": 40,
      "idProceso": 18169790,
      "isUltimaAct": false,
      "createdAt": "2024-02-10T00:54:53.094Z"
    },
    {
      "idRegActuacion": 266700180,
      "llaveProceso": "11001400306520170178600",
      "consActuacion": 32,
      "fechaActuacion": "2019-03-12T05:00:00.000Z",
      "actuacion": "Oficio Elaborado",
      "anotacion": null,
      "fechaInicial": null,
      "fechaFinal": null,
      "fechaRegistro": "2019-03-12T05:00:00.000Z",
      "codRegla": "00                              ",
      "conDocumentos": false,
      "cant": 40,
      "idProceso": 18169790,
      "isUltimaAct": false,
      "createdAt": "2024-02-10T00:54:53.094Z"
    },
    {
      "idRegActuacion": 266700170,
      "llaveProceso": "11001400306520170178600",
      "consActuacion": 31,
      "fechaActuacion": "2019-03-01T05:00:00.000Z",
      "actuacion": "Fijacion estado",
      "anotacion": "Actuación registrada el 01/03/2019 a las 17:04:53.",
      "fechaInicial": "2019-03-04T05:00:00.000Z",
      "fechaFinal": "2019-03-04T05:00:00.000Z",
      "fechaRegistro": "2019-03-01T05:00:00.000Z",
      "codRegla": "00                              ",
      "conDocumentos": false,
      "cant": 40,
      "idProceso": 18169790,
      "isUltimaAct": false,
      "createdAt": "2024-02-10T00:54:53.094Z"
    },
    {
      "idRegActuacion": 266700160,
      "llaveProceso": "11001400306520170178600",
      "consActuacion": 30,
      "fechaActuacion": "2019-03-01T05:00:00.000Z",
      "actuacion": "Auto termina proceso por Pago",
      "anotacion": null,
      "fechaInicial": null,
      "fechaFinal": null,
      "fechaRegistro": "2019-03-01T05:00:00.000Z",
      "codRegla": "00                              ",
      "conDocumentos": false,
      "cant": 40,
      "idProceso": 18169790,
      "isUltimaAct": false,
      "createdAt": "2024-02-10T00:54:53.094Z"
    },
    {
      "idRegActuacion": 266700150,
      "llaveProceso": "11001400306520170178600",
      "consActuacion": 29,
      "fechaActuacion": "2019-02-27T05:00:00.000Z",
      "actuacion": "Al despacho",
      "anotacion": "Solicitud terminar proceso por pago total.",
      "fechaInicial": null,
      "fechaFinal": null,
      "fechaRegistro": "2019-02-27T05:00:00.000Z",
      "codRegla": "00                              ",
      "conDocumentos": false,
      "cant": 40,
      "idProceso": 18169790,
      "isUltimaAct": false,
      "createdAt": "2024-02-10T00:54:53.094Z"
    },
    {
      "idRegActuacion": 266700140,
      "llaveProceso": "11001400306520170178600",
      "consActuacion": 28,
      "fechaActuacion": "2018-10-30T05:00:00.000Z",
      "actuacion": "Fijacion estado",
      "anotacion": "Actuación registrada el 30/10/2018 a las 15:23:56.",
      "fechaInicial": "2018-10-31T05:00:00.000Z",
      "fechaFinal": "2018-10-31T05:00:00.000Z",
      "fechaRegistro": "2018-10-30T05:00:00.000Z",
      "codRegla": "00                              ",
      "conDocumentos": false,
      "cant": 40,
      "idProceso": 18169790,
      "isUltimaAct": false,
      "createdAt": "2024-02-10T00:54:53.094Z"
    },
    {
      "idRegActuacion": 266700130,
      "llaveProceso": "11001400306520170178600",
      "consActuacion": 27,
      "fechaActuacion": "2018-10-30T05:00:00.000Z",
      "actuacion": "Auto resuelve sustitución poder",
      "anotacion": null,
      "fechaInicial": null,
      "fechaFinal": null,
      "fechaRegistro": "2018-10-30T05:00:00.000Z",
      "codRegla": "00                              ",
      "conDocumentos": false,
      "cant": 40,
      "idProceso": 18169790,
      "isUltimaAct": false,
      "createdAt": "2024-02-10T00:54:53.094Z"
    },
    {
      "idRegActuacion": 266700120,
      "llaveProceso": "11001400306520170178600",
      "consActuacion": 26,
      "fechaActuacion": "2018-10-30T05:00:00.000Z",
      "actuacion": "Fijacion estado",
      "anotacion": "Actuación registrada el 30/10/2018 a las 15:00:36.",
      "fechaInicial": "2018-10-31T05:00:00.000Z",
      "fechaFinal": "2018-10-31T05:00:00.000Z",
      "fechaRegistro": "2018-10-30T05:00:00.000Z",
      "codRegla": "00                              ",
      "conDocumentos": false,
      "cant": 40,
      "idProceso": 18169790,
      "isUltimaAct": false,
      "createdAt": "2024-02-10T00:54:53.094Z"
    },
    {
      "idRegActuacion": 266700110,
      "llaveProceso": "11001400306520170178600",
      "consActuacion": 25,
      "fechaActuacion": "2018-10-30T05:00:00.000Z",
      "actuacion": "Auto ordena Seguir adelante la Ejecucion  Ley 1395/2010",
      "anotacion": null,
      "fechaInicial": null,
      "fechaFinal": null,
      "fechaRegistro": "2018-10-30T05:00:00.000Z",
      "codRegla": "00                              ",
      "conDocumentos": false,
      "cant": 40,
      "idProceso": 18169790,
      "isUltimaAct": false,
      "createdAt": "2024-02-10T00:54:53.094Z"
    },
    {
      "idRegActuacion": 266700100,
      "llaveProceso": "11001400306520170178600",
      "consActuacion": 24,
      "fechaActuacion": "2018-10-30T05:00:00.000Z",
      "actuacion": "Al despacho",
      "anotacion": "Apodserado actor allega certificado de representación y existencia.",
      "fechaInicial": null,
      "fechaFinal": null,
      "fechaRegistro": "2018-10-30T05:00:00.000Z",
      "codRegla": "00                              ",
      "conDocumentos": false,
      "cant": 40,
      "idProceso": 18169790,
      "isUltimaAct": false,
      "createdAt": "2024-02-10T00:54:53.094Z"
    },
    {
      "idRegActuacion": 266700090,
      "llaveProceso": "11001400306520170178600",
      "consActuacion": 23,
      "fechaActuacion": "2018-10-19T05:00:00.000Z",
      "actuacion": "Acta Diligencia",
      "anotacion": "NO COMAPRECEN INTERESADOS EN LA PRACICA DE LA DILIGENCIA  ",
      "fechaInicial": null,
      "fechaFinal": null,
      "fechaRegistro": "2018-10-19T05:00:00.000Z",
      "codRegla": "00                              ",
      "conDocumentos": false,
      "cant": 40,
      "idProceso": 18169790,
      "isUltimaAct": false,
      "createdAt": "2024-02-10T00:54:53.094Z"
    },
    {
      "idRegActuacion": 266700080,
      "llaveProceso": "11001400306520170178600",
      "consActuacion": 22,
      "fechaActuacion": "2018-10-16T05:00:00.000Z",
      "actuacion": "Envío Comunicaciones",
      "anotacion": "SECUESTRE",
      "fechaInicial": null,
      "fechaFinal": null,
      "fechaRegistro": "2018-10-16T05:00:00.000Z",
      "codRegla": "00                              ",
      "conDocumentos": false,
      "cant": 40,
      "idProceso": 18169790,
      "isUltimaAct": false,
      "createdAt": "2024-02-10T00:54:53.094Z"
    },
    {
      "idRegActuacion": 266700070,
      "llaveProceso": "11001400306520170178600",
      "consActuacion": 21,
      "fechaActuacion": "2018-10-01T05:00:00.000Z",
      "actuacion": "Fijacion estado",
      "anotacion": "Actuación registrada el 01/10/2018 a las 08:08:32.",
      "fechaInicial": "2018-10-02T05:00:00.000Z",
      "fechaFinal": "2018-10-02T05:00:00.000Z",
      "fechaRegistro": "2018-10-01T05:00:00.000Z",
      "codRegla": "00                              ",
      "conDocumentos": false,
      "cant": 40,
      "idProceso": 18169790,
      "isUltimaAct": false,
      "createdAt": "2024-02-10T00:54:53.094Z"
    },
    {
      "idRegActuacion": 266700060,
      "llaveProceso": "11001400306520170178600",
      "consActuacion": 20,
      "fechaActuacion": "2018-10-01T05:00:00.000Z",
      "actuacion": "Auto fija fecha audiencia y/o diligencia",
      "anotacion": "DILIGENCIA DE SECUESTRO PARA EL DIA 19 DE OCTUBRE DE 2018",
      "fechaInicial": null,
      "fechaFinal": null,
      "fechaRegistro": "2018-10-01T05:00:00.000Z",
      "codRegla": "00                              ",
      "conDocumentos": false,
      "cant": 40,
      "idProceso": 18169790,
      "isUltimaAct": false,
      "createdAt": "2024-02-10T00:54:53.094Z"
    },
    {
      "idRegActuacion": 266700050,
      "llaveProceso": "11001400306520170178600",
      "consActuacion": 19,
      "fechaActuacion": "2018-09-27T05:00:00.000Z",
      "actuacion": "Al despacho",
      "anotacion": "Registrado embargo del inmueble",
      "fechaInicial": null,
      "fechaFinal": null,
      "fechaRegistro": "2018-09-27T05:00:00.000Z",
      "codRegla": "00                              ",
      "conDocumentos": false,
      "cant": 40,
      "idProceso": 18169790,
      "isUltimaAct": false,
      "createdAt": "2024-02-10T00:54:53.094Z"
    },
    {
      "idRegActuacion": 266700040,
      "llaveProceso": "11001400306520170178600",
      "consActuacion": 18,
      "fechaActuacion": "2018-06-27T05:00:00.000Z",
      "actuacion": "Fijacion estado",
      "anotacion": "Actuación registrada el 27/06/2018 a las 17:19:38.",
      "fechaInicial": "2018-06-28T05:00:00.000Z",
      "fechaFinal": "2018-06-28T05:00:00.000Z",
      "fechaRegistro": "2018-06-27T05:00:00.000Z",
      "codRegla": "00                              ",
      "conDocumentos": false,
      "cant": 40,
      "idProceso": 18169790,
      "isUltimaAct": false,
      "createdAt": "2024-02-10T00:54:53.094Z"
    },
    {
      "idRegActuacion": 266700030,
      "llaveProceso": "11001400306520170178600",
      "consActuacion": 17,
      "fechaActuacion": "2018-06-27T05:00:00.000Z",
      "actuacion": "Auto resuelve solicitud",
      "anotacion": null,
      "fechaInicial": null,
      "fechaFinal": null,
      "fechaRegistro": "2018-06-27T05:00:00.000Z",
      "codRegla": "00                              ",
      "conDocumentos": false,
      "cant": 40,
      "idProceso": 18169790,
      "isUltimaAct": false,
      "createdAt": "2024-02-10T00:54:53.094Z"
    },
    {
      "idRegActuacion": 266700020,
      "llaveProceso": "11001400306520170178600",
      "consActuacion": 16,
      "fechaActuacion": "2018-06-26T05:00:00.000Z",
      "actuacion": "Al despacho",
      "anotacion": "Solicitud sentencia. No existe respuesta de registro embargo inmueble.",
      "fechaInicial": null,
      "fechaFinal": null,
      "fechaRegistro": "2018-06-26T05:00:00.000Z",
      "codRegla": "00                              ",
      "conDocumentos": false,
      "cant": 40,
      "idProceso": 18169790,
      "isUltimaAct": false,
      "createdAt": "2024-02-10T00:54:53.094Z"
    },
    {
      "idRegActuacion": 266700010,
      "llaveProceso": "11001400306520170178600",
      "consActuacion": 15,
      "fechaActuacion": "2018-05-25T05:00:00.000Z",
      "actuacion": "Fijacion estado",
      "anotacion": "Actuación registrada el 25/05/2018 a las 08:18:30.",
      "fechaInicial": "2018-05-28T05:00:00.000Z",
      "fechaFinal": "2018-05-28T05:00:00.000Z",
      "fechaRegistro": "2018-05-25T05:00:00.000Z",
      "codRegla": "00                              ",
      "conDocumentos": false,
      "cant": 40,
      "idProceso": 18169790,
      "isUltimaAct": false,
      "createdAt": "2024-02-10T00:54:53.094Z"
    },
    {
      "idRegActuacion": 266700000,
      "llaveProceso": "11001400306520170178600",
      "consActuacion": 14,
      "fechaActuacion": "2018-05-25T05:00:00.000Z",
      "actuacion": "Auto ordena oficiar",
      "anotacion": null,
      "fechaInicial": null,
      "fechaFinal": null,
      "fechaRegistro": "2018-05-25T05:00:00.000Z",
      "codRegla": "00                              ",
      "conDocumentos": false,
      "cant": 40,
      "idProceso": 18169790,
      "isUltimaAct": false,
      "createdAt": "2024-02-10T00:54:53.094Z"
    },
    {
      "idRegActuacion": 266699990,
      "llaveProceso": "11001400306520170178600",
      "consActuacion": 13,
      "fechaActuacion": "2018-05-24T05:00:00.000Z",
      "actuacion": "Al despacho",
      "anotacion": "Solicitud requerir registro embargo inmueble.",
      "fechaInicial": null,
      "fechaFinal": null,
      "fechaRegistro": "2018-05-24T05:00:00.000Z",
      "codRegla": "00                              ",
      "conDocumentos": false,
      "cant": 40,
      "idProceso": 18169790,
      "isUltimaAct": false,
      "createdAt": "2024-02-10T00:54:53.094Z"
    },
    {
      "idRegActuacion": 266699980,
      "llaveProceso": "11001400306520170178600",
      "consActuacion": 12,
      "fechaActuacion": "2018-05-07T05:00:00.000Z",
      "actuacion": "Fijacion estado",
      "anotacion": "Actuación registrada el 07/05/2018 a las 17:35:18.",
      "fechaInicial": "2018-05-08T05:00:00.000Z",
      "fechaFinal": "2018-05-08T05:00:00.000Z",
      "fechaRegistro": "2018-05-07T05:00:00.000Z",
      "codRegla": "00                              ",
      "conDocumentos": false,
      "cant": 40,
      "idProceso": 18169790,
      "isUltimaAct": false,
      "createdAt": "2024-02-10T00:54:53.094Z"
    },
    {
      "idRegActuacion": 266699970,
      "llaveProceso": "11001400306520170178600",
      "consActuacion": 11,
      "fechaActuacion": "2018-05-07T05:00:00.000Z",
      "actuacion": "Auto pone en conocimiento",
      "anotacion": null,
      "fechaInicial": null,
      "fechaFinal": null,
      "fechaRegistro": "2018-05-07T05:00:00.000Z",
      "codRegla": "00                              ",
      "conDocumentos": false,
      "cant": 40,
      "idProceso": 18169790,
      "isUltimaAct": false,
      "createdAt": "2024-02-10T00:54:53.094Z"
    },
    {
      "idRegActuacion": 266699960,
      "llaveProceso": "11001400306520170178600",
      "consActuacion": 10,
      "fechaActuacion": "2018-05-07T05:00:00.000Z",
      "actuacion": "Al despacho",
      "anotacion": "Not personal. No contestó. No registró embargo del inmueble.",
      "fechaInicial": null,
      "fechaFinal": null,
      "fechaRegistro": "2018-05-07T05:00:00.000Z",
      "codRegla": "00                              ",
      "conDocumentos": false,
      "cant": 40,
      "idProceso": 18169790,
      "isUltimaAct": false,
      "createdAt": "2024-02-10T00:54:53.094Z"
    },
    {
      "idRegActuacion": 266699950,
      "llaveProceso": "11001400306520170178600",
      "consActuacion": 9,
      "fechaActuacion": "2018-04-10T05:00:00.000Z",
      "actuacion": "Diligencia de notificación personal (acta)",
      "anotacion": "demandado JOSE DAVID PEÑA SAAVEDRA ",
      "fechaInicial": null,
      "fechaFinal": null,
      "fechaRegistro": "2018-04-10T05:00:00.000Z",
      "codRegla": "00                              ",
      "conDocumentos": false,
      "cant": 40,
      "idProceso": 18169790,
      "isUltimaAct": false,
      "createdAt": "2024-02-10T00:54:53.094Z"
    },
    {
      "idRegActuacion": 266699940,
      "llaveProceso": "11001400306520170178600",
      "consActuacion": 8,
      "fechaActuacion": "2018-02-12T05:00:00.000Z",
      "actuacion": "Oficio Elaborado",
      "anotacion": null,
      "fechaInicial": null,
      "fechaFinal": null,
      "fechaRegistro": "2018-02-12T05:00:00.000Z",
      "codRegla": "00                              ",
      "conDocumentos": false,
      "cant": 40,
      "idProceso": 18169790,
      "isUltimaAct": false,
      "createdAt": "2024-02-10T00:54:53.094Z"
    },
    {
      "idRegActuacion": 266699930,
      "llaveProceso": "11001400306520170178600",
      "consActuacion": 7,
      "fechaActuacion": "2018-02-02T05:00:00.000Z",
      "actuacion": "Fijacion estado",
      "anotacion": "Actuación registrada el 02/02/2018 a las 17:02:51.",
      "fechaInicial": "2018-02-05T05:00:00.000Z",
      "fechaFinal": "2018-02-05T05:00:00.000Z",
      "fechaRegistro": "2018-02-02T05:00:00.000Z",
      "codRegla": "00                              ",
      "conDocumentos": false,
      "cant": 40,
      "idProceso": 18169790,
      "isUltimaAct": false,
      "createdAt": "2024-02-10T00:54:53.094Z"
    },
    {
      "idRegActuacion": 266699920,
      "llaveProceso": "11001400306520170178600",
      "consActuacion": 6,
      "fechaActuacion": "2018-02-02T05:00:00.000Z",
      "actuacion": "Auto libra mandamiento ejecutivo",
      "anotacion": null,
      "fechaInicial": null,
      "fechaFinal": null,
      "fechaRegistro": "2018-02-02T05:00:00.000Z",
      "codRegla": "00                              ",
      "conDocumentos": false,
      "cant": 40,
      "idProceso": 18169790,
      "isUltimaAct": false,
      "createdAt": "2024-02-10T00:54:53.094Z"
    },
    {
      "idRegActuacion": 266699910,
      "llaveProceso": "11001400306520170178600",
      "consActuacion": 5,
      "fechaActuacion": "2018-01-25T05:00:00.000Z",
      "actuacion": "Al despacho",
      "anotacion": "Subsanó la demanda",
      "fechaInicial": null,
      "fechaFinal": null,
      "fechaRegistro": "2018-01-25T05:00:00.000Z",
      "codRegla": "00                              ",
      "conDocumentos": false,
      "cant": 40,
      "idProceso": 18169790,
      "isUltimaAct": false,
      "createdAt": "2024-02-10T00:54:53.094Z"
    },
    {
      "idRegActuacion": 266699900,
      "llaveProceso": "11001400306520170178600",
      "consActuacion": 4,
      "fechaActuacion": "2018-01-11T05:00:00.000Z",
      "actuacion": "Fijacion estado",
      "anotacion": "Actuación registrada el 11/01/2018 a las 15:44:04.",
      "fechaInicial": "2018-01-12T05:00:00.000Z",
      "fechaFinal": "2018-01-12T05:00:00.000Z",
      "fechaRegistro": "2018-01-11T05:00:00.000Z",
      "codRegla": "00                              ",
      "conDocumentos": false,
      "cant": 40,
      "idProceso": 18169790,
      "isUltimaAct": false,
      "createdAt": "2024-02-10T00:54:53.094Z"
    },
    {
      "idRegActuacion": 266699890,
      "llaveProceso": "11001400306520170178600",
      "consActuacion": 3,
      "fechaActuacion": "2018-01-11T05:00:00.000Z",
      "actuacion": "Auto inadmite demanda",
      "anotacion": null,
      "fechaInicial": null,
      "fechaFinal": null,
      "fechaRegistro": "2018-01-11T05:00:00.000Z",
      "codRegla": "00                              ",
      "conDocumentos": false,
      "cant": 40,
      "idProceso": 18169790,
      "isUltimaAct": false,
      "createdAt": "2024-02-10T00:54:53.094Z"
    },
    {
      "idRegActuacion": 266699880,
      "llaveProceso": "11001400306520170178600",
      "consActuacion": 2,
      "fechaActuacion": "2017-12-13T05:00:00.000Z",
      "actuacion": "Al Despacho Por Reparto",
      "anotacion": null,
      "fechaInicial": null,
      "fechaFinal": null,
      "fechaRegistro": "2017-12-13T05:00:00.000Z",
      "codRegla": "00                              ",
      "conDocumentos": false,
      "cant": 40,
      "idProceso": 18169790,
      "isUltimaAct": false,
      "createdAt": "2024-02-10T00:54:53.094Z"
    },
    {
      "idRegActuacion": 266699870,
      "llaveProceso": "11001400306520170178600",
      "consActuacion": 1,
      "fechaActuacion": "2017-12-13T05:00:00.000Z",
      "actuacion": " Radicación de Proceso",
      "anotacion": "Actuación de  Radicación de Proceso  realizada el 13/12/2017 a las 08:08:33",
      "fechaInicial": "2017-12-13T05:00:00.000Z",
      "fechaFinal": "2017-12-13T05:00:00.000Z",
      "fechaRegistro": "2017-12-13T05:00:00.000Z",
      "codRegla": "00                              ",
      "conDocumentos": false,
      "cant": 40,
      "idProceso": 18169790,
      "isUltimaAct": false,
      "createdAt": "2024-02-10T00:54:53.094Z"
    }
  ],
  "category": "Terminados",
  "codeudor": {
    "nombre": null,
    "cedula": null,
    "direccion": null,
    "telefono": null,
    "id": 359
  },
  "demanda": {
    "liquidacion": "1000",
    "avaluo": "1000",
    "capitalAdeudado": "8725321",
    "departamento": "CUNDINAMARCA",
    "despacho": null,
    "entregaGarantiasAbogado": null,
    "etapaProcesal": "NOTIFICACION",
    "fechaPresentacion": ["2017-12-07T05:00:00.000Z"],
    "id": 359,
    "llaveProceso": "11001400306520170178600",
    "mandamientoPago": [],
    "municipio": "BOGOTA",
    "notificacion": {
      "id": 359,
      "notifiers": [
        {
          "tipo": "291",
          "fechaRecibido": null,
          "fechaAporta": null,
          "resultado": null
        },
        {
          "tipo": "292",
          "fechaRecibido": null,
          "fechaAporta": null,
          "resultado": null
        }
      ],
      "certimail": null,
      "fisico": null,
      "autoNotificado": null
    },
    "obligacion": ["71141"],
    "radicado": "2017 - 01786",
    "tipoProceso": "HIPOTECARIO",
    "vencimientoPagare": ["2018-07-29T05:00:00.000Z"],
    "medidasCautelares": {
      "id": 359,
      "fechaOrdenaMedida": "2024-02-10T00:54:52.828Z",
      "medidaSolicitada": "PERSONAL"
    }
  },
  "deudor": {
    "id": 359,
    "telCelular": "3165335586",
    "telFijo": "1665335 ",
    "primerNombre": "JOSE",
    "segundoNombre": "DAVID",
    "primerApellido": "PEÑA",
    "segundoApellido": "SAAVEDRA",
    "cedula": "79357895",
    "direccion": "CARRERA 123 No 13 - 85 casa 364",
    "email": " "
  },
  "fecha": "2020-01-14T05:00:00.000Z",
  "idProcesos": [18169790],
  "idRegUltimaAct": 944912050,
  "llaveProceso": "11001400306520170178600",
  "nombre": "jose david peña saavedra",
  "numero": 359,
  "procesos": [
    {
      "idProceso": 18169790,
      "idConexion": 260,
      "llaveProceso": "11001400306520170178600",
      "fechaProceso": "2017-12-13T05:00:00.000Z",
      "fechaUltimaActuacion": "2020-01-14T05:00:00.000Z",
      "despacho": "JUZGADO 065 CIVIL MUNICIPAL DE BOGOTÁ ",
      "departamento": "BOGOTÁ",
      "sujetosProcesales": "Demandante: TITULARIZADORA COLOMBIANA S.A. HITOS | Demandado: JOSE DAVID PEÑA SAAVEDRA ",
      "esPrivado": false,
      "cantFilas": -1,
      "juzgado": {
        "id": 65,
        "tipo": "JUZGADO 065 CIVIL MUNICIPAL DE BOGOTÁ",
        "url": "https://www.ramajudicial.gov.co/web/juzgado-65-civil-municipal-de-bogota"
      }
    }
  ],
  "revisado": false,
  "terminado": true,
  "tipoProceso": "HIPOTECARIO",
  "ultimaActuacion": {
    "idRegActuacion": 944912050,
    "llaveProceso": "11001400306520170178600",
    "consActuacion": 40,
    "fechaActuacion": "2020-01-14T05:00:00.000Z",
    "actuacion": "Archivo Definitivo",
    "anotacion": "paquete 657",
    "fechaInicial": null,
    "fechaFinal": null,
    "fechaRegistro": "2020-01-14T05:00:00.000Z",
    "codRegla": "00                              ",
    "conDocumentos": false,
    "cant": 40,
    "idProceso": 18169790,
    "isUltimaAct": true
  },
  "notas": [
    {
      "carpetaNumero": 359,
      "createdAt": "2024-02-10T00:54:52.828Z",
      "pathname": null,
      "dueDate": "2019-04-01T05:00:00.000Z",
      "text": "EL 1/03/2019 EL JUZGADO DECRETA LA TERMINACION DEL PROCESO POR PAGO TOTAL DE LA OBLIGACION ",
      "content": []
    },
    {
      "carpetaNumero": 359,
      "createdAt": "2024-02-10T00:54:52.828Z",
      "pathname": null,
      "dueDate": null,
      "text": " GARANTIAS EN FAVOR DE LA PARTE DEMANDADA ",
      "content": []
    },
    {
      "carpetaNumero": 359,
      "createdAt": "2024-02-10T00:54:52.828Z",
      "pathname": null,
      "dueDate": null,
      "text": " LEVANTAMIENTO DE MEDIDAS CAUTELARES EN FAVOR DE LA PARTE DEUDORA",
      "content": []
    }
  ],
  "updatedAt": "2024-02-10T00:54:52.828Z"
}
