{
  "id": 51733931,
  "actuaciones": [
    {
      "idRegActuacion": 1259812941,
      "llaveProceso": "11001400307920170114200",
      "consActuacion": 46,
      "fechaActuacion": "2023-06-05T05:00:00.000Z",
      "actuacion": "Fijacion estado",
      "anotacion": "Actuación registrada el 05/06/2023 a las 17:22:49.",
      "fechaInicial": "2023-06-06T05:00:00.000Z",
      "fechaFinal": "2023-06-06T05:00:00.000Z",
      "fechaRegistro": "2023-06-05T05:00:00.000Z",
      "codRegla": "00                              ",
      "conDocumentos": false,
      "cant": 46,
      "idProceso": 128433271,
      "isUltimaAct": true,
      "createdAt": "2024-02-10T00:54:37.979Z"
    },
    {
      "idRegActuacion": 1259812931,
      "llaveProceso": "11001400307920170114200",
      "consActuacion": 45,
      "fechaActuacion": "2023-06-05T05:00:00.000Z",
      "actuacion": "Auto de Trámite",
      "anotacion": "ordena remitir proceso ejecutivo al proceso de insolvencia referido al JUZGADO CINCUENTA (54) CIVIL MUNICIPAL DE BOGOTÁ",
      "fechaInicial": null,
      "fechaFinal": null,
      "fechaRegistro": "2023-06-05T05:00:00.000Z",
      "codRegla": "00                              ",
      "conDocumentos": false,
      "cant": 46,
      "idProceso": 128433271,
      "isUltimaAct": false,
      "createdAt": "2024-02-10T00:54:37.979Z"
    },
    {
      "idRegActuacion": 1230020351,
      "llaveProceso": "11001400307920170114200",
      "consActuacion": 44,
      "fechaActuacion": "2023-03-08T05:00:00.000Z",
      "actuacion": "Al despacho",
      "anotacion": null,
      "fechaInicial": null,
      "fechaFinal": null,
      "fechaRegistro": "2023-03-08T05:00:00.000Z",
      "codRegla": "00                              ",
      "conDocumentos": false,
      "cant": 46,
      "idProceso": 128433271,
      "isUltimaAct": false,
      "createdAt": "2024-02-10T00:54:37.979Z"
    },
    {
      "idRegActuacion": 1207956721,
      "llaveProceso": "11001400307920170114200",
      "consActuacion": 43,
      "fechaActuacion": "2022-12-15T05:00:00.000Z",
      "actuacion": "Fijacion estado",
      "anotacion": "Actuación registrada el 15/12/2022 a las 16:47:16.",
      "fechaInicial": "2022-12-16T05:00:00.000Z",
      "fechaFinal": "2022-12-16T05:00:00.000Z",
      "fechaRegistro": "2022-12-15T05:00:00.000Z",
      "codRegla": "00                              ",
      "conDocumentos": false,
      "cant": 46,
      "idProceso": 128433271,
      "isUltimaAct": false,
      "createdAt": "2024-02-10T00:54:37.979Z"
    },
    {
      "idRegActuacion": 1207956711,
      "llaveProceso": "11001400307920170114200",
      "consActuacion": 42,
      "fechaActuacion": "2022-12-15T05:00:00.000Z",
      "actuacion": "Auto ordena oficiar",
      "anotacion": "ordena oficiar al  al  Juzgado 54 Civil Municipal  de  Bogotá",
      "fechaInicial": null,
      "fechaFinal": null,
      "fechaRegistro": "2022-12-15T05:00:00.000Z",
      "codRegla": "00                              ",
      "conDocumentos": false,
      "cant": 46,
      "idProceso": 128433271,
      "isUltimaAct": false,
      "createdAt": "2024-02-10T00:54:37.979Z"
    },
    {
      "idRegActuacion": 1198934381,
      "llaveProceso": "11001400307920170114200",
      "consActuacion": 41,
      "fechaActuacion": "2022-11-18T05:00:00.000Z",
      "actuacion": "Al despacho",
      "anotacion": null,
      "fechaInicial": null,
      "fechaFinal": null,
      "fechaRegistro": "2022-11-18T05:00:00.000Z",
      "codRegla": "00                              ",
      "conDocumentos": false,
      "cant": 46,
      "idProceso": 128433271,
      "isUltimaAct": false,
      "createdAt": "2024-02-10T00:54:37.979Z"
    },
    {
      "idRegActuacion": 1180771771,
      "llaveProceso": "11001400307920170114200",
      "consActuacion": 40,
      "fechaActuacion": "2022-09-23T05:00:00.000Z",
      "actuacion": "Constancia secretarial",
      "anotacion": "En virtud de lo establecido en el artículo 33 del Acuerdo PCSJA20-11567 de 2020 y la circular CSJBTC22-67 referentes al plan de digitalización y la entrega de expedientes fisicos para la digitalización de los mismos, este despacho hizo entrega del expediente fisico al consorcio a cargo del proyecto de digitalización. ",
      "fechaInicial": null,
      "fechaFinal": null,
      "fechaRegistro": "2022-09-23T05:00:00.000Z",
      "codRegla": "00                              ",
      "conDocumentos": false,
      "cant": 46,
      "idProceso": 128433271,
      "isUltimaAct": false,
      "createdAt": "2024-02-10T00:54:37.979Z"
    },
    {
      "idRegActuacion": 1162814911,
      "llaveProceso": "11001400307920170114200",
      "consActuacion": 39,
      "fechaActuacion": "2022-08-02T05:00:00.000Z",
      "actuacion": "Constancia secretarial",
      "anotacion": "Se remite oficio al juzgado 54 cm ",
      "fechaInicial": null,
      "fechaFinal": null,
      "fechaRegistro": "2022-08-02T05:00:00.000Z",
      "codRegla": "00                              ",
      "conDocumentos": false,
      "cant": 46,
      "idProceso": 128433271,
      "isUltimaAct": false,
      "createdAt": "2024-02-10T00:54:37.979Z"
    },
    {
      "idRegActuacion": 1140479851,
      "llaveProceso": "11001400307920170114200",
      "consActuacion": 38,
      "fechaActuacion": "2022-05-19T05:00:00.000Z",
      "actuacion": "Auto ordena oficiar",
      "anotacion": "ordena oficiar al Juzgado 54 Civil Municipal de Bogotá",
      "fechaInicial": null,
      "fechaFinal": null,
      "fechaRegistro": "2022-05-19T05:00:00.000Z",
      "codRegla": "00                              ",
      "conDocumentos": false,
      "cant": 46,
      "idProceso": 128433271,
      "isUltimaAct": false,
      "createdAt": "2024-02-10T00:54:37.979Z"
    },
    {
      "idRegActuacion": 1131453891,
      "llaveProceso": "11001400307920170114200",
      "consActuacion": 37,
      "fechaActuacion": "2022-04-20T05:00:00.000Z",
      "actuacion": "Al despacho",
      "anotacion": null,
      "fechaInicial": null,
      "fechaFinal": null,
      "fechaRegistro": "2022-04-20T05:00:00.000Z",
      "codRegla": "00                              ",
      "conDocumentos": false,
      "cant": 46,
      "idProceso": 128433271,
      "isUltimaAct": false,
      "createdAt": "2024-02-10T00:54:37.979Z"
    },
    {
      "idRegActuacion": 1086405431,
      "llaveProceso": "11001400307920170114200",
      "consActuacion": 36,
      "fechaActuacion": "2021-12-09T05:00:00.000Z",
      "actuacion": "Fijacion estado",
      "anotacion": "Actuación registrada el 09/12/2021 a las 15:19:15.",
      "fechaInicial": "2021-12-10T05:00:00.000Z",
      "fechaFinal": "2021-12-10T05:00:00.000Z",
      "fechaRegistro": "2021-12-09T05:00:00.000Z",
      "codRegla": "00                              ",
      "conDocumentos": false,
      "cant": 46,
      "idProceso": 128433271,
      "isUltimaAct": false,
      "createdAt": "2024-02-10T00:54:37.979Z"
    },
    {
      "idRegActuacion": 1086405421,
      "llaveProceso": "11001400307920170114200",
      "consActuacion": 35,
      "fechaActuacion": "2021-12-09T05:00:00.000Z",
      "actuacion": "Auto ordena oficiar",
      "anotacion": "ordena oficiar centro de conciliación",
      "fechaInicial": null,
      "fechaFinal": null,
      "fechaRegistro": "2021-12-09T05:00:00.000Z",
      "codRegla": "00                              ",
      "conDocumentos": false,
      "cant": 46,
      "idProceso": 128433271,
      "isUltimaAct": false,
      "createdAt": "2024-02-10T00:54:37.979Z"
    },
    {
      "idRegActuacion": 1086155301,
      "llaveProceso": "11001400307920170114200",
      "consActuacion": 34,
      "fechaActuacion": "2021-11-30T05:00:00.000Z",
      "actuacion": "Al despacho",
      "anotacion": null,
      "fechaInicial": null,
      "fechaFinal": null,
      "fechaRegistro": "2021-11-30T05:00:00.000Z",
      "codRegla": "00                              ",
      "conDocumentos": false,
      "cant": 46,
      "idProceso": 128433271,
      "isUltimaAct": false,
      "createdAt": "2024-02-10T00:54:37.979Z"
    },
    {
      "idRegActuacion": 1096883051,
      "llaveProceso": "11001400307920170114200",
      "consActuacion": 33,
      "fechaActuacion": "2021-08-11T05:00:00.000Z",
      "actuacion": "Fijacion estado",
      "anotacion": "Actuación registrada el 11/08/2021 a las 15:22:39.",
      "fechaInicial": "2021-08-12T05:00:00.000Z",
      "fechaFinal": "2021-08-12T05:00:00.000Z",
      "fechaRegistro": "2021-08-11T05:00:00.000Z",
      "codRegla": "00                              ",
      "conDocumentos": false,
      "cant": 46,
      "idProceso": 128433271,
      "isUltimaAct": false,
      "createdAt": "2024-02-10T00:54:37.979Z"
    },
    {
      "idRegActuacion": 1096883041,
      "llaveProceso": "11001400307920170114200",
      "consActuacion": 32,
      "fechaActuacion": "2021-08-11T05:00:00.000Z",
      "actuacion": "Auto de Trámite",
      "anotacion": "ordena mantener el proceso en secretaría ",
      "fechaInicial": null,
      "fechaFinal": null,
      "fechaRegistro": "2021-08-11T05:00:00.000Z",
      "codRegla": "00                              ",
      "conDocumentos": false,
      "cant": 46,
      "idProceso": 128433271,
      "isUltimaAct": false,
      "createdAt": "2024-02-10T00:54:37.979Z"
    },
    {
      "idRegActuacion": 1096883031,
      "llaveProceso": "11001400307920170114200",
      "consActuacion": 31,
      "fechaActuacion": "2021-05-25T05:00:00.000Z",
      "actuacion": "Al despacho",
      "anotacion": null,
      "fechaInicial": null,
      "fechaFinal": null,
      "fechaRegistro": "2021-05-25T05:00:00.000Z",
      "codRegla": "00                              ",
      "conDocumentos": false,
      "cant": 46,
      "idProceso": 128433271,
      "isUltimaAct": false,
      "createdAt": "2024-02-10T00:54:37.979Z"
    },
    {
      "idRegActuacion": 1010187081,
      "llaveProceso": "11001400307920170114200",
      "consActuacion": 30,
      "fechaActuacion": "2021-05-20T05:00:00.000Z",
      "actuacion": "Fijacion estado",
      "anotacion": "Actuación registrada el 20/05/2021 a las 16:48:25.",
      "fechaInicial": "2021-05-21T05:00:00.000Z",
      "fechaFinal": "2021-05-21T05:00:00.000Z",
      "fechaRegistro": "2021-05-20T05:00:00.000Z",
      "codRegla": "00                              ",
      "conDocumentos": false,
      "cant": 46,
      "idProceso": 128433271,
      "isUltimaAct": false,
      "createdAt": "2024-02-10T00:54:37.979Z"
    },
    {
      "idRegActuacion": 1010187071,
      "llaveProceso": "11001400307920170114200",
      "consActuacion": 29,
      "fechaActuacion": "2021-05-20T05:00:00.000Z",
      "actuacion": "Auto de Trámite",
      "anotacion": null,
      "fechaInicial": null,
      "fechaFinal": null,
      "fechaRegistro": "2021-05-20T05:00:00.000Z",
      "codRegla": "00                              ",
      "conDocumentos": false,
      "cant": 46,
      "idProceso": 128433271,
      "isUltimaAct": false,
      "createdAt": "2024-02-10T00:54:37.979Z"
    },
    {
      "idRegActuacion": 1001578641,
      "llaveProceso": "11001400307920170114200",
      "consActuacion": 28,
      "fechaActuacion": "2021-04-12T05:00:00.000Z",
      "actuacion": "Al despacho",
      "anotacion": null,
      "fechaInicial": null,
      "fechaFinal": null,
      "fechaRegistro": "2021-04-12T05:00:00.000Z",
      "codRegla": "00                              ",
      "conDocumentos": false,
      "cant": 46,
      "idProceso": 128433271,
      "isUltimaAct": false,
      "createdAt": "2024-02-10T00:54:37.979Z"
    },
    {
      "idRegActuacion": 998385411,
      "llaveProceso": "11001400307920170114200",
      "consActuacion": 27,
      "fechaActuacion": "2021-03-25T05:00:00.000Z",
      "actuacion": "Fijacion estado",
      "anotacion": "Actuación registrada el 25/03/2021 a las 12:36:14.",
      "fechaInicial": "2021-03-26T05:00:00.000Z",
      "fechaFinal": "2021-03-26T05:00:00.000Z",
      "fechaRegistro": "2021-03-25T05:00:00.000Z",
      "codRegla": "00                              ",
      "conDocumentos": false,
      "cant": 46,
      "idProceso": 128433271,
      "isUltimaAct": false,
      "createdAt": "2024-02-10T00:54:37.979Z"
    },
    {
      "idRegActuacion": 998385401,
      "llaveProceso": "11001400307920170114200",
      "consActuacion": 26,
      "fechaActuacion": "2021-03-25T05:00:00.000Z",
      "actuacion": "Auto requiere",
      "anotacion": null,
      "fechaInicial": null,
      "fechaFinal": null,
      "fechaRegistro": "2021-03-25T05:00:00.000Z",
      "codRegla": "00                              ",
      "conDocumentos": false,
      "cant": 46,
      "idProceso": 128433271,
      "isUltimaAct": false,
      "createdAt": "2024-02-10T00:54:37.979Z"
    },
    {
      "idRegActuacion": 988429401,
      "llaveProceso": "11001400307920170114200",
      "consActuacion": 25,
      "fechaActuacion": "2021-02-22T05:00:00.000Z",
      "actuacion": "Al despacho",
      "anotacion": null,
      "fechaInicial": null,
      "fechaFinal": null,
      "fechaRegistro": "2021-02-22T05:00:00.000Z",
      "codRegla": "00                              ",
      "conDocumentos": false,
      "cant": 46,
      "idProceso": 128433271,
      "isUltimaAct": false,
      "createdAt": "2024-02-10T00:54:37.979Z"
    },
    {
      "idRegActuacion": 682012091,
      "llaveProceso": "11001400307920170114200",
      "consActuacion": 24,
      "fechaActuacion": "2019-10-24T05:00:00.000Z",
      "actuacion": "Fijacion estado",
      "anotacion": "Actuación registrada el 24/10/2019 a las 16:05:00.",
      "fechaInicial": "2019-10-25T05:00:00.000Z",
      "fechaFinal": "2019-10-25T05:00:00.000Z",
      "fechaRegistro": "2019-10-24T05:00:00.000Z",
      "codRegla": "00                              ",
      "conDocumentos": false,
      "cant": 46,
      "idProceso": 128433271,
      "isUltimaAct": false,
      "createdAt": "2024-02-10T00:54:37.979Z"
    },
    {
      "idRegActuacion": 682012081,
      "llaveProceso": "11001400307920170114200",
      "consActuacion": 23,
      "fechaActuacion": "2019-10-24T05:00:00.000Z",
      "actuacion": "Auto de Trámite",
      "anotacion": null,
      "fechaInicial": null,
      "fechaFinal": null,
      "fechaRegistro": "2019-10-24T05:00:00.000Z",
      "codRegla": "00                              ",
      "conDocumentos": false,
      "cant": 46,
      "idProceso": 128433271,
      "isUltimaAct": false,
      "createdAt": "2024-02-10T00:54:37.979Z"
    },
    {
      "idRegActuacion": 681592251,
      "llaveProceso": "11001400307920170114200",
      "consActuacion": 22,
      "fechaActuacion": "2019-10-22T05:00:00.000Z",
      "actuacion": "Al despacho",
      "anotacion": "Queda con entreda al desapcho del 21 de aotubre de 2019. ",
      "fechaInicial": null,
      "fechaFinal": null,
      "fechaRegistro": "2019-10-22T05:00:00.000Z",
      "codRegla": "00                              ",
      "conDocumentos": false,
      "cant": 46,
      "idProceso": 128433271,
      "isUltimaAct": false,
      "createdAt": "2024-02-10T00:54:37.979Z"
    },
    {
      "idRegActuacion": 680505071,
      "llaveProceso": "11001400307920170114200",
      "consActuacion": 21,
      "fechaActuacion": "2019-09-25T05:00:00.000Z",
      "actuacion": "Oficio Elaborado",
      "anotacion": null,
      "fechaInicial": null,
      "fechaFinal": null,
      "fechaRegistro": "2019-09-25T05:00:00.000Z",
      "codRegla": "00                              ",
      "conDocumentos": false,
      "cant": 46,
      "idProceso": 128433271,
      "isUltimaAct": false,
      "createdAt": "2024-02-10T00:54:37.979Z"
    },
    {
      "idRegActuacion": 416233641,
      "llaveProceso": "11001400307920170114200",
      "consActuacion": 20,
      "fechaActuacion": "2019-09-18T05:00:00.000Z",
      "actuacion": "Fijacion estado",
      "anotacion": "Actuación registrada el 18/09/2019 a las 16:34:18.",
      "fechaInicial": "2019-09-19T05:00:00.000Z",
      "fechaFinal": "2019-09-19T05:00:00.000Z",
      "fechaRegistro": "2019-09-18T05:00:00.000Z",
      "codRegla": "00                              ",
      "conDocumentos": false,
      "cant": 46,
      "idProceso": 128433271,
      "isUltimaAct": false,
      "createdAt": "2024-02-10T00:54:37.979Z"
    },
    {
      "idRegActuacion": 416233631,
      "llaveProceso": "11001400307920170114200",
      "consActuacion": 19,
      "fechaActuacion": "2019-09-18T05:00:00.000Z",
      "actuacion": "Auto requiere",
      "anotacion": null,
      "fechaInicial": null,
      "fechaFinal": null,
      "fechaRegistro": "2019-09-18T05:00:00.000Z",
      "codRegla": "00                              ",
      "conDocumentos": false,
      "cant": 46,
      "idProceso": 128433271,
      "isUltimaAct": false,
      "createdAt": "2024-02-10T00:54:37.979Z"
    },
    {
      "idRegActuacion": 416246931,
      "llaveProceso": "11001400307920170114200",
      "consActuacion": 18,
      "fechaActuacion": "2019-09-11T05:00:00.000Z",
      "actuacion": "Al despacho",
      "anotacion": null,
      "fechaInicial": null,
      "fechaFinal": null,
      "fechaRegistro": "2019-09-11T05:00:00.000Z",
      "codRegla": "00                              ",
      "conDocumentos": false,
      "cant": 46,
      "idProceso": 128433271,
      "isUltimaAct": false,
      "createdAt": "2024-02-10T00:54:37.979Z"
    },
    {
      "idRegActuacion": 407615671,
      "llaveProceso": "11001400307920170114200",
      "consActuacion": 17,
      "fechaActuacion": "2019-09-03T05:00:00.000Z",
      "actuacion": "Oficio Elaborado",
      "anotacion": null,
      "fechaInicial": null,
      "fechaFinal": null,
      "fechaRegistro": "2019-09-03T05:00:00.000Z",
      "codRegla": "00                              ",
      "conDocumentos": false,
      "cant": 46,
      "idProceso": 128433271,
      "isUltimaAct": false,
      "createdAt": "2024-02-10T00:54:37.979Z"
    },
    {
      "idRegActuacion": 407615661,
      "llaveProceso": "11001400307920170114200",
      "consActuacion": 16,
      "fechaActuacion": "2019-08-27T05:00:00.000Z",
      "actuacion": "Fijacion estado",
      "anotacion": "Actuación registrada el 27/08/2019 a las 17:08:30.",
      "fechaInicial": "2019-08-28T05:00:00.000Z",
      "fechaFinal": "2019-08-28T05:00:00.000Z",
      "fechaRegistro": "2019-08-27T05:00:00.000Z",
      "codRegla": "00                              ",
      "conDocumentos": false,
      "cant": 46,
      "idProceso": 128433271,
      "isUltimaAct": false,
      "createdAt": "2024-02-10T00:54:37.979Z"
    },
    {
      "idRegActuacion": 407615651,
      "llaveProceso": "11001400307920170114200",
      "consActuacion": 15,
      "fechaActuacion": "2019-08-27T05:00:00.000Z",
      "actuacion": "Auto ordena oficiar",
      "anotacion": null,
      "fechaInicial": null,
      "fechaFinal": null,
      "fechaRegistro": "2019-08-27T05:00:00.000Z",
      "codRegla": "00                              ",
      "conDocumentos": false,
      "cant": 46,
      "idProceso": 128433271,
      "isUltimaAct": false,
      "createdAt": "2024-02-10T00:54:37.979Z"
    },
    {
      "idRegActuacion": 407615641,
      "llaveProceso": "11001400307920170114200",
      "consActuacion": 14,
      "fechaActuacion": "2019-08-23T05:00:00.000Z",
      "actuacion": "Al despacho",
      "anotacion": null,
      "fechaInicial": null,
      "fechaFinal": null,
      "fechaRegistro": "2019-08-23T05:00:00.000Z",
      "codRegla": "00                              ",
      "conDocumentos": false,
      "cant": 46,
      "idProceso": 128433271,
      "isUltimaAct": false,
      "createdAt": "2024-02-10T00:54:37.979Z"
    },
    {
      "idRegActuacion": 381875931,
      "llaveProceso": "11001400307920170114200",
      "consActuacion": 13,
      "fechaActuacion": "2019-07-11T05:00:00.000Z",
      "actuacion": "Fijacion estado",
      "anotacion": "Actuación registrada el 11/07/2019 a las 16:28:23.",
      "fechaInicial": "2019-07-12T05:00:00.000Z",
      "fechaFinal": "2019-07-12T05:00:00.000Z",
      "fechaRegistro": "2019-07-11T05:00:00.000Z",
      "codRegla": "00                              ",
      "conDocumentos": false,
      "cant": 46,
      "idProceso": 128433271,
      "isUltimaAct": false,
      "createdAt": "2024-02-10T00:54:37.979Z"
    },
    {
      "idRegActuacion": 381875921,
      "llaveProceso": "11001400307920170114200",
      "consActuacion": 12,
      "fechaActuacion": "2019-07-11T05:00:00.000Z",
      "actuacion": "Auto de Trámite",
      "anotacion": "Auto niega solicitud",
      "fechaInicial": null,
      "fechaFinal": null,
      "fechaRegistro": "2019-07-11T05:00:00.000Z",
      "codRegla": "00                              ",
      "conDocumentos": false,
      "cant": 46,
      "idProceso": 128433271,
      "isUltimaAct": false,
      "createdAt": "2024-02-10T00:54:37.979Z"
    },
    {
      "idRegActuacion": 381875911,
      "llaveProceso": "11001400307920170114200",
      "consActuacion": 11,
      "fechaActuacion": "2019-07-10T05:00:00.000Z",
      "actuacion": "Al despacho",
      "anotacion": null,
      "fechaInicial": null,
      "fechaFinal": null,
      "fechaRegistro": "2019-07-10T05:00:00.000Z",
      "codRegla": "00                              ",
      "conDocumentos": false,
      "cant": 46,
      "idProceso": 128433271,
      "isUltimaAct": false,
      "createdAt": "2024-02-10T00:54:37.979Z"
    },
    {
      "idRegActuacion": 358467071,
      "llaveProceso": "11001400307920170114200",
      "consActuacion": 10,
      "fechaActuacion": "2019-03-26T05:00:00.000Z",
      "actuacion": "Fijacion estado",
      "anotacion": "Actuación registrada el 26/03/2019 a las 16:16:39.",
      "fechaInicial": "2019-03-27T05:00:00.000Z",
      "fechaFinal": "2019-03-27T05:00:00.000Z",
      "fechaRegistro": "2019-03-26T05:00:00.000Z",
      "codRegla": "00                              ",
      "conDocumentos": false,
      "cant": 46,
      "idProceso": 128433271,
      "isUltimaAct": false,
      "createdAt": "2024-02-10T00:54:37.979Z"
    },
    {
      "idRegActuacion": 358467061,
      "llaveProceso": "11001400307920170114200",
      "consActuacion": 9,
      "fechaActuacion": "2019-03-26T05:00:00.000Z",
      "actuacion": "Auto de Trámite",
      "anotacion": null,
      "fechaInicial": null,
      "fechaFinal": null,
      "fechaRegistro": "2019-03-26T05:00:00.000Z",
      "codRegla": "00                              ",
      "conDocumentos": false,
      "cant": 46,
      "idProceso": 128433271,
      "isUltimaAct": false,
      "createdAt": "2024-02-10T00:54:37.979Z"
    },
    {
      "idRegActuacion": 358467051,
      "llaveProceso": "11001400307920170114200",
      "consActuacion": 8,
      "fechaActuacion": "2019-03-20T05:00:00.000Z",
      "actuacion": "Al despacho",
      "anotacion": null,
      "fechaInicial": null,
      "fechaFinal": null,
      "fechaRegistro": "2019-03-20T05:00:00.000Z",
      "codRegla": "00                              ",
      "conDocumentos": false,
      "cant": 46,
      "idProceso": 128433271,
      "isUltimaAct": false,
      "createdAt": "2024-02-10T00:54:37.979Z"
    },
    {
      "idRegActuacion": 358467041,
      "llaveProceso": "11001400307920170114200",
      "consActuacion": 7,
      "fechaActuacion": "2019-02-28T05:00:00.000Z",
      "actuacion": "Fijacion estado",
      "anotacion": "Actuación registrada el 28/02/2019 a las 16:17:29.",
      "fechaInicial": "2019-03-01T05:00:00.000Z",
      "fechaFinal": "2019-03-01T05:00:00.000Z",
      "fechaRegistro": "2019-02-28T05:00:00.000Z",
      "codRegla": "00                              ",
      "conDocumentos": false,
      "cant": 46,
      "idProceso": 128433271,
      "isUltimaAct": false,
      "createdAt": "2024-02-10T00:54:37.979Z"
    }
  ],
  "category": "Insolvencia",
  "codeudor": {
    "nombre": null,
    "cedula": null,
    "direccion": null,
    "telefono": null,
    "id": 201
  },
  "demanda": {
    "liquidacion": "1000",
    "avaluo": "1000",
    "capitalAdeudado": "27602951.6",
    "departamento": "CUNDINAMARCA",
    "despacho": null,
    "entregaGarantiasAbogado": "2017-08-23T05:00:16.000Z",
    "etapaProcesal": "11001400307920170114200",
    "fechaPresentacion": [],
    "id": 201,
    "llaveProceso": "11001400307920170114200",
    "mandamientoPago": ["2017-09-04T05:00:16.000Z"],
    "municipio": "BOGOTA",
    "notificacion": {
      "id": 201,
      "notifiers": [
        {
          "tipo": "291",
          "fechaRecibido": "2017-10-04T05:00:16.000Z",
          "fechaAporta": null,
          "resultado": null
        },
        {
          "tipo": "292",
          "fechaRecibido": null,
          "fechaAporta": null,
          "resultado": null
        }
      ],
      "certimail": null,
      "fisico": null,
      "autoNotificado": null
    },
    "obligacion": ["377816483778266", "4513080485378479"],
    "radicado": "2017 - 01142",
    "tipoProceso": "SINGULAR",
    "vencimientoPagare": [
      "2019-11-16T05:00:00.000Z",
      "2020-03-06T05:00:00.000Z"
    ],
    "medidasCautelares": {
      "id": 201,
      "fechaOrdenaMedida": "2024-02-10T00:54:37.933Z",
      "medidaSolicitada": null
    }
  },
  "deudor": {
    "id": 201,
    "telCelular": "3108711046",
    "telFijo": "6256456 ",
    "primerNombre": "PIEDAD",
    "segundoNombre": "MARITZA",
    "primerApellido": "OLGA",
    "segundoApellido": "ROCIO",
    "cedula": "51733931",
    "direccion": "CALLE 127D # 21 - 80 APTO 105",
    "email": "sebantialbeltransprieto@hotmail.com"
  },
  "fecha": "2023-06-05T05:00:00.000Z",
  "idProcesos": [128433271],
  "idRegUltimaAct": 1259812941,
  "llaveProceso": "11001400307920170114200",
  "nombre": "piedad maritza olga rocio prieto vargas",
  "numero": 201,
  "procesos": [
    {
      "idProceso": 128433271,
      "idConexion": 256,
      "llaveProceso": "11001400307920170114200",
      "fechaProceso": "2018-11-02T05:00:00.000Z",
      "fechaUltimaActuacion": "2023-06-05T05:00:00.000Z",
      "despacho": "JUZGADO 040 CIVIL MUNICIPAL DE BOGOTÁ ",
      "departamento": "BOGOTÁ",
      "sujetosProcesales": "Demandante: BANCOLOMBIA S.A | Demandado: PIEDAD MARITZA OLGA ROCIO PRIETO VARGAS ",
      "esPrivado": false,
      "cantFilas": -1,
      "juzgado": {
        "id": 40,
        "tipo": "JUZGADO 040 CIVIL MUNICIPAL DE BOGOTÁ",
        "url": "https://www.ramajudicial.gov.co/web/juzgado-40-civil-municipal-de-bogota"
      }
    }
  ],
  "revisado": false,
  "terminado": false,
  "tipoProceso": "SINGULAR",
  "ultimaActuacion": {
    "idRegActuacion": 1259812941,
    "llaveProceso": "11001400307920170114200",
    "consActuacion": 46,
    "fechaActuacion": "2023-06-05T05:00:00.000Z",
    "actuacion": "Fijacion estado",
    "anotacion": "Actuación registrada el 05/06/2023 a las 17:22:49.",
    "fechaInicial": "2023-06-06T05:00:00.000Z",
    "fechaFinal": "2023-06-06T05:00:00.000Z",
    "fechaRegistro": "2023-06-05T05:00:00.000Z",
    "codRegla": "00                              ",
    "conDocumentos": false,
    "cant": 46,
    "idProceso": 128433271,
    "isUltimaAct": true
  },
  "notas": [
    {
      "carpetaNumero": 201,
      "createdAt": "2024-02-10T00:54:37.933Z",
      "pathname": null,
      "dueDate": "2018-05-30T05:00:00.000Z",
      "text": "EL 30/04/2018 SE FIRMO ACUERDO DE PAGO DEUDAS EN CENTRO DE CONCILIACION ",
      "content": []
    },
    {
      "carpetaNumero": 201,
      "createdAt": "2024-02-10T00:54:37.933Z",
      "pathname": null,
      "dueDate": "2023-07-05T05:00:00.000Z",
      "text": "5/06/2023 SE ORDENA REMITIR PROCESO CON MEDIDAS CAUTELRES AL PROCESO DE LIQUIDACION POR INSOLVENCIA AL JUZGADO 54 CIVIL MUNICIPAL DE BOGOTA",
      "content": []
    }
  ],
  "updatedAt": "2024-02-10T00:54:37.933Z"
}
