{
  "id": 79789620,
  "actuaciones": [
    {
      "idRegActuacion": 1128845033,
      "llaveProceso": "11001400304820170050700",
      "consActuacion": 56,
      "fechaActuacion": "2022-05-31T05:00:00.000Z",
      "actuacion": "Archivo Definitivo",
      "anotacion": "PROCESO ARCHIVADO EN LA CAJA 76 SEGÚN ACUERDO PCSJA20-11567 DEL 2020.",
      "fechaInicial": null,
      "fechaFinal": null,
      "fechaRegistro": "2022-05-31T05:00:00.000Z",
      "codRegla": "00                              ",
      "conDocumentos": false,
      "cant": 56,
      "idProceso": 10681823,
      "isUltimaAct": true,
      "createdAt": "2024-01-02T02:09:05.633Z"
    },
    {
      "idRegActuacion": 898509453,
      "llaveProceso": "11001400304820170050700",
      "consActuacion": 55,
      "fechaActuacion": "2020-02-20T05:00:00.000Z",
      "actuacion": "Elaboración de oficios",
      "anotacion": "SE ELABORA OFICIO 0551",
      "fechaInicial": null,
      "fechaFinal": null,
      "fechaRegistro": "2020-02-20T05:00:00.000Z",
      "codRegla": "00                              ",
      "conDocumentos": false,
      "cant": 56,
      "idProceso": 10681823,
      "isUltimaAct": false,
      "createdAt": "2024-01-02T02:09:05.633Z"
    },
    {
      "idRegActuacion": 896224953,
      "llaveProceso": "11001400304820170050700",
      "consActuacion": 54,
      "fechaActuacion": "2020-02-10T05:00:00.000Z",
      "actuacion": "Fijacion estado",
      "anotacion": "Actuación registrada el 10/02/2020 a las 13:36:05.",
      "fechaInicial": "2020-02-11T05:00:00.000Z",
      "fechaFinal": "2020-02-11T05:00:00.000Z",
      "fechaRegistro": "2020-02-10T05:00:00.000Z",
      "codRegla": "00                              ",
      "conDocumentos": false,
      "cant": 56,
      "idProceso": 10681823,
      "isUltimaAct": false,
      "createdAt": "2024-01-02T02:09:05.633Z"
    },
    {
      "idRegActuacion": 896224943,
      "llaveProceso": "11001400304820170050700",
      "consActuacion": 53,
      "fechaActuacion": "2020-02-10T05:00:00.000Z",
      "actuacion": "Auto termina proceso por Pago",
      "anotacion": "TERMINA PROCESO POR PAGO TOTAL DE LA OBLIGACIÓN.",
      "fechaInicial": null,
      "fechaFinal": null,
      "fechaRegistro": "2020-02-10T05:00:00.000Z",
      "codRegla": "00                              ",
      "conDocumentos": false,
      "cant": 56,
      "idProceso": 10681823,
      "isUltimaAct": false,
      "createdAt": "2024-01-02T02:09:05.633Z"
    },
    {
      "idRegActuacion": 894799703,
      "llaveProceso": "11001400304820170050700",
      "consActuacion": 52,
      "fechaActuacion": "2020-02-03T05:00:00.000Z",
      "actuacion": "Al despacho",
      "anotacion": null,
      "fechaInicial": null,
      "fechaFinal": null,
      "fechaRegistro": "2020-02-03T05:00:00.000Z",
      "codRegla": "00                              ",
      "conDocumentos": false,
      "cant": 56,
      "idProceso": 10681823,
      "isUltimaAct": false,
      "createdAt": "2024-01-02T02:09:05.633Z"
    },
    {
      "idRegActuacion": 894270143,
      "llaveProceso": "11001400304820170050700",
      "consActuacion": 51,
      "fechaActuacion": "2020-01-30T05:00:00.000Z",
      "actuacion": "Recepción memorial",
      "anotacion": "se agrega solicitud de medidas cautelares ",
      "fechaInicial": null,
      "fechaFinal": null,
      "fechaRegistro": "2020-01-30T05:00:00.000Z",
      "codRegla": "00                              ",
      "conDocumentos": false,
      "cant": 56,
      "idProceso": 10681823,
      "isUltimaAct": false,
      "createdAt": "2024-01-02T02:09:05.633Z"
    },
    {
      "idRegActuacion": 796982093,
      "llaveProceso": "11001400304820170050700",
      "consActuacion": 50,
      "fechaActuacion": "2019-10-16T05:00:00.000Z",
      "actuacion": "Fijacion estado",
      "anotacion": "Actuación registrada el 16/10/2019 a las 08:21:49.",
      "fechaInicial": "2019-10-17T05:00:00.000Z",
      "fechaFinal": "2019-10-17T05:00:00.000Z",
      "fechaRegistro": "2019-10-16T05:00:00.000Z",
      "codRegla": "00                              ",
      "conDocumentos": false,
      "cant": 56,
      "idProceso": 10681823,
      "isUltimaAct": false,
      "createdAt": "2024-01-02T02:09:05.633Z"
    },
    {
      "idRegActuacion": 796982083,
      "llaveProceso": "11001400304820170050700",
      "consActuacion": 49,
      "fechaActuacion": "2019-10-16T05:00:00.000Z",
      "actuacion": "Auto aprueba liquidación",
      "anotacion": "APRUEBA LIQUIDACIÓN CRÉDITO, ORDENA REMITIR EXPEDIENTE JUZGADOS DE EJECUCIÓN. ",
      "fechaInicial": null,
      "fechaFinal": null,
      "fechaRegistro": "2019-10-16T05:00:00.000Z",
      "codRegla": "00                              ",
      "conDocumentos": false,
      "cant": 56,
      "idProceso": 10681823,
      "isUltimaAct": false,
      "createdAt": "2024-01-02T02:09:05.633Z"
    },
    {
      "idRegActuacion": 787937483,
      "llaveProceso": "11001400304820170050700",
      "consActuacion": 48,
      "fechaActuacion": "2019-10-08T05:00:00.000Z",
      "actuacion": "Al despacho",
      "anotacion": null,
      "fechaInicial": null,
      "fechaFinal": null,
      "fechaRegistro": "2019-10-08T05:00:00.000Z",
      "codRegla": "00                              ",
      "conDocumentos": false,
      "cant": 56,
      "idProceso": 10681823,
      "isUltimaAct": false,
      "createdAt": "2024-01-02T02:09:05.633Z"
    },
    {
      "idRegActuacion": 796123933,
      "llaveProceso": "11001400304820170050700",
      "consActuacion": 47,
      "fechaActuacion": "2019-09-23T05:00:00.000Z",
      "actuacion": "Traslado Liquidación Credito Art. 446 C.G.P.",
      "anotacion": null,
      "fechaInicial": "2019-09-24T05:00:00.000Z",
      "fechaFinal": "2019-09-26T05:00:00.000Z",
      "fechaRegistro": "2019-09-23T05:00:00.000Z",
      "codRegla": "00                              ",
      "conDocumentos": false,
      "cant": 56,
      "idProceso": 10681823,
      "isUltimaAct": false,
      "createdAt": "2024-01-02T02:09:05.633Z"
    },
    {
      "idRegActuacion": 796123923,
      "llaveProceso": "11001400304820170050700",
      "consActuacion": 46,
      "fechaActuacion": "2019-08-26T05:00:00.000Z",
      "actuacion": "Telegrama",
      "anotacion": "Se envía oficio No 1816 (4 septiembre)",
      "fechaInicial": null,
      "fechaFinal": null,
      "fechaRegistro": "2019-08-26T05:00:00.000Z",
      "codRegla": "00                              ",
      "conDocumentos": false,
      "cant": 56,
      "idProceso": 10681823,
      "isUltimaAct": false,
      "createdAt": "2024-01-02T02:09:05.633Z"
    },
    {
      "idRegActuacion": 796123913,
      "llaveProceso": "11001400304820170050700",
      "consActuacion": 45,
      "fechaActuacion": "2019-08-13T05:00:00.000Z",
      "actuacion": "Elaboración de oficios",
      "anotacion": "SE ELABORA OFICIO 1816",
      "fechaInicial": null,
      "fechaFinal": null,
      "fechaRegistro": "2019-08-13T05:00:00.000Z",
      "codRegla": "00                              ",
      "conDocumentos": false,
      "cant": 56,
      "idProceso": 10681823,
      "isUltimaAct": false,
      "createdAt": "2024-01-02T02:09:05.633Z"
    },
    {
      "idRegActuacion": 796123903,
      "llaveProceso": "11001400304820170050700",
      "consActuacion": 44,
      "fechaActuacion": "2019-08-06T05:00:00.000Z",
      "actuacion": "Fijacion estado",
      "anotacion": "Actuación registrada el 06/08/2019 a las 08:11:35.",
      "fechaInicial": "2019-08-08T05:00:00.000Z",
      "fechaFinal": "2019-08-08T05:00:00.000Z",
      "fechaRegistro": "2019-08-06T05:00:00.000Z",
      "codRegla": "00                              ",
      "conDocumentos": false,
      "cant": 56,
      "idProceso": 10681823,
      "isUltimaAct": false,
      "createdAt": "2024-01-02T02:09:05.633Z"
    },
    {
      "idRegActuacion": 796123893,
      "llaveProceso": "11001400304820170050700",
      "consActuacion": 43,
      "fechaActuacion": "2019-08-06T05:00:00.000Z",
      "actuacion": "Auto requiere",
      "anotacion": "REQUIERE NUEVAMENTE Y POR ÚLTIMA VEZ AL REPRESENTANTE JUDICIAL DE LA ACTORA TERMINO CINCO DÍAS SIGUIENTES EJECUTORIA AUTO Y SO PENA COMPULSA COPIAS, ALLEGUE PAZ Y SALVO EXPEDIDO . LIBRAR TELEGRAMA. ",
      "fechaInicial": null,
      "fechaFinal": null,
      "fechaRegistro": "2019-08-06T05:00:00.000Z",
      "codRegla": "00                              ",
      "conDocumentos": false,
      "cant": 56,
      "idProceso": 10681823,
      "isUltimaAct": false,
      "createdAt": "2024-01-02T02:09:05.633Z"
    },
    {
      "idRegActuacion": 796123883,
      "llaveProceso": "11001400304820170050700",
      "consActuacion": 42,
      "fechaActuacion": "2019-07-30T05:00:00.000Z",
      "actuacion": "Al despacho",
      "anotacion": null,
      "fechaInicial": null,
      "fechaFinal": null,
      "fechaRegistro": "2019-07-30T05:00:00.000Z",
      "codRegla": "00                              ",
      "conDocumentos": false,
      "cant": 56,
      "idProceso": 10681823,
      "isUltimaAct": false,
      "createdAt": "2024-01-02T02:09:05.633Z"
    },
    {
      "idRegActuacion": 743241863,
      "llaveProceso": "11001400304820170050700",
      "consActuacion": 41,
      "fechaActuacion": "2019-07-18T05:00:00.000Z",
      "actuacion": "Fijacion estado",
      "anotacion": "Actuación registrada el 18/07/2019 a las 18:10:26.",
      "fechaInicial": "2019-07-19T05:00:00.000Z",
      "fechaFinal": "2019-07-19T05:00:00.000Z",
      "fechaRegistro": "2019-07-18T05:00:00.000Z",
      "codRegla": "00                              ",
      "conDocumentos": false,
      "cant": 56,
      "idProceso": 10681823,
      "isUltimaAct": false,
      "createdAt": "2024-01-02T02:09:05.633Z"
    },
    {
      "idRegActuacion": 743241853,
      "llaveProceso": "11001400304820170050700",
      "consActuacion": 40,
      "fechaActuacion": "2019-07-18T05:00:00.000Z",
      "actuacion": "Auto reconoce personería",
      "anotacion": "ACEPTA REVOCATORIA PODER / RECONOCE PERSONERÍA NUEVO APODERADO PARTE ACTORA / REQUIERE REP. JUDICIAL DE LA ACTIVA TERMINO 5 DÍAS ALLEGUE PAZ Y SALVO CORRESPONDIENTE, SO PENA COMPULSA DE COPIAS. ",
      "fechaInicial": null,
      "fechaFinal": null,
      "fechaRegistro": "2019-07-18T05:00:00.000Z",
      "codRegla": "00                              ",
      "conDocumentos": false,
      "cant": 56,
      "idProceso": 10681823,
      "isUltimaAct": false,
      "createdAt": "2024-01-02T02:09:05.633Z"
    },
    {
      "idRegActuacion": 742844613,
      "llaveProceso": "11001400304820170050700",
      "consActuacion": 39,
      "fechaActuacion": "2019-07-15T05:00:00.000Z",
      "actuacion": "Al despacho",
      "anotacion": null,
      "fechaInicial": null,
      "fechaFinal": null,
      "fechaRegistro": "2019-07-15T05:00:00.000Z",
      "codRegla": "00                              ",
      "conDocumentos": false,
      "cant": 56,
      "idProceso": 10681823,
      "isUltimaAct": false,
      "createdAt": "2024-01-02T02:09:05.633Z"
    },
    {
      "idRegActuacion": 518933933,
      "llaveProceso": "11001400304820170050700",
      "consActuacion": 38,
      "fechaActuacion": "2019-05-15T05:00:00.000Z",
      "actuacion": "Fijacion estado",
      "anotacion": "Actuación registrada el 15/05/2019 a las 07:37:49.",
      "fechaInicial": "2019-05-16T05:00:00.000Z",
      "fechaFinal": "2019-05-16T05:00:00.000Z",
      "fechaRegistro": "2019-05-15T05:00:00.000Z",
      "codRegla": "00                              ",
      "conDocumentos": false,
      "cant": 56,
      "idProceso": 10681823,
      "isUltimaAct": false,
      "createdAt": "2024-01-02T02:09:05.633Z"
    },
    {
      "idRegActuacion": 518933923,
      "llaveProceso": "11001400304820170050700",
      "consActuacion": 37,
      "fechaActuacion": "2019-05-15T05:00:00.000Z",
      "actuacion": "Auto aprueba liquidación",
      "anotacion": "APRUEBA LIQUIDACIÓN DE COSTAS. ",
      "fechaInicial": null,
      "fechaFinal": null,
      "fechaRegistro": "2019-05-15T05:00:00.000Z",
      "codRegla": "00                              ",
      "conDocumentos": false,
      "cant": 56,
      "idProceso": 10681823,
      "isUltimaAct": false,
      "createdAt": "2024-01-02T02:09:05.633Z"
    },
    {
      "idRegActuacion": 518933913,
      "llaveProceso": "11001400304820170050700",
      "consActuacion": 36,
      "fechaActuacion": "2019-05-13T05:00:00.000Z",
      "actuacion": "Al despacho",
      "anotacion": null,
      "fechaInicial": null,
      "fechaFinal": null,
      "fechaRegistro": "2019-05-13T05:00:00.000Z",
      "codRegla": "00                              ",
      "conDocumentos": false,
      "cant": 56,
      "idProceso": 10681823,
      "isUltimaAct": false,
      "createdAt": "2024-01-02T02:09:05.633Z"
    },
    {
      "idRegActuacion": 518933903,
      "llaveProceso": "11001400304820170050700",
      "consActuacion": 35,
      "fechaActuacion": "2019-03-27T05:00:00.000Z",
      "actuacion": "Acta audiencia",
      "anotacion": "SE REALIZA AUDIENCIA FALLO -  2 DE ABRIL",
      "fechaInicial": null,
      "fechaFinal": null,
      "fechaRegistro": "2019-03-27T05:00:00.000Z",
      "codRegla": "00                              ",
      "conDocumentos": false,
      "cant": 56,
      "idProceso": 10681823,
      "isUltimaAct": false,
      "createdAt": "2024-01-02T02:09:05.633Z"
    },
    {
      "idRegActuacion": 518933893,
      "llaveProceso": "11001400304820170050700",
      "consActuacion": 34,
      "fechaActuacion": "2019-01-18T05:00:00.000Z",
      "actuacion": "Fijacion estado",
      "anotacion": "Actuación registrada el 18/01/2019 a las 14:13:26.",
      "fechaInicial": "2019-01-21T05:00:00.000Z",
      "fechaFinal": "2019-01-21T05:00:00.000Z",
      "fechaRegistro": "2019-01-18T05:00:00.000Z",
      "codRegla": "00                              ",
      "conDocumentos": false,
      "cant": 56,
      "idProceso": 10681823,
      "isUltimaAct": false,
      "createdAt": "2024-01-02T02:09:05.633Z"
    },
    {
      "idRegActuacion": 518933883,
      "llaveProceso": "11001400304820170050700",
      "consActuacion": 33,
      "fechaActuacion": "2019-01-18T05:00:00.000Z",
      "actuacion": "Auto fija fecha audiencia y/o diligencia",
      "anotacion": "SEÑALA NUEVA FECHA Y HORA AUDIENCIA ARTS. 372 Y 373 CGP (27 DE MARZO / 2019 A LA HORA DE LAS 9:00 AM). ",
      "fechaInicial": null,
      "fechaFinal": null,
      "fechaRegistro": "2019-01-18T05:00:00.000Z",
      "codRegla": "00                              ",
      "conDocumentos": false,
      "cant": 56,
      "idProceso": 10681823,
      "isUltimaAct": false,
      "createdAt": "2024-01-02T02:09:05.633Z"
    },
    {
      "idRegActuacion": 518933873,
      "llaveProceso": "11001400304820170050700",
      "consActuacion": 32,
      "fechaActuacion": "2019-01-11T05:00:00.000Z",
      "actuacion": "Al despacho",
      "anotacion": null,
      "fechaInicial": null,
      "fechaFinal": null,
      "fechaRegistro": "2019-01-11T05:00:00.000Z",
      "codRegla": "00                              ",
      "conDocumentos": false,
      "cant": 56,
      "idProceso": 10681823,
      "isUltimaAct": false,
      "createdAt": "2024-01-02T02:09:05.633Z"
    },
    {
      "idRegActuacion": 130480203,
      "llaveProceso": "11001400304820170050700",
      "consActuacion": 31,
      "fechaActuacion": "2018-10-17T05:00:00.000Z",
      "actuacion": "Fijacion estado",
      "anotacion": "Actuación registrada el 17/10/2018 a las 16:31:23.",
      "fechaInicial": "2018-10-18T05:00:00.000Z",
      "fechaFinal": "2018-10-18T05:00:00.000Z",
      "fechaRegistro": "2018-10-17T05:00:00.000Z",
      "codRegla": "00                              ",
      "conDocumentos": false,
      "cant": 56,
      "idProceso": 10681823,
      "isUltimaAct": false,
      "createdAt": "2024-01-02T02:09:05.633Z"
    },
    {
      "idRegActuacion": 130480193,
      "llaveProceso": "11001400304820170050700",
      "consActuacion": 30,
      "fechaActuacion": "2018-10-17T05:00:00.000Z",
      "actuacion": "Auto resuelve sustitución poder",
      "anotacion": "RECONOCE PERSONERIA DRA. LINA JULIED AVILA.",
      "fechaInicial": null,
      "fechaFinal": null,
      "fechaRegistro": "2018-10-17T05:00:00.000Z",
      "codRegla": "00                              ",
      "conDocumentos": false,
      "cant": 56,
      "idProceso": 10681823,
      "isUltimaAct": false,
      "createdAt": "2024-01-02T02:09:05.633Z"
    },
    {
      "idRegActuacion": 130480173,
      "llaveProceso": "11001400304820170050700",
      "consActuacion": 29,
      "fechaActuacion": "2018-10-16T05:00:00.000Z",
      "actuacion": "Al despacho",
      "anotacion": null,
      "fechaInicial": null,
      "fechaFinal": null,
      "fechaRegistro": "2018-10-16T05:00:00.000Z",
      "codRegla": "00                              ",
      "conDocumentos": false,
      "cant": 56,
      "idProceso": 10681823,
      "isUltimaAct": false,
      "createdAt": "2024-01-02T02:09:05.633Z"
    },
    {
      "idRegActuacion": 130480163,
      "llaveProceso": "11001400304820170050700",
      "consActuacion": 28,
      "fechaActuacion": "2018-10-12T05:00:00.000Z",
      "actuacion": "Recepción memorial",
      "anotacion": "SE AGREGA PODER ",
      "fechaInicial": null,
      "fechaFinal": null,
      "fechaRegistro": "2018-10-12T05:00:00.000Z",
      "codRegla": "00                              ",
      "conDocumentos": false,
      "cant": 56,
      "idProceso": 10681823,
      "isUltimaAct": false,
      "createdAt": "2024-01-02T02:09:05.633Z"
    },
    {
      "idRegActuacion": 130480153,
      "llaveProceso": "11001400304820170050700",
      "consActuacion": 27,
      "fechaActuacion": "2018-10-09T05:00:00.000Z",
      "actuacion": "Fijacion estado",
      "anotacion": "Actuación registrada el 09/10/2018 a las 20:37:44.",
      "fechaInicial": "2018-10-10T05:00:00.000Z",
      "fechaFinal": "2018-10-10T05:00:00.000Z",
      "fechaRegistro": "2018-10-09T05:00:00.000Z",
      "codRegla": "00                              ",
      "conDocumentos": false,
      "cant": 56,
      "idProceso": 10681823,
      "isUltimaAct": false,
      "createdAt": "2024-01-02T02:09:05.633Z"
    },
    {
      "idRegActuacion": 130480143,
      "llaveProceso": "11001400304820170050700",
      "consActuacion": 26,
      "fechaActuacion": "2018-10-09T05:00:00.000Z",
      "actuacion": "Auto fija fecha audiencia y/o diligencia",
      "anotacion": "AGREGA A LOS AUTOS ESCRITO DESCORRE TRASLADO EXCEPCIONES / SEÑALA FECHA Y HORA AUDIENCIA ARTS. 373 Y 373 CGP (11 DIC / 2018 A LA HORA DE LAS 11:00 AM)",
      "fechaInicial": null,
      "fechaFinal": null,
      "fechaRegistro": "2018-10-09T05:00:00.000Z",
      "codRegla": "00                              ",
      "conDocumentos": false,
      "cant": 56,
      "idProceso": 10681823,
      "isUltimaAct": false,
      "createdAt": "2024-01-02T02:09:05.633Z"
    },
    {
      "idRegActuacion": 130480133,
      "llaveProceso": "11001400304820170050700",
      "consActuacion": 25,
      "fechaActuacion": "2018-08-22T05:00:00.000Z",
      "actuacion": "Al despacho",
      "anotacion": null,
      "fechaInicial": null,
      "fechaFinal": null,
      "fechaRegistro": "2018-08-22T05:00:00.000Z",
      "codRegla": "00                              ",
      "conDocumentos": false,
      "cant": 56,
      "idProceso": 10681823,
      "isUltimaAct": false,
      "createdAt": "2024-01-02T02:09:05.633Z"
    },
    {
      "idRegActuacion": 130480123,
      "llaveProceso": "11001400304820170050700",
      "consActuacion": 24,
      "fechaActuacion": "2018-08-16T05:00:00.000Z",
      "actuacion": "Elaboración de oficios",
      "anotacion": "SE ELABORA OFICIO 192",
      "fechaInicial": null,
      "fechaFinal": null,
      "fechaRegistro": "2018-08-16T05:00:00.000Z",
      "codRegla": "00                              ",
      "conDocumentos": false,
      "cant": 56,
      "idProceso": 10681823,
      "isUltimaAct": false,
      "createdAt": "2024-01-02T02:09:05.633Z"
    },
    {
      "idRegActuacion": 130480113,
      "llaveProceso": "11001400304820170050700",
      "consActuacion": 23,
      "fechaActuacion": "2018-07-30T05:00:00.000Z",
      "actuacion": "Fijacion estado",
      "anotacion": "Actuación registrada el 30/07/2018 a las 09:44:07.",
      "fechaInicial": "2018-07-31T05:00:00.000Z",
      "fechaFinal": "2018-07-31T05:00:00.000Z",
      "fechaRegistro": "2018-07-30T05:00:00.000Z",
      "codRegla": "00                              ",
      "conDocumentos": false,
      "cant": 56,
      "idProceso": 10681823,
      "isUltimaAct": false,
      "createdAt": "2024-01-02T02:09:05.633Z"
    },
    {
      "idRegActuacion": 130480103,
      "llaveProceso": "11001400304820170050700",
      "consActuacion": 22,
      "fechaActuacion": "2018-07-30T05:00:00.000Z",
      "actuacion": "Auto decreta retención vehículos",
      "anotacion": "OFICIAR SIJIN AUTOMOTORES / CORRE TRASLADO PARTE ACTORA TERMINO LEGAL ESCRITO DE EXCEPCIONES.",
      "fechaInicial": null,
      "fechaFinal": null,
      "fechaRegistro": "2018-07-30T05:00:00.000Z",
      "codRegla": "00                              ",
      "conDocumentos": false,
      "cant": 56,
      "idProceso": 10681823,
      "isUltimaAct": false,
      "createdAt": "2024-01-02T02:09:05.633Z"
    },
    {
      "idRegActuacion": 130480093,
      "llaveProceso": "11001400304820170050700",
      "consActuacion": 21,
      "fechaActuacion": "2018-07-18T05:00:00.000Z",
      "actuacion": "Al despacho",
      "anotacion": null,
      "fechaInicial": null,
      "fechaFinal": null,
      "fechaRegistro": "2018-07-18T05:00:00.000Z",
      "codRegla": "00                              ",
      "conDocumentos": false,
      "cant": 56,
      "idProceso": 10681823,
      "isUltimaAct": false,
      "createdAt": "2024-01-02T02:09:05.633Z"
    },
    {
      "idRegActuacion": 130480083,
      "llaveProceso": "11001400304820170050700",
      "consActuacion": 20,
      "fechaActuacion": "2018-07-17T05:00:00.000Z",
      "actuacion": "Recepción memorial",
      "anotacion": "SE AGREGA SOLICITUD DE CAPTURA DE AUTOMOTOR ",
      "fechaInicial": null,
      "fechaFinal": null,
      "fechaRegistro": "2018-07-17T05:00:00.000Z",
      "codRegla": "00                              ",
      "conDocumentos": false,
      "cant": 56,
      "idProceso": 10681823,
      "isUltimaAct": false,
      "createdAt": "2024-01-02T02:09:05.633Z"
    },
    {
      "idRegActuacion": 130480063,
      "llaveProceso": "11001400304820170050700",
      "consActuacion": 19,
      "fechaActuacion": "2018-06-27T05:00:00.000Z",
      "actuacion": "Fijacion estado",
      "anotacion": "Actuación registrada el 27/06/2018 a las 12:21:36.",
      "fechaInicial": "2018-06-28T05:00:00.000Z",
      "fechaFinal": "2018-06-28T05:00:00.000Z",
      "fechaRegistro": "2018-06-27T05:00:00.000Z",
      "codRegla": "00                              ",
      "conDocumentos": false,
      "cant": 56,
      "idProceso": 10681823,
      "isUltimaAct": false,
      "createdAt": "2024-01-02T02:09:05.633Z"
    },
    {
      "idRegActuacion": 130480053,
      "llaveProceso": "11001400304820170050700",
      "consActuacion": 18,
      "fechaActuacion": "2018-06-27T05:00:00.000Z",
      "actuacion": "Auto reconoce personería",
      "anotacion": "RECONOCE PERSONERÍA APODERADO JUDICIAL DE LOS DEMANDADOS, QUIEN ALLEGA DENTRO DE LA OPORTUNIDAD PROCESAL ESCRITO DE EXCEPCIONES / PREVIO RESOLVER SOBRE ÉSTE, LA ACTIVA ACREDITE TRAMITE MEDIDA CAUTELAR. ",
      "fechaInicial": null,
      "fechaFinal": null,
      "fechaRegistro": "2018-06-27T05:00:00.000Z",
      "codRegla": "00                              ",
      "conDocumentos": false,
      "cant": 56,
      "idProceso": 10681823,
      "isUltimaAct": false,
      "createdAt": "2024-01-02T02:09:05.633Z"
    },
    {
      "idRegActuacion": 130480043,
      "llaveProceso": "11001400304820170050700",
      "consActuacion": 17,
      "fechaActuacion": "2018-06-06T05:00:00.000Z",
      "actuacion": "Al despacho",
      "anotacion": null,
      "fechaInicial": null,
      "fechaFinal": null,
      "fechaRegistro": "2018-06-06T05:00:00.000Z",
      "codRegla": "00                              ",
      "conDocumentos": false,
      "cant": 56,
      "idProceso": 10681823,
      "isUltimaAct": false,
      "createdAt": "2024-01-02T02:09:05.633Z"
    }
  ],
  "category": "Terminados",
  "codeudor": {
    "nombre": "VERONICA MARTINEZ SEGURA",
    "cedula": "52666505",
    "direccion": "CALLE 107A # 54- 57 APTO 202",
    "telefono": "8040407",
    "id": 74
  },
  "demanda": {
    "obligacion": ["12185017"],
    "llaveProceso": "11001400304820170050700",
    "notificacion": {
      "certimail": null,
      "fisico": null,
      "autoNotificado": "06/06/2018 AMBOS"
    },
    "medidasCautelares": {
      "fechaOrdenaMedida": null,
      "medidaSolicitada": "VEHICULO"
    },
    "capitalAdeudado": 44110828,
    "departamento": "CUNDINAMARCA",
    "despacho": null,
    "entregaGarantiasAbogado": "2017-12-06T05:00:00.000Z",
    "etapaProcesal": "NOTIFICACION",
    "fechaPresentacion": ["2017-06-15T05:00:00.000Z"],
    "mandamientoPago": null,
    "municipio": "BOGOTA",
    "radicado": "2017 - 00507",
    "tipoProceso": "PRENDARIO",
    "vencimientoPagare": ["2017-06-07T05:00:00.000Z"]
  },
  "deudor": {
    "tel": {
      "fijo": null,
      "celular": 3138327713
    },
    "primerNombre": "CARLOS",
    "segundoNombre": "ANDRÉS",
    "primerApellido": "BORRAY",
    "segundoApellido": "ARCE",
    "cedula": 79789620,
    "direccion": "CARRERA 18 # 120 - 65 APTO 306",
    "email": "carlosborray@gmail.com"
  },
  "fecha": "2022-05-31T05:00:00.000Z",
  "idProcesos": [10681823],
  "idRegUltimaAct": 1128845033,
  "llaveProceso": "11001400304820170050700",
  "nombre": "CARLOS ANDRÉS BORRAY ARCE",
  "numero": 74,
  "procesos": [
    {
      "idProceso": 10681823,
      "idConexion": 261,
      "llaveProceso": "11001400304820170050700",
      "fechaProceso": "2017-07-17T05:00:00.000Z",
      "fechaUltimaActuacion": "2022-05-31T05:00:00.000Z",
      "despacho": "JUZGADO 048 CIVIL MUNICIPAL DE BOGOTÁ ",
      "departamento": "BOGOTÁ",
      "sujetosProcesales": "Demandante: BANCOLOMBIA S.A | Demandado: CARLOS ANDRES BORRAY ARCE | Demandado: VERONICA ARTINEZ SEGURA ",
      "esPrivado": false,
      "cantFilas": -1,
      "juzgado": {
        "id": 48,
        "tipo": "JUZGADO 048 CIVIL MUNICIPAL DE BOGOTÁ",
        "url": "https://www.ramajudicial.gov.co/web/juzgado-048-civil-municipal-de-bogota"
      }
    }
  ],
  "revisado": true,
  "terminado": true,
  "tipoProceso": "PRENDARIO",
  "ultimaActuacion": {
    "idRegActuacion": 1128845033,
    "llaveProceso": "11001400304820170050700",
    "consActuacion": 56,
    "fechaActuacion": "2022-05-31T05:00:00.000Z",
    "actuacion": "Archivo Definitivo",
    "anotacion": "PROCESO ARCHIVADO EN LA CAJA 76 SEGÚN ACUERDO PCSJA20-11567 DEL 2020.",
    "fechaInicial": null,
    "fechaFinal": null,
    "fechaRegistro": "2022-05-31T05:00:00.000Z",
    "codRegla": "00                              ",
    "conDocumentos": false,
    "cant": 56,
    "idProceso": 10681823,
    "isUltimaAct": true
  },
  "updatedAt": "2024-01-02T02:09:05.504Z"
}
