{
  "id": 900520023,
  "actuaciones": [
    {
      "idRegActuacion": 1945088290,
      "llaveProceso": "11001400306820200102100",
      "consActuacion": 39,
      "fechaActuacion": "2024-01-17T05:00:00.000Z",
      "actuacion": "Fijacion estado",
      "anotacion": "Actuación registrada el 17/01/2024 a las 09:46:30.",
      "fechaInicial": "2024-01-18T05:00:00.000Z",
      "fechaFinal": "2024-01-18T05:00:00.000Z",
      "fechaRegistro": "2024-01-17T05:00:00.000Z",
      "codRegla": "00                              ",
      "conDocumentos": false,
      "cant": 39,
      "idProceso": 112628300,
      "isUltimaAct": true,
      "createdAt": "2024-02-10T00:55:05.285Z"
    },
    {
      "idRegActuacion": 1945088280,
      "llaveProceso": "11001400306820200102100",
      "consActuacion": 38,
      "fechaActuacion": "2024-01-17T05:00:00.000Z",
      "actuacion": "Auto aprueba liquidación",
      "anotacion": "de costas",
      "fechaInicial": null,
      "fechaFinal": null,
      "fechaRegistro": "2024-01-17T05:00:00.000Z",
      "codRegla": "00                              ",
      "conDocumentos": false,
      "cant": 39,
      "idProceso": 112628300,
      "isUltimaAct": false,
      "createdAt": "2024-02-10T00:55:05.285Z"
    },
    {
      "idRegActuacion": 1942917940,
      "llaveProceso": "11001400306820200102100",
      "consActuacion": 37,
      "fechaActuacion": "2023-12-18T05:00:00.000Z",
      "actuacion": "Al despacho",
      "anotacion": "con liquidación de costas",
      "fechaInicial": null,
      "fechaFinal": null,
      "fechaRegistro": "2023-12-18T05:00:00.000Z",
      "codRegla": "00                              ",
      "conDocumentos": false,
      "cant": 39,
      "idProceso": 112628300,
      "isUltimaAct": false,
      "createdAt": "2024-02-10T00:55:05.286Z"
    },
    {
      "idRegActuacion": 1921423940,
      "llaveProceso": "11001400306820200102100",
      "consActuacion": 36,
      "fechaActuacion": "2023-10-30T05:00:00.000Z",
      "actuacion": "Fijacion estado",
      "anotacion": "Actuación registrada el 30/10/2023 a las 10:47:06.",
      "fechaInicial": "2023-10-31T05:00:00.000Z",
      "fechaFinal": "2023-10-31T05:00:00.000Z",
      "fechaRegistro": "2023-10-30T05:00:00.000Z",
      "codRegla": "00                              ",
      "conDocumentos": false,
      "cant": 39,
      "idProceso": 112628300,
      "isUltimaAct": false,
      "createdAt": "2024-02-10T00:55:05.286Z"
    },
    {
      "idRegActuacion": 1921423930,
      "llaveProceso": "11001400306820200102100",
      "consActuacion": 35,
      "fechaActuacion": "2023-10-30T05:00:00.000Z",
      "actuacion": "Auto ordena Seguir adelante la Ejecucion  Ley 1395/2010",
      "anotacion": null,
      "fechaInicial": null,
      "fechaFinal": null,
      "fechaRegistro": "2023-10-30T05:00:00.000Z",
      "codRegla": "00                              ",
      "conDocumentos": false,
      "cant": 39,
      "idProceso": 112628300,
      "isUltimaAct": false,
      "createdAt": "2024-02-10T00:55:05.286Z"
    },
    {
      "idRegActuacion": 1921359860,
      "llaveProceso": "11001400306820200102100",
      "consActuacion": 34,
      "fechaActuacion": "2023-10-30T05:00:00.000Z",
      "actuacion": "Fijacion estado",
      "anotacion": "Actuación registrada el 30/10/2023 a las 10:40:49.",
      "fechaInicial": "2023-10-31T05:00:00.000Z",
      "fechaFinal": "2023-10-31T05:00:00.000Z",
      "fechaRegistro": "2023-10-30T05:00:00.000Z",
      "codRegla": "00                              ",
      "conDocumentos": false,
      "cant": 39,
      "idProceso": 112628300,
      "isUltimaAct": false,
      "createdAt": "2024-02-10T00:55:05.286Z"
    },
    {
      "idRegActuacion": 1921359850,
      "llaveProceso": "11001400306820200102100",
      "consActuacion": 33,
      "fechaActuacion": "2023-10-30T05:00:00.000Z",
      "actuacion": "Auto rechaza de plano solicitud nulidad",
      "anotacion": null,
      "fechaInicial": null,
      "fechaFinal": null,
      "fechaRegistro": "2023-10-30T05:00:00.000Z",
      "codRegla": "00                              ",
      "conDocumentos": false,
      "cant": 39,
      "idProceso": 112628300,
      "isUltimaAct": false,
      "createdAt": "2024-02-10T00:55:05.286Z"
    },
    {
      "idRegActuacion": 1866723570,
      "llaveProceso": "11001400306820200102100",
      "consActuacion": 32,
      "fechaActuacion": "2023-09-04T05:00:00.000Z",
      "actuacion": "Al despacho",
      "anotacion": "venciendo traslado de notificación y con solicitud de emplazamiento",
      "fechaInicial": null,
      "fechaFinal": null,
      "fechaRegistro": "2023-09-01T05:00:00.000Z",
      "codRegla": "00                              ",
      "conDocumentos": false,
      "cant": 39,
      "idProceso": 112628300,
      "isUltimaAct": false,
      "createdAt": "2024-02-10T00:55:05.286Z"
    },
    {
      "idRegActuacion": 1825785160,
      "llaveProceso": "11001400306820200102100",
      "consActuacion": 31,
      "fechaActuacion": "2023-07-27T05:00:00.000Z",
      "actuacion": "Fijacion estado",
      "anotacion": "Actuación registrada el 27/07/2023 a las 20:14:20.",
      "fechaInicial": "2023-07-28T05:00:00.000Z",
      "fechaFinal": "2023-07-28T05:00:00.000Z",
      "fechaRegistro": "2023-07-27T05:00:00.000Z",
      "codRegla": "00                              ",
      "conDocumentos": false,
      "cant": 39,
      "idProceso": 112628300,
      "isUltimaAct": false,
      "createdAt": "2024-02-10T00:55:05.286Z"
    },
    {
      "idRegActuacion": 1825785150,
      "llaveProceso": "11001400306820200102100",
      "consActuacion": 30,
      "fechaActuacion": "2023-07-27T05:00:00.000Z",
      "actuacion": "Auto de Trámite",
      "anotacion": "no tiene en cuenta escrito allegado",
      "fechaInicial": null,
      "fechaFinal": null,
      "fechaRegistro": "2023-07-27T05:00:00.000Z",
      "codRegla": "00                              ",
      "conDocumentos": false,
      "cant": 39,
      "idProceso": 112628300,
      "isUltimaAct": false,
      "createdAt": "2024-02-10T00:55:05.286Z"
    },
    {
      "idRegActuacion": 1818696410,
      "llaveProceso": "11001400306820200102100",
      "consActuacion": 29,
      "fechaActuacion": "2023-07-21T05:00:00.000Z",
      "actuacion": "Oficio Elaborado",
      "anotacion": "ENVIO DESPACHO COMISORIO",
      "fechaInicial": null,
      "fechaFinal": null,
      "fechaRegistro": "2023-07-21T05:00:00.000Z",
      "codRegla": "00                              ",
      "conDocumentos": false,
      "cant": 39,
      "idProceso": 112628300,
      "isUltimaAct": false,
      "createdAt": "2024-02-10T00:55:05.286Z"
    },
    {
      "idRegActuacion": 1791918410,
      "llaveProceso": "11001400306820200102100",
      "consActuacion": 28,
      "fechaActuacion": "2023-06-29T05:00:00.000Z",
      "actuacion": "Al despacho",
      "anotacion": "con escrito de contestación de demanda y excepciones previas",
      "fechaInicial": null,
      "fechaFinal": null,
      "fechaRegistro": "2023-06-29T05:00:00.000Z",
      "codRegla": "00                              ",
      "conDocumentos": false,
      "cant": 39,
      "idProceso": 112628300,
      "isUltimaAct": false,
      "createdAt": "2024-02-10T00:55:05.286Z"
    },
    {
      "idRegActuacion": 1746217140,
      "llaveProceso": "11001400306820200102100",
      "consActuacion": 27,
      "fechaActuacion": "2023-05-17T05:00:00.000Z",
      "actuacion": "Fijacion estado",
      "anotacion": "Actuación registrada el 17/05/2023 a las 14:45:40.",
      "fechaInicial": "2023-05-18T05:00:00.000Z",
      "fechaFinal": "2023-05-18T05:00:00.000Z",
      "fechaRegistro": "2023-05-17T05:00:00.000Z",
      "codRegla": "00                              ",
      "conDocumentos": false,
      "cant": 39,
      "idProceso": 112628300,
      "isUltimaAct": false,
      "createdAt": "2024-02-10T00:55:05.286Z"
    },
    {
      "idRegActuacion": 1746217130,
      "llaveProceso": "11001400306820200102100",
      "consActuacion": 26,
      "fechaActuacion": "2023-05-17T05:00:00.000Z",
      "actuacion": "Auto ordena comisión",
      "anotacion": "elaborar despacho comisorio",
      "fechaInicial": null,
      "fechaFinal": null,
      "fechaRegistro": "2023-05-17T05:00:00.000Z",
      "codRegla": "00                              ",
      "conDocumentos": false,
      "cant": 39,
      "idProceso": 112628300,
      "isUltimaAct": false,
      "createdAt": "2024-02-10T00:55:05.286Z"
    },
    {
      "idRegActuacion": 1746217120,
      "llaveProceso": "11001400306820200102100",
      "consActuacion": 25,
      "fechaActuacion": "2023-05-17T05:00:00.000Z",
      "actuacion": "Fijacion estado",
      "anotacion": "Actuación registrada el 17/05/2023 a las 14:43:42.",
      "fechaInicial": "2023-05-18T05:00:00.000Z",
      "fechaFinal": "2023-05-18T05:00:00.000Z",
      "fechaRegistro": "2023-05-17T05:00:00.000Z",
      "codRegla": "00                              ",
      "conDocumentos": false,
      "cant": 39,
      "idProceso": 112628300,
      "isUltimaAct": false,
      "createdAt": "2024-02-10T00:55:05.286Z"
    },
    {
      "idRegActuacion": 1746217110,
      "llaveProceso": "11001400306820200102100",
      "consActuacion": 24,
      "fechaActuacion": "2023-05-17T05:00:00.000Z",
      "actuacion": "Auto ordena notificar",
      "anotacion": "a la pasiva",
      "fechaInicial": null,
      "fechaFinal": null,
      "fechaRegistro": "2023-05-17T05:00:00.000Z",
      "codRegla": "00                              ",
      "conDocumentos": false,
      "cant": 39,
      "idProceso": 112628300,
      "isUltimaAct": false,
      "createdAt": "2024-02-10T00:55:05.286Z"
    },
    {
      "idRegActuacion": 1621439040,
      "llaveProceso": "11001400306820200102100",
      "consActuacion": 23,
      "fechaActuacion": "2023-01-23T05:00:00.000Z",
      "actuacion": "Al despacho",
      "anotacion": "venciendo requerimiento del art. 317 del C. G. del P.",
      "fechaInicial": null,
      "fechaFinal": null,
      "fechaRegistro": "2023-01-20T05:00:00.000Z",
      "codRegla": "00                              ",
      "conDocumentos": false,
      "cant": 39,
      "idProceso": 112628300,
      "isUltimaAct": false,
      "createdAt": "2024-02-10T00:55:05.286Z"
    },
    {
      "idRegActuacion": 1495958170,
      "llaveProceso": "11001400306820200102100",
      "consActuacion": 22,
      "fechaActuacion": "2022-11-08T05:00:00.000Z",
      "actuacion": "Fijacion estado",
      "anotacion": "Actuación registrada el 08/11/2022 a las 12:04:23.",
      "fechaInicial": "2022-11-09T05:00:00.000Z",
      "fechaFinal": "2022-11-09T05:00:00.000Z",
      "fechaRegistro": "2022-11-08T05:00:00.000Z",
      "codRegla": "00                              ",
      "conDocumentos": false,
      "cant": 39,
      "idProceso": 112628300,
      "isUltimaAct": false,
      "createdAt": "2024-02-10T00:55:05.286Z"
    },
    {
      "idRegActuacion": 1495958160,
      "llaveProceso": "11001400306820200102100",
      "consActuacion": 21,
      "fechaActuacion": "2022-11-08T05:00:00.000Z",
      "actuacion": "Auto requiere",
      "anotacion": "de conformidad con el art. 317 del C.G. del P.",
      "fechaInicial": null,
      "fechaFinal": null,
      "fechaRegistro": "2022-11-08T05:00:00.000Z",
      "codRegla": "00                              ",
      "conDocumentos": false,
      "cant": 39,
      "idProceso": 112628300,
      "isUltimaAct": false,
      "createdAt": "2024-02-10T00:55:05.286Z"
    },
    {
      "idRegActuacion": 1455776710,
      "llaveProceso": "11001400306820200102100",
      "consActuacion": 20,
      "fechaActuacion": "2022-10-14T05:00:00.000Z",
      "actuacion": "Al despacho",
      "anotacion": "con solicitud de emplazamiento",
      "fechaInicial": null,
      "fechaFinal": null,
      "fechaRegistro": "2022-10-13T05:00:00.000Z",
      "codRegla": "00                              ",
      "conDocumentos": false,
      "cant": 39,
      "idProceso": 112628300,
      "isUltimaAct": false,
      "createdAt": "2024-02-10T00:55:05.286Z"
    },
    {
      "idRegActuacion": 1387362500,
      "llaveProceso": "11001400306820200102100",
      "consActuacion": 19,
      "fechaActuacion": "2022-09-05T05:00:00.000Z",
      "actuacion": "Fijacion estado",
      "anotacion": "Actuación registrada el 05/09/2022 a las 10:38:20.",
      "fechaInicial": "2022-09-06T05:00:00.000Z",
      "fechaFinal": "2022-09-06T05:00:00.000Z",
      "fechaRegistro": "2022-09-05T05:00:00.000Z",
      "codRegla": "00                              ",
      "conDocumentos": false,
      "cant": 39,
      "idProceso": 112628300,
      "isUltimaAct": false,
      "createdAt": "2024-02-10T00:55:05.286Z"
    },
    {
      "idRegActuacion": 1387362490,
      "llaveProceso": "11001400306820200102100",
      "consActuacion": 18,
      "fechaActuacion": "2022-09-05T05:00:00.000Z",
      "actuacion": "Auto ordena notificar",
      "anotacion": "a la parte demandada",
      "fechaInicial": null,
      "fechaFinal": null,
      "fechaRegistro": "2022-09-05T05:00:00.000Z",
      "codRegla": "00                              ",
      "conDocumentos": false,
      "cant": 39,
      "idProceso": 112628300,
      "isUltimaAct": false,
      "createdAt": "2024-02-10T00:55:05.286Z"
    },
    {
      "idRegActuacion": 1373870970,
      "llaveProceso": "11001400306820200102100",
      "consActuacion": 17,
      "fechaActuacion": "2022-08-23T05:00:00.000Z",
      "actuacion": "Al despacho",
      "anotacion": "venciendo requerimiento del art. 317 del C. G. del P.",
      "fechaInicial": null,
      "fechaFinal": null,
      "fechaRegistro": "2022-08-19T05:00:00.000Z",
      "codRegla": "00                              ",
      "conDocumentos": false,
      "cant": 39,
      "idProceso": 112628300,
      "isUltimaAct": false,
      "createdAt": "2024-02-10T00:55:05.286Z"
    },
    {
      "idRegActuacion": 1355721150,
      "llaveProceso": "11001400306820200102100",
      "consActuacion": 16,
      "fechaActuacion": "2022-08-03T05:00:00.000Z",
      "actuacion": "Fijacion estado",
      "anotacion": "Actuación registrada el 03/08/2022 a las 14:34:04.",
      "fechaInicial": "2022-08-04T05:00:00.000Z",
      "fechaFinal": "2022-08-04T05:00:00.000Z",
      "fechaRegistro": "2022-08-03T05:00:00.000Z",
      "codRegla": "00                              ",
      "conDocumentos": false,
      "cant": 39,
      "idProceso": 112628300,
      "isUltimaAct": false,
      "createdAt": "2024-02-10T00:55:05.286Z"
    },
    {
      "idRegActuacion": 1355721140,
      "llaveProceso": "11001400306820200102100",
      "consActuacion": 15,
      "fechaActuacion": "2022-08-03T05:00:00.000Z",
      "actuacion": "Auto requiere",
      "anotacion": "de conformidad con el art. 317 del C. G. del P. ",
      "fechaInicial": null,
      "fechaFinal": null,
      "fechaRegistro": "2022-08-03T05:00:00.000Z",
      "codRegla": "00                              ",
      "conDocumentos": false,
      "cant": 39,
      "idProceso": 112628300,
      "isUltimaAct": false,
      "createdAt": "2024-02-10T00:55:05.286Z"
    },
    {
      "idRegActuacion": 1348343500,
      "llaveProceso": "11001400306820200102100",
      "consActuacion": 14,
      "fechaActuacion": "2022-07-27T05:00:00.000Z",
      "actuacion": "Oficio Elaborado",
      "anotacion": "REMISION DESPACHO COMISORIO",
      "fechaInicial": null,
      "fechaFinal": null,
      "fechaRegistro": "2022-07-27T05:00:00.000Z",
      "codRegla": "00                              ",
      "conDocumentos": false,
      "cant": 39,
      "idProceso": 112628300,
      "isUltimaAct": false,
      "createdAt": "2024-02-10T00:55:05.286Z"
    },
    {
      "idRegActuacion": 1323788860,
      "llaveProceso": "11001400306820200102100",
      "consActuacion": 13,
      "fechaActuacion": "2022-07-01T05:00:00.000Z",
      "actuacion": "Al despacho",
      "anotacion": "con solicitud de emplazamiento",
      "fechaInicial": null,
      "fechaFinal": null,
      "fechaRegistro": "2022-06-29T05:00:00.000Z",
      "codRegla": "00                              ",
      "conDocumentos": false,
      "cant": 39,
      "idProceso": 112628300,
      "isUltimaAct": false,
      "createdAt": "2024-02-10T00:55:05.286Z"
    },
    {
      "idRegActuacion": 1270012290,
      "llaveProceso": "11001400306820200102100",
      "consActuacion": 12,
      "fechaActuacion": "2022-04-01T05:00:00.000Z",
      "actuacion": "Fijacion estado",
      "anotacion": "Actuación registrada el 01/04/2022 a las 22:05:38.",
      "fechaInicial": "2022-04-04T05:00:00.000Z",
      "fechaFinal": "2022-04-04T05:00:00.000Z",
      "fechaRegistro": "2022-04-01T05:00:00.000Z",
      "codRegla": "00                              ",
      "conDocumentos": false,
      "cant": 39,
      "idProceso": 112628300,
      "isUltimaAct": false,
      "createdAt": "2024-02-10T00:55:05.286Z"
    },
    {
      "idRegActuacion": 1270012280,
      "llaveProceso": "11001400306820200102100",
      "consActuacion": 11,
      "fechaActuacion": "2022-04-01T05:00:00.000Z",
      "actuacion": "Auto decreta medida cautelar",
      "anotacion": null,
      "fechaInicial": null,
      "fechaFinal": null,
      "fechaRegistro": "2022-04-01T05:00:00.000Z",
      "codRegla": "00                              ",
      "conDocumentos": false,
      "cant": 39,
      "idProceso": 112628300,
      "isUltimaAct": false,
      "createdAt": "2024-02-10T00:55:05.286Z"
    },
    {
      "idRegActuacion": 1270012270,
      "llaveProceso": "11001400306820200102100",
      "consActuacion": 10,
      "fechaActuacion": "2022-04-01T05:00:00.000Z",
      "actuacion": "Fijacion estado",
      "anotacion": "Actuación registrada el 01/04/2022 a las 22:05:20.",
      "fechaInicial": "2022-04-04T05:00:00.000Z",
      "fechaFinal": "2022-04-04T05:00:00.000Z",
      "fechaRegistro": "2022-04-01T05:00:00.000Z",
      "codRegla": "00                              ",
      "conDocumentos": false,
      "cant": 39,
      "idProceso": 112628300,
      "isUltimaAct": false,
      "createdAt": "2024-02-10T00:55:05.286Z"
    },
    {
      "idRegActuacion": 1270012260,
      "llaveProceso": "11001400306820200102100",
      "consActuacion": 9,
      "fechaActuacion": "2022-04-01T05:00:00.000Z",
      "actuacion": "Auto ordena notificar",
      "anotacion": "a la parte demandada",
      "fechaInicial": null,
      "fechaFinal": null,
      "fechaRegistro": "2022-04-01T05:00:00.000Z",
      "codRegla": "00                              ",
      "conDocumentos": false,
      "cant": 39,
      "idProceso": 112628300,
      "isUltimaAct": false,
      "createdAt": "2024-02-10T00:55:05.286Z"
    },
    {
      "idRegActuacion": 1242841990,
      "llaveProceso": "11001400306820200102100",
      "consActuacion": 8,
      "fechaActuacion": "2021-10-27T05:00:00.000Z",
      "actuacion": "Al despacho",
      "anotacion": "con oficio acatando medida cautelar",
      "fechaInicial": null,
      "fechaFinal": null,
      "fechaRegistro": "2021-10-27T05:00:00.000Z",
      "codRegla": "00                              ",
      "conDocumentos": false,
      "cant": 39,
      "idProceso": 112628300,
      "isUltimaAct": false,
      "createdAt": "2024-02-10T00:55:05.286Z"
    },
    {
      "idRegActuacion": 1015468960,
      "llaveProceso": "11001400306820200102100",
      "consActuacion": 7,
      "fechaActuacion": "2021-05-07T05:00:00.000Z",
      "actuacion": "Oficio Elaborado",
      "anotacion": null,
      "fechaInicial": null,
      "fechaFinal": null,
      "fechaRegistro": "2021-05-07T05:00:00.000Z",
      "codRegla": "00                              ",
      "conDocumentos": false,
      "cant": 39,
      "idProceso": 112628300,
      "isUltimaAct": false,
      "createdAt": "2024-02-10T00:55:05.286Z"
    },
    {
      "idRegActuacion": 1243845490,
      "llaveProceso": "11001400306820200102100",
      "consActuacion": 6,
      "fechaActuacion": "2020-11-13T05:00:00.000Z",
      "actuacion": "Fijacion estado",
      "anotacion": "Actuación registrada el 13/11/2020 a las 08:13:51.",
      "fechaInicial": "2020-11-17T05:00:00.000Z",
      "fechaFinal": "2020-11-17T05:00:00.000Z",
      "fechaRegistro": "2020-11-13T05:00:00.000Z",
      "codRegla": "00                              ",
      "conDocumentos": false,
      "cant": 39,
      "idProceso": 112628300,
      "isUltimaAct": false,
      "createdAt": "2024-02-10T00:55:05.286Z"
    },
    {
      "idRegActuacion": 998301160,
      "llaveProceso": "11001400306820200102100",
      "consActuacion": 5,
      "fechaActuacion": "2020-11-13T05:00:00.000Z",
      "actuacion": "Auto decreta medida cautelar",
      "anotacion": null,
      "fechaInicial": null,
      "fechaFinal": null,
      "fechaRegistro": "2020-11-13T05:00:00.000Z",
      "codRegla": "00                              ",
      "conDocumentos": false,
      "cant": 39,
      "idProceso": 112628300,
      "isUltimaAct": false,
      "createdAt": "2024-02-10T00:55:05.286Z"
    },
    {
      "idRegActuacion": 1243845480,
      "llaveProceso": "11001400306820200102100",
      "consActuacion": 4,
      "fechaActuacion": "2020-11-13T05:00:00.000Z",
      "actuacion": "Fijacion estado",
      "anotacion": "Actuación registrada el 13/11/2020 a las 08:13:18.",
      "fechaInicial": "2020-11-17T05:00:00.000Z",
      "fechaFinal": "2020-11-17T05:00:00.000Z",
      "fechaRegistro": "2020-11-13T05:00:00.000Z",
      "codRegla": "00                              ",
      "conDocumentos": false,
      "cant": 39,
      "idProceso": 112628300,
      "isUltimaAct": false,
      "createdAt": "2024-02-10T00:55:05.286Z"
    },
    {
      "idRegActuacion": 998301140,
      "llaveProceso": "11001400306820200102100",
      "consActuacion": 3,
      "fechaActuacion": "2020-11-13T05:00:00.000Z",
      "actuacion": "Auto libra mandamiento ejecutivo",
      "anotacion": null,
      "fechaInicial": null,
      "fechaFinal": null,
      "fechaRegistro": "2020-11-13T05:00:00.000Z",
      "codRegla": "00                              ",
      "conDocumentos": false,
      "cant": 39,
      "idProceso": 112628300,
      "isUltimaAct": false,
      "createdAt": "2024-02-10T00:55:05.286Z"
    },
    {
      "idRegActuacion": 995598950,
      "llaveProceso": "11001400306820200102100",
      "consActuacion": 2,
      "fechaActuacion": "2020-10-14T05:00:00.000Z",
      "actuacion": "Al Despacho Por Reparto",
      "anotacion": null,
      "fechaInicial": null,
      "fechaFinal": null,
      "fechaRegistro": "2020-10-14T05:00:00.000Z",
      "codRegla": "00                              ",
      "conDocumentos": false,
      "cant": 39,
      "idProceso": 112628300,
      "isUltimaAct": false,
      "createdAt": "2024-02-10T00:55:05.286Z"
    },
    {
      "idRegActuacion": 995598940,
      "llaveProceso": "11001400306820200102100",
      "consActuacion": 1,
      "fechaActuacion": "2020-10-09T05:00:00.000Z",
      "actuacion": " Radicación de Proceso",
      "anotacion": "Actuación de  Radicación de Proceso  realizada el 09/10/2020 a las 22:09:54",
      "fechaInicial": "2020-10-09T05:00:00.000Z",
      "fechaFinal": "2020-10-09T05:00:00.000Z",
      "fechaRegistro": "2020-10-09T05:00:00.000Z",
      "codRegla": "00                              ",
      "conDocumentos": false,
      "cant": 39,
      "idProceso": 112628300,
      "isUltimaAct": false,
      "createdAt": "2024-02-10T00:55:05.286Z"
    }
  ],
  "category": "Bancolombia",
  "codeudor": {
    "nombre": null,
    "cedula": null,
    "direccion": null,
    "telefono": null,
    "id": 532
  },
  "demanda": {
    "liquidacion": "1000",
    "avaluo": "1000",
    "capitalAdeudado": "15324570",
    "departamento": "CUNDINAMARCA",
    "despacho": null,
    "entregaGarantiasAbogado": "2020-09-05T05:00:16.000Z",
    "etapaProcesal": "CONTESTACIÓN DEMANDA",
    "fechaPresentacion": [],
    "id": 532,
    "llaveProceso": "11001400306820200102100",
    "mandamientoPago": [],
    "municipio": "BOGOTA",
    "notificacion": {
      "id": 532,
      "notifiers": [
        {
          "tipo": "291",
          "fechaRecibido": null,
          "fechaAporta": null,
          "resultado": null
        },
        {
          "tipo": "292",
          "fechaRecibido": null,
          "fechaAporta": null,
          "resultado": null
        }
      ],
      "certimail": null,
      "fisico": null,
      "autoNotificado": null
    },
    "obligacion": ["65886140334", "4594260446916180"],
    "radicado": "2020-1021",
    "tipoProceso": "SINGULAR",
    "vencimientoPagare": [],
    "medidasCautelares": {
      "id": 532,
      "fechaOrdenaMedida": "2024-02-10T00:55:05.244Z",
      "medidaSolicitada": null
    }
  },
  "deudor": {
    "id": 532,
    "telCelular": null,
    "telFijo": null,
    "primerNombre": "DIMOIN",
    "segundoNombre": "COLOMBIA",
    "primerApellido": "S.A.S.",
    "segundoApellido": null,
    "cedula": "900520023",
    "direccion": "AV BOYACA 63D - 26 OFICINA 103",
    "email": null
  },
  "fecha": "2024-01-17T05:00:00.000Z",
  "idProcesos": [112628300],
  "idRegUltimaAct": 1945088290,
  "llaveProceso": "11001400306820200102100",
  "nombre": "dimoin colombia s.a.s.",
  "numero": 532,
  "procesos": [
    {
      "idProceso": 112628300,
      "idConexion": 262,
      "llaveProceso": "11001400306820200102100",
      "fechaProceso": "2020-10-09T05:00:00.000Z",
      "fechaUltimaActuacion": "2024-01-17T05:00:00.000Z",
      "despacho": "JUZGADO 068 CIVIL MUNICIPAL DE BOGOTÁ ",
      "departamento": "BOGOTÁ",
      "sujetosProcesales": "Demandante: BANCOLOMBIA S.A | Demandado: DIMOIN COLOMBIA SAS ",
      "esPrivado": false,
      "cantFilas": -1,
      "juzgado": {
        "id": 68,
        "tipo": "JUZGADO 068 CIVIL MUNICIPAL DE BOGOTÁ",
        "url": "https://www.ramajudicial.gov.co/web/juzgado-068-civil-municipal-de-bogota"
      }
    }
  ],
  "revisado": false,
  "terminado": false,
  "tipoProceso": "SINGULAR",
  "ultimaActuacion": {
    "idRegActuacion": 1945088290,
    "llaveProceso": "11001400306820200102100",
    "consActuacion": 39,
    "fechaActuacion": "2024-01-17T05:00:00.000Z",
    "actuacion": "Fijacion estado",
    "anotacion": "Actuación registrada el 17/01/2024 a las 09:46:30.",
    "fechaInicial": "2024-01-18T05:00:00.000Z",
    "fechaFinal": "2024-01-18T05:00:00.000Z",
    "fechaRegistro": "2024-01-17T05:00:00.000Z",
    "codRegla": "00                              ",
    "conDocumentos": false,
    "cant": 39,
    "idProceso": 112628300,
    "isUltimaAct": true
  },
  "notas": [
    {
      "carpetaNumero": 532,
      "createdAt": "2024-02-10T00:55:05.244Z",
      "pathname": null,
      "dueDate": null,
      "text": "30 NOV 2022 SE ENVIA SOLICITUD CORECCION DESPACHO COMISORIO ",
      "content": []
    },
    {
      "carpetaNumero": 532,
      "createdAt": "2024-02-10T00:55:05.244Z",
      "pathname": null,
      "dueDate": null,
      "text": " INFORMAR AL JUZGADO NUEVAS DIRECCIONES SUMINISTRADAS POR AECSA S.A. ",
      "content": []
    },
    {
      "carpetaNumero": 532,
      "createdAt": "2024-02-10T00:55:05.244Z",
      "pathname": null,
      "dueDate": null,
      "text": " 2 MARZO 2023 SE APORTAN NUEVAS DIRECCIONES A JUZGADO ",
      "content": []
    },
    {
      "carpetaNumero": 532,
      "createdAt": "2024-02-10T00:55:05.244Z",
      "pathname": null,
      "dueDate": null,
      "text": " 23 MARZO 2023 AL DESPACHO DECIDIR DIRECCIONES ",
      "content": []
    },
    {
      "carpetaNumero": 532,
      "createdAt": "2024-02-10T00:55:05.244Z",
      "pathname": null,
      "dueDate": null,
      "text": "  21 JUNIO 2023 AL DESPACHO CONTESTACION DEMANDA Y EXCEPCIONES PREVIAS ",
      "content": []
    },
    {
      "carpetaNumero": 532,
      "createdAt": "2024-02-10T00:55:05.244Z",
      "pathname": null,
      "dueDate": null,
      "text": "29 AGOSTO 2023 SE RADICA MEMORIAL AGOTANDO NOTIFICACIONES.",
      "content": []
    },
    {
      "carpetaNumero": 532,
      "createdAt": "2024-02-10T00:55:05.244Z",
      "pathname": null,
      "dueDate": null,
      "text": "30 OCT 2023 AUTO SENTENCIA ",
      "content": []
    },
    {
      "carpetaNumero": 532,
      "createdAt": "2024-02-10T00:55:05.244Z",
      "pathname": null,
      "dueDate": null,
      "text": " 10 NOV 2023 SE ENVIA SOLICITUD LIQUI CREDITO A AECSA  ",
      "content": []
    },
    {
      "carpetaNumero": 532,
      "createdAt": "2024-02-10T00:55:05.244Z",
      "pathname": null,
      "dueDate": null,
      "text": " 23 enero 2024 se envia a juzgado funza solicitud nueva fecha secuestro ",
      "content": []
    },
    {
      "carpetaNumero": 532,
      "createdAt": "2024-02-10T00:55:05.244Z",
      "pathname": null,
      "dueDate": null,
      "text": " 16-01-2024 APRUEBA LIQUI COSTAS",
      "content": []
    }
  ],
  "updatedAt": "2024-02-10T00:55:05.244Z"
}
