{
  "actuaciones": [
    {
      "idRegActuacion": 1673133283,
      "llaveProceso": "11001400305220170090600",
      "consActuacion": 48,
      "fechaActuacion": "2023-10-25T05:00:00.000Z",
      "actuacion": "Oficio Elaborado",
      "anotacion": "Oficio elaborado y tramitado -centro de conciliacion ",
      "fechaInicial": null,
      "fechaFinal": null,
      "fechaRegistro": "2023-10-25T05:00:00.000Z",
      "codRegla": "00                              ",
      "conDocumentos": false,
      "cant": 48,
      "idProceso": 11720143,
      "isUltimaAct": true,
      "carpetaNumero": 230,
      "createdAt": "2023-12-10T20:30:56.711Z"
    },
    {
      "idRegActuacion": 1547325133,
      "llaveProceso": "11001400305220170090600",
      "consActuacion": 47,
      "fechaActuacion": "2023-01-27T05:00:00.000Z",
      "actuacion": "Fijacion estado",
      "anotacion": "Actuación registrada el 27/01/2023 a las 16:24:40.",
      "fechaInicial": "2023-01-30T05:00:00.000Z",
      "fechaFinal": "2023-01-30T05:00:00.000Z",
      "fechaRegistro": "2023-01-27T05:00:00.000Z",
      "codRegla": "00                              ",
      "conDocumentos": false,
      "cant": 48,
      "idProceso": 11720143,
      "isUltimaAct": false,
      "carpetaNumero": 230,
      "createdAt": "2023-12-10T20:30:56.711Z"
    },
    {
      "idRegActuacion": 1547325123,
      "llaveProceso": "11001400305220170090600",
      "consActuacion": 46,
      "fechaActuacion": "2023-01-27T05:00:00.000Z",
      "actuacion": "Auto ordena oficiar",
      "anotacion": "COMO SE FUNDAMENTA",
      "fechaInicial": null,
      "fechaFinal": null,
      "fechaRegistro": "2023-01-27T05:00:00.000Z",
      "codRegla": "00                              ",
      "conDocumentos": false,
      "cant": 48,
      "idProceso": 11720143,
      "isUltimaAct": false,
      "carpetaNumero": 230,
      "createdAt": "2023-12-10T20:30:56.711Z"
    },
    {
      "idRegActuacion": 1538165813,
      "llaveProceso": "11001400305220170090600",
      "consActuacion": 45,
      "fechaActuacion": "2023-01-16T05:00:00.000Z",
      "actuacion": "Al despacho",
      "anotacion": "REVISAR",
      "fechaInicial": null,
      "fechaFinal": null,
      "fechaRegistro": "2023-01-13T05:00:00.000Z",
      "codRegla": "00                              ",
      "conDocumentos": false,
      "cant": 48,
      "idProceso": 11720143,
      "isUltimaAct": false,
      "carpetaNumero": 230,
      "createdAt": "2023-12-10T20:30:56.711Z"
    },
    {
      "idRegActuacion": 1219742803,
      "llaveProceso": "11001400305220170090600",
      "consActuacion": 44,
      "fechaActuacion": "2022-08-24T05:00:00.000Z",
      "actuacion": "Oficio Elaborado",
      "anotacion": null,
      "fechaInicial": null,
      "fechaFinal": null,
      "fechaRegistro": "2022-08-24T05:00:00.000Z",
      "codRegla": "00                              ",
      "conDocumentos": false,
      "cant": 48,
      "idProceso": 11720143,
      "isUltimaAct": false,
      "carpetaNumero": 230,
      "createdAt": "2023-12-10T20:30:56.711Z"
    },
    {
      "idRegActuacion": 1181342723,
      "llaveProceso": "11001400305220170090600",
      "consActuacion": 43,
      "fechaActuacion": "2022-07-22T05:00:00.000Z",
      "actuacion": "Fijacion estado",
      "anotacion": "Actuación registrada el 22/07/2022 a las 14:14:49.",
      "fechaInicial": "2022-07-25T05:00:00.000Z",
      "fechaFinal": "2022-07-25T05:00:00.000Z",
      "fechaRegistro": "2022-07-22T05:00:00.000Z",
      "codRegla": "00                              ",
      "conDocumentos": false,
      "cant": 48,
      "idProceso": 11720143,
      "isUltimaAct": false,
      "carpetaNumero": 230,
      "createdAt": "2023-12-10T20:30:56.711Z"
    },
    {
      "idRegActuacion": 1181342713,
      "llaveProceso": "11001400305220170090600",
      "consActuacion": 42,
      "fechaActuacion": "2022-07-22T05:00:00.000Z",
      "actuacion": "Auto ordena oficiar",
      "anotacion": "A CENTRO DE CONCILIACIÓN COMO SE INDICA",
      "fechaInicial": null,
      "fechaFinal": null,
      "fechaRegistro": "2022-07-22T05:00:00.000Z",
      "codRegla": "00                              ",
      "conDocumentos": false,
      "cant": 48,
      "idProceso": 11720143,
      "isUltimaAct": false,
      "carpetaNumero": 230,
      "createdAt": "2023-12-10T20:30:56.711Z"
    },
    {
      "idRegActuacion": 1135378413,
      "llaveProceso": "11001400305220170090600",
      "consActuacion": 41,
      "fechaActuacion": "2022-06-07T05:00:00.000Z",
      "actuacion": "Al despacho",
      "anotacion": "SIN RESPUESTA CENTRO DE CONCILIACION",
      "fechaInicial": null,
      "fechaFinal": null,
      "fechaRegistro": "2022-06-06T05:00:00.000Z",
      "codRegla": "00                              ",
      "conDocumentos": false,
      "cant": 48,
      "idProceso": 11720143,
      "isUltimaAct": false,
      "carpetaNumero": 230,
      "createdAt": "2023-12-10T20:30:56.711Z"
    },
    {
      "idRegActuacion": 1134026893,
      "llaveProceso": "11001400305220170090600",
      "consActuacion": 40,
      "fechaActuacion": "2022-06-01T05:00:00.000Z",
      "actuacion": "Constancia secretarial",
      "anotacion": "VUELVE DE DIGITALIZACION",
      "fechaInicial": null,
      "fechaFinal": null,
      "fechaRegistro": "2022-06-06T05:00:00.000Z",
      "codRegla": "00                              ",
      "conDocumentos": false,
      "cant": 48,
      "idProceso": 11720143,
      "isUltimaAct": false,
      "carpetaNumero": 230,
      "createdAt": "2023-12-10T20:30:56.711Z"
    },
    {
      "idRegActuacion": 1105167843,
      "llaveProceso": "11001400305220170090600",
      "consActuacion": 39,
      "fechaActuacion": "2022-04-27T05:00:00.000Z",
      "actuacion": "Constancia secretarial",
      "anotacion": "SE REMITE PROCESO PARA SU DIGITALIZACION AL CONSORCIO ENCARGADO SEGUN la aplicación del Protocolo versión II –\nCircular PCSJC21-6 del Consejo Superior de la Judicatura, contrato No. 172 de 2020",
      "fechaInicial": null,
      "fechaFinal": null,
      "fechaRegistro": "2022-04-27T05:00:00.000Z",
      "codRegla": "00                              ",
      "conDocumentos": false,
      "cant": 48,
      "idProceso": 11720143,
      "isUltimaAct": false,
      "carpetaNumero": 230,
      "createdAt": "2023-12-10T20:30:56.711Z"
    },
    {
      "idRegActuacion": 1102431123,
      "llaveProceso": "11001400305220170090600",
      "consActuacion": 38,
      "fechaActuacion": "2022-04-07T05:00:00.000Z",
      "actuacion": "Constancia secretarial",
      "anotacion": "SE ENVIA OFICIO POR 472 ",
      "fechaInicial": null,
      "fechaFinal": null,
      "fechaRegistro": "2022-04-07T05:00:00.000Z",
      "codRegla": "00                              ",
      "conDocumentos": false,
      "cant": 48,
      "idProceso": 11720143,
      "isUltimaAct": false,
      "carpetaNumero": 230,
      "createdAt": "2023-12-10T20:30:56.711Z"
    },
    {
      "idRegActuacion": 1102140163,
      "llaveProceso": "11001400305220170090600",
      "consActuacion": 37,
      "fechaActuacion": "2022-03-30T05:00:00.000Z",
      "actuacion": "Oficio Elaborado",
      "anotacion": null,
      "fechaInicial": null,
      "fechaFinal": null,
      "fechaRegistro": "2022-03-30T05:00:00.000Z",
      "codRegla": "00                              ",
      "conDocumentos": false,
      "cant": 48,
      "idProceso": 11720143,
      "isUltimaAct": false,
      "carpetaNumero": 230,
      "createdAt": "2023-12-10T20:30:56.711Z"
    },
    {
      "idRegActuacion": 1099144843,
      "llaveProceso": "11001400305220170090600",
      "consActuacion": 36,
      "fechaActuacion": "2022-03-23T05:00:00.000Z",
      "actuacion": "Fijacion estado",
      "anotacion": "Actuación registrada el 23/03/2022 a las 08:56:16.",
      "fechaInicial": "2022-03-24T05:00:00.000Z",
      "fechaFinal": "2022-03-24T05:00:00.000Z",
      "fechaRegistro": "2022-03-23T05:00:00.000Z",
      "codRegla": "00                              ",
      "conDocumentos": false,
      "cant": 48,
      "idProceso": 11720143,
      "isUltimaAct": false,
      "carpetaNumero": 230,
      "createdAt": "2023-12-10T20:30:56.711Z"
    },
    {
      "idRegActuacion": 1099144833,
      "llaveProceso": "11001400305220170090600",
      "consActuacion": 35,
      "fechaActuacion": "2022-03-23T05:00:00.000Z",
      "actuacion": "Auto ordena oficiar",
      "anotacion": "A CENTRO DE CONCILIACION COMO SE EXPONE",
      "fechaInicial": null,
      "fechaFinal": null,
      "fechaRegistro": "2022-03-23T05:00:00.000Z",
      "codRegla": "00                              ",
      "conDocumentos": false,
      "cant": 48,
      "idProceso": 11720143,
      "isUltimaAct": false,
      "carpetaNumero": 230,
      "createdAt": "2023-12-10T20:30:56.711Z"
    },
    {
      "idRegActuacion": 1096311833,
      "llaveProceso": "11001400305220170090600",
      "consActuacion": 34,
      "fechaActuacion": "2022-03-09T05:00:00.000Z",
      "actuacion": "Al despacho",
      "anotacion": "REVISAR",
      "fechaInicial": null,
      "fechaFinal": null,
      "fechaRegistro": "2022-03-08T05:00:00.000Z",
      "codRegla": "00                              ",
      "conDocumentos": false,
      "cant": 48,
      "idProceso": 11720143,
      "isUltimaAct": false,
      "carpetaNumero": 230,
      "createdAt": "2023-12-10T20:30:56.711Z"
    },
    {
      "idRegActuacion": 743309073,
      "llaveProceso": "11001400305220170090600",
      "consActuacion": 33,
      "fechaActuacion": "2019-07-19T05:00:00.000Z",
      "actuacion": "Fijacion estado",
      "anotacion": "Actuación registrada el 19/07/2019 a las 16:36:56.",
      "fechaInicial": "2019-07-22T05:00:00.000Z",
      "fechaFinal": "2019-07-22T05:00:00.000Z",
      "fechaRegistro": "2019-07-19T05:00:00.000Z",
      "codRegla": "00                              ",
      "conDocumentos": false,
      "cant": 48,
      "idProceso": 11720143,
      "isUltimaAct": false,
      "carpetaNumero": 230,
      "createdAt": "2023-12-10T20:30:56.711Z"
    },
    {
      "idRegActuacion": 743309063,
      "llaveProceso": "11001400305220170090600",
      "consActuacion": 32,
      "fechaActuacion": "2019-07-19T05:00:00.000Z",
      "actuacion": "Reasume  Poder",
      "anotacion": "AGREGAR RESPUESTA CENTRO DE CONCILIACIÓN, CORRIGE PROVIDENCIA Y CONTINUA EL ASUNTO SUSPENDIDO. ",
      "fechaInicial": null,
      "fechaFinal": null,
      "fechaRegistro": "2019-07-19T05:00:00.000Z",
      "codRegla": "00                              ",
      "conDocumentos": false,
      "cant": 48,
      "idProceso": 11720143,
      "isUltimaAct": false,
      "carpetaNumero": 230,
      "createdAt": "2023-12-10T20:30:56.711Z"
    },
    {
      "idRegActuacion": 742408473,
      "llaveProceso": "11001400305220170090600",
      "consActuacion": 31,
      "fechaActuacion": "2019-07-11T05:00:00.000Z",
      "actuacion": "Al despacho",
      "anotacion": "PIDE OFICIAR. ",
      "fechaInicial": null,
      "fechaFinal": null,
      "fechaRegistro": "2019-07-11T05:00:00.000Z",
      "codRegla": "00                              ",
      "conDocumentos": false,
      "cant": 48,
      "idProceso": 11720143,
      "isUltimaAct": false,
      "carpetaNumero": 230,
      "createdAt": "2023-12-10T20:30:56.711Z"
    },
    {
      "idRegActuacion": 742408463,
      "llaveProceso": "11001400305220170090600",
      "consActuacion": 30,
      "fechaActuacion": "2019-07-10T05:00:00.000Z",
      "actuacion": "Recepción memorial",
      "anotacion": "RENUNCIA PODER @AR ",
      "fechaInicial": null,
      "fechaFinal": null,
      "fechaRegistro": "2019-07-10T05:00:00.000Z",
      "codRegla": "00                              ",
      "conDocumentos": false,
      "cant": 48,
      "idProceso": 11720143,
      "isUltimaAct": false,
      "carpetaNumero": 230,
      "createdAt": "2023-12-10T20:30:56.711Z"
    },
    {
      "idRegActuacion": 520950093,
      "llaveProceso": "11001400305220170090600",
      "consActuacion": 29,
      "fechaActuacion": "2019-03-22T05:00:00.000Z",
      "actuacion": "Envío Comunicaciones",
      "anotacion": null,
      "fechaInicial": null,
      "fechaFinal": null,
      "fechaRegistro": "2019-03-22T05:00:00.000Z",
      "codRegla": "00                              ",
      "conDocumentos": false,
      "cant": 48,
      "idProceso": 11720143,
      "isUltimaAct": false,
      "carpetaNumero": 230,
      "createdAt": "2023-12-10T20:30:56.711Z"
    },
    {
      "idRegActuacion": 520950083,
      "llaveProceso": "11001400305220170090600",
      "consActuacion": 28,
      "fechaActuacion": "2019-03-15T05:00:00.000Z",
      "actuacion": "Oficio Elaborado",
      "anotacion": null,
      "fechaInicial": null,
      "fechaFinal": null,
      "fechaRegistro": "2019-03-15T05:00:00.000Z",
      "codRegla": "00                              ",
      "conDocumentos": false,
      "cant": 48,
      "idProceso": 11720143,
      "isUltimaAct": false,
      "carpetaNumero": 230,
      "createdAt": "2023-12-10T20:30:56.711Z"
    },
    {
      "idRegActuacion": 520950073,
      "llaveProceso": "11001400305220170090600",
      "consActuacion": 27,
      "fechaActuacion": "2019-03-08T05:00:00.000Z",
      "actuacion": "Fijacion estado",
      "anotacion": "Actuación registrada el 08/03/2019 a las 07:49:59.",
      "fechaInicial": "2019-03-11T05:00:00.000Z",
      "fechaFinal": "2019-03-11T05:00:00.000Z",
      "fechaRegistro": "2019-03-08T05:00:00.000Z",
      "codRegla": "00                              ",
      "conDocumentos": false,
      "cant": 48,
      "idProceso": 11720143,
      "isUltimaAct": false,
      "carpetaNumero": 230,
      "createdAt": "2023-12-10T20:30:56.711Z"
    },
    {
      "idRegActuacion": 520950063,
      "llaveProceso": "11001400305220170090600",
      "consActuacion": 26,
      "fechaActuacion": "2019-03-08T05:00:00.000Z",
      "actuacion": "Auto ordena oficiar",
      "anotacion": "A CENTRO DE CONCILIACIÓN, SUSPENDER PROCESO HASTA VERIFICAR CUMPLIMIENTO Y NO HAY MEDIDA DE APREHENSIÓN. ",
      "fechaInicial": null,
      "fechaFinal": null,
      "fechaRegistro": "2019-03-08T05:00:00.000Z",
      "codRegla": "00                              ",
      "conDocumentos": false,
      "cant": 48,
      "idProceso": 11720143,
      "isUltimaAct": false,
      "carpetaNumero": 230,
      "createdAt": "2023-12-10T20:30:56.711Z"
    },
    {
      "idRegActuacion": 520950053,
      "llaveProceso": "11001400305220170090600",
      "consActuacion": 25,
      "fechaActuacion": "2019-03-05T05:00:00.000Z",
      "actuacion": "Al despacho",
      "anotacion": "COMUNICACIÓN CONCILIACIÓN.",
      "fechaInicial": null,
      "fechaFinal": null,
      "fechaRegistro": "2019-03-05T05:00:00.000Z",
      "codRegla": "00                              ",
      "conDocumentos": false,
      "cant": 48,
      "idProceso": 11720143,
      "isUltimaAct": false,
      "carpetaNumero": 230,
      "createdAt": "2023-12-10T20:30:56.711Z"
    },
    {
      "idRegActuacion": 520950043,
      "llaveProceso": "11001400305220170090600",
      "consActuacion": 24,
      "fechaActuacion": "2019-01-14T05:00:00.000Z",
      "actuacion": "Recepción memorial",
      "anotacion": "SOLICITUD -S-",
      "fechaInicial": null,
      "fechaFinal": null,
      "fechaRegistro": "2019-01-14T05:00:00.000Z",
      "codRegla": "00                              ",
      "conDocumentos": false,
      "cant": 48,
      "idProceso": 11720143,
      "isUltimaAct": false,
      "carpetaNumero": 230,
      "createdAt": "2023-12-10T20:30:56.711Z"
    },
    {
      "idRegActuacion": 520950033,
      "llaveProceso": "11001400305220170090600",
      "consActuacion": 23,
      "fechaActuacion": "2019-01-14T05:00:00.000Z",
      "actuacion": "Recepción memorial",
      "anotacion": "SOLICITUD DE SUSPENCION -S-",
      "fechaInicial": null,
      "fechaFinal": null,
      "fechaRegistro": "2019-01-14T05:00:00.000Z",
      "codRegla": "00                              ",
      "conDocumentos": false,
      "cant": 48,
      "idProceso": 11720143,
      "isUltimaAct": false,
      "carpetaNumero": 230,
      "createdAt": "2023-12-10T20:30:56.711Z"
    },
    {
      "idRegActuacion": 149084433,
      "llaveProceso": "11001400305220170090600",
      "consActuacion": 22,
      "fechaActuacion": "2018-10-29T05:00:00.000Z",
      "actuacion": "Fijacion estado",
      "anotacion": "Actuación registrada el 29/10/2018 a las 14:15:50.",
      "fechaInicial": "2018-10-30T05:00:00.000Z",
      "fechaFinal": "2018-10-30T05:00:00.000Z",
      "fechaRegistro": "2018-10-29T05:00:00.000Z",
      "codRegla": "00                              ",
      "conDocumentos": false,
      "cant": 48,
      "idProceso": 11720143,
      "isUltimaAct": false,
      "carpetaNumero": 230,
      "createdAt": "2023-12-10T20:30:56.711Z"
    },
    {
      "idRegActuacion": 149084423,
      "llaveProceso": "11001400305220170090600",
      "consActuacion": 21,
      "fechaActuacion": "2018-10-29T05:00:00.000Z",
      "actuacion": "Auto resuelve prorroga",
      "anotacion": "POR 6 MESES.",
      "fechaInicial": null,
      "fechaFinal": null,
      "fechaRegistro": "2018-10-29T05:00:00.000Z",
      "codRegla": "00                              ",
      "conDocumentos": false,
      "cant": 48,
      "idProceso": 11720143,
      "isUltimaAct": false,
      "carpetaNumero": 230,
      "createdAt": "2023-12-10T20:30:56.711Z"
    },
    {
      "idRegActuacion": 149084413,
      "llaveProceso": "11001400305220170090600",
      "consActuacion": 20,
      "fechaActuacion": "2018-10-26T05:00:00.000Z",
      "actuacion": "Al despacho",
      "anotacion": "REVISAR.",
      "fechaInicial": null,
      "fechaFinal": null,
      "fechaRegistro": "2018-10-26T05:00:00.000Z",
      "codRegla": "00                              ",
      "conDocumentos": false,
      "cant": 48,
      "idProceso": 11720143,
      "isUltimaAct": false,
      "carpetaNumero": 230,
      "createdAt": "2023-12-10T20:30:56.711Z"
    },
    {
      "idRegActuacion": 149084393,
      "llaveProceso": "11001400305220170090600",
      "consActuacion": 19,
      "fechaActuacion": "2018-10-04T05:00:00.000Z",
      "actuacion": "Fijacion estado",
      "anotacion": "Actuación registrada el 04/10/2018 a las 16:07:33.",
      "fechaInicial": "2018-10-05T05:00:00.000Z",
      "fechaFinal": "2018-10-05T05:00:00.000Z",
      "fechaRegistro": "2018-10-04T05:00:00.000Z",
      "codRegla": "00                              ",
      "conDocumentos": false,
      "cant": 48,
      "idProceso": 11720143,
      "isUltimaAct": false,
      "carpetaNumero": 230,
      "createdAt": "2023-12-10T20:30:56.711Z"
    },
    {
      "idRegActuacion": 149084383,
      "llaveProceso": "11001400305220170090600",
      "consActuacion": 18,
      "fechaActuacion": "2018-10-04T05:00:00.000Z",
      "actuacion": "Auto reconoce personería",
      "anotacion": "Y NIEGA SOLICITUD CONFORME A LO ANOTADO. ",
      "fechaInicial": null,
      "fechaFinal": null,
      "fechaRegistro": "2018-10-04T05:00:00.000Z",
      "codRegla": "00                              ",
      "conDocumentos": false,
      "cant": 48,
      "idProceso": 11720143,
      "isUltimaAct": false,
      "carpetaNumero": 230,
      "createdAt": "2023-12-10T20:30:56.711Z"
    },
    {
      "idRegActuacion": 149084373,
      "llaveProceso": "11001400305220170090600",
      "consActuacion": 17,
      "fechaActuacion": "2018-10-01T05:00:00.000Z",
      "actuacion": "Recepción memorial",
      "anotacion": "SUSTITUCION DE PODER",
      "fechaInicial": null,
      "fechaFinal": null,
      "fechaRegistro": "2018-10-01T05:00:00.000Z",
      "codRegla": "00                              ",
      "conDocumentos": false,
      "cant": 48,
      "idProceso": 11720143,
      "isUltimaAct": false,
      "carpetaNumero": 230,
      "createdAt": "2023-12-10T20:30:56.711Z"
    },
    {
      "idRegActuacion": 149084363,
      "llaveProceso": "11001400305220170090600",
      "consActuacion": 16,
      "fechaActuacion": "2018-09-17T05:00:00.000Z",
      "actuacion": "Al despacho",
      "anotacion": "SE REFIERE A ACUMULACIÓN DE DEMANDA.",
      "fechaInicial": null,
      "fechaFinal": null,
      "fechaRegistro": "2018-09-17T05:00:00.000Z",
      "codRegla": "00                              ",
      "conDocumentos": false,
      "cant": 48,
      "idProceso": 11720143,
      "isUltimaAct": false,
      "carpetaNumero": 230,
      "createdAt": "2023-12-10T20:30:56.711Z"
    },
    {
      "idRegActuacion": 149084353,
      "llaveProceso": "11001400305220170090600",
      "consActuacion": 15,
      "fechaActuacion": "2018-09-05T05:00:00.000Z",
      "actuacion": "Fijacion estado",
      "anotacion": "Actuación registrada el 05/09/2018 a las 16:48:11.",
      "fechaInicial": "2018-09-06T05:00:00.000Z",
      "fechaFinal": "2018-09-06T05:00:00.000Z",
      "fechaRegistro": "2018-09-05T05:00:00.000Z",
      "codRegla": "00                              ",
      "conDocumentos": false,
      "cant": 48,
      "idProceso": 11720143,
      "isUltimaAct": false,
      "carpetaNumero": 230,
      "createdAt": "2023-12-10T20:30:56.711Z"
    },
    {
      "idRegActuacion": 149084343,
      "llaveProceso": "11001400305220170090600",
      "consActuacion": 14,
      "fechaActuacion": "2018-09-05T05:00:00.000Z",
      "actuacion": "Auto Tener por notificado Art. 320",
      "anotacion": "POR AVISO C.G.P. Y PREVIO A SEGUIR ACREDITESE INSCRIPCIÓN EMBARGO.",
      "fechaInicial": null,
      "fechaFinal": null,
      "fechaRegistro": "2018-09-05T05:00:00.000Z",
      "codRegla": "00                              ",
      "conDocumentos": false,
      "cant": 48,
      "idProceso": 11720143,
      "isUltimaAct": false,
      "carpetaNumero": 230,
      "createdAt": "2023-12-10T20:30:56.711Z"
    },
    {
      "idRegActuacion": 149084333,
      "llaveProceso": "11001400305220170090600",
      "consActuacion": 13,
      "fechaActuacion": "2018-09-03T05:00:00.000Z",
      "actuacion": "Al despacho",
      "anotacion": "VENCIÓ TÉRMINO.",
      "fechaInicial": null,
      "fechaFinal": null,
      "fechaRegistro": "2018-09-03T05:00:00.000Z",
      "codRegla": "00                              ",
      "conDocumentos": false,
      "cant": 48,
      "idProceso": 11720143,
      "isUltimaAct": false,
      "carpetaNumero": 230,
      "createdAt": "2023-12-10T20:30:56.711Z"
    },
    {
      "idRegActuacion": 149084323,
      "llaveProceso": "11001400305220170090600",
      "consActuacion": 12,
      "fechaActuacion": "2018-07-25T05:00:00.000Z",
      "actuacion": "Fijacion estado",
      "anotacion": "Actuación registrada el 25/07/2018 a las 17:10:43.",
      "fechaInicial": "2018-07-26T05:00:00.000Z",
      "fechaFinal": "2018-07-26T05:00:00.000Z",
      "fechaRegistro": "2018-07-25T05:00:00.000Z",
      "codRegla": "00                              ",
      "conDocumentos": false,
      "cant": 48,
      "idProceso": 11720143,
      "isUltimaAct": false,
      "carpetaNumero": 230,
      "createdAt": "2023-12-10T20:30:56.711Z"
    },
    {
      "idRegActuacion": 149084313,
      "llaveProceso": "11001400305220170090600",
      "consActuacion": 11,
      "fechaActuacion": "2018-07-25T05:00:00.000Z",
      "actuacion": "Auto de Trámite",
      "anotacion": "NIEGA SOLICITUD CONFORME A LAS CONSIDERACIONES.",
      "fechaInicial": null,
      "fechaFinal": null,
      "fechaRegistro": "2018-07-25T05:00:00.000Z",
      "codRegla": "00                              ",
      "conDocumentos": false,
      "cant": 48,
      "idProceso": 11720143,
      "isUltimaAct": false,
      "carpetaNumero": 230,
      "createdAt": "2023-12-10T20:30:56.711Z"
    },
    {
      "idRegActuacion": 149084303,
      "llaveProceso": "11001400305220170090600",
      "consActuacion": 10,
      "fechaActuacion": "2018-06-21T05:00:00.000Z",
      "actuacion": "Al despacho",
      "anotacion": "SOLICITA REQUIERIR MOVILIDAD.",
      "fechaInicial": null,
      "fechaFinal": null,
      "fechaRegistro": "2018-06-21T05:00:00.000Z",
      "codRegla": "00                              ",
      "conDocumentos": false,
      "cant": 48,
      "idProceso": 11720143,
      "isUltimaAct": false,
      "carpetaNumero": 230,
      "createdAt": "2023-12-10T20:30:56.711Z"
    },
    {
      "idRegActuacion": 149084503,
      "llaveProceso": "11001400305220170090600",
      "consActuacion": 9,
      "fechaActuacion": "2018-06-07T05:00:00.000Z",
      "actuacion": "Fijacion estado",
      "anotacion": "Actuación registrada el 07/06/2018 a las 19:27:39.",
      "fechaInicial": "2018-06-08T05:00:00.000Z",
      "fechaFinal": "2018-06-08T05:00:00.000Z",
      "fechaRegistro": "2018-06-07T05:00:00.000Z",
      "codRegla": "00                              ",
      "conDocumentos": false,
      "cant": 48,
      "idProceso": 11720143,
      "isUltimaAct": false,
      "carpetaNumero": 230,
      "createdAt": "2023-12-10T20:30:56.711Z"
    }
  ],
  "juzgados": [
    {
      "id": 52,
      "tipo": "JUZGADO 052 CIVIL MUNICIPAL DE BOGOTÁ ",
      "url": "https://www.ramajudicial.gov.co/web/juzgado-52-civil-municipal-de-bogota"
    }
  ],
  "codeudor": null,
  "demanda": {
    "vencimientoPagare": "23/0/72018",
    "obligacion": {
      "A": 12519174
    },
    "capitalAdeudado": "$ 29.908.812",
    "entregaGarantiasAbogado": "22/08/2017",
    "departamento": "CUNDINAMARCA",
    "municipio": "BOGOTA",
    "tipoProceso": "PRENDARIO",
    "radicado": "2017 - 00906",
    "llaveProceso": "11001400305220170090600",
    "etapaProcesal": "11001400305220170090600",
    "fechaPresentacion": "SUSPENDIDO CENTRO DE CONCILIACIÓN",
    "mandamientoPago": "30/08/2017",
    "notificacion": {
      "certimail": "16/02/2018"
    },
    "medidasCautelares": {
      "fechaOrdenaMedidas": "5/09/2018",
      "medidaSolicitada": "16/02/2018"
    }
  },
  "demandas": [
    {
      "idProceso": 11720143,
      "idConexion": 261,
      "llaveProceso": "11001400305220170090600",
      "fechaProceso": "2017-08-31T05:00:00.000Z",
      "fechaUltimaActuacion": "2023-10-25T05:00:00.000Z",
      "sujetosProcesales": "Demandante: BANCOLOMBIA S.A. | Demandado: FREDY ALEXANDER MUÑOZ CASTAÑEDA ",
      "esPrivado": false,
      "cantFilas": -1,
      "medidasCautelares": {
        "fechaOrdenaMedida": "2018-05-09T05:00:00.000Z",
        "medidaSolicitada": "16/02/2018"
      },
      "vencimientoPagare": ["7201-01-01T05:00:00.000Z"],
      "capitalAdeudado": null,
      "departamento": "CUNDINAMARCA",
      "entregaGarantiasAbogado": null,
      "tipoProceso": "PRENDARIO",
      "mandamientoPago": null,
      "etapaProcesal": "11001400305220170090600",
      "fechaPresentacion": [],
      "municipio": "BOGOTA",
      "obligacion": [12519174],
      "radicado": "2017 - 00906"
    }
  ],
  "numero": 230,
  "llaveProceso": "11001400305220170090600",
  "fecha": "2023-10-25T05:00:00.000Z",
  "ultimaActuacion": {
    "idRegActuacion": 1673133283,
    "llaveProceso": "11001400305220170090600",
    "consActuacion": 48,
    "fechaActuacion": "2023-10-25T00:00:00",
    "actuacion": "Oficio Elaborado",
    "anotacion": "Oficio elaborado y tramitado -centro de conciliacion ",
    "fechaInicial": null,
    "fechaFinal": null,
    "fechaRegistro": "2023-10-25T00:00:00",
    "codRegla": "00                              ",
    "conDocumentos": false,
    "cant": 48,
    "idProceso": 11720143,
    "isUltimaAct": true
  },
  "category": "Terminados",
  "revisado": true,
  "terminado": true,
  "tipoProceso": "PRENDARIO",
  "deudor": {
    "tel": {
      "fijo": 8137713,
      "celular": 3057528084
    },
    "primerNombre": "FREDY",
    "segundoNombre": "ALEXANDER",
    "primerApellido": "MUÑOZ",
    "segundoApellido": "CASTAÑEDA",
    "cedula": 1014185483,
    "direccion": "CALLE 95 # 71 - 45 TORRE 8 APTO 1604",
    "email": "alexander.arquitecto@gmail.com"
  },
  "cc": 1014185483,
  "procesos": [
    {
      "idProceso": 11720143,
      "idConexion": 261,
      "llaveProceso": "11001400305220170090600",
      "fechaProceso": "2017-08-31T05:00:00.000Z",
      "fechaUltimaActuacion": "2023-10-25T05:00:00.000Z",
      "despacho": "JUZGADO 052 CIVIL MUNICIPAL DE BOGOTÁ ",
      "departamento": "BOGOTÁ",
      "sujetosProcesales": "Demandante: BANCOLOMBIA S.A. | Demandado: FREDY ALEXANDER MUÑOZ CASTAÑEDA ",
      "esPrivado": false,
      "cantFilas": -1
    }
  ],
  "idProcesos": [11720143],
  "nombre": "FREDY ALEXANDER MUÑOZ CASTAÑEDA",
  "notificacion": {
    "notifiers": [],
    "certimail": false,
    "fisico": null,
    "autoNotificado": null
  }
}
