{
  "actuaciones": [
    {
      "idRegActuacion": 909598440,
      "llaveProceso": "11001410300120180040400",
      "consActuacion": 46,
      "fechaActuacion": "2019-12-19T05:00:00.000Z",
      "actuacion": "Archivo Definitivo",
      "anotacion": "CAJA 150 DE 2019\r\n",
      "fechaInicial": null,
      "fechaFinal": null,
      "fechaRegistro": "2019-12-19T05:00:00.000Z",
      "codRegla": "00                              ",
      "conDocumentos": false,
      "cant": 46,
      "idProceso": 17487020,
      "isUltimaAct": true,
      "carpetaNumero": 430,
      "createdAt": "2023-12-10T20:31:27.335Z"
    },
    {
      "idRegActuacion": 904335610,
      "llaveProceso": "11001410300120180040400",
      "consActuacion": 45,
      "fechaActuacion": "2019-12-13T05:00:00.000Z",
      "actuacion": "Entrega Desglose",
      "anotacion": "SE ENTREGAN TITULOS A FVOR DE LA PARTE EJECUTANTE",
      "fechaInicial": null,
      "fechaFinal": null,
      "fechaRegistro": "2019-12-13T05:00:00.000Z",
      "codRegla": "00                              ",
      "conDocumentos": false,
      "cant": 46,
      "idProceso": 17487020,
      "isUltimaAct": false,
      "carpetaNumero": 430,
      "createdAt": "2023-12-10T20:31:27.335Z"
    },
    {
      "idRegActuacion": 903244020,
      "llaveProceso": "11001410300120180040400",
      "consActuacion": 44,
      "fechaActuacion": "2019-12-10T05:00:00.000Z",
      "actuacion": "Oficio Elaborado",
      "anotacion": null,
      "fechaInicial": null,
      "fechaFinal": null,
      "fechaRegistro": "2019-12-10T05:00:00.000Z",
      "codRegla": "00                              ",
      "conDocumentos": false,
      "cant": 46,
      "idProceso": 17487020,
      "isUltimaAct": false,
      "carpetaNumero": 430,
      "createdAt": "2023-12-10T20:31:27.335Z"
    },
    {
      "idRegActuacion": 870181530,
      "llaveProceso": "11001410300120180040400",
      "consActuacion": 43,
      "fechaActuacion": "2019-11-22T05:00:00.000Z",
      "actuacion": "Fijacion estado",
      "anotacion": "Actuación registrada el 22/11/2019 a las 08:43:32.",
      "fechaInicial": "2019-11-26T05:00:00.000Z",
      "fechaFinal": "2019-11-26T05:00:00.000Z",
      "fechaRegistro": "2019-11-22T05:00:00.000Z",
      "codRegla": "00                              ",
      "conDocumentos": false,
      "cant": 46,
      "idProceso": 17487020,
      "isUltimaAct": false,
      "carpetaNumero": 430,
      "createdAt": "2023-12-10T20:31:27.335Z"
    },
    {
      "idRegActuacion": 870181520,
      "llaveProceso": "11001410300120180040400",
      "consActuacion": 42,
      "fechaActuacion": "2019-11-22T05:00:00.000Z",
      "actuacion": "Auto termina proceso por Pago",
      "anotacion": null,
      "fechaInicial": null,
      "fechaFinal": null,
      "fechaRegistro": "2019-11-22T05:00:00.000Z",
      "codRegla": "00                              ",
      "conDocumentos": false,
      "cant": 46,
      "idProceso": 17487020,
      "isUltimaAct": false,
      "carpetaNumero": 430,
      "createdAt": "2023-12-10T20:31:27.335Z"
    },
    {
      "idRegActuacion": 866722040,
      "llaveProceso": "11001410300120180040400",
      "consActuacion": 41,
      "fechaActuacion": "2019-11-05T05:00:00.000Z",
      "actuacion": "Al despacho",
      "anotacion": null,
      "fechaInicial": null,
      "fechaFinal": null,
      "fechaRegistro": "2019-11-05T05:00:00.000Z",
      "codRegla": "00                              ",
      "conDocumentos": false,
      "cant": 46,
      "idProceso": 17487020,
      "isUltimaAct": false,
      "carpetaNumero": 430,
      "createdAt": "2023-12-10T20:31:27.335Z"
    },
    {
      "idRegActuacion": 865296370,
      "llaveProceso": "11001410300120180040400",
      "consActuacion": 40,
      "fechaActuacion": "2019-10-25T05:00:00.000Z",
      "actuacion": "Recepción memorial",
      "anotacion": "TERMINACIÓN POR PAGO",
      "fechaInicial": null,
      "fechaFinal": null,
      "fechaRegistro": "2019-10-25T05:00:00.000Z",
      "codRegla": "00                              ",
      "conDocumentos": false,
      "cant": 46,
      "idProceso": 17487020,
      "isUltimaAct": false,
      "carpetaNumero": 430,
      "createdAt": "2023-12-10T20:31:27.335Z"
    },
    {
      "idRegActuacion": 889263510,
      "llaveProceso": "11001410300120180040400",
      "consActuacion": 39,
      "fechaActuacion": "2019-10-23T05:00:00.000Z",
      "actuacion": "Oficio Elaborado",
      "anotacion": null,
      "fechaInicial": null,
      "fechaFinal": null,
      "fechaRegistro": "2019-10-23T05:00:00.000Z",
      "codRegla": "00                              ",
      "conDocumentos": false,
      "cant": 46,
      "idProceso": 17487020,
      "isUltimaAct": false,
      "carpetaNumero": 430,
      "createdAt": "2023-12-10T20:31:27.335Z"
    },
    {
      "idRegActuacion": 862725110,
      "llaveProceso": "11001410300120180040400",
      "consActuacion": 38,
      "fechaActuacion": "2019-10-04T05:00:00.000Z",
      "actuacion": "Fijacion estado",
      "anotacion": "Actuación registrada el 04/10/2019 a las 14:06:59.",
      "fechaInicial": "2019-10-08T05:00:00.000Z",
      "fechaFinal": "2019-10-08T05:00:00.000Z",
      "fechaRegistro": "2019-10-04T05:00:00.000Z",
      "codRegla": "00                              ",
      "conDocumentos": false,
      "cant": 46,
      "idProceso": 17487020,
      "isUltimaAct": false,
      "carpetaNumero": 430,
      "createdAt": "2023-12-10T20:31:27.335Z"
    },
    {
      "idRegActuacion": 862725100,
      "llaveProceso": "11001410300120180040400",
      "consActuacion": 37,
      "fechaActuacion": "2019-10-04T05:00:00.000Z",
      "actuacion": "Auto ordena oficiar",
      "anotacion": null,
      "fechaInicial": null,
      "fechaFinal": null,
      "fechaRegistro": "2019-10-04T05:00:00.000Z",
      "codRegla": "00                              ",
      "conDocumentos": false,
      "cant": 46,
      "idProceso": 17487020,
      "isUltimaAct": false,
      "carpetaNumero": 430,
      "createdAt": "2023-12-10T20:31:27.335Z"
    },
    {
      "idRegActuacion": 566031830,
      "llaveProceso": "11001410300120180040400",
      "consActuacion": 36,
      "fechaActuacion": "2019-09-17T05:00:00.000Z",
      "actuacion": "Al despacho",
      "anotacion": null,
      "fechaInicial": null,
      "fechaFinal": null,
      "fechaRegistro": "2019-09-17T05:00:00.000Z",
      "codRegla": "00                              ",
      "conDocumentos": false,
      "cant": 46,
      "idProceso": 17487020,
      "isUltimaAct": false,
      "carpetaNumero": 430,
      "createdAt": "2023-12-10T20:31:27.335Z"
    },
    {
      "idRegActuacion": 566031820,
      "llaveProceso": "11001410300120180040400",
      "consActuacion": 35,
      "fechaActuacion": "2019-09-13T05:00:00.000Z",
      "actuacion": "Recepción memorial",
      "anotacion": "RESPUESTA CATASTRO",
      "fechaInicial": null,
      "fechaFinal": null,
      "fechaRegistro": "2019-09-17T05:00:00.000Z",
      "codRegla": "00                              ",
      "conDocumentos": false,
      "cant": 46,
      "idProceso": 17487020,
      "isUltimaAct": false,
      "carpetaNumero": 430,
      "createdAt": "2023-12-10T20:31:27.335Z"
    },
    {
      "idRegActuacion": 557806810,
      "llaveProceso": "11001410300120180040400",
      "consActuacion": 34,
      "fechaActuacion": "2019-07-30T05:00:00.000Z",
      "actuacion": "Oficio Elaborado",
      "anotacion": "OFICIO PARA CATASTRO",
      "fechaInicial": null,
      "fechaFinal": null,
      "fechaRegistro": "2019-07-30T05:00:00.000Z",
      "codRegla": "00                              ",
      "conDocumentos": false,
      "cant": 46,
      "idProceso": 17487020,
      "isUltimaAct": false,
      "carpetaNumero": 430,
      "createdAt": "2023-12-10T20:31:27.335Z"
    },
    {
      "idRegActuacion": 552855780,
      "llaveProceso": "11001410300120180040400",
      "consActuacion": 33,
      "fechaActuacion": "2019-07-08T05:00:00.000Z",
      "actuacion": "Fijacion estado",
      "anotacion": "Actuación registrada el 08/07/2019 a las 16:35:23.",
      "fechaInicial": "2019-07-10T05:00:00.000Z",
      "fechaFinal": "2019-07-10T05:00:00.000Z",
      "fechaRegistro": "2019-07-08T05:00:00.000Z",
      "codRegla": "00                              ",
      "conDocumentos": false,
      "cant": 46,
      "idProceso": 17487020,
      "isUltimaAct": false,
      "carpetaNumero": 430,
      "createdAt": "2023-12-10T20:31:27.335Z"
    },
    {
      "idRegActuacion": 552855770,
      "llaveProceso": "11001410300120180040400",
      "consActuacion": 32,
      "fechaActuacion": "2019-07-08T05:00:00.000Z",
      "actuacion": "Auto ordena oficiar",
      "anotacion": "A LA UNIDAD ADMINISTRATIVA ESPECIAL DE CATASTRO",
      "fechaInicial": null,
      "fechaFinal": null,
      "fechaRegistro": "2019-07-08T05:00:00.000Z",
      "codRegla": "00                              ",
      "conDocumentos": false,
      "cant": 46,
      "idProceso": 17487020,
      "isUltimaAct": false,
      "carpetaNumero": 430,
      "createdAt": "2023-12-10T20:31:27.335Z"
    },
    {
      "idRegActuacion": 408245280,
      "llaveProceso": "11001410300120180040400",
      "consActuacion": 31,
      "fechaActuacion": "2019-06-17T05:00:00.000Z",
      "actuacion": "Al despacho",
      "anotacion": null,
      "fechaInicial": null,
      "fechaFinal": null,
      "fechaRegistro": "2019-06-17T05:00:00.000Z",
      "codRegla": "00                              ",
      "conDocumentos": false,
      "cant": 46,
      "idProceso": 17487020,
      "isUltimaAct": false,
      "carpetaNumero": 430,
      "createdAt": "2023-12-10T20:31:27.335Z"
    },
    {
      "idRegActuacion": 393347950,
      "llaveProceso": "11001410300120180040400",
      "consActuacion": 30,
      "fechaActuacion": "2019-06-11T05:00:00.000Z",
      "actuacion": "Recepción memorial",
      "anotacion": null,
      "fechaInicial": null,
      "fechaFinal": null,
      "fechaRegistro": "2019-06-12T05:00:00.000Z",
      "codRegla": "00                              ",
      "conDocumentos": false,
      "cant": 46,
      "idProceso": 17487020,
      "isUltimaAct": false,
      "carpetaNumero": 430,
      "createdAt": "2023-12-10T20:31:27.335Z"
    },
    {
      "idRegActuacion": 257882030,
      "llaveProceso": "11001410300120180040400",
      "consActuacion": 29,
      "fechaActuacion": "2019-05-17T05:00:00.000Z",
      "actuacion": "Fijacion estado",
      "anotacion": "Actuación registrada el 17/05/2019 a las 14:48:59.",
      "fechaInicial": "2019-05-21T05:00:00.000Z",
      "fechaFinal": "2019-05-21T05:00:00.000Z",
      "fechaRegistro": "2019-05-17T05:00:00.000Z",
      "codRegla": "00                              ",
      "conDocumentos": false,
      "cant": 46,
      "idProceso": 17487020,
      "isUltimaAct": false,
      "carpetaNumero": 430,
      "createdAt": "2023-12-10T20:31:27.335Z"
    },
    {
      "idRegActuacion": 257882020,
      "llaveProceso": "11001410300120180040400",
      "consActuacion": 28,
      "fechaActuacion": "2019-05-17T05:00:00.000Z",
      "actuacion": "Auto aprueba liquidación",
      "anotacion": "DE CRÉDITO Y REQUIERE PARA QUE EN EL TÉRMINO DE 20 DÍAS......0..",
      "fechaInicial": null,
      "fechaFinal": null,
      "fechaRegistro": "2019-05-17T05:00:00.000Z",
      "codRegla": "00                              ",
      "conDocumentos": false,
      "cant": 46,
      "idProceso": 17487020,
      "isUltimaAct": false,
      "carpetaNumero": 430,
      "createdAt": "2023-12-10T20:31:27.335Z"
    },
    {
      "idRegActuacion": 257882010,
      "llaveProceso": "11001410300120180040400",
      "consActuacion": 27,
      "fechaActuacion": "2019-05-06T05:00:00.000Z",
      "actuacion": "Al despacho",
      "anotacion": null,
      "fechaInicial": null,
      "fechaFinal": null,
      "fechaRegistro": "2019-05-06T05:00:00.000Z",
      "codRegla": "00                              ",
      "conDocumentos": false,
      "cant": 46,
      "idProceso": 17487020,
      "isUltimaAct": false,
      "carpetaNumero": 430,
      "createdAt": "2023-12-10T20:31:27.335Z"
    },
    {
      "idRegActuacion": 257882000,
      "llaveProceso": "11001410300120180040400",
      "consActuacion": 26,
      "fechaActuacion": "2019-03-15T05:00:00.000Z",
      "actuacion": "Fijacion estado",
      "anotacion": "Actuación registrada el 15/03/2019 a las 15:16:46.",
      "fechaInicial": "2019-03-19T05:00:00.000Z",
      "fechaFinal": "2019-03-19T05:00:00.000Z",
      "fechaRegistro": "2019-03-15T05:00:00.000Z",
      "codRegla": "00                              ",
      "conDocumentos": false,
      "cant": 46,
      "idProceso": 17487020,
      "isUltimaAct": false,
      "carpetaNumero": 430,
      "createdAt": "2023-12-10T20:31:27.335Z"
    },
    {
      "idRegActuacion": 257881990,
      "llaveProceso": "11001410300120180040400",
      "consActuacion": 25,
      "fechaActuacion": "2019-03-15T05:00:00.000Z",
      "actuacion": "Auto aprueba liquidación",
      "anotacion": "DE CRÉDITO, SE ORDENA QUE POR SECRETARÍA SE HAGA LA LIQUIDACIÓN DE COSTAS",
      "fechaInicial": null,
      "fechaFinal": null,
      "fechaRegistro": "2019-03-15T05:00:00.000Z",
      "codRegla": "00                              ",
      "conDocumentos": false,
      "cant": 46,
      "idProceso": 17487020,
      "isUltimaAct": false,
      "carpetaNumero": 430,
      "createdAt": "2023-12-10T20:31:27.335Z"
    },
    {
      "idRegActuacion": 257881980,
      "llaveProceso": "11001410300120180040400",
      "consActuacion": 24,
      "fechaActuacion": "2019-03-07T05:00:00.000Z",
      "actuacion": "Al despacho",
      "anotacion": null,
      "fechaInicial": null,
      "fechaFinal": null,
      "fechaRegistro": "2019-03-07T05:00:00.000Z",
      "codRegla": "00                              ",
      "conDocumentos": false,
      "cant": 46,
      "idProceso": 17487020,
      "isUltimaAct": false,
      "carpetaNumero": 430,
      "createdAt": "2023-12-10T20:31:27.335Z"
    },
    {
      "idRegActuacion": 257881970,
      "llaveProceso": "11001410300120180040400",
      "consActuacion": 23,
      "fechaActuacion": "2019-03-04T05:00:00.000Z",
      "actuacion": "Acta Diligencia",
      "anotacion": null,
      "fechaInicial": null,
      "fechaFinal": null,
      "fechaRegistro": "2019-03-04T05:00:00.000Z",
      "codRegla": "00                              ",
      "conDocumentos": false,
      "cant": 46,
      "idProceso": 17487020,
      "isUltimaAct": false,
      "carpetaNumero": 430,
      "createdAt": "2023-12-10T20:31:27.335Z"
    },
    {
      "idRegActuacion": 257881960,
      "llaveProceso": "11001410300120180040400",
      "consActuacion": 22,
      "fechaActuacion": "2019-03-05T05:00:00.000Z",
      "actuacion": "Acta Diligencia",
      "anotacion": "SE MATERIALIZA SECUESTRO DE INMUEBLE",
      "fechaInicial": null,
      "fechaFinal": null,
      "fechaRegistro": "2019-03-05T05:00:00.000Z",
      "codRegla": "00                              ",
      "conDocumentos": false,
      "cant": 46,
      "idProceso": 17487020,
      "isUltimaAct": false,
      "carpetaNumero": 430,
      "createdAt": "2023-12-10T20:31:27.335Z"
    },
    {
      "idRegActuacion": 257881950,
      "llaveProceso": "11001410300120180040400",
      "consActuacion": 21,
      "fechaActuacion": "2019-02-22T05:00:00.000Z",
      "actuacion": "Traslado Art. 108 CPC",
      "anotacion": "LIQUIDACIÓN CREDITO",
      "fechaInicial": "2019-02-25T05:00:00.000Z",
      "fechaFinal": "2019-02-27T05:00:00.000Z",
      "fechaRegistro": "2019-02-22T05:00:00.000Z",
      "codRegla": "00                              ",
      "conDocumentos": false,
      "cant": 46,
      "idProceso": 17487020,
      "isUltimaAct": false,
      "carpetaNumero": 430,
      "createdAt": "2023-12-10T20:31:27.335Z"
    },
    {
      "idRegActuacion": 257881940,
      "llaveProceso": "11001410300120180040400",
      "consActuacion": 20,
      "fechaActuacion": "2019-02-07T05:00:00.000Z",
      "actuacion": "Telegrama",
      "anotacion": null,
      "fechaInicial": null,
      "fechaFinal": null,
      "fechaRegistro": "2019-02-07T05:00:00.000Z",
      "codRegla": "00                              ",
      "conDocumentos": false,
      "cant": 46,
      "idProceso": 17487020,
      "isUltimaAct": false,
      "carpetaNumero": 430,
      "createdAt": "2023-12-10T20:31:27.335Z"
    },
    {
      "idRegActuacion": 257881930,
      "llaveProceso": "11001410300120180040400",
      "consActuacion": 19,
      "fechaActuacion": "2019-01-21T05:00:00.000Z",
      "actuacion": "Acta Diligencia",
      "anotacion": "SE FIJA NUEVA FECHA DE DILIGANCIA DE SECUESTRO PARA EL DIA 4 DE MARZO A LAS 10:30",
      "fechaInicial": null,
      "fechaFinal": null,
      "fechaRegistro": "2019-01-21T05:00:00.000Z",
      "codRegla": "00                              ",
      "conDocumentos": false,
      "cant": 46,
      "idProceso": 17487020,
      "isUltimaAct": false,
      "carpetaNumero": 430,
      "createdAt": "2023-12-10T20:31:27.335Z"
    },
    {
      "idRegActuacion": 257881920,
      "llaveProceso": "11001410300120180040400",
      "consActuacion": 18,
      "fechaActuacion": "2018-11-30T05:00:00.000Z",
      "actuacion": "Telegrama",
      "anotacion": null,
      "fechaInicial": null,
      "fechaFinal": null,
      "fechaRegistro": "2018-11-30T05:00:00.000Z",
      "codRegla": "00                              ",
      "conDocumentos": false,
      "cant": 46,
      "idProceso": 17487020,
      "isUltimaAct": false,
      "carpetaNumero": 430,
      "createdAt": "2023-12-10T20:31:27.335Z"
    },
    {
      "idRegActuacion": 257881910,
      "llaveProceso": "11001410300120180040400",
      "consActuacion": 17,
      "fechaActuacion": "2018-11-14T05:00:00.000Z",
      "actuacion": "Fijacion estado",
      "anotacion": "Actuación registrada el 14/11/2018 a las 18:18:34.",
      "fechaInicial": "2018-11-16T05:00:00.000Z",
      "fechaFinal": "2018-11-16T05:00:00.000Z",
      "fechaRegistro": "2018-11-14T05:00:00.000Z",
      "codRegla": "00                              ",
      "conDocumentos": false,
      "cant": 46,
      "idProceso": 17487020,
      "isUltimaAct": false,
      "carpetaNumero": 430,
      "createdAt": "2023-12-10T20:31:27.335Z"
    },
    {
      "idRegActuacion": 257881900,
      "llaveProceso": "11001410300120180040400",
      "consActuacion": 16,
      "fechaActuacion": "2018-11-14T05:00:00.000Z",
      "actuacion": "Auto nombra Auxiliar de la Justicia",
      "anotacion": "NOMBRA AUXILIAR",
      "fechaInicial": null,
      "fechaFinal": null,
      "fechaRegistro": "2018-11-14T05:00:00.000Z",
      "codRegla": "00                              ",
      "conDocumentos": false,
      "cant": 46,
      "idProceso": 17487020,
      "isUltimaAct": false,
      "carpetaNumero": 430,
      "createdAt": "2023-12-10T20:31:27.335Z"
    },
    {
      "idRegActuacion": 257881890,
      "llaveProceso": "11001410300120180040400",
      "consActuacion": 15,
      "fechaActuacion": "2018-11-02T05:00:00.000Z",
      "actuacion": "Al despacho",
      "anotacion": null,
      "fechaInicial": null,
      "fechaFinal": null,
      "fechaRegistro": "2018-11-02T05:00:00.000Z",
      "codRegla": "00                              ",
      "conDocumentos": false,
      "cant": 46,
      "idProceso": 17487020,
      "isUltimaAct": false,
      "carpetaNumero": 430,
      "createdAt": "2023-12-10T20:31:27.335Z"
    },
    {
      "idRegActuacion": 257881880,
      "llaveProceso": "11001410300120180040400",
      "consActuacion": 14,
      "fechaActuacion": "2018-10-03T05:00:00.000Z",
      "actuacion": "Fijacion estado",
      "anotacion": "Actuación registrada el 03/10/2018 a las 15:18:23.",
      "fechaInicial": "2018-10-05T05:00:00.000Z",
      "fechaFinal": "2018-10-05T05:00:00.000Z",
      "fechaRegistro": "2018-10-03T05:00:00.000Z",
      "codRegla": "00                              ",
      "conDocumentos": false,
      "cant": 46,
      "idProceso": 17487020,
      "isUltimaAct": false,
      "carpetaNumero": 430,
      "createdAt": "2023-12-10T20:31:27.335Z"
    },
    {
      "idRegActuacion": 257881870,
      "llaveProceso": "11001410300120180040400",
      "consActuacion": 13,
      "fechaActuacion": "2018-10-03T05:00:00.000Z",
      "actuacion": "Auto ordena Seguir adelante la Ejecucion  Ley 1395/2010",
      "anotacion": "AUTO SIGUE ADELANTE CON LA EJECUCIÓN",
      "fechaInicial": null,
      "fechaFinal": null,
      "fechaRegistro": "2018-10-03T05:00:00.000Z",
      "codRegla": "00                              ",
      "conDocumentos": false,
      "cant": 46,
      "idProceso": 17487020,
      "isUltimaAct": false,
      "carpetaNumero": 430,
      "createdAt": "2023-12-10T20:31:27.335Z"
    },
    {
      "idRegActuacion": 257881860,
      "llaveProceso": "11001410300120180040400",
      "consActuacion": 12,
      "fechaActuacion": "2018-10-03T05:00:00.000Z",
      "actuacion": "Fijacion estado",
      "anotacion": "Actuación registrada el 03/10/2018 a las 15:18:00.",
      "fechaInicial": "2018-10-05T05:00:00.000Z",
      "fechaFinal": "2018-10-05T05:00:00.000Z",
      "fechaRegistro": "2018-10-03T05:00:00.000Z",
      "codRegla": "00                              ",
      "conDocumentos": false,
      "cant": 46,
      "idProceso": 17487020,
      "isUltimaAct": false,
      "carpetaNumero": 430,
      "createdAt": "2023-12-10T20:31:27.335Z"
    },
    {
      "idRegActuacion": 257881850,
      "llaveProceso": "11001410300120180040400",
      "consActuacion": 11,
      "fechaActuacion": "2018-10-03T05:00:00.000Z",
      "actuacion": "Auto fija fecha audiencia y/o diligencia",
      "anotacion": "FIJA FECHA PARA SECUESTRO EL DIA 21 DE ENERO DE 2019",
      "fechaInicial": null,
      "fechaFinal": null,
      "fechaRegistro": "2018-10-03T05:00:00.000Z",
      "codRegla": "00                              ",
      "conDocumentos": false,
      "cant": 46,
      "idProceso": 17487020,
      "isUltimaAct": false,
      "carpetaNumero": 430,
      "createdAt": "2023-12-10T20:31:27.335Z"
    },
    {
      "idRegActuacion": 257881840,
      "llaveProceso": "11001410300120180040400",
      "consActuacion": 10,
      "fechaActuacion": "2018-09-18T05:00:00.000Z",
      "actuacion": "Al despacho",
      "anotacion": null,
      "fechaInicial": null,
      "fechaFinal": null,
      "fechaRegistro": "2018-09-18T05:00:00.000Z",
      "codRegla": "00                              ",
      "conDocumentos": false,
      "cant": 46,
      "idProceso": 17487020,
      "isUltimaAct": false,
      "carpetaNumero": 430,
      "createdAt": "2023-12-10T20:31:27.335Z"
    },
    {
      "idRegActuacion": 257881830,
      "llaveProceso": "11001410300120180040400",
      "consActuacion": 9,
      "fechaActuacion": "2018-09-07T05:00:00.000Z",
      "actuacion": "Fijacion estado",
      "anotacion": "Actuación registrada el 07/09/2018 a las 11:57:19.",
      "fechaInicial": "2018-09-11T05:00:00.000Z",
      "fechaFinal": "2018-09-11T05:00:00.000Z",
      "fechaRegistro": "2018-09-07T05:00:00.000Z",
      "codRegla": "00                              ",
      "conDocumentos": false,
      "cant": 46,
      "idProceso": 17487020,
      "isUltimaAct": false,
      "carpetaNumero": 430,
      "createdAt": "2023-12-10T20:31:27.335Z"
    },
    {
      "idRegActuacion": 257881820,
      "llaveProceso": "11001410300120180040400",
      "consActuacion": 8,
      "fechaActuacion": "2018-09-07T05:00:00.000Z",
      "actuacion": "Auto pone en conocimiento",
      "anotacion": "TIENE POR NITIFICADOS A LOS DEMANDADOS",
      "fechaInicial": null,
      "fechaFinal": null,
      "fechaRegistro": "2018-09-07T05:00:00.000Z",
      "codRegla": "00                              ",
      "conDocumentos": false,
      "cant": 46,
      "idProceso": 17487020,
      "isUltimaAct": false,
      "carpetaNumero": 430,
      "createdAt": "2023-12-10T20:31:27.335Z"
    },
    {
      "idRegActuacion": 257881810,
      "llaveProceso": "11001410300120180040400",
      "consActuacion": 7,
      "fechaActuacion": "2018-08-23T05:00:00.000Z",
      "actuacion": "Al despacho",
      "anotacion": null,
      "fechaInicial": null,
      "fechaFinal": null,
      "fechaRegistro": "2018-08-23T05:00:00.000Z",
      "codRegla": "00                              ",
      "conDocumentos": false,
      "cant": 46,
      "idProceso": 17487020,
      "isUltimaAct": false,
      "carpetaNumero": 430,
      "createdAt": "2023-12-10T20:31:27.335Z"
    },
    {
      "idRegActuacion": 737744993,
      "llaveProceso": "11001410300120180040400",
      "consActuacion": 5,
      "fechaActuacion": "2018-08-28T05:00:00.000Z",
      "actuacion": "Envio Expediente Centro Servicios Administrativos",
      "anotacion": "COMPETENCIA OFICIO 925 - JUZGADO 37 CIVIL MUNICIPAL",
      "fechaInicial": null,
      "fechaFinal": null,
      "fechaRegistro": "2018-08-28T05:00:00.000Z",
      "codRegla": "00                              ",
      "conDocumentos": false,
      "cant": 5,
      "idProceso": 50678323,
      "isUltimaAct": true,
      "carpetaNumero": 430,
      "createdAt": "2023-12-10T20:31:27.350Z"
    },
    {
      "idRegActuacion": 737744983,
      "llaveProceso": "11001410300120180040400",
      "consActuacion": 4,
      "fechaActuacion": "2018-08-14T05:00:00.000Z",
      "actuacion": "Fijacion estado",
      "anotacion": "Actuación registrada el 14/08/2018 a las 16:30:48.",
      "fechaInicial": "2018-08-15T05:00:00.000Z",
      "fechaFinal": "2018-08-15T05:00:00.000Z",
      "fechaRegistro": "2018-08-14T05:00:00.000Z",
      "codRegla": "00                              ",
      "conDocumentos": false,
      "cant": 5,
      "idProceso": 50678323,
      "isUltimaAct": false,
      "carpetaNumero": 430,
      "createdAt": "2023-12-10T20:31:27.350Z"
    },
    {
      "idRegActuacion": 737744973,
      "llaveProceso": "11001410300120180040400",
      "consActuacion": 3,
      "fechaActuacion": "2018-08-14T05:00:00.000Z",
      "actuacion": "Auto ordena enviar proceso",
      "anotacion": "REMITIR A LA OFICINA DE CENTRO DE SERVICIOS ADMINISTRATIVOS JURISDICCIONALES PARA LOS JUZGADOS CIVILES Y DE FAMILIA - REPARTO- EL PRESENTE PROCESO PARA SER ASIGNADO A LOS JUECES CIVILES MUNICIPALES DE BOGOTÁ D.C.",
      "fechaInicial": null,
      "fechaFinal": null,
      "fechaRegistro": "2018-08-14T05:00:00.000Z",
      "codRegla": "00                              ",
      "conDocumentos": false,
      "cant": 5,
      "idProceso": 50678323,
      "isUltimaAct": false,
      "carpetaNumero": 430,
      "createdAt": "2023-12-10T20:31:27.350Z"
    },
    {
      "idRegActuacion": 737744963,
      "llaveProceso": "11001410300120180040400",
      "consActuacion": 2,
      "fechaActuacion": "2018-07-26T05:00:00.000Z",
      "actuacion": "Al despacho",
      "anotacion": null,
      "fechaInicial": null,
      "fechaFinal": null,
      "fechaRegistro": "2018-07-26T05:00:00.000Z",
      "codRegla": "00                              ",
      "conDocumentos": false,
      "cant": 5,
      "idProceso": 50678323,
      "isUltimaAct": false,
      "carpetaNumero": 430,
      "createdAt": "2023-12-10T20:31:27.350Z"
    },
    {
      "idRegActuacion": 737744953,
      "llaveProceso": "11001410300120180040400",
      "consActuacion": 1,
      "fechaActuacion": "2018-07-26T05:00:00.000Z",
      "actuacion": " Radicación de Proceso",
      "anotacion": "Actuación de  Radicación de Proceso  realizada el 26/07/2018 a las 13:11:30",
      "fechaInicial": "2018-07-26T05:00:00.000Z",
      "fechaFinal": "2018-07-26T05:00:00.000Z",
      "fechaRegistro": "2018-07-26T05:00:00.000Z",
      "codRegla": "00                              ",
      "conDocumentos": false,
      "cant": 5,
      "idProceso": 50678323,
      "isUltimaAct": false,
      "carpetaNumero": 430,
      "createdAt": "2023-12-10T20:31:27.350Z"
    }
  ],
  "juzgados": [
    {
      "id": 1,
      "tipo": "JUZGADO 001  DE PEQUEÑAS CAUSAS Y COMPETENCIA MÚLTIPLE DE BOGOTÁ ",
      "url": "https://www.ramajudicial.gov.cojuzgado-001--de-pequeñas-causas-y-competencia-múltiple-de-bogotá-"
    },
    {
      "id": 1,
      "tipo": "JUZGADO 001  MUNICIPAL DE PEQUEÑAS CAUSAS LABORALES DE BOGOTÁ ",
      "url": "https://www.ramajudicial.gov.cojuzgado-001--municipal-de-pequeñas-causas-laborales-de-bogotá-"
    }
  ],
  "codeudor": {
    "nombre": "JESSICA ALEXANDRA SANTOS AVENDAÑO",
    "cedula": "1024527755",
    "direccion": "DIAGONAL 68D No 70C-31",
    "telefono": "3134216520",
    "id": 430,
    "carpetaNumero": 430
  },
  "demanda": {
    "vencimientoPagare": "10/04/2028",
    "obligacion": {
      "A": 20990162905
    },
    "capitalAdeudado": "29.045.383.03",
    "entregaGarantiasAbogado": "27/04/2018",
    "departamento": "CUNDINAMARCA",
    "municipio": "BOGOTA",
    "tipoProceso": "HIPOTECARIO",
    "radicado": "2018 - 00404",
    "llaveProceso": "11001410300120180040400",
    "etapaProcesal": "ADMISION",
    "fechaPresentacion": "08/05/2018"
  },
  "demandas": [
    {
      "idProceso": 17487020,
      "idConexion": 257,
      "llaveProceso": "11001410300120180040400",
      "fechaProceso": "2018-06-12T05:00:00.000Z",
      "fechaUltimaActuacion": "2019-12-19T05:00:00.000Z",
      "sujetosProcesales": "Demandante: BANCOLOMBIA S.A. | Demandado: JESSICA ALEXANDRA SANTOS AVENDAÑO | Demandado: JHONATAN ALEXANDER CUELLAR ARIAS ",
      "esPrivado": false,
      "cantFilas": -1,
      "medidasCautelares": null,
      "vencimientoPagare": ["2028-01-01T05:00:00.000Z"],
      "capitalAdeudado": 2904538303,
      "departamento": "CUNDINAMARCA",
      "entregaGarantiasAbogado": null,
      "tipoProceso": "HIPOTECARIO",
      "mandamientoPago": null,
      "etapaProcesal": "ADMISION",
      "fechaPresentacion": ["2018-05-08T05:00:00.000Z"],
      "municipio": "BOGOTA",
      "obligacion": [20990162905],
      "radicado": "2018 - 00404"
    },
    {
      "idProceso": 50678323,
      "idConexion": 135,
      "llaveProceso": "11001410300120180040400",
      "fechaProceso": "2018-07-26T05:00:00.000Z",
      "fechaUltimaActuacion": "2018-08-28T05:00:00.000Z",
      "sujetosProcesales": "Demandante: JAIME ORLANDO CARRILLO DAZA | Demandado: COOVIPORFAC LIMITADA ",
      "esPrivado": false,
      "cantFilas": -1,
      "medidasCautelares": null,
      "vencimientoPagare": ["2028-01-01T05:00:00.000Z"],
      "capitalAdeudado": 2904538303,
      "departamento": "CUNDINAMARCA",
      "entregaGarantiasAbogado": null,
      "tipoProceso": "HIPOTECARIO",
      "mandamientoPago": null,
      "etapaProcesal": "ADMISION",
      "fechaPresentacion": ["2018-05-08T05:00:00.000Z"],
      "municipio": "BOGOTA",
      "obligacion": [20990162905],
      "radicado": "2018 - 00404"
    }
  ],
  "numero": 430,
  "llaveProceso": "11001410300120180040400",
  "fecha": "2019-12-19T05:00:00.000Z",
  "ultimaActuacion": {
    "idRegActuacion": 909598440,
    "llaveProceso": "11001410300120180040400",
    "consActuacion": 46,
    "fechaActuacion": "2019-12-19T00:00:00",
    "actuacion": "Archivo Definitivo",
    "anotacion": "CAJA 150 DE 2019\r\n",
    "fechaInicial": null,
    "fechaFinal": null,
    "fechaRegistro": "2019-12-19T00:00:00",
    "codRegla": "00                              ",
    "conDocumentos": false,
    "cant": 46,
    "idProceso": 17487020,
    "isUltimaAct": true
  },
  "category": "Terminados",
  "revisado": true,
  "terminado": true,
  "tipoProceso": "HIPOTECARIO",
  "deudor": {
    "tel": {
      "fijo": null,
      "celular": 3112907361
    },
    "primerNombre": "JHONATAN",
    "segundoNombre": "ALEJANDRO",
    "primerApellido": "",
    "segundoApellido": ["CUELLAR", "ARIAS"],
    "cedula": 1024517216,
    "direccion": "DIAGONAL 68 D No 70C-31",
    "email": "alejaso1291@hotmail.com"
  },
  "cc": 1024517216,
  "procesos": [
    {
      "idProceso": 17487020,
      "idConexion": 257,
      "llaveProceso": "11001410300120180040400",
      "fechaProceso": "2018-06-12T05:00:00.000Z",
      "fechaUltimaActuacion": "2019-12-19T05:00:00.000Z",
      "despacho": "JUZGADO 001  DE PEQUEÑAS CAUSAS Y COMPETENCIA MÚLTIPLE DE BOGOTÁ ",
      "departamento": "BOGOTÁ",
      "sujetosProcesales": "Demandante: BANCOLOMBIA S.A. | Demandado: JESSICA ALEXANDRA SANTOS AVENDAÑO | Demandado: JHONATAN ALEXANDER CUELLAR ARIAS ",
      "esPrivado": false,
      "cantFilas": -1
    },
    {
      "idProceso": 50678323,
      "idConexion": 135,
      "llaveProceso": "11001410300120180040400",
      "fechaProceso": "2018-07-26T05:00:00.000Z",
      "fechaUltimaActuacion": "2018-08-28T05:00:00.000Z",
      "despacho": "JUZGADO 001  MUNICIPAL DE PEQUEÑAS CAUSAS LABORALES DE BOGOTÁ ",
      "departamento": "BOGOTÁ",
      "sujetosProcesales": "Demandante: JAIME ORLANDO CARRILLO DAZA | Demandado: COOVIPORFAC LIMITADA ",
      "esPrivado": false,
      "cantFilas": -1
    }
  ],
  "idProcesos": [17487020, 50678323],
  "nombre": "JHONATAN ALEJANDRO  CUELLAR ARIAS",
  "notificacion": null
}
