{
  "actuaciones": [
    {
      "idRegActuacion": 1940027670,
      "llaveProceso": "11001418901420190065600",
      "consActuacion": 108,
      "fechaActuacion": "2023-12-05T05:00:00.000Z",
      "actuacion": "A la Oficina de Ejecución por Reparto",
      "anotacion": null,
      "fechaInicial": "2023-12-05T05:00:00.000Z",
      "fechaFinal": null,
      "fechaRegistro": "2023-12-05T05:00:00.000Z",
      "codRegla": "00                              ",
      "conDocumentos": false,
      "cant": 108,
      "idProceso": 51816100,
      "isUltimaAct": true,
      "carpetaNumero": 463,
      "createdAt": "2023-12-10T20:31:33.052Z"
    },
    {
      "idRegActuacion": 1903234690,
      "llaveProceso": "11001418901420190065600",
      "consActuacion": 107,
      "fechaActuacion": "2023-10-12T05:00:00.000Z",
      "actuacion": "Remite Oficina de Ejecución",
      "anotacion": null,
      "fechaInicial": null,
      "fechaFinal": null,
      "fechaRegistro": "2023-10-12T05:00:00.000Z",
      "codRegla": "00                              ",
      "conDocumentos": false,
      "cant": 108,
      "idProceso": 51816100,
      "isUltimaAct": false,
      "carpetaNumero": 463,
      "createdAt": "2023-12-10T20:31:33.052Z"
    },
    {
      "idRegActuacion": 1867566150,
      "llaveProceso": "11001418901420190065600",
      "consActuacion": 106,
      "fechaActuacion": "2023-09-01T05:00:00.000Z",
      "actuacion": "Recepción memorial",
      "anotacion": "Curador no acepta cargo",
      "fechaInicial": null,
      "fechaFinal": null,
      "fechaRegistro": "2023-09-04T05:00:00.000Z",
      "codRegla": "00                              ",
      "conDocumentos": false,
      "cant": 108,
      "idProceso": 51816100,
      "isUltimaAct": false,
      "carpetaNumero": 463,
      "createdAt": "2023-12-10T20:31:33.052Z"
    },
    {
      "idRegActuacion": 1858515000,
      "llaveProceso": "11001418901420190065600",
      "consActuacion": 105,
      "fechaActuacion": "2023-08-31T05:00:00.000Z",
      "actuacion": "Oficio Elaborado",
      "anotacion": null,
      "fechaInicial": null,
      "fechaFinal": null,
      "fechaRegistro": "2023-08-25T05:00:00.000Z",
      "codRegla": "00                              ",
      "conDocumentos": false,
      "cant": 108,
      "idProceso": 51816100,
      "isUltimaAct": false,
      "carpetaNumero": 463,
      "createdAt": "2023-12-10T20:31:33.052Z"
    },
    {
      "idRegActuacion": 1857424040,
      "llaveProceso": "11001418901420190065600",
      "consActuacion": 104,
      "fechaActuacion": "2023-08-24T05:00:00.000Z",
      "actuacion": "Fijacion estado",
      "anotacion": "Actuación registrada el 24/08/2023 a las 20:21:35.",
      "fechaInicial": "2023-08-25T05:00:00.000Z",
      "fechaFinal": "2023-08-25T05:00:00.000Z",
      "fechaRegistro": "2023-08-24T05:00:00.000Z",
      "codRegla": "00                              ",
      "conDocumentos": false,
      "cant": 108,
      "idProceso": 51816100,
      "isUltimaAct": false,
      "carpetaNumero": 463,
      "createdAt": "2023-12-10T20:31:33.052Z"
    },
    {
      "idRegActuacion": 1857424030,
      "llaveProceso": "11001418901420190065600",
      "consActuacion": 103,
      "fechaActuacion": "2023-08-24T05:00:00.000Z",
      "actuacion": "Auto Releva curador",
      "anotacion": null,
      "fechaInicial": null,
      "fechaFinal": null,
      "fechaRegistro": "2023-08-24T05:00:00.000Z",
      "codRegla": "00                              ",
      "conDocumentos": false,
      "cant": 108,
      "idProceso": 51816100,
      "isUltimaAct": false,
      "carpetaNumero": 463,
      "createdAt": "2023-12-10T20:31:33.052Z"
    },
    {
      "idRegActuacion": 1854099410,
      "llaveProceso": "11001418901420190065600",
      "consActuacion": 102,
      "fechaActuacion": "2023-08-22T05:00:00.000Z",
      "actuacion": "Al despacho",
      "anotacion": null,
      "fechaInicial": null,
      "fechaFinal": null,
      "fechaRegistro": "2023-08-22T05:00:00.000Z",
      "codRegla": "00                              ",
      "conDocumentos": false,
      "cant": 108,
      "idProceso": 51816100,
      "isUltimaAct": false,
      "carpetaNumero": 463,
      "createdAt": "2023-12-10T20:31:33.052Z"
    },
    {
      "idRegActuacion": 1831181600,
      "llaveProceso": "11001418901420190065600",
      "consActuacion": 101,
      "fechaActuacion": "2023-08-09T05:00:00.000Z",
      "actuacion": "Oficio Elaborado",
      "anotacion": null,
      "fechaInicial": null,
      "fechaFinal": null,
      "fechaRegistro": "2023-08-02T05:00:00.000Z",
      "codRegla": "00                              ",
      "conDocumentos": false,
      "cant": 108,
      "idProceso": 51816100,
      "isUltimaAct": false,
      "carpetaNumero": 463,
      "createdAt": "2023-12-10T20:31:33.052Z"
    },
    {
      "idRegActuacion": 1830582980,
      "llaveProceso": "11001418901420190065600",
      "consActuacion": 100,
      "fechaActuacion": "2023-08-01T05:00:00.000Z",
      "actuacion": "Fijacion estado",
      "anotacion": "Actuación registrada el 01/08/2023 a las 20:10:18.",
      "fechaInicial": "2023-08-02T05:00:00.000Z",
      "fechaFinal": "2023-08-02T05:00:00.000Z",
      "fechaRegistro": "2023-08-01T05:00:00.000Z",
      "codRegla": "00                              ",
      "conDocumentos": false,
      "cant": 108,
      "idProceso": 51816100,
      "isUltimaAct": false,
      "carpetaNumero": 463,
      "createdAt": "2023-12-10T20:31:33.052Z"
    },
    {
      "idRegActuacion": 1830582970,
      "llaveProceso": "11001418901420190065600",
      "consActuacion": 99,
      "fechaActuacion": "2023-08-01T05:00:00.000Z",
      "actuacion": "Auto Releva curador",
      "anotacion": null,
      "fechaInicial": null,
      "fechaFinal": null,
      "fechaRegistro": "2023-08-01T05:00:00.000Z",
      "codRegla": "00                              ",
      "conDocumentos": false,
      "cant": 108,
      "idProceso": 51816100,
      "isUltimaAct": false,
      "carpetaNumero": 463,
      "createdAt": "2023-12-10T20:31:33.052Z"
    },
    {
      "idRegActuacion": 1828846780,
      "llaveProceso": "11001418901420190065600",
      "consActuacion": 98,
      "fechaActuacion": "2023-07-31T05:00:00.000Z",
      "actuacion": "Al despacho",
      "anotacion": null,
      "fechaInicial": null,
      "fechaFinal": null,
      "fechaRegistro": "2023-07-31T05:00:00.000Z",
      "codRegla": "00                              ",
      "conDocumentos": false,
      "cant": 108,
      "idProceso": 51816100,
      "isUltimaAct": false,
      "carpetaNumero": 463,
      "createdAt": "2023-12-10T20:31:33.052Z"
    },
    {
      "idRegActuacion": 1791264470,
      "llaveProceso": "11001418901420190065600",
      "consActuacion": 97,
      "fechaActuacion": "2023-06-27T05:00:00.000Z",
      "actuacion": "Fijacion estado",
      "anotacion": "Actuación registrada el 27/06/2023 a las 20:15:32.",
      "fechaInicial": "2023-06-28T05:00:00.000Z",
      "fechaFinal": "2023-06-28T05:00:00.000Z",
      "fechaRegistro": "2023-06-27T05:00:00.000Z",
      "codRegla": "00                              ",
      "conDocumentos": false,
      "cant": 108,
      "idProceso": 51816100,
      "isUltimaAct": false,
      "carpetaNumero": 463,
      "createdAt": "2023-12-10T20:31:33.052Z"
    },
    {
      "idRegActuacion": 1791264460,
      "llaveProceso": "11001418901420190065600",
      "consActuacion": 96,
      "fechaActuacion": "2023-06-27T05:00:00.000Z",
      "actuacion": "Auto Releva curador",
      "anotacion": null,
      "fechaInicial": null,
      "fechaFinal": null,
      "fechaRegistro": "2023-06-27T05:00:00.000Z",
      "codRegla": "00                              ",
      "conDocumentos": false,
      "cant": 108,
      "idProceso": 51816100,
      "isUltimaAct": false,
      "carpetaNumero": 463,
      "createdAt": "2023-12-10T20:31:33.052Z"
    },
    {
      "idRegActuacion": 1789638470,
      "llaveProceso": "11001418901420190065600",
      "consActuacion": 95,
      "fechaActuacion": "2023-06-26T05:00:00.000Z",
      "actuacion": "Al despacho",
      "anotacion": null,
      "fechaInicial": null,
      "fechaFinal": null,
      "fechaRegistro": "2023-06-26T05:00:00.000Z",
      "codRegla": "00                              ",
      "conDocumentos": false,
      "cant": 108,
      "idProceso": 51816100,
      "isUltimaAct": false,
      "carpetaNumero": 463,
      "createdAt": "2023-12-10T20:31:33.052Z"
    },
    {
      "idRegActuacion": 1781989610,
      "llaveProceso": "11001418901420190065600",
      "consActuacion": 94,
      "fechaActuacion": "2023-06-15T05:00:00.000Z",
      "actuacion": "Recepción memorial",
      "anotacion": "curador renuncia cargo",
      "fechaInicial": null,
      "fechaFinal": null,
      "fechaRegistro": "2023-06-20T05:00:00.000Z",
      "codRegla": "00                              ",
      "conDocumentos": false,
      "cant": 108,
      "idProceso": 51816100,
      "isUltimaAct": false,
      "carpetaNumero": 463,
      "createdAt": "2023-12-10T20:31:33.052Z"
    },
    {
      "idRegActuacion": 1776765150,
      "llaveProceso": "11001418901420190065600",
      "consActuacion": 93,
      "fechaActuacion": "2023-06-14T05:00:00.000Z",
      "actuacion": "Fijacion estado",
      "anotacion": "Actuación registrada el 14/06/2023 a las 17:19:09.",
      "fechaInicial": "2023-06-15T05:00:00.000Z",
      "fechaFinal": "2023-06-15T05:00:00.000Z",
      "fechaRegistro": "2023-06-14T05:00:00.000Z",
      "codRegla": "00                              ",
      "conDocumentos": false,
      "cant": 108,
      "idProceso": 51816100,
      "isUltimaAct": false,
      "carpetaNumero": 463,
      "createdAt": "2023-12-10T20:31:33.052Z"
    },
    {
      "idRegActuacion": 1776765140,
      "llaveProceso": "11001418901420190065600",
      "consActuacion": 92,
      "fechaActuacion": "2023-06-14T05:00:00.000Z",
      "actuacion": "Auto aprueba liquidación",
      "anotacion": null,
      "fechaInicial": null,
      "fechaFinal": null,
      "fechaRegistro": "2023-06-14T05:00:00.000Z",
      "codRegla": "00                              ",
      "conDocumentos": false,
      "cant": 108,
      "idProceso": 51816100,
      "isUltimaAct": false,
      "carpetaNumero": 463,
      "createdAt": "2023-12-10T20:31:33.052Z"
    },
    {
      "idRegActuacion": 1775214960,
      "llaveProceso": "11001418901420190065600",
      "consActuacion": 91,
      "fechaActuacion": "2023-06-13T05:00:00.000Z",
      "actuacion": "Al despacho",
      "anotacion": null,
      "fechaInicial": null,
      "fechaFinal": null,
      "fechaRegistro": "2023-06-13T05:00:00.000Z",
      "codRegla": "00                              ",
      "conDocumentos": false,
      "cant": 108,
      "idProceso": 51816100,
      "isUltimaAct": false,
      "carpetaNumero": 463,
      "createdAt": "2023-12-10T20:31:33.052Z"
    },
    {
      "idRegActuacion": 1775157270,
      "llaveProceso": "11001418901420190065600",
      "consActuacion": 90,
      "fechaActuacion": "2023-06-13T05:00:00.000Z",
      "actuacion": "Liquidación Costas Art. 366 C.G.P.",
      "anotacion": null,
      "fechaInicial": null,
      "fechaFinal": null,
      "fechaRegistro": "2023-06-13T05:00:00.000Z",
      "codRegla": "00                              ",
      "conDocumentos": false,
      "cant": 108,
      "idProceso": 51816100,
      "isUltimaAct": false,
      "carpetaNumero": 463,
      "createdAt": "2023-12-10T20:31:33.052Z"
    },
    {
      "idRegActuacion": 1766214710,
      "llaveProceso": "11001418901420190065600",
      "consActuacion": 89,
      "fechaActuacion": "2023-06-05T05:00:00.000Z",
      "actuacion": "Fijacion estado",
      "anotacion": "Actuación registrada el 05/06/2023 a las 19:36:45.",
      "fechaInicial": "2023-06-06T05:00:00.000Z",
      "fechaFinal": "2023-06-06T05:00:00.000Z",
      "fechaRegistro": "2023-06-05T05:00:00.000Z",
      "codRegla": "00                              ",
      "conDocumentos": false,
      "cant": 108,
      "idProceso": 51816100,
      "isUltimaAct": false,
      "carpetaNumero": 463,
      "createdAt": "2023-12-10T20:31:33.052Z"
    },
    {
      "idRegActuacion": 1766214700,
      "llaveProceso": "11001418901420190065600",
      "consActuacion": 88,
      "fechaActuacion": "2023-06-05T05:00:00.000Z",
      "actuacion": "Sentencia Anticipada",
      "anotacion": "Ordena seguir adelante la ejecucion",
      "fechaInicial": null,
      "fechaFinal": null,
      "fechaRegistro": "2023-06-05T05:00:00.000Z",
      "codRegla": "00                              ",
      "conDocumentos": false,
      "cant": 108,
      "idProceso": 51816100,
      "isUltimaAct": false,
      "carpetaNumero": 463,
      "createdAt": "2023-12-10T20:31:33.052Z"
    },
    {
      "idRegActuacion": 1708242050,
      "llaveProceso": "11001418901420190065600",
      "consActuacion": 87,
      "fechaActuacion": "2023-04-12T05:00:00.000Z",
      "actuacion": "Al despacho",
      "anotacion": null,
      "fechaInicial": null,
      "fechaFinal": null,
      "fechaRegistro": "2023-04-12T05:00:00.000Z",
      "codRegla": "00                              ",
      "conDocumentos": false,
      "cant": 108,
      "idProceso": 51816100,
      "isUltimaAct": false,
      "carpetaNumero": 463,
      "createdAt": "2023-12-10T20:31:33.052Z"
    },
    {
      "idRegActuacion": 1694642690,
      "llaveProceso": "11001418901420190065600",
      "consActuacion": 86,
      "fechaActuacion": "2023-03-29T05:00:00.000Z",
      "actuacion": "Fijacion estado",
      "anotacion": "Actuación registrada el 29/03/2023 a las 16:46:11.",
      "fechaInicial": "2023-03-30T05:00:00.000Z",
      "fechaFinal": "2023-03-30T05:00:00.000Z",
      "fechaRegistro": "2023-03-29T05:00:00.000Z",
      "codRegla": "00                              ",
      "conDocumentos": false,
      "cant": 108,
      "idProceso": 51816100,
      "isUltimaAct": false,
      "carpetaNumero": 463,
      "createdAt": "2023-12-10T20:31:33.052Z"
    },
    {
      "idRegActuacion": 1694642680,
      "llaveProceso": "11001418901420190065600",
      "consActuacion": 85,
      "fechaActuacion": "2023-03-29T05:00:00.000Z",
      "actuacion": "Auto resuelve pruebas pedidas",
      "anotacion": "Decreta pruebas - ordena ingresar al Despacho para sentencia anticipada",
      "fechaInicial": null,
      "fechaFinal": null,
      "fechaRegistro": "2023-03-29T05:00:00.000Z",
      "codRegla": "00                              ",
      "conDocumentos": false,
      "cant": 108,
      "idProceso": 51816100,
      "isUltimaAct": false,
      "carpetaNumero": 463,
      "createdAt": "2023-12-10T20:31:33.052Z"
    },
    {
      "idRegActuacion": 1693369990,
      "llaveProceso": "11001418901420190065600",
      "consActuacion": 84,
      "fechaActuacion": "2023-03-28T05:00:00.000Z",
      "actuacion": "Al despacho",
      "anotacion": null,
      "fechaInicial": null,
      "fechaFinal": null,
      "fechaRegistro": "2023-03-28T05:00:00.000Z",
      "codRegla": "00                              ",
      "conDocumentos": false,
      "cant": 108,
      "idProceso": 51816100,
      "isUltimaAct": false,
      "carpetaNumero": 463,
      "createdAt": "2023-12-10T20:31:33.052Z"
    },
    {
      "idRegActuacion": 1687484890,
      "llaveProceso": "11001418901420190065600",
      "consActuacion": 83,
      "fechaActuacion": "2023-03-23T05:00:00.000Z",
      "actuacion": "Recepción memorial",
      "anotacion": "Traslado Excepciones",
      "fechaInicial": null,
      "fechaFinal": null,
      "fechaRegistro": "2023-03-23T05:00:00.000Z",
      "codRegla": "00                              ",
      "conDocumentos": false,
      "cant": 108,
      "idProceso": 51816100,
      "isUltimaAct": false,
      "carpetaNumero": 463,
      "createdAt": "2023-12-10T20:31:33.052Z"
    },
    {
      "idRegActuacion": 1670817650,
      "llaveProceso": "11001418901420190065600",
      "consActuacion": 82,
      "fechaActuacion": "2023-03-08T05:00:00.000Z",
      "actuacion": "Fijacion estado",
      "anotacion": "Actuación registrada el 08/03/2023 a las 16:42:17.",
      "fechaInicial": "2023-03-09T05:00:00.000Z",
      "fechaFinal": "2023-03-09T05:00:00.000Z",
      "fechaRegistro": "2023-03-08T05:00:00.000Z",
      "codRegla": "00                              ",
      "conDocumentos": false,
      "cant": 108,
      "idProceso": 51816100,
      "isUltimaAct": false,
      "carpetaNumero": 463,
      "createdAt": "2023-12-10T20:31:33.052Z"
    },
    {
      "idRegActuacion": 1670817640,
      "llaveProceso": "11001418901420190065600",
      "consActuacion": 81,
      "fechaActuacion": "2023-03-08T05:00:00.000Z",
      "actuacion": "Auto ordena correr traslado",
      "anotacion": null,
      "fechaInicial": null,
      "fechaFinal": null,
      "fechaRegistro": "2023-03-08T05:00:00.000Z",
      "codRegla": "00                              ",
      "conDocumentos": false,
      "cant": 108,
      "idProceso": 51816100,
      "isUltimaAct": false,
      "carpetaNumero": 463,
      "createdAt": "2023-12-10T20:31:33.052Z"
    },
    {
      "idRegActuacion": 1669393430,
      "llaveProceso": "11001418901420190065600",
      "consActuacion": 80,
      "fechaActuacion": "2023-03-07T05:00:00.000Z",
      "actuacion": "Al despacho",
      "anotacion": null,
      "fechaInicial": null,
      "fechaFinal": null,
      "fechaRegistro": "2023-03-07T05:00:00.000Z",
      "codRegla": "00                              ",
      "conDocumentos": false,
      "cant": 108,
      "idProceso": 51816100,
      "isUltimaAct": false,
      "carpetaNumero": 463,
      "createdAt": "2023-12-10T20:31:33.052Z"
    },
    {
      "idRegActuacion": 1651161170,
      "llaveProceso": "11001418901420190065600",
      "consActuacion": 79,
      "fechaActuacion": "2023-02-20T05:00:00.000Z",
      "actuacion": "Recepción memorial",
      "anotacion": "Contestación Demanda",
      "fechaInicial": null,
      "fechaFinal": null,
      "fechaRegistro": "2023-02-20T05:00:00.000Z",
      "codRegla": "00                              ",
      "conDocumentos": false,
      "cant": 108,
      "idProceso": 51816100,
      "isUltimaAct": false,
      "carpetaNumero": 463,
      "createdAt": "2023-12-10T20:31:33.052Z"
    },
    {
      "idRegActuacion": 1647215050,
      "llaveProceso": "11001418901420190065600",
      "consActuacion": 78,
      "fechaActuacion": "2023-02-15T05:00:00.000Z",
      "actuacion": "Recepción memorial",
      "anotacion": "SOLICITUD ",
      "fechaInicial": null,
      "fechaFinal": null,
      "fechaRegistro": "2023-02-15T05:00:00.000Z",
      "codRegla": "00                              ",
      "conDocumentos": false,
      "cant": 108,
      "idProceso": 51816100,
      "isUltimaAct": false,
      "carpetaNumero": 463,
      "createdAt": "2023-12-10T20:31:33.052Z"
    },
    {
      "idRegActuacion": 1513371320,
      "llaveProceso": "11001418901420190065600",
      "consActuacion": 77,
      "fechaActuacion": "2022-11-17T05:00:00.000Z",
      "actuacion": "Fijacion estado",
      "anotacion": "Actuación registrada el 17/11/2022 a las 16:33:22.",
      "fechaInicial": "2022-11-18T05:00:00.000Z",
      "fechaFinal": "2022-11-18T05:00:00.000Z",
      "fechaRegistro": "2022-11-17T05:00:00.000Z",
      "codRegla": "00                              ",
      "conDocumentos": false,
      "cant": 108,
      "idProceso": 51816100,
      "isUltimaAct": false,
      "carpetaNumero": 463,
      "createdAt": "2023-12-10T20:31:33.052Z"
    },
    {
      "idRegActuacion": 1513371310,
      "llaveProceso": "11001418901420190065600",
      "consActuacion": 76,
      "fechaActuacion": "2022-11-17T05:00:00.000Z",
      "actuacion": "Auto Releva curador",
      "anotacion": null,
      "fechaInicial": null,
      "fechaFinal": null,
      "fechaRegistro": "2022-11-17T05:00:00.000Z",
      "codRegla": "00                              ",
      "conDocumentos": false,
      "cant": 108,
      "idProceso": 51816100,
      "isUltimaAct": false,
      "carpetaNumero": 463,
      "createdAt": "2023-12-10T20:31:33.052Z"
    },
    {
      "idRegActuacion": 1511766240,
      "llaveProceso": "11001418901420190065600",
      "consActuacion": 75,
      "fechaActuacion": "2022-11-16T05:00:00.000Z",
      "actuacion": "Al despacho",
      "anotacion": null,
      "fechaInicial": null,
      "fechaFinal": null,
      "fechaRegistro": "2022-11-16T05:00:00.000Z",
      "codRegla": "00                              ",
      "conDocumentos": false,
      "cant": 108,
      "idProceso": 51816100,
      "isUltimaAct": false,
      "carpetaNumero": 463,
      "createdAt": "2023-12-10T20:31:33.052Z"
    },
    {
      "idRegActuacion": 1463854210,
      "llaveProceso": "11001418901420190065600",
      "consActuacion": 74,
      "fechaActuacion": "2022-10-18T05:00:00.000Z",
      "actuacion": "Fijacion estado",
      "anotacion": "Actuación registrada el 18/10/2022 a las 16:11:49.",
      "fechaInicial": "2022-10-19T05:00:00.000Z",
      "fechaFinal": "2022-10-19T05:00:00.000Z",
      "fechaRegistro": "2022-10-18T05:00:00.000Z",
      "codRegla": "00                              ",
      "conDocumentos": false,
      "cant": 108,
      "idProceso": 51816100,
      "isUltimaAct": false,
      "carpetaNumero": 463,
      "createdAt": "2023-12-10T20:31:33.052Z"
    },
    {
      "idRegActuacion": 1463854200,
      "llaveProceso": "11001418901420190065600",
      "consActuacion": 73,
      "fechaActuacion": "2022-10-18T05:00:00.000Z",
      "actuacion": "Auto nombra Auxiliar de la Justicia",
      "anotacion": null,
      "fechaInicial": null,
      "fechaFinal": null,
      "fechaRegistro": "2022-10-18T05:00:00.000Z",
      "codRegla": "00                              ",
      "conDocumentos": false,
      "cant": 108,
      "idProceso": 51816100,
      "isUltimaAct": false,
      "carpetaNumero": 463,
      "createdAt": "2023-12-10T20:31:33.052Z"
    },
    {
      "idRegActuacion": 1459305250,
      "llaveProceso": "11001418901420190065600",
      "consActuacion": 72,
      "fechaActuacion": "2022-10-14T05:00:00.000Z",
      "actuacion": "Al despacho",
      "anotacion": null,
      "fechaInicial": null,
      "fechaFinal": null,
      "fechaRegistro": "2022-10-14T05:00:00.000Z",
      "codRegla": "00                              ",
      "conDocumentos": false,
      "cant": 108,
      "idProceso": 51816100,
      "isUltimaAct": false,
      "carpetaNumero": 463,
      "createdAt": "2023-12-10T20:31:33.052Z"
    },
    {
      "idRegActuacion": 1395435520,
      "llaveProceso": "11001418901420190065600",
      "consActuacion": 71,
      "fechaActuacion": "2022-09-12T05:00:00.000Z",
      "actuacion": "Fijación edicto emplazatorio",
      "anotacion": "En Cumplimiento A Lo Ordenado Con Auto Del 5 De Septiembre De 2022, Se Efectúa El Emplazamiento De La Demandada En La Forma Prevista En El Art. 108 Del C.. G. Del P., En Consonancia Con El Art. 10 De La Ley 2213 De 2022.",
      "fechaInicial": "2022-09-13T05:00:00.000Z",
      "fechaFinal": "2022-10-03T05:00:00.000Z",
      "fechaRegistro": "2022-09-12T05:00:00.000Z",
      "codRegla": "00                              ",
      "conDocumentos": false,
      "cant": 108,
      "idProceso": 51816100,
      "isUltimaAct": false,
      "carpetaNumero": 463,
      "createdAt": "2023-12-10T20:31:33.052Z"
    },
    {
      "idRegActuacion": 1388017360,
      "llaveProceso": "11001418901420190065600",
      "consActuacion": 70,
      "fechaActuacion": "2022-09-05T05:00:00.000Z",
      "actuacion": "Fijacion estado",
      "anotacion": "Actuación registrada el 05/09/2022 a las 16:07:41.",
      "fechaInicial": "2022-09-06T05:00:00.000Z",
      "fechaFinal": "2022-09-06T05:00:00.000Z",
      "fechaRegistro": "2022-09-05T05:00:00.000Z",
      "codRegla": "00                              ",
      "conDocumentos": false,
      "cant": 108,
      "idProceso": 51816100,
      "isUltimaAct": false,
      "carpetaNumero": 463,
      "createdAt": "2023-12-10T20:31:33.052Z"
    },
    {
      "idRegActuacion": 1388017350,
      "llaveProceso": "11001418901420190065600",
      "consActuacion": 69,
      "fechaActuacion": "2022-09-05T05:00:00.000Z",
      "actuacion": "Auto ordena emplazamiento",
      "anotacion": null,
      "fechaInicial": null,
      "fechaFinal": null,
      "fechaRegistro": "2022-09-05T05:00:00.000Z",
      "codRegla": "00                              ",
      "conDocumentos": false,
      "cant": 108,
      "idProceso": 51816100,
      "isUltimaAct": false,
      "carpetaNumero": 463,
      "createdAt": "2023-12-10T20:31:33.052Z"
    },
    {
      "idRegActuacion": 1176372381,
      "llaveProceso": "11001418901420190065600",
      "consActuacion": 28516253,
      "fechaActuacion": "2022-09-12T05:00:00.000Z",
      "actuacion": "Auto Emplaza",
      "anotacion": "En cumplimiento a lo ordenado con auto del 5 de septiembre de 2022, se efectúa el emplazamiento de la demandada LEIDY YANETH VIDAL RODRIGUEZ en la forma prevista en el art. 108 del C.. G. del P., en consonancia con el art. 10 de la Ley 2213 de 2022.",
      "fechaInicial": "2022-09-13T05:00:00.000Z",
      "fechaFinal": "2022-10-03T05:00:00.000Z",
      "fechaRegistro": "2022-09-12T05:00:00.000Z",
      "codRegla": "00                              ",
      "conDocumentos": true,
      "cant": 1,
      "idProceso": 135801811,
      "isUltimaAct": false,
      "carpetaNumero": 463,
      "createdAt": "2023-12-10T20:31:33.066Z"
    }
  ],
  "juzgados": [
    {
      "id": 12,
      "tipo": "JUZGADO 012 CIVIL MUNICIPAL DE EJECUCIÓN DE SENTENCIAS DE BOGOTÁ ",
      "url": "https://www.ramajudicial.gov.co/web/juzgado-12-de-ejecucion-civil-municipal-de-bogota"
    },
    {
      "id": 14,
      "tipo": "JUZGADO 014 DE PEQUEÑAS CAUSAS  Y COMPETENCIA MÚLTIPLE DE BOGOTÁ ",
      "url": "https://www.ramajudicial.gov.cojuzgado-014-de-pequeñas-causas--y-competencia-múltiple-de-bogotá-"
    }
  ],
  "codeudor": null,
  "demanda": {
    "vencimientoPagare": "4/02/2021 // 16/02/2021",
    "obligacion": {
      "A": "AMERICAN 0377814037749057",
      "B": "VISA 4513083943843365 // MASTER 5303729958258417"
    },
    "capitalAdeudado": "$ 24.501.535",
    "entregaGarantiasAbogado": "5/07/2018",
    "departamento": "CUNDINAMARCA",
    "municipio": "BOGOTA",
    "tipoProceso": "SINGULAR",
    "radicado": "2019 - 00656",
    "llaveProceso": "11001418901420190065600",
    "etapaProcesal": "CONTESTACION DEMANDA",
    "fechaPresentacion": "12/07/2018",
    "mandamientoPago": "7/05/2019",
    "notificacion": {
      "291": {
        "fechaRecibido": "28/09/2019",
        "resultado": "NEGATIVO",
        "fechaAporta": "28/09/2019"
      },
      "292": {
        "resultado": "POSITIVO"
      },
      "certimail": "SI",
      "fisico": "SI",
      "tipo": "CERTIMAIL Y CORREO",
      "autoNotificado": "29/01/2020"
    },
    "medidasCautelares": {
      "fechaOrdenaMedidas": "14/05/2019",
      "medidaSolicitada": "EMBARGO DE INMUEBLE"
    }
  },
  "demandas": [
    {
      "idProceso": 51816100,
      "idConexion": 259,
      "llaveProceso": "11001418901420190065600",
      "fechaProceso": "2019-04-04T05:00:00.000Z",
      "fechaUltimaActuacion": "2023-12-05T05:00:00.000Z",
      "sujetosProcesales": "Demandante: BANCOLOMBIA S.A. | Demandado: LEIDY YANETH VIDAL RODRÍGUEZ ",
      "esPrivado": false,
      "cantFilas": -1,
      "medidasCautelares": {
        "fechaOrdenaMedida": null,
        "medidaSolicitada": "EMBARGO DE INMUEBLE"
      },
      "vencimientoPagare": [
        "2021-01-01T05:00:00.000Z",
        "2021-01-01T05:00:00.000Z"
      ],
      "capitalAdeudado": null,
      "departamento": "CUNDINAMARCA",
      "entregaGarantiasAbogado": "2018-05-07T05:00:00.000Z",
      "tipoProceso": "SINGULAR",
      "mandamientoPago": "2019-07-05T05:00:00.000Z",
      "etapaProcesal": "CONTESTACION DEMANDA",
      "fechaPresentacion": ["2018-07-12T05:00:00.000Z"],
      "municipio": "BOGOTA",
      "obligacion": [
        "AMERICAN 0377814037749057",
        "VISA 4513083943843365 // MASTER 5303729958258417"
      ],
      "radicado": "2019 - 00656"
    },
    {
      "idProceso": 135801811,
      "idConexion": 320,
      "llaveProceso": "11001418901420190065600",
      "fechaProceso": "2019-04-03T05:00:00.000Z",
      "fechaUltimaActuacion": "2022-09-12T05:00:00.000Z",
      "sujetosProcesales": "Demandante/accionante: BANCOLOMBIA SA | Demandado/indiciado/causante: LEIDY YANETH VIDAL RODRIGUEZ (Emplazado) ",
      "esPrivado": false,
      "cantFilas": -1,
      "medidasCautelares": {
        "fechaOrdenaMedida": null,
        "medidaSolicitada": "EMBARGO DE INMUEBLE"
      },
      "vencimientoPagare": [
        "2021-01-01T05:00:00.000Z",
        "2021-01-01T05:00:00.000Z"
      ],
      "capitalAdeudado": null,
      "departamento": "CUNDINAMARCA",
      "entregaGarantiasAbogado": "2018-05-07T05:00:00.000Z",
      "tipoProceso": "SINGULAR",
      "mandamientoPago": "2019-07-05T05:00:00.000Z",
      "etapaProcesal": "CONTESTACION DEMANDA",
      "fechaPresentacion": ["2018-07-12T05:00:00.000Z"],
      "municipio": "BOGOTA",
      "obligacion": [
        "AMERICAN 0377814037749057",
        "VISA 4513083943843365 // MASTER 5303729958258417"
      ],
      "radicado": "2019 - 00656"
    }
  ],
  "numero": 463,
  "llaveProceso": "11001418901420190065600",
  "fecha": "2023-12-05T05:00:00.000Z",
  "ultimaActuacion": {
    "idRegActuacion": 1940027670,
    "llaveProceso": "11001418901420190065600",
    "consActuacion": 108,
    "fechaActuacion": "2023-12-05T00:00:00",
    "actuacion": "A la Oficina de Ejecución por Reparto",
    "anotacion": null,
    "fechaInicial": "2023-12-05T00:00:00",
    "fechaFinal": null,
    "fechaRegistro": "2023-12-05T00:00:00",
    "codRegla": "00                              ",
    "conDocumentos": false,
    "cant": 108,
    "idProceso": 51816100,
    "isUltimaAct": true
  },
  "category": "Bancolombia",
  "revisado": false,
  "terminado": false,
  "tipoProceso": "SINGULAR",
  "deudor": {
    "tel": {
      "fijo": null,
      "celular": null
    },
    "primerNombre": "LEIDY",
    "segundoNombre": "YANETH",
    "primerApellido": "VIDAL",
    "segundoApellido": "RODRIGUEZ",
    "cedula": 52883958,
    "direccion": "DIAGONAL 2 No 21 B-20",
    "email": "leidyyaneth.lyv@gmail.com"
  },
  "cc": 52883958,
  "procesos": [
    {
      "idProceso": 51816100,
      "idConexion": 259,
      "llaveProceso": "11001418901420190065600",
      "fechaProceso": "2019-04-04T05:00:00.000Z",
      "fechaUltimaActuacion": "2023-12-05T05:00:00.000Z",
      "despacho": "JUZGADO 012 CIVIL MUNICIPAL DE EJECUCIÓN DE SENTENCIAS DE BOGOTÁ ",
      "departamento": "BOGOTÁ",
      "sujetosProcesales": "Demandante: BANCOLOMBIA S.A. | Demandado: LEIDY YANETH VIDAL RODRÍGUEZ ",
      "esPrivado": false,
      "cantFilas": -1
    },
    {
      "idProceso": 135801811,
      "idConexion": 320,
      "llaveProceso": "11001418901420190065600",
      "fechaProceso": "2019-04-03T05:00:00.000Z",
      "fechaUltimaActuacion": "2022-09-12T05:00:00.000Z",
      "despacho": "JUZGADO 014 DE PEQUEÑAS CAUSAS  Y COMPETENCIA MÚLTIPLE DE BOGOTÁ ",
      "departamento": "BOGOTÁ",
      "sujetosProcesales": "Demandante/accionante: BANCOLOMBIA SA | Demandado/indiciado/causante: LEIDY YANETH VIDAL RODRIGUEZ (Emplazado) ",
      "esPrivado": false,
      "cantFilas": -1
    }
  ],
  "idProcesos": [51816100, 135801811],
  "nombre": "LEIDY YANETH VIDAL RODRIGUEZ",
  "notificacion": {
    "notifiers": [
      {
        "tipo": "291",
        "fechaRecibido": "2019-09-28T05:00:00.000Z",
        "fechaAporta": "2019-09-28T05:00:00.000Z",
        "resultado": false
      },
      {
        "tipo": "292",
        "fechaRecibido": null,
        "fechaAporta": null,
        "resultado": true
      }
    ],
    "certimail": true,
    "fisico": true,
    "autoNotificado": "29/01/2020"
  }
}
