{
  "id": 900535464,
  "actuaciones": [
    {
      "idRegActuacion": 863844990,
      "llaveProceso": "11001400302320170104400",
      "consActuacion": 51,
      "fechaActuacion": "2019-10-18T05:00:00.000Z",
      "actuacion": "Oficio Elaborado",
      "anotacion": "CAJA 494",
      "fechaInicial": null,
      "fechaFinal": null,
      "fechaRegistro": "2019-10-18T05:00:00.000Z",
      "codRegla": "00                              ",
      "conDocumentos": false,
      "cant": 51,
      "idProceso": 50725030,
      "isUltimaAct": true,
      "createdAt": "2024-01-02T02:10:07.317Z"
    },
    {
      "idRegActuacion": 863839750,
      "llaveProceso": "11001400302320170104400",
      "consActuacion": 50,
      "fechaActuacion": "2019-10-18T05:00:00.000Z",
      "actuacion": "Oficio Elaborado",
      "anotacion": null,
      "fechaInicial": null,
      "fechaFinal": null,
      "fechaRegistro": "2019-10-18T05:00:00.000Z",
      "codRegla": "00                              ",
      "conDocumentos": false,
      "cant": 51,
      "idProceso": 50725030,
      "isUltimaAct": false,
      "createdAt": "2024-01-02T02:10:07.317Z"
    },
    {
      "idRegActuacion": 860819640,
      "llaveProceso": "11001400302320170104400",
      "consActuacion": 49,
      "fechaActuacion": "2019-10-08T05:00:00.000Z",
      "actuacion": "Fijacion estado",
      "anotacion": "Actuación registrada el 08/10/2019 a las 15:54:19.",
      "fechaInicial": "2019-10-09T05:00:00.000Z",
      "fechaFinal": "2019-10-09T05:00:00.000Z",
      "fechaRegistro": "2019-10-08T05:00:00.000Z",
      "codRegla": "00                              ",
      "conDocumentos": false,
      "cant": 51,
      "idProceso": 50725030,
      "isUltimaAct": false,
      "createdAt": "2024-01-02T02:10:07.317Z"
    },
    {
      "idRegActuacion": 860819630,
      "llaveProceso": "11001400302320170104400",
      "consActuacion": 48,
      "fechaActuacion": "2019-10-08T05:00:00.000Z",
      "actuacion": "Auto termina proceso por Pago",
      "anotacion": null,
      "fechaInicial": null,
      "fechaFinal": null,
      "fechaRegistro": "2019-10-08T05:00:00.000Z",
      "codRegla": "00                              ",
      "conDocumentos": false,
      "cant": 51,
      "idProceso": 50725030,
      "isUltimaAct": false,
      "createdAt": "2024-01-02T02:10:07.317Z"
    },
    {
      "idRegActuacion": 565618080,
      "llaveProceso": "11001400302320170104400",
      "consActuacion": 47,
      "fechaActuacion": "2019-09-20T05:00:00.000Z",
      "actuacion": "Al despacho",
      "anotacion": null,
      "fechaInicial": null,
      "fechaFinal": null,
      "fechaRegistro": "2019-09-20T05:00:00.000Z",
      "codRegla": "00                              ",
      "conDocumentos": false,
      "cant": 51,
      "idProceso": 50725030,
      "isUltimaAct": false,
      "createdAt": "2024-01-02T02:10:07.317Z"
    },
    {
      "idRegActuacion": 696579660,
      "llaveProceso": "11001400302320170104400",
      "consActuacion": 46,
      "fechaActuacion": "2019-08-12T05:00:00.000Z",
      "actuacion": "Fijacion estado",
      "anotacion": "Actuación registrada el 12/08/2019 a las 07:49:06.",
      "fechaInicial": "2019-08-13T05:00:00.000Z",
      "fechaFinal": "2019-08-13T05:00:00.000Z",
      "fechaRegistro": "2019-08-12T05:00:00.000Z",
      "codRegla": "00                              ",
      "conDocumentos": false,
      "cant": 51,
      "idProceso": 50725030,
      "isUltimaAct": false,
      "createdAt": "2024-01-02T02:10:07.317Z"
    },
    {
      "idRegActuacion": 696579650,
      "llaveProceso": "11001400302320170104400",
      "consActuacion": 45,
      "fechaActuacion": "2019-08-12T05:00:00.000Z",
      "actuacion": "Auto pone en conocimiento",
      "anotacion": null,
      "fechaInicial": null,
      "fechaFinal": null,
      "fechaRegistro": "2019-08-12T05:00:00.000Z",
      "codRegla": "00                              ",
      "conDocumentos": false,
      "cant": 51,
      "idProceso": 50725030,
      "isUltimaAct": false,
      "createdAt": "2024-01-02T02:10:07.317Z"
    },
    {
      "idRegActuacion": 696579640,
      "llaveProceso": "11001400302320170104400",
      "consActuacion": 44,
      "fechaActuacion": "2019-08-06T05:00:00.000Z",
      "actuacion": "Al despacho",
      "anotacion": null,
      "fechaInicial": null,
      "fechaFinal": null,
      "fechaRegistro": "2019-08-06T05:00:00.000Z",
      "codRegla": "00                              ",
      "conDocumentos": false,
      "cant": 51,
      "idProceso": 50725030,
      "isUltimaAct": false,
      "createdAt": "2024-01-02T02:10:07.317Z"
    },
    {
      "idRegActuacion": 696579630,
      "llaveProceso": "11001400302320170104400",
      "consActuacion": 43,
      "fechaActuacion": "2019-07-30T05:00:00.000Z",
      "actuacion": "Fijacion estado",
      "anotacion": "Actuación registrada el 30/07/2019 a las 09:45:13.",
      "fechaInicial": "2019-07-31T05:00:00.000Z",
      "fechaFinal": "2019-07-31T05:00:00.000Z",
      "fechaRegistro": "2019-07-30T05:00:00.000Z",
      "codRegla": "00                              ",
      "conDocumentos": false,
      "cant": 51,
      "idProceso": 50725030,
      "isUltimaAct": false,
      "createdAt": "2024-01-02T02:10:07.317Z"
    },
    {
      "idRegActuacion": 696579620,
      "llaveProceso": "11001400302320170104400",
      "consActuacion": 42,
      "fechaActuacion": "2019-07-30T05:00:00.000Z",
      "actuacion": "Auto requiere",
      "anotacion": null,
      "fechaInicial": null,
      "fechaFinal": null,
      "fechaRegistro": "2019-07-30T05:00:00.000Z",
      "codRegla": "00                              ",
      "conDocumentos": false,
      "cant": 51,
      "idProceso": 50725030,
      "isUltimaAct": false,
      "createdAt": "2024-01-02T02:10:07.317Z"
    },
    {
      "idRegActuacion": 696579610,
      "llaveProceso": "11001400302320170104400",
      "consActuacion": 41,
      "fechaActuacion": "2019-07-24T05:00:00.000Z",
      "actuacion": "Al despacho",
      "anotacion": null,
      "fechaInicial": null,
      "fechaFinal": null,
      "fechaRegistro": "2019-07-24T05:00:00.000Z",
      "codRegla": "00                              ",
      "conDocumentos": false,
      "cant": 51,
      "idProceso": 50725030,
      "isUltimaAct": false,
      "createdAt": "2024-01-02T02:10:07.317Z"
    },
    {
      "idRegActuacion": 696579600,
      "llaveProceso": "11001400302320170104400",
      "consActuacion": 40,
      "fechaActuacion": "2019-07-11T05:00:00.000Z",
      "actuacion": "Fijacion estado",
      "anotacion": "Actuación registrada el 11/07/2019 a las 15:23:02.",
      "fechaInicial": "2019-07-12T05:00:00.000Z",
      "fechaFinal": "2019-07-12T05:00:00.000Z",
      "fechaRegistro": "2019-07-11T05:00:00.000Z",
      "codRegla": "00                              ",
      "conDocumentos": false,
      "cant": 51,
      "idProceso": 50725030,
      "isUltimaAct": false,
      "createdAt": "2024-01-02T02:10:07.317Z"
    },
    {
      "idRegActuacion": 696579590,
      "llaveProceso": "11001400302320170104400",
      "consActuacion": 39,
      "fechaActuacion": "2019-07-11T05:00:00.000Z",
      "actuacion": "Auto requiere",
      "anotacion": null,
      "fechaInicial": null,
      "fechaFinal": null,
      "fechaRegistro": "2019-07-11T05:00:00.000Z",
      "codRegla": "00                              ",
      "conDocumentos": false,
      "cant": 51,
      "idProceso": 50725030,
      "isUltimaAct": false,
      "createdAt": "2024-01-02T02:10:07.317Z"
    },
    {
      "idRegActuacion": 696579580,
      "llaveProceso": "11001400302320170104400",
      "consActuacion": 38,
      "fechaActuacion": "2019-07-10T05:00:00.000Z",
      "actuacion": "Al despacho",
      "anotacion": null,
      "fechaInicial": null,
      "fechaFinal": null,
      "fechaRegistro": "2019-07-10T05:00:00.000Z",
      "codRegla": "00                              ",
      "conDocumentos": false,
      "cant": 51,
      "idProceso": 50725030,
      "isUltimaAct": false,
      "createdAt": "2024-01-02T02:10:07.317Z"
    },
    {
      "idRegActuacion": 696579570,
      "llaveProceso": "11001400302320170104400",
      "consActuacion": 37,
      "fechaActuacion": "2019-07-02T05:00:00.000Z",
      "actuacion": "Oficio Elaborado",
      "anotacion": null,
      "fechaInicial": null,
      "fechaFinal": null,
      "fechaRegistro": "2019-07-10T05:00:00.000Z",
      "codRegla": "00                              ",
      "conDocumentos": false,
      "cant": 51,
      "idProceso": 50725030,
      "isUltimaAct": false,
      "createdAt": "2024-01-02T02:10:07.317Z"
    },
    {
      "idRegActuacion": 696579560,
      "llaveProceso": "11001400302320170104400",
      "consActuacion": 36,
      "fechaActuacion": "2019-06-25T05:00:00.000Z",
      "actuacion": "Fijacion estado",
      "anotacion": "Actuación registrada el 25/06/2019 a las 19:57:50.",
      "fechaInicial": "2019-06-26T05:00:00.000Z",
      "fechaFinal": "2019-06-26T05:00:00.000Z",
      "fechaRegistro": "2019-06-25T05:00:00.000Z",
      "codRegla": "00                              ",
      "conDocumentos": false,
      "cant": 51,
      "idProceso": 50725030,
      "isUltimaAct": false,
      "createdAt": "2024-01-02T02:10:07.317Z"
    },
    {
      "idRegActuacion": 696579550,
      "llaveProceso": "11001400302320170104400",
      "consActuacion": 35,
      "fechaActuacion": "2019-06-25T05:00:00.000Z",
      "actuacion": "Auto fija fecha audiencia y/o diligencia",
      "anotacion": null,
      "fechaInicial": null,
      "fechaFinal": null,
      "fechaRegistro": "2019-06-25T05:00:00.000Z",
      "codRegla": "00                              ",
      "conDocumentos": false,
      "cant": 51,
      "idProceso": 50725030,
      "isUltimaAct": false,
      "createdAt": "2024-01-02T02:10:07.317Z"
    },
    {
      "idRegActuacion": 696579540,
      "llaveProceso": "11001400302320170104400",
      "consActuacion": 34,
      "fechaActuacion": "2019-06-04T05:00:00.000Z",
      "actuacion": "Al despacho",
      "anotacion": null,
      "fechaInicial": null,
      "fechaFinal": null,
      "fechaRegistro": "2019-06-04T05:00:00.000Z",
      "codRegla": "00                              ",
      "conDocumentos": false,
      "cant": 51,
      "idProceso": 50725030,
      "isUltimaAct": false,
      "createdAt": "2024-01-02T02:10:07.317Z"
    },
    {
      "idRegActuacion": 696579530,
      "llaveProceso": "11001400302320170104400",
      "consActuacion": 33,
      "fechaActuacion": "2019-04-23T05:00:00.000Z",
      "actuacion": "Fijacion estado",
      "anotacion": "Actuación registrada el 23/04/2019 a las 17:10:49.",
      "fechaInicial": "2019-04-24T05:00:00.000Z",
      "fechaFinal": "2019-04-24T05:00:00.000Z",
      "fechaRegistro": "2019-04-23T05:00:00.000Z",
      "codRegla": "00                              ",
      "conDocumentos": false,
      "cant": 51,
      "idProceso": 50725030,
      "isUltimaAct": false,
      "createdAt": "2024-01-02T02:10:07.317Z"
    },
    {
      "idRegActuacion": 696579520,
      "llaveProceso": "11001400302320170104400",
      "consActuacion": 32,
      "fechaActuacion": "2019-04-23T05:00:00.000Z",
      "actuacion": "Auto ordena correr traslado",
      "anotacion": null,
      "fechaInicial": null,
      "fechaFinal": null,
      "fechaRegistro": "2019-04-23T05:00:00.000Z",
      "codRegla": "00                              ",
      "conDocumentos": false,
      "cant": 51,
      "idProceso": 50725030,
      "isUltimaAct": false,
      "createdAt": "2024-01-02T02:10:07.317Z"
    },
    {
      "idRegActuacion": 696579510,
      "llaveProceso": "11001400302320170104400",
      "consActuacion": 31,
      "fechaActuacion": "2019-04-02T05:00:00.000Z",
      "actuacion": "Al despacho",
      "anotacion": null,
      "fechaInicial": null,
      "fechaFinal": null,
      "fechaRegistro": "2019-04-02T05:00:00.000Z",
      "codRegla": "00                              ",
      "conDocumentos": false,
      "cant": 51,
      "idProceso": 50725030,
      "isUltimaAct": false,
      "createdAt": "2024-01-02T02:10:07.317Z"
    },
    {
      "idRegActuacion": 696579500,
      "llaveProceso": "11001400302320170104400",
      "consActuacion": 30,
      "fechaActuacion": "2019-03-21T05:00:00.000Z",
      "actuacion": "Fijacion estado",
      "anotacion": "Actuación registrada el 21/03/2019 a las 19:53:46.",
      "fechaInicial": "2019-03-22T05:00:00.000Z",
      "fechaFinal": "2019-03-22T05:00:00.000Z",
      "fechaRegistro": "2019-03-21T05:00:00.000Z",
      "codRegla": "00                              ",
      "conDocumentos": false,
      "cant": 51,
      "idProceso": 50725030,
      "isUltimaAct": false,
      "createdAt": "2024-01-02T02:10:07.317Z"
    },
    {
      "idRegActuacion": 696579490,
      "llaveProceso": "11001400302320170104400",
      "consActuacion": 29,
      "fechaActuacion": "2019-03-21T05:00:00.000Z",
      "actuacion": "Auto ordena correr traslado",
      "anotacion": null,
      "fechaInicial": null,
      "fechaFinal": null,
      "fechaRegistro": "2019-03-21T05:00:00.000Z",
      "codRegla": "00                              ",
      "conDocumentos": false,
      "cant": 51,
      "idProceso": 50725030,
      "isUltimaAct": false,
      "createdAt": "2024-01-02T02:10:07.317Z"
    },
    {
      "idRegActuacion": 696579480,
      "llaveProceso": "11001400302320170104400",
      "consActuacion": 28,
      "fechaActuacion": "2018-10-17T05:00:00.000Z",
      "actuacion": "Al despacho",
      "anotacion": null,
      "fechaInicial": null,
      "fechaFinal": null,
      "fechaRegistro": "2018-10-17T05:00:00.000Z",
      "codRegla": "00                              ",
      "conDocumentos": false,
      "cant": 51,
      "idProceso": 50725030,
      "isUltimaAct": false,
      "createdAt": "2024-01-02T02:10:07.317Z"
    },
    {
      "idRegActuacion": 696579470,
      "llaveProceso": "11001400302320170104400",
      "consActuacion": 27,
      "fechaActuacion": "2018-10-08T05:00:00.000Z",
      "actuacion": "Traslado Recurso Reposición Art. 319 C.G.P.",
      "anotacion": null,
      "fechaInicial": "2018-10-09T05:00:00.000Z",
      "fechaFinal": "2018-10-11T05:00:00.000Z",
      "fechaRegistro": "2018-10-08T05:00:00.000Z",
      "codRegla": "00                              ",
      "conDocumentos": false,
      "cant": 51,
      "idProceso": 50725030,
      "isUltimaAct": false,
      "createdAt": "2024-01-02T02:10:07.317Z"
    },
    {
      "idRegActuacion": 696579460,
      "llaveProceso": "11001400302320170104400",
      "consActuacion": 26,
      "fechaActuacion": "2018-10-03T05:00:00.000Z",
      "actuacion": "Recepción memorial",
      "anotacion": null,
      "fechaInicial": null,
      "fechaFinal": null,
      "fechaRegistro": "2018-10-03T05:00:00.000Z",
      "codRegla": "00                              ",
      "conDocumentos": false,
      "cant": 51,
      "idProceso": 50725030,
      "isUltimaAct": false,
      "createdAt": "2024-01-02T02:10:07.317Z"
    },
    {
      "idRegActuacion": 696579450,
      "llaveProceso": "11001400302320170104400",
      "consActuacion": 25,
      "fechaActuacion": "2018-09-13T05:00:00.000Z",
      "actuacion": "Fijacion estado",
      "anotacion": "Actuación registrada el 13/09/2018 a las 15:41:17.",
      "fechaInicial": "2018-09-14T05:00:00.000Z",
      "fechaFinal": "2018-09-14T05:00:00.000Z",
      "fechaRegistro": "2018-09-13T05:00:00.000Z",
      "codRegla": "00                              ",
      "conDocumentos": false,
      "cant": 51,
      "idProceso": 50725030,
      "isUltimaAct": false,
      "createdAt": "2024-01-02T02:10:07.317Z"
    },
    {
      "idRegActuacion": 696579440,
      "llaveProceso": "11001400302320170104400",
      "consActuacion": 24,
      "fechaActuacion": "2018-09-13T05:00:00.000Z",
      "actuacion": "Auto resuelve Solicitud",
      "anotacion": null,
      "fechaInicial": null,
      "fechaFinal": null,
      "fechaRegistro": "2018-09-13T05:00:00.000Z",
      "codRegla": "00                              ",
      "conDocumentos": false,
      "cant": 51,
      "idProceso": 50725030,
      "isUltimaAct": false,
      "createdAt": "2024-01-02T02:10:07.317Z"
    },
    {
      "idRegActuacion": 696579430,
      "llaveProceso": "11001400302320170104400",
      "consActuacion": 23,
      "fechaActuacion": "2018-09-04T05:00:00.000Z",
      "actuacion": "Al despacho",
      "anotacion": null,
      "fechaInicial": null,
      "fechaFinal": null,
      "fechaRegistro": "2018-09-04T05:00:00.000Z",
      "codRegla": "00                              ",
      "conDocumentos": false,
      "cant": 51,
      "idProceso": 50725030,
      "isUltimaAct": false,
      "createdAt": "2024-01-02T02:10:07.317Z"
    },
    {
      "idRegActuacion": 696579420,
      "llaveProceso": "11001400302320170104400",
      "consActuacion": 22,
      "fechaActuacion": "2018-08-13T05:00:00.000Z",
      "actuacion": "Fijacion estado",
      "anotacion": "Actuación registrada el 13/08/2018 a las 15:42:42.",
      "fechaInicial": "2018-08-14T05:00:00.000Z",
      "fechaFinal": "2018-08-14T05:00:00.000Z",
      "fechaRegistro": "2018-08-13T05:00:00.000Z",
      "codRegla": "00                              ",
      "conDocumentos": false,
      "cant": 51,
      "idProceso": 50725030,
      "isUltimaAct": false,
      "createdAt": "2024-01-02T02:10:07.317Z"
    },
    {
      "idRegActuacion": 696579410,
      "llaveProceso": "11001400302320170104400",
      "consActuacion": 21,
      "fechaActuacion": "2018-08-13T05:00:00.000Z",
      "actuacion": "Auto pone en conocimiento",
      "anotacion": null,
      "fechaInicial": null,
      "fechaFinal": null,
      "fechaRegistro": "2018-08-13T05:00:00.000Z",
      "codRegla": "00                              ",
      "conDocumentos": false,
      "cant": 51,
      "idProceso": 50725030,
      "isUltimaAct": false,
      "createdAt": "2024-01-02T02:10:07.317Z"
    },
    {
      "idRegActuacion": 696579400,
      "llaveProceso": "11001400302320170104400",
      "consActuacion": 20,
      "fechaActuacion": "2018-07-25T05:00:00.000Z",
      "actuacion": "Al despacho",
      "anotacion": null,
      "fechaInicial": null,
      "fechaFinal": null,
      "fechaRegistro": "2018-07-25T05:00:00.000Z",
      "codRegla": "00                              ",
      "conDocumentos": false,
      "cant": 51,
      "idProceso": 50725030,
      "isUltimaAct": false,
      "createdAt": "2024-01-02T02:10:07.317Z"
    },
    {
      "idRegActuacion": 696579390,
      "llaveProceso": "11001400302320170104400",
      "consActuacion": 19,
      "fechaActuacion": "2018-07-06T05:00:00.000Z",
      "actuacion": "Al despacho",
      "anotacion": null,
      "fechaInicial": null,
      "fechaFinal": null,
      "fechaRegistro": "2018-07-06T05:00:00.000Z",
      "codRegla": "00                              ",
      "conDocumentos": false,
      "cant": 51,
      "idProceso": 50725030,
      "isUltimaAct": false,
      "createdAt": "2024-01-02T02:10:07.317Z"
    },
    {
      "idRegActuacion": 696579380,
      "llaveProceso": "11001400302320170104400",
      "consActuacion": 18,
      "fechaActuacion": "2018-06-18T05:00:00.000Z",
      "actuacion": "Diligencia de notificación personal (acta)",
      "anotacion": null,
      "fechaInicial": null,
      "fechaFinal": null,
      "fechaRegistro": "2018-06-18T05:00:00.000Z",
      "codRegla": "00                              ",
      "conDocumentos": false,
      "cant": 51,
      "idProceso": 50725030,
      "isUltimaAct": false,
      "createdAt": "2024-01-02T02:10:07.317Z"
    },
    {
      "idRegActuacion": 696579370,
      "llaveProceso": "11001400302320170104400",
      "consActuacion": 17,
      "fechaActuacion": "2018-05-30T05:00:00.000Z",
      "actuacion": "Fijacion estado",
      "anotacion": "Actuación registrada el 30/05/2018 a las 14:41:42.",
      "fechaInicial": "2018-05-31T05:00:00.000Z",
      "fechaFinal": "2018-05-31T05:00:00.000Z",
      "fechaRegistro": "2018-05-30T05:00:00.000Z",
      "codRegla": "00                              ",
      "conDocumentos": false,
      "cant": 51,
      "idProceso": 50725030,
      "isUltimaAct": false,
      "createdAt": "2024-01-02T02:10:07.317Z"
    },
    {
      "idRegActuacion": 696579360,
      "llaveProceso": "11001400302320170104400",
      "consActuacion": 16,
      "fechaActuacion": "2018-05-30T05:00:00.000Z",
      "actuacion": "Auto pone en conocimiento",
      "anotacion": null,
      "fechaInicial": null,
      "fechaFinal": null,
      "fechaRegistro": "2018-05-30T05:00:00.000Z",
      "codRegla": "00                              ",
      "conDocumentos": false,
      "cant": 51,
      "idProceso": 50725030,
      "isUltimaAct": false,
      "createdAt": "2024-01-02T02:10:07.317Z"
    },
    {
      "idRegActuacion": 696579350,
      "llaveProceso": "11001400302320170104400",
      "consActuacion": 15,
      "fechaActuacion": "2018-05-22T05:00:00.000Z",
      "actuacion": "Al despacho",
      "anotacion": null,
      "fechaInicial": null,
      "fechaFinal": null,
      "fechaRegistro": "2018-05-22T05:00:00.000Z",
      "codRegla": "00                              ",
      "conDocumentos": false,
      "cant": 51,
      "idProceso": 50725030,
      "isUltimaAct": false,
      "createdAt": "2024-01-02T02:10:07.317Z"
    },
    {
      "idRegActuacion": 696579340,
      "llaveProceso": "11001400302320170104400",
      "consActuacion": 14,
      "fechaActuacion": "2018-01-24T05:00:00.000Z",
      "actuacion": "Fijacion estado",
      "anotacion": "Actuación registrada el 24/01/2018 a las 07:24:42.",
      "fechaInicial": "2018-01-25T05:00:00.000Z",
      "fechaFinal": "2018-01-25T05:00:00.000Z",
      "fechaRegistro": "2018-01-24T05:00:00.000Z",
      "codRegla": "00                              ",
      "conDocumentos": false,
      "cant": 51,
      "idProceso": 50725030,
      "isUltimaAct": false,
      "createdAt": "2024-01-02T02:10:07.317Z"
    },
    {
      "idRegActuacion": 696579330,
      "llaveProceso": "11001400302320170104400",
      "consActuacion": 13,
      "fechaActuacion": "2018-01-24T05:00:00.000Z",
      "actuacion": "Auto pone en conocimiento",
      "anotacion": null,
      "fechaInicial": null,
      "fechaFinal": null,
      "fechaRegistro": "2018-01-24T05:00:00.000Z",
      "codRegla": "00                              ",
      "conDocumentos": false,
      "cant": 51,
      "idProceso": 50725030,
      "isUltimaAct": false,
      "createdAt": "2024-01-02T02:10:07.317Z"
    },
    {
      "idRegActuacion": 696579320,
      "llaveProceso": "11001400302320170104400",
      "consActuacion": 12,
      "fechaActuacion": "2018-01-15T05:00:00.000Z",
      "actuacion": "Al despacho",
      "anotacion": null,
      "fechaInicial": null,
      "fechaFinal": null,
      "fechaRegistro": "2018-01-15T05:00:00.000Z",
      "codRegla": "00                              ",
      "conDocumentos": false,
      "cant": 51,
      "idProceso": 50725030,
      "isUltimaAct": false,
      "createdAt": "2024-01-02T02:10:07.317Z"
    }
  ],
  "category": "Terminados",
  "codeudor": {
    "nombre": "ANGELICA PAOLA CASTILLO GARCIA",
    "cedula": "1020787803",
    "direccion": "CARRERA 8A BIS No 151-86 BARRIO CEDRO",
    "telefono": "4791494",
    "id": 241
  },
  "demanda": {
    "obligacion": ["18000088458"],
    "llaveProceso": "11001400302320170104400",
    "notificacion": {
      "292": {
        "fechaRecibido": null,
        "fechaAporta": null,
        "resultado": false
      },
      "certimail": false,
      "fisico": null,
      "autoNotificado": "18/06/2018 REP LEGAL"
    },
    "medidasCautelares": {
      "fechaOrdenaMedida": null,
      "medidaSolicitada": "BANCOS"
    },
    "capitalAdeudado": 1267778600,
    "departamento": "CUNDINNAMARCA",
    "despacho": null,
    "entregaGarantiasAbogado": "2017-11-09T05:00:00.000Z",
    "etapaProcesal": "NOTIFICACION",
    "fechaPresentacion": ["2017-09-19T05:00:00.000Z"],
    "mandamientoPago": null,
    "municipio": "BOGOTA",
    "radicado": "2017 - 01044",
    "tipoProceso": "SINGULAR",
    "vencimientoPagare": ["2018-07-27T05:00:00.000Z"]
  },
  "deudor": {
    "tel": {
      "fijo": null,
      "celular": null
    },
    "primerNombre": "PUBLI",
    "segundoNombre": "MAGIC",
    "primerApellido": "S..A.S.",
    "segundoApellido": null,
    "cedula": 900535464,
    "direccion": "CARRERA 8 BIS A No 151-86 APARTAMENTO 201",
    "email": "publi.magic@hotmail.com"
  },
  "fecha": "2019-10-18T05:00:00.000Z",
  "idProcesos": [50725030],
  "idRegUltimaAct": 863844990,
  "llaveProceso": "11001400302320170104400",
  "nombre": "PUBLI MAGIC S..A.S.",
  "numero": 241,
  "procesos": [
    {
      "idProceso": 50725030,
      "idConexion": 259,
      "llaveProceso": "11001400302320170104400",
      "fechaProceso": "2017-09-21T05:00:00.000Z",
      "fechaUltimaActuacion": "2019-10-18T05:00:00.000Z",
      "despacho": "JUZGADO 023 CIVIL MUNICIPAL DE BOGOTÁ ",
      "departamento": "BOGOTÁ",
      "sujetosProcesales": "Demandante: BANCOLOMBIA S.A. | Demandado: PUBLI MAGIC S.A.S. | Demandado: FRANCISCO CASTILLO BUSTOS | Demandado: ANGELICA PAOLA CASTILLO GARCIA ",
      "esPrivado": false,
      "cantFilas": -1,
      "juzgado": {
        "id": 23,
        "tipo": "JUZGADO 023 CIVIL MUNICIPAL DE BOGOTÁ",
        "url": "https://www.ramajudicial.gov.co/web/juzgado-23-civil-municipal-de-bogota"
      }
    }
  ],
  "revisado": true,
  "terminado": true,
  "tipoProceso": "SINGULAR",
  "ultimaActuacion": {
    "idRegActuacion": 863844990,
    "llaveProceso": "11001400302320170104400",
    "consActuacion": 51,
    "fechaActuacion": "2019-10-18T05:00:00.000Z",
    "actuacion": "Oficio Elaborado",
    "anotacion": "CAJA 494",
    "fechaInicial": null,
    "fechaFinal": null,
    "fechaRegistro": "2019-10-18T05:00:00.000Z",
    "codRegla": "00                              ",
    "conDocumentos": false,
    "cant": 51,
    "idProceso": 50725030,
    "isUltimaAct": true
  },
  "updatedAt": "2024-01-02T02:10:07.067Z"
}
