{
  "actuaciones": [
    {
      "idRegActuacion": 1938429690,
      "llaveProceso": "11001400300320170126400",
      "consActuacion": 92,
      "fechaActuacion": "2023-11-28T05:00:00.000Z",
      "actuacion": "Fijacion estado",
      "anotacion": "Actuación registrada el 28/11/2023 a las 22:04:54.",
      "fechaInicial": "2023-11-29T05:00:00.000Z",
      "fechaFinal": "2023-11-29T05:00:00.000Z",
      "fechaRegistro": "2023-11-28T05:00:00.000Z",
      "codRegla": "00                              ",
      "conDocumentos": false,
      "cant": 92,
      "idProceso": 50598770,
      "isUltimaAct": true,
      "carpetaNumero": 169,
      "createdAt": "2023-12-10T20:30:47.334Z"
    },
    {
      "idRegActuacion": 1938429680,
      "llaveProceso": "11001400300320170126400",
      "consActuacion": 91,
      "fechaActuacion": "2023-11-28T05:00:00.000Z",
      "actuacion": "Auto termina proceso por Pago",
      "anotacion": null,
      "fechaInicial": null,
      "fechaFinal": null,
      "fechaRegistro": "2023-11-28T05:00:00.000Z",
      "codRegla": "00                              ",
      "conDocumentos": false,
      "cant": 92,
      "idProceso": 50598770,
      "isUltimaAct": false,
      "carpetaNumero": 169,
      "createdAt": "2023-12-10T20:30:47.334Z"
    },
    {
      "idRegActuacion": 1938429670,
      "llaveProceso": "11001400300320170126400",
      "consActuacion": 90,
      "fechaActuacion": "2023-09-21T05:00:00.000Z",
      "actuacion": "Al despacho",
      "anotacion": null,
      "fechaInicial": null,
      "fechaFinal": null,
      "fechaRegistro": "2023-11-28T05:00:00.000Z",
      "codRegla": "00                              ",
      "conDocumentos": false,
      "cant": 92,
      "idProceso": 50598770,
      "isUltimaAct": false,
      "carpetaNumero": 169,
      "createdAt": "2023-12-10T20:30:47.334Z"
    },
    {
      "idRegActuacion": 1900297790,
      "llaveProceso": "11001400300320170126400",
      "consActuacion": 89,
      "fechaActuacion": "2023-10-10T05:00:00.000Z",
      "actuacion": "Recepción memorial",
      "anotacion": "APORTAN CESION ",
      "fechaInicial": null,
      "fechaFinal": null,
      "fechaRegistro": "2023-10-10T05:00:00.000Z",
      "codRegla": "00                              ",
      "conDocumentos": false,
      "cant": 92,
      "idProceso": 50598770,
      "isUltimaAct": false,
      "carpetaNumero": 169,
      "createdAt": "2023-12-10T20:30:47.334Z"
    },
    {
      "idRegActuacion": 1878023340,
      "llaveProceso": "11001400300320170126400",
      "consActuacion": 88,
      "fechaActuacion": "2023-09-12T05:00:00.000Z",
      "actuacion": "Recepción memorial",
      "anotacion": "TERMIANCION POR PAGO ",
      "fechaInicial": null,
      "fechaFinal": null,
      "fechaRegistro": "2023-09-12T05:00:00.000Z",
      "codRegla": "00                              ",
      "conDocumentos": false,
      "cant": 92,
      "idProceso": 50598770,
      "isUltimaAct": false,
      "carpetaNumero": 169,
      "createdAt": "2023-12-10T20:30:47.334Z"
    },
    {
      "idRegActuacion": 1839416970,
      "llaveProceso": "11001400300320170126400",
      "consActuacion": 87,
      "fechaActuacion": "2023-08-09T05:00:00.000Z",
      "actuacion": "Recepción memorial",
      "anotacion": "OFICIO RADICADO ",
      "fechaInicial": null,
      "fechaFinal": null,
      "fechaRegistro": "2023-08-09T05:00:00.000Z",
      "codRegla": "00                              ",
      "conDocumentos": false,
      "cant": 92,
      "idProceso": 50598770,
      "isUltimaAct": false,
      "carpetaNumero": 169,
      "createdAt": "2023-12-10T20:30:47.334Z"
    },
    {
      "idRegActuacion": 1762735860,
      "llaveProceso": "11001400300320170126400",
      "consActuacion": 86,
      "fechaActuacion": "2023-06-01T05:00:00.000Z",
      "actuacion": "Fijacion estado",
      "anotacion": "Actuación registrada el 01/06/2023 a las 14:52:38.",
      "fechaInicial": "2023-06-02T05:00:00.000Z",
      "fechaFinal": "2023-06-02T05:00:00.000Z",
      "fechaRegistro": "2023-06-01T05:00:00.000Z",
      "codRegla": "00                              ",
      "conDocumentos": false,
      "cant": 92,
      "idProceso": 50598770,
      "isUltimaAct": false,
      "carpetaNumero": 169,
      "createdAt": "2023-12-10T20:30:47.334Z"
    },
    {
      "idRegActuacion": 1762735850,
      "llaveProceso": "11001400300320170126400",
      "consActuacion": 85,
      "fechaActuacion": "2023-06-01T05:00:00.000Z",
      "actuacion": "Auto resuelve diligencias previas",
      "anotacion": "Tiene por notificada a la demandada",
      "fechaInicial": null,
      "fechaFinal": null,
      "fechaRegistro": "2023-06-01T05:00:00.000Z",
      "codRegla": "00                              ",
      "conDocumentos": false,
      "cant": 92,
      "idProceso": 50598770,
      "isUltimaAct": false,
      "carpetaNumero": 169,
      "createdAt": "2023-12-10T20:30:47.334Z"
    },
    {
      "idRegActuacion": 1692896690,
      "llaveProceso": "11001400300320170126400",
      "consActuacion": 84,
      "fechaActuacion": "2023-03-29T05:00:00.000Z",
      "actuacion": "Al despacho",
      "anotacion": null,
      "fechaInicial": null,
      "fechaFinal": null,
      "fechaRegistro": "2023-03-28T05:00:00.000Z",
      "codRegla": "00                              ",
      "conDocumentos": false,
      "cant": 92,
      "idProceso": 50598770,
      "isUltimaAct": false,
      "carpetaNumero": 169,
      "createdAt": "2023-12-10T20:30:47.334Z"
    },
    {
      "idRegActuacion": 1677265800,
      "llaveProceso": "11001400300320170126400",
      "consActuacion": 83,
      "fechaActuacion": "2023-03-14T05:00:00.000Z",
      "actuacion": "Fijacion estado",
      "anotacion": "Actuación registrada el 14/03/2023 a las 16:21:05.",
      "fechaInicial": "2023-03-15T05:00:00.000Z",
      "fechaFinal": "2023-03-15T05:00:00.000Z",
      "fechaRegistro": "2023-03-14T05:00:00.000Z",
      "codRegla": "00                              ",
      "conDocumentos": false,
      "cant": 92,
      "idProceso": 50598770,
      "isUltimaAct": false,
      "carpetaNumero": 169,
      "createdAt": "2023-12-10T20:30:47.334Z"
    },
    {
      "idRegActuacion": 1677265790,
      "llaveProceso": "11001400300320170126400",
      "consActuacion": 82,
      "fechaActuacion": "2023-03-14T05:00:00.000Z",
      "actuacion": "Auto decide recurso",
      "anotacion": null,
      "fechaInicial": null,
      "fechaFinal": null,
      "fechaRegistro": "2023-03-14T05:00:00.000Z",
      "codRegla": "00                              ",
      "conDocumentos": false,
      "cant": 92,
      "idProceso": 50598770,
      "isUltimaAct": false,
      "carpetaNumero": 169,
      "createdAt": "2023-12-10T20:30:47.334Z"
    },
    {
      "idRegActuacion": 1644933260,
      "llaveProceso": "11001400300320170126400",
      "consActuacion": 81,
      "fechaActuacion": "2023-02-15T05:00:00.000Z",
      "actuacion": "Al despacho",
      "anotacion": null,
      "fechaInicial": null,
      "fechaFinal": null,
      "fechaRegistro": "2023-02-14T05:00:00.000Z",
      "codRegla": "00                              ",
      "conDocumentos": false,
      "cant": 92,
      "idProceso": 50598770,
      "isUltimaAct": false,
      "carpetaNumero": 169,
      "createdAt": "2023-12-10T20:30:47.334Z"
    },
    {
      "idRegActuacion": 1637860050,
      "llaveProceso": "11001400300320170126400",
      "consActuacion": 80,
      "fechaActuacion": "2023-02-08T05:00:00.000Z",
      "actuacion": "Traslado Recurso Reposición Art. 319 C.G.P.",
      "anotacion": null,
      "fechaInicial": "2023-02-09T05:00:00.000Z",
      "fechaFinal": "2023-02-13T05:00:00.000Z",
      "fechaRegistro": "2023-02-07T05:00:00.000Z",
      "codRegla": "00                              ",
      "conDocumentos": false,
      "cant": 92,
      "idProceso": 50598770,
      "isUltimaAct": false,
      "carpetaNumero": 169,
      "createdAt": "2023-12-10T20:30:47.334Z"
    },
    {
      "idRegActuacion": 1392877320,
      "llaveProceso": "11001400300320170126400",
      "consActuacion": 79,
      "fechaActuacion": "2022-09-09T05:00:00.000Z",
      "actuacion": "Recepción memorial",
      "anotacion": "RECURSO",
      "fechaInicial": null,
      "fechaFinal": null,
      "fechaRegistro": "2022-09-09T05:00:00.000Z",
      "codRegla": "00                              ",
      "conDocumentos": false,
      "cant": 92,
      "idProceso": 50598770,
      "isUltimaAct": false,
      "carpetaNumero": 169,
      "createdAt": "2023-12-10T20:30:47.334Z"
    },
    {
      "idRegActuacion": 1388056070,
      "llaveProceso": "11001400300320170126400",
      "consActuacion": 78,
      "fechaActuacion": "2022-09-05T05:00:00.000Z",
      "actuacion": "Fijacion estado",
      "anotacion": "Actuación registrada el 05/09/2022 a las 16:19:28.",
      "fechaInicial": "2022-09-06T05:00:00.000Z",
      "fechaFinal": "2022-09-06T05:00:00.000Z",
      "fechaRegistro": "2022-09-05T05:00:00.000Z",
      "codRegla": "00                              ",
      "conDocumentos": false,
      "cant": 92,
      "idProceso": 50598770,
      "isUltimaAct": false,
      "carpetaNumero": 169,
      "createdAt": "2023-12-10T20:30:47.334Z"
    },
    {
      "idRegActuacion": 1388056060,
      "llaveProceso": "11001400300320170126400",
      "consActuacion": 77,
      "fechaActuacion": "2022-09-05T05:00:00.000Z",
      "actuacion": "Auto resuelve solicitud",
      "anotacion": "No tiene en cuenta notificación",
      "fechaInicial": null,
      "fechaFinal": null,
      "fechaRegistro": "2022-09-05T05:00:00.000Z",
      "codRegla": "00                              ",
      "conDocumentos": false,
      "cant": 92,
      "idProceso": 50598770,
      "isUltimaAct": false,
      "carpetaNumero": 169,
      "createdAt": "2023-12-10T20:30:47.334Z"
    },
    {
      "idRegActuacion": 1374714620,
      "llaveProceso": "11001400300320170126400",
      "consActuacion": 76,
      "fechaActuacion": "2022-08-19T05:00:00.000Z",
      "actuacion": "Al despacho",
      "anotacion": null,
      "fechaInicial": null,
      "fechaFinal": null,
      "fechaRegistro": "2022-08-23T05:00:00.000Z",
      "codRegla": "00                              ",
      "conDocumentos": false,
      "cant": 92,
      "idProceso": 50598770,
      "isUltimaAct": false,
      "carpetaNumero": 169,
      "createdAt": "2023-12-10T20:30:47.334Z"
    },
    {
      "idRegActuacion": 1303729200,
      "llaveProceso": "11001400300320170126400",
      "consActuacion": 75,
      "fechaActuacion": "2022-06-03T05:00:00.000Z",
      "actuacion": "Fijacion estado",
      "anotacion": "Actuación registrada el 03/06/2022 a las 17:40:46.",
      "fechaInicial": "2022-06-06T05:00:00.000Z",
      "fechaFinal": "2022-06-06T05:00:00.000Z",
      "fechaRegistro": "2022-06-03T05:00:00.000Z",
      "codRegla": "00                              ",
      "conDocumentos": false,
      "cant": 92,
      "idProceso": 50598770,
      "isUltimaAct": false,
      "carpetaNumero": 169,
      "createdAt": "2023-12-10T20:30:47.334Z"
    },
    {
      "idRegActuacion": 1303729190,
      "llaveProceso": "11001400300320170126400",
      "consActuacion": 74,
      "fechaActuacion": "2022-06-03T05:00:00.000Z",
      "actuacion": "Auto resuelve Solicitud",
      "anotacion": "No tiene en cuenta notificación",
      "fechaInicial": null,
      "fechaFinal": null,
      "fechaRegistro": "2022-06-03T05:00:00.000Z",
      "codRegla": "00                              ",
      "conDocumentos": false,
      "cant": 92,
      "idProceso": 50598770,
      "isUltimaAct": false,
      "carpetaNumero": 169,
      "createdAt": "2023-12-10T20:30:47.334Z"
    },
    {
      "idRegActuacion": 1286393650,
      "llaveProceso": "11001400300320170126400",
      "consActuacion": 73,
      "fechaActuacion": "2022-05-12T05:00:00.000Z",
      "actuacion": "Recepción memorial",
      "anotacion": "APORTAN NOTIFICACIONES",
      "fechaInicial": null,
      "fechaFinal": null,
      "fechaRegistro": "2022-05-12T05:00:00.000Z",
      "codRegla": "00                              ",
      "conDocumentos": false,
      "cant": 92,
      "idProceso": 50598770,
      "isUltimaAct": false,
      "carpetaNumero": 169,
      "createdAt": "2023-12-10T20:30:47.334Z"
    },
    {
      "idRegActuacion": 1264578400,
      "llaveProceso": "11001400300320170126400",
      "consActuacion": 72,
      "fechaActuacion": "2022-03-17T05:00:00.000Z",
      "actuacion": "Fijacion estado",
      "anotacion": "Actuación registrada el 17/03/2022 a las 14:56:21.",
      "fechaInicial": "2022-03-18T05:00:00.000Z",
      "fechaFinal": "2022-03-18T05:00:00.000Z",
      "fechaRegistro": "2022-03-17T05:00:00.000Z",
      "codRegla": "00                              ",
      "conDocumentos": false,
      "cant": 92,
      "idProceso": 50598770,
      "isUltimaAct": false,
      "carpetaNumero": 169,
      "createdAt": "2023-12-10T20:30:47.334Z"
    },
    {
      "idRegActuacion": 1264578390,
      "llaveProceso": "11001400300320170126400",
      "consActuacion": 71,
      "fechaActuacion": "2022-03-17T05:00:00.000Z",
      "actuacion": "Auto resuelve solicitud",
      "anotacion": "No tiene en cuenta notificación",
      "fechaInicial": null,
      "fechaFinal": null,
      "fechaRegistro": "2022-03-17T05:00:00.000Z",
      "codRegla": "00                              ",
      "conDocumentos": false,
      "cant": 92,
      "idProceso": 50598770,
      "isUltimaAct": false,
      "carpetaNumero": 169,
      "createdAt": "2023-12-10T20:30:47.334Z"
    },
    {
      "idRegActuacion": 1263643500,
      "llaveProceso": "11001400300320170126400",
      "consActuacion": 70,
      "fechaActuacion": "2022-03-15T05:00:00.000Z",
      "actuacion": "Al despacho",
      "anotacion": null,
      "fechaInicial": null,
      "fechaFinal": null,
      "fechaRegistro": "2022-03-15T05:00:00.000Z",
      "codRegla": "00                              ",
      "conDocumentos": false,
      "cant": 92,
      "idProceso": 50598770,
      "isUltimaAct": false,
      "carpetaNumero": 169,
      "createdAt": "2023-12-10T20:30:47.334Z"
    },
    {
      "idRegActuacion": 1258734980,
      "llaveProceso": "11001400300320170126400",
      "consActuacion": 69,
      "fechaActuacion": "2022-02-21T05:00:00.000Z",
      "actuacion": "Recepción memorial",
      "anotacion": "291 Y 292 ",
      "fechaInicial": null,
      "fechaFinal": null,
      "fechaRegistro": "2022-02-22T05:00:00.000Z",
      "codRegla": "00                              ",
      "conDocumentos": false,
      "cant": 92,
      "idProceso": 50598770,
      "isUltimaAct": false,
      "carpetaNumero": 169,
      "createdAt": "2023-12-10T20:30:47.334Z"
    },
    {
      "idRegActuacion": 1231973590,
      "llaveProceso": "11001400300320170126400",
      "consActuacion": 68,
      "fechaActuacion": "2021-11-04T05:00:00.000Z",
      "actuacion": "Fijacion estado",
      "anotacion": "Actuación registrada el 04/11/2021 a las 17:21:35.",
      "fechaInicial": "2021-11-05T05:00:00.000Z",
      "fechaFinal": "2021-11-05T05:00:00.000Z",
      "fechaRegistro": "2021-11-04T05:00:00.000Z",
      "codRegla": "00                              ",
      "conDocumentos": false,
      "cant": 92,
      "idProceso": 50598770,
      "isUltimaAct": false,
      "carpetaNumero": 169,
      "createdAt": "2023-12-10T20:30:47.334Z"
    },
    {
      "idRegActuacion": 1231973580,
      "llaveProceso": "11001400300320170126400",
      "consActuacion": 67,
      "fechaActuacion": "2021-11-04T05:00:00.000Z",
      "actuacion": "Auto pone en conocimiento",
      "anotacion": "TERMINA PODER",
      "fechaInicial": null,
      "fechaFinal": null,
      "fechaRegistro": "2021-11-04T05:00:00.000Z",
      "codRegla": "00                              ",
      "conDocumentos": false,
      "cant": 92,
      "idProceso": 50598770,
      "isUltimaAct": false,
      "carpetaNumero": 169,
      "createdAt": "2023-12-10T20:30:47.334Z"
    },
    {
      "idRegActuacion": 1231490730,
      "llaveProceso": "11001400300320170126400",
      "consActuacion": 66,
      "fechaActuacion": "2021-11-02T05:00:00.000Z",
      "actuacion": "Al despacho",
      "anotacion": null,
      "fechaInicial": null,
      "fechaFinal": null,
      "fechaRegistro": "2021-11-02T05:00:00.000Z",
      "codRegla": "00                              ",
      "conDocumentos": false,
      "cant": 92,
      "idProceso": 50598770,
      "isUltimaAct": false,
      "carpetaNumero": 169,
      "createdAt": "2023-12-10T20:30:47.334Z"
    },
    {
      "idRegActuacion": 1019316910,
      "llaveProceso": "11001400300320170126400",
      "consActuacion": 65,
      "fechaActuacion": "2021-06-16T05:00:00.000Z",
      "actuacion": "Fijacion estado",
      "anotacion": "Actuación registrada el 16/06/2021 a las 14:47:14.",
      "fechaInicial": "2021-06-17T05:00:00.000Z",
      "fechaFinal": "2021-06-17T05:00:00.000Z",
      "fechaRegistro": "2021-06-16T05:00:00.000Z",
      "codRegla": "00                              ",
      "conDocumentos": false,
      "cant": 92,
      "idProceso": 50598770,
      "isUltimaAct": false,
      "carpetaNumero": 169,
      "createdAt": "2023-12-10T20:30:47.334Z"
    },
    {
      "idRegActuacion": 1019316900,
      "llaveProceso": "11001400300320170126400",
      "consActuacion": 64,
      "fechaActuacion": "2021-06-16T05:00:00.000Z",
      "actuacion": "Auto pone en conocimiento",
      "anotacion": null,
      "fechaInicial": null,
      "fechaFinal": null,
      "fechaRegistro": "2021-06-16T05:00:00.000Z",
      "codRegla": "00                              ",
      "conDocumentos": false,
      "cant": 92,
      "idProceso": 50598770,
      "isUltimaAct": false,
      "carpetaNumero": 169,
      "createdAt": "2023-12-10T20:30:47.334Z"
    },
    {
      "idRegActuacion": 1019046560,
      "llaveProceso": "11001400300320170126400",
      "consActuacion": 63,
      "fechaActuacion": "2021-06-15T05:00:00.000Z",
      "actuacion": "Al despacho",
      "anotacion": null,
      "fechaInicial": null,
      "fechaFinal": null,
      "fechaRegistro": "2021-06-15T05:00:00.000Z",
      "codRegla": "00                              ",
      "conDocumentos": false,
      "cant": 92,
      "idProceso": 50598770,
      "isUltimaAct": false,
      "carpetaNumero": 169,
      "createdAt": "2023-12-10T20:30:47.334Z"
    },
    {
      "idRegActuacion": 1018674630,
      "llaveProceso": "11001400300320170126400",
      "consActuacion": 62,
      "fechaActuacion": "2021-06-02T05:00:00.000Z",
      "actuacion": "Recepción memorial",
      "anotacion": "APORTA NOTIFICACIONES",
      "fechaInicial": null,
      "fechaFinal": null,
      "fechaRegistro": "2021-06-09T05:00:00.000Z",
      "codRegla": "00                              ",
      "conDocumentos": false,
      "cant": 92,
      "idProceso": 50598770,
      "isUltimaAct": false,
      "carpetaNumero": 169,
      "createdAt": "2023-12-10T20:30:47.334Z"
    },
    {
      "idRegActuacion": 1011005560,
      "llaveProceso": "11001400300320170126400",
      "consActuacion": 61,
      "fechaActuacion": "2021-04-05T05:00:00.000Z",
      "actuacion": "Fijacion estado",
      "anotacion": "Actuación registrada el 05/04/2021 a las 09:55:08.",
      "fechaInicial": "2021-04-06T05:00:00.000Z",
      "fechaFinal": "2021-04-06T05:00:00.000Z",
      "fechaRegistro": "2021-04-05T05:00:00.000Z",
      "codRegla": "00                              ",
      "conDocumentos": false,
      "cant": 92,
      "idProceso": 50598770,
      "isUltimaAct": false,
      "carpetaNumero": 169,
      "createdAt": "2023-12-10T20:30:47.334Z"
    },
    {
      "idRegActuacion": 1011005550,
      "llaveProceso": "11001400300320170126400",
      "consActuacion": 60,
      "fechaActuacion": "2021-04-05T05:00:00.000Z",
      "actuacion": "Auto pone en conocimiento",
      "anotacion": null,
      "fechaInicial": null,
      "fechaFinal": null,
      "fechaRegistro": "2021-04-05T05:00:00.000Z",
      "codRegla": "00                              ",
      "conDocumentos": false,
      "cant": 92,
      "idProceso": 50598770,
      "isUltimaAct": false,
      "carpetaNumero": 169,
      "createdAt": "2023-12-10T20:30:47.334Z"
    },
    {
      "idRegActuacion": 1010141580,
      "llaveProceso": "11001400300320170126400",
      "consActuacion": 59,
      "fechaActuacion": "2021-03-23T05:00:00.000Z",
      "actuacion": "Al despacho",
      "anotacion": null,
      "fechaInicial": null,
      "fechaFinal": null,
      "fechaRegistro": "2021-03-23T05:00:00.000Z",
      "codRegla": "00                              ",
      "conDocumentos": false,
      "cant": 92,
      "idProceso": 50598770,
      "isUltimaAct": false,
      "carpetaNumero": 169,
      "createdAt": "2023-12-10T20:30:47.334Z"
    },
    {
      "idRegActuacion": 1007926390,
      "llaveProceso": "11001400300320170126400",
      "consActuacion": 58,
      "fechaActuacion": "2021-03-05T05:00:00.000Z",
      "actuacion": "Fijacion estado",
      "anotacion": "Actuación registrada el 05/03/2021 a las 10:38:41.",
      "fechaInicial": "2021-03-08T05:00:00.000Z",
      "fechaFinal": "2021-03-08T05:00:00.000Z",
      "fechaRegistro": "2021-03-05T05:00:00.000Z",
      "codRegla": "00                              ",
      "conDocumentos": false,
      "cant": 92,
      "idProceso": 50598770,
      "isUltimaAct": false,
      "carpetaNumero": 169,
      "createdAt": "2023-12-10T20:30:47.334Z"
    },
    {
      "idRegActuacion": 1007926380,
      "llaveProceso": "11001400300320170126400",
      "consActuacion": 57,
      "fechaActuacion": "2021-03-05T05:00:00.000Z",
      "actuacion": "Auto ordena notificar",
      "anotacion": null,
      "fechaInicial": null,
      "fechaFinal": null,
      "fechaRegistro": "2021-03-05T05:00:00.000Z",
      "codRegla": "00                              ",
      "conDocumentos": false,
      "cant": 92,
      "idProceso": 50598770,
      "isUltimaAct": false,
      "carpetaNumero": 169,
      "createdAt": "2023-12-10T20:30:47.334Z"
    },
    {
      "idRegActuacion": 1007325560,
      "llaveProceso": "11001400300320170126400",
      "consActuacion": 56,
      "fechaActuacion": "2021-03-02T05:00:00.000Z",
      "actuacion": "Al despacho",
      "anotacion": null,
      "fechaInicial": null,
      "fechaFinal": null,
      "fechaRegistro": "2021-03-01T05:00:00.000Z",
      "codRegla": "00                              ",
      "conDocumentos": false,
      "cant": 92,
      "idProceso": 50598770,
      "isUltimaAct": false,
      "carpetaNumero": 169,
      "createdAt": "2023-12-10T20:30:47.334Z"
    },
    {
      "idRegActuacion": 978544320,
      "llaveProceso": "11001400300320170126400",
      "consActuacion": 55,
      "fechaActuacion": "2020-07-07T05:00:00.000Z",
      "actuacion": "Fijacion estado",
      "anotacion": "Actuación registrada el 07/07/2020 a las 12:27:54.",
      "fechaInicial": "2020-07-08T05:00:00.000Z",
      "fechaFinal": "2020-07-08T05:00:00.000Z",
      "fechaRegistro": "2020-07-07T05:00:00.000Z",
      "codRegla": "00                              ",
      "conDocumentos": false,
      "cant": 92,
      "idProceso": 50598770,
      "isUltimaAct": false,
      "carpetaNumero": 169,
      "createdAt": "2023-12-10T20:30:47.334Z"
    },
    {
      "idRegActuacion": 978544310,
      "llaveProceso": "11001400300320170126400",
      "consActuacion": 54,
      "fechaActuacion": "2020-07-07T05:00:00.000Z",
      "actuacion": "Auto ordena oficiar",
      "anotacion": null,
      "fechaInicial": null,
      "fechaFinal": null,
      "fechaRegistro": "2020-07-07T05:00:00.000Z",
      "codRegla": "00                              ",
      "conDocumentos": false,
      "cant": 92,
      "idProceso": 50598770,
      "isUltimaAct": false,
      "carpetaNumero": 169,
      "createdAt": "2023-12-10T20:30:47.334Z"
    },
    {
      "idRegActuacion": 978410740,
      "llaveProceso": "11001400300320170126400",
      "consActuacion": 53,
      "fechaActuacion": "2020-07-06T05:00:00.000Z",
      "actuacion": "Recepción memorial",
      "anotacion": "SOLICITUD DE DAR POR NOTIFICADA A LA DEMANDADA",
      "fechaInicial": null,
      "fechaFinal": null,
      "fechaRegistro": "2020-07-06T05:00:00.000Z",
      "codRegla": "00                              ",
      "conDocumentos": false,
      "cant": 92,
      "idProceso": 50598770,
      "isUltimaAct": false,
      "carpetaNumero": 169,
      "createdAt": "2023-12-10T20:30:47.334Z"
    }
  ],
  "juzgados": [
    {
      "id": 3,
      "tipo": "JUZGADO 003 CIVIL MUNICIPAL DE BOGOTÁ ",
      "url": "https://www.ramajudicial.gov.co/web/juzgado-03-civil-municipal-de-bogota"
    }
  ],
  "codeudor": {
    "nombre": "NIDIA DORANCY GOMEZ BLANCO",
    "cedula": "46453644",
    "direccion": null,
    "telefono": null,
    "id": 169,
    "carpetaNumero": 169
  },
  "demanda": {
    "vencimientoPagare": "15/03/2020",
    "obligacion": {
      "A": 12498762,
      "B": "audioprestamo"
    },
    "capitalAdeudado": "$ 13.144.437",
    "entregaGarantiasAbogado": "1/08/2017",
    "departamento": "CUNDINAMARCA",
    "municipio": "BOGOTA",
    "tipoProceso": "PRENDARIO",
    "radicado": "2017 - 01264",
    "llaveProceso": "11001400300320170126400",
    "etapaProcesal": "NOTIFICACION",
    "fechaPresentacion": "21/07/2017",
    "mandamientoPago": "3/08/2017",
    "notificacion": {
      "291": {
        "fechaRecibido": "26/11/2019",
        "resultado": "POSITIVO",
        "fechaAporta": "5/12/2019"
      },
      "292": {
        "fechaAporta": "12/12/2019",
        "resultado": "POSITIVO"
      },
      "certimail": "NO",
      "fisico": "SI",
      "tipo": "CORREO",
      "autoNotificado": "12/12/2019"
    },
    "medidasCautelares": {
      "fechaOrdenaMedidas": "3/08/2017",
      "medidaSolicitada": "EMBARGO DE VEHICULO"
    }
  },
  "demandas": [
    {
      "idProceso": 50598770,
      "idConexion": 259,
      "llaveProceso": "11001400300320170126400",
      "fechaProceso": "2017-07-27T05:00:00.000Z",
      "fechaUltimaActuacion": "2023-11-28T05:00:00.000Z",
      "sujetosProcesales": "Demandante: BANCOLOMBIA S.A. | Demandado: NIDIA DORANCY GOMEZ BLANCO ",
      "esPrivado": false,
      "cantFilas": -1,
      "medidasCautelares": {
        "fechaOrdenaMedida": "2017-03-08T05:00:00.000Z",
        "medidaSolicitada": "EMBARGO DE VEHICULO"
      },
      "vencimientoPagare": ["2020-01-01T05:00:00.000Z"],
      "capitalAdeudado": null,
      "departamento": "CUNDINAMARCA",
      "entregaGarantiasAbogado": "2017-01-08T05:00:00.000Z",
      "tipoProceso": "PRENDARIO",
      "mandamientoPago": "2017-03-08T05:00:00.000Z",
      "etapaProcesal": "NOTIFICACION",
      "fechaPresentacion": ["2017-07-21T05:00:00.000Z"],
      "municipio": "BOGOTA",
      "obligacion": [12498762, "audioprestamo"],
      "radicado": "2017 - 01264"
    }
  ],
  "numero": 169,
  "llaveProceso": "11001400300320170126400",
  "fecha": "2023-11-28T05:00:00.000Z",
  "ultimaActuacion": {
    "idRegActuacion": 1938429690,
    "llaveProceso": "11001400300320170126400",
    "consActuacion": 92,
    "fechaActuacion": "2023-11-28T00:00:00",
    "actuacion": "Fijacion estado",
    "anotacion": "Actuación registrada el 28/11/2023 a las 22:04:54.",
    "fechaInicial": "2023-11-29T00:00:00",
    "fechaFinal": "2023-11-29T00:00:00",
    "fechaRegistro": "2023-11-28T00:00:00",
    "codRegla": "00                              ",
    "conDocumentos": false,
    "cant": 92,
    "idProceso": 50598770,
    "isUltimaAct": true
  },
  "category": "Reintegra",
  "revisado": false,
  "terminado": false,
  "tipoProceso": "PRENDARIO",
  "deudor": {
    "tel": {
      "fijo": null,
      "celular": null
    },
    "primerNombre": "RITA",
    "segundoNombre": "BLANCO",
    "primerApellido": "DE",
    "segundoApellido": "GOMEZ",
    "cedula": 23553904,
    "direccion": "Carrera 67 No. 65-22 sur Torre 15 Apto 559",
    "email": "dorancy1@hotmail.com"
  },
  "cc": 23553904,
  "procesos": [
    {
      "idProceso": 50598770,
      "idConexion": 259,
      "llaveProceso": "11001400300320170126400",
      "fechaProceso": "2017-07-27T05:00:00.000Z",
      "fechaUltimaActuacion": "2023-11-28T05:00:00.000Z",
      "despacho": "JUZGADO 003 CIVIL MUNICIPAL DE BOGOTÁ ",
      "departamento": "BOGOTÁ",
      "sujetosProcesales": "Demandante: BANCOLOMBIA S.A. | Demandado: NIDIA DORANCY GOMEZ BLANCO ",
      "esPrivado": false,
      "cantFilas": -1
    }
  ],
  "idProcesos": [50598770],
  "nombre": "RITA BLANCO DE GOMEZ",
  "notificacion": {
    "notifiers": [
      {
        "tipo": "291",
        "fechaRecibido": "2019-11-26T05:00:00.000Z",
        "fechaAporta": "2019-12-05T05:00:00.000Z",
        "resultado": true
      },
      {
        "tipo": "292",
        "fechaRecibido": null,
        "fechaAporta": "2019-12-12T05:00:00.000Z",
        "resultado": true
      }
    ],
    "certimail": false,
    "fisico": true,
    "autoNotificado": "12/12/2019"
  }
}
